AP345,N8UMU Waterville                  OH US,Sun Jul 11 16:18:57 PDT 2004,0.00,123.00
AP346,AB8KN-2 Upper Arlington           OH US,Sun Jul 11 16:19:17 PDT 2004,0.00,94.00
AP349,W8GUC Vandalia                    OH US,Sun Jul 11 16:19:37 PDT 2004,4.02,243.00
AP350,W8DYY Miamisburg                  OH US,Sun Jul 11 16:15:30 PDT 2004,2.24,120.00
AP352,N8NQF Middletown                  OH US,Sun Jul 11 16:18:29 PDT 2004,0.00,246.00
AP353,W8EH Blue Bell                    OH US,Sun Jul 11 16:11:53 PDT 2004,1.34,247.00
AP355,KB8SGF Detroit                    MI US,Sun Jul 11 16:14:18 PDT 2004,0.00,130.00
AP359,K7UHP West Point                  UT US,Sun Jul 11 16:13:29 PDT 2004,3.58,350.00
AP360,N9GKE Lafayette                   IN US,Sun Jul 11 16:19:58 PDT 2004,1.34,212.00
AP370,WL7CKY Manasota                   FL US,Sun Jul 11 16:07:51 PDT 2004,7.60,101.00
AP377,W9QL Druce Lake                   IL US,Sun Jul 11 16:19:29 PDT 2004,3.13,113.00
AP380,WO4U-10 Crossville                TN US,Sun Jul 11 16:20:18 PDT 2004,0.00,312.00
AP385,N1IP-4 Hog Mountain               GA US,Sun Jul 11 16:12:15 PDT 2004,0.45,343.00
AP386,WA4DSY Mountain Park              GA US,Sun Jul 11 16:16:03 PDT 2004,2.24,315.00
AP390,KB7ZHE Apache Junction            AZ US,Sun Jul 11 16:12:08 PDT 2004,1.79,310.00
AP392,KG4EYO Campbellton                GA US,Sun Jul 11 16:07:02 PDT 2004,0.00,38.00
AP394,KN4YZ Peachtree City              GA US,Sun Jul 11 16:13:45 PDT 2004,0.00,286.00
AP395,AB4KN Peachtree City              GA US,Sun Jul 11 16:19:30 PDT 2004,0.00,321.00
AP400,WA9YVE Ixonia                     WI US,Sun Jul 11 16:08:38 PDT 2004,0.45,130.00
AP401,N9OIG Union Grove                 WI US,Sun Jul 11 16:18:35 PDT 2004,1.34,145.00
AP403,KF4CHG Ft.White                   FL US,Sun Jul 11 16:15:46 PDT 2004,1.34,68.00
AP404,KE4LKQ Broadway                   VA US,Sun Jul 11 16:19:57 PDT 2004,0.00,167.00
AP406,AA3JY-3 LakeMontrose              PA US,Sun Jul 11 16:15:29 PDT 2004,0.00,120.00
AP407,KB2M Ocean View                   NJ US,Sun Jul 11 16:18:04 PDT 2004,0.00,4.00
AP408,W0GJB Conifer                     CO US,Sun Jul 11 16:15:48 PDT 2004,0.45,139.00
AP411,N4XI-3 Evansville                 IN US,Sun Jul 11 16:18:06 PDT 2004,0.00,220.00
AP413,N2KBD Ringwood                    NJ US,Sun Jul 11 16:16:21 PDT 2004,0.00,302.00
AP423,WA6OFT-4 Poston                   AZ US,Sun Jul 11 16:16:40 PDT 2004,2.68,241.00
AP424,K0DMX Johnston                    IA US,Sun Jul 11 16:18:17 PDT 2004,1.34,225.00
AP426,N0SLJ Harrisonville               MO US,Sun Jul 11 16:18:50 PDT 2004,1.79,282.00
AP427,KB0VZP Warrensburg                MO US,Sun Jul 11 16:13:33 PDT 2004,4.02,188.00
AP429,KC0CZI Jefferson City             MO US,Sun Jul 11 16:18:50 PDT 2004,1.34,225.00
AP431,K0STL-15 Manchester               MO US,Sun Jul 11 16:20:05 PDT 2004,0.00,237.00
AP433,WK1P Walpole                      NH US,Sun Jul 11 16:15:11 PDT 2004,0.00,0.00
AP446,KC0FOW Rochester                  MN US,Sun Jul 11 16:09:53 PDT 2004,2.24,273.00
AP449,WB9BJQ Onalaska                   WI US,Sun Jul 11 16:16:04 PDT 2004,2.68,226.00
AP450,W9RPM La Crosse                   WI US,Sun Jul 11 16:18:04 PDT 2004,0.45,151.00
AP455,W0NSA Omaha                       NE US,Sun Jul 11 16:17:19 PDT 2004,0.45,239.00
AP458,N5RIG Fremont                     NE US,Sun Jul 11 16:20:06 PDT 2004,0.00,0.00
AP460,KB0VMZ Belmont                    NE US,Sun Jul 11 16:15:45 PDT 2004,0.00,315.00
AP462,MB7UIK Maidstone                     UK,Sun Jul 11 16:20:13 PDT 2004,0.00,0.00
AP463,K4RVH Madison                     AL US,Sun Jul 11 16:16:47 PDT 2004,1.34,319.00
AP464,KU4ME Andersonville               TN US,Sun Jul 11 16:16:49 PDT 2004,0.00,263.00
AP472,W7EPP Lynden                      WA US,Sun Jul 11 16:20:14 PDT 2004,2.68,255.00
AP473,VE7SDJ-1 Victoria                 BC CA,Sun Jul 11 16:16:11 PDT 2004,0.89,10.00
AP474,AA7OA Astoria                     OR US,Sun Jul 11 16:11:02 PDT 2004,0.89,263.00
AP475,KB7OHO Tukwila                    WA US,Sun Jul 11 16:07:14 PDT 2004,1.79,9.00
AP476,W7DG Longview                     WA US,Sun Jul 11 16:18:50 PDT 2004,0.00,116.00
AP477,KC7ZPO Milwaukie                  OR US,Sun Jul 11 16:14:00 PDT 2004,1.34,232.00
AP479,KC7AM-10 Tollgate                 OR US,Sun Jul 11 16:19:25 PDT 2004,0.45,263.00
AP483,N9OSQ-7 Pensacola                 FL US,Sun Jul 11 16:08:19 PDT 2004,0.00,228.00
AP487,WX6X Springfield                  MO US,Sun Jul 11 16:17:32 PDT 2004,2.68,135.00
AP492,WA6OFT-5 Quartzsite               AZ US,Sun Jul 11 16:17:06 PDT 2004,1.34,114.00
AP499,KD4YJJ-2 Pensacola                FL US,Sun Jul 11 16:20:15 PDT 2004,0.00,241.00
AP500,N1SKZ Hillsboro                   NH US,Sun Jul 11 16:15:37 PDT 2004,0.00,191.00
AP510,KK6RW Gig Harbor                  WA US,Sun Jul 11 16:19:09 PDT 2004,0.00,159.00
AP513,WB4QEV-4 Hollingers Is.           AL US,Sun Jul 11 16:17:35 PDT 2004,3.13,256.00
AP516,K6YDW Henderson                   NV US,Sun Jul 11 16:18:09 PDT 2004,6.26,252.00
AP517,WW7RA Gold Mountain               WA US,Sun Jul 11 16:10:35 PDT 2004,0.00,14.00
AP519,W2KB Lebanon Twp.                 NJ US,Sun Jul 11 16:17:13 PDT 2004,0.00,112.00
AP520,WA4LZC Orlando                    FL US,Sun Jul 11 16:16:54 PDT 2004,0.00,79.00
AP521,KD4K Cumming                      GA US,Sun Jul 11 16:19:59 PDT 2004,0.00,284.00
AP522,K3CHZ Dayton                      MD US,Sun Jul 11 16:18:12 PDT 2004,0.00,272.00
AP523,WA9UKW Boise                      ID US,Sun Jul 11 16:18:02 PDT 2004,4.02,356.00
AP525,N6RZR-2 Anderson                  CA US,Sun Jul 11 16:16:13 PDT 2004,1.34,143.00
AP526,KG4CVZ Tallulah Falls             GA US,Sun Jul 11 16:20:06 PDT 2004,0.45,143.00
AP527,WB0TAX Elm Grove                  LA US,Sun Jul 11 16:20:05 PDT 2004,0.89,223.00
AP530,W7IUC-3 Big Pine Key              FL US,Sun Jul 11 16:19:58 PDT 2004,0.00,82.00
AP534,W2MJD Hempstead                   NY US,Sun Jul 11 16:20:22 PDT 2004,1.34,185.00
AP535,N1LTP Norton                      MA US,Sun Jul 11 16:16:51 PDT 2004,0.00,92.00
AP537,KC6TYC Port St. John              FL US,Sun Jul 11 16:20:22 PDT 2004,0.00,285.00
AP538,WA3YML Thornhurst                 PA US,Sun Jul 11 16:15:28 PDT 2004,0.89,265.00
AP540,LU2VA-8 Neuquen                      AR,Sun Jul 11 16:20:08 PDT 2004,0.00,68.00
AP542,WM0F Berthoud                     CO US,Sun Jul 11 16:15:08 PDT 2004,1.34,135.00
AP550,N9LBG Edwardsville                IL US,Sun Jul 11 16:19:38 PDT 2004,0.00,315.00
AP554,N2XW Manahawkin                   NJ US,Sun Jul 11 16:14:19 PDT 2004,2.24,214.00
AP555,WA1LOU-15 Wolcott                 CT US,Sun Jul 11 16:18:29 PDT 2004,0.00,0.00
AP556,VE3PEW Mississauga               ONT CA,Sun Jul 11 16:19:55 PDT 2004,1.79,102.00
AP558,N9GTL Marion                      IN US,Sun Jul 11 16:16:34 PDT 2004,1.34,170.00
AP560,KB9LHX-6 Jasper                   IN US,Sun Jul 11 16:17:59 PDT 2004,1.79,222.00
AP561,AI9H-6 Mount Carmel               IL US,Sun Jul 11 16:13:18 PDT 2004,2.68,241.00
AP564,N1OTX Woburn                      MA US,Sun Jul 11 16:17:05 PDT 2004,0.00,119.00
AP565,KQ4YD White City                  FL US,Sun Jul 11 16:15:42 PDT 2004,0.00,253.00
AP566,KQ4KX Lakeland                    FL US,Sun Jul 11 16:20:01 PDT 2004,1.79,121.00
AP567,WB7SWW Dunkirk                    NY US,Sun Jul 11 16:07:57 PDT 2004,0.00,351.00
AP574,K0JJV Hays                        KS US,Sun Jul 11 16:11:21 PDT 2004,0.00,153.00
AP575,KB5WIO Amarillo                   TX US,Sun Jul 11 16:20:02 PDT 2004,4.02,157.00
AP583,W9HOI Kickapoo                    IL US,Sun Jul 11 16:18:34 PDT 2004,1.79,193.00
AP584,KC9BWF-1 Green Bay                WI US,Sun Jul 11 16:18:59 PDT 2004,4.92,86.00
AP585,KC9BWF-3 Green Bay                WI US,Sun Jul 11 16:18:19 PDT 2004,5.36,48.00
AP586,N1EPX Jamaica Plain               MA US,Sun Jul 11 16:16:57 PDT 2004,0.00,59.00
AP588,WD4CD Pickens                     SC US,Sun Jul 11 16:16:42 PDT 2004,0.00,25.00
AP590,KD5RXP Ft.Worth                   TX US,Sun Jul 11 16:19:41 PDT 2004,0.00,0.00
AP592,N9IDH-4 Waukesha                  WI US,Sun Jul 11 16:20:16 PDT 2004,0.00,358.00
AP593,KC5JIF Amarillo                   TX US,Sun Jul 11 16:18:41 PDT 2004,1.79,260.00
AP594,KC5JZG-2 Bryan                    TX US,Sun Jul 11 16:19:27 PDT 2004,0.00,0.00
AP602,KG5RG Dickinson                   TX US,Sun Jul 11 16:05:37 PDT 2004,0.89,329.00
AP606,VE2SIL-2 Pierrefonds             QUE CA,Sun Jul 11 16:17:30 PDT 2004,0.00,0.00
AP610,WB9HLA-2 Hartford City            IN US,Sun Jul 11 16:19:34 PDT 2004,2.24,160.00
AP613,PA0OKE Neptunuslaan                  NL,Sun Jul 11 16:20:20 PDT 2004,3.58,264.00
AP614,ON4BDW Vaartdijk                     BE,Sun Jul 11 16:09:06 PDT 2004,1.79,282.00
AP618,IT9OBK Messina                       IT,Sun Jul 11 16:19:37 PDT 2004,1.34,270.00
AP619,IZ6ADZ Scalo                         IT,Sun Jul 11 16:06:42 PDT 2004,2.68,347.00
AP620,IW0RQH Foligno                       IT,Sun Jul 11 16:17:49 PDT 2004,1.34,20.00
AP624,M0ADS Sheffield                      UK,Sun Jul 11 16:15:07 PDT 2004,0.00,286.00
AP626,G1YXH Kent                           UK,Sun Jul 11 16:13:14 PDT 2004,0.45,42.00
AP629,VK3CSJ Dandenong                     AU,Sun Jul 11 16:10:09 PDT 2004,0.89,289.00
AP630,VK3MY Knox City                      AU,Sun Jul 11 16:16:57 PDT 2004,0.00,7.00
AP632,VK3ZV Moondarra                      AU,Sun Jul 11 16:17:23 PDT 2004,2.24,226.00
AP635,VK5BRC-7 Angaston                    AU,Sun Jul 11 16:09:29 PDT 2004,6.26,270.00
AP640,KC7MRW Lincoln                    ND US,Sun Jul 11 16:15:32 PDT 2004,4.02,193.00
AP641,KB0WBM-2 Arnold                   ND US,Sun Jul 11 16:20:08 PDT 2004,3.58,165.00
AP642,W0NWS-2 Mead                      NE US,Sun Jul 11 16:10:51 PDT 2004,0.00,224.00
AP643,W0HII-3 Cedar Creek               NE US,Sun Jul 11 16:12:10 PDT 2004,1.34,229.00
AP647,K5ZZT-5 San Antonio               TX US,Sun Jul 11 16:10:30 PDT 2004,1.79,35.00
AP649,KA5KTH Austin                     TX US,Sun Jul 11 16:17:47 PDT 2004,2.68,298.00
AP650,N5CWM Montgomery                  TX US,Sun Jul 11 16:15:06 PDT 2004,0.45,152.00
AP652,KK5AV-4 Brownwood                 TX US,Sun Jul 11 16:18:58 PDT 2004,0.00,113.00
AP654,N5YXO Granbury                    TX US,Sun Jul 11 16:15:13 PDT 2004,0.89,154.00
AP656,KC5TIL Rendon                     TX US,Sun Jul 11 16:17:54 PDT 2004,0.89,205.00
AP657,KC4WTI Carrolton                  TX US,Sun Jul 11 16:16:59 PDT 2004,4.92,103.00
AP661,WA5KXX Plano                      TX US,Sun Jul 11 16:17:56 PDT 2004,0.00,111.00
AP669,PA0OKE Amsterdam                     NL,Sun Jul 11 16:20:20 PDT 2004,3.58,264.00
AP671,KD5FGW NW Oranjestad                 AW,Sun Jul 11 16:10:24 PDT 2004,5.81,125.00
AP679,ON5CT St-Niklaas                     BE,Sun Jul 11 16:10:23 PDT 2004,1.34,257.00
AP680,KA1GOZ Nashua                     NH US,Sun Jul 11 16:15:41 PDT 2004,0.00,25.00
AP681,N7RIG-6 Mt Vernon                 WA US,Sun Jul 11 16:16:49 PDT 2004,4.02,352.00
AP682,W7KKE-3 Road's End                OR US,Sun Jul 11 16:18:18 PDT 2004,6.26,330.00
AP685,KD7CTY Vancouver                  WA US,Sun Jul 11 16:16:41 PDT 2004,0.00,313.00
AP689,KF4TTB-2 Huntsville               AL US,Sun Jul 11 16:18:12 PDT 2004,1.79,300.00
AP690,KF4TTB-1 Huntsville               AL US,Sun Jul 11 16:17:41 PDT 2004,0.00,265.00
AP691,KE4ROC-9 Flemington Hts.          AL US,Sun Jul 11 16:17:47 PDT 2004,0.00,316.00
AP695,ZL3AQ Ashburton                      NZ,Sun Jul 11 16:06:17 PDT 2004,1.79,336.00
AP701,EA3ABN Barcelona                     ES,Sun Jul 11 16:16:14 PDT 2004,1.34,125.00
AP704,KA1UDX Collegeville               PA US,Sun Jul 11 16:10:10 PDT 2004,0.00,272.00
AP705,K4VVN Kingsport                   TN US,Sun Jul 11 16:20:10 PDT 2004,0.00,279.00
AP706,N0PJH Grand Island                NE US,Sun Jul 11 16:17:18 PDT 2004,1.79,151.00
AP710,N7XRD Renton                      WA US,Sun Jul 11 16:15:35 PDT 2004,2.68,323.00
AP711,W0DVM Divide                      CO US,Sun Jul 11 16:17:07 PDT 2004,0.45,44.00
AP712,KA1HEU Hudson                     NH US,Sun Jul 11 16:20:19 PDT 2004,0.00,241.00
AP715,K4DNM Clayton                     NC US,Sun Jul 11 16:19:18 PDT 2004,1.79,172.00
AP718,K4YK Greensboro                   GA US,Sun Jul 11 16:19:45 PDT 2004,0.00,217.00
AP722,KF4ORW Dade City                  FL US,Sun Jul 11 16:16:18 PDT 2004,0.00,35.00
AP723,KB2RC Orlando                     FL US,Sun Jul 11 16:19:04 PDT 2004,0.00,32.00
AP725,KD4BNP Palm Bay                   FL US,Sun Jul 11 16:20:12 PDT 2004,0.00,224.00
AP727,LA9QFA Trondheim                     NO,Sun Jul 11 16:09:04 PDT 2004,0.00,229.00
AP731,WW6HAM Pacifica                   CA US,Sun Jul 11 16:10:01 PDT 2004,4.47,219.00
AP732,KC9AVZ Jackson                    WI US,Sun Jul 11 16:05:39 PDT 2004,1.34,102.00
AP733,K0YCN East Tawakoni               TX US,Sun Jul 11 16:08:44 PDT 2004,3.13,190.00
AP739,WB0TWE Encinitas                  CA US,Sun Jul 11 16:16:18 PDT 2004,0.89,0.00
AP744,K0RM Colorado Springs             CO US,Sun Jul 11 16:14:20 PDT 2004,1.34,90.00
AP745,K4GPS-1 Jupiter Farms             FL US,Sun Jul 11 16:19:01 PDT 2004,0.00,274.00
AP746,AA3H Avon                         OH US,Sun Jul 11 16:16:17 PDT 2004,0.00,154.00
AP747,KC4ANB Trussville                 AL US,Sun Jul 11 16:17:20 PDT 2004,0.89,331.00
AP749,N3FJA Mountain Top                PA US,Sun Jul 11 16:19:17 PDT 2004,0.00,53.00
AP750,W1OEM Flanders                    CT US,Sun Jul 11 16:18:34 PDT 2004,0.89,135.00
AP751,KC2KY Centereach                  NY US,Sun Jul 11 16:18:42 PDT 2004,2.24,141.00
AP757,K3PP Palmerton                    PA US,Sun Jul 11 16:14:02 PDT 2004,0.00,288.00
AP758,KC7BWK Florence                   OR US,Sun Jul 11 16:19:28 PDT 2004,4.92,278.00
AP760,WB0BLV Security/Widefield         CO US,Sun Jul 11 16:15:46 PDT 2004,0.89,241.00
AP763,OX3HI Kangerlussuaq                  GL,Sun Jul 11 16:15:13 PDT 2004,0.89,63.00
AP765,N3EYQ Kingston                    NY US,Sun Jul 11 16:17:49 PDT 2004,0.00,70.00
AP766,WB2CMF Farmingville               NY US,Sun Jul 11 16:05:44 PDT 2004,0.45,182.00
AP767,N2XP Flanders                     NJ US,Sun Jul 11 16:17:45 PDT 2004,0.89,158.00
AP771,WD9HDQ-2 Northfield               MN US,Sun Jul 11 16:18:24 PDT 2004,2.68,333.00
AP772,K4KAL Marietta                    GA US,Sun Jul 11 16:15:22 PDT 2004,0.00,41.00
AP773,KB4TOH-11 Columbia                NC US,Sun Jul 11 16:17:25 PDT 2004,1.79,219.00
AP774,N8OVD Wendell                     NC US,Sun Jul 11 16:16:34 PDT 2004,0.00,180.00
AP779,K4CCC-9 Cheraw                    SC US,Sun Jul 11 16:16:36 PDT 2004,0.00,233.00
AP780,W5VBQ Santa Fe                    NM US,Sun Jul 11 16:13:20 PDT 2004,1.34,296.00
AP783,KC5DPC-3 Slidell                  TX US,Sun Jul 11 16:18:07 PDT 2004,4.92,257.00
AP786,K5EBQ Houston                     TX US,Sun Jul 11 16:18:01 PDT 2004,0.00,232.00
AP787,KC5LPN Houston                    TX US,Sun Jul 11 16:10:39 PDT 2004,0.00,6.00
AP792,KB0TVJ-4 MeadowLake Airport       CO US,Sun Jul 11 16:09:44 PDT 2004,0.89,74.00
AP795,KD7TTL Greenbank                  WA US,Sun Jul 11 16:16:28 PDT 2004,0.00,315.00
AP796,KF4ZMN Mooresville                NC US,Sun Jul 11 16:18:36 PDT 2004,0.00,232.00
AP799,AE0S-3 Columbia                   MO US,Sun Jul 11 16:19:00 PDT 2004,0.00,191.00
AP802,W4OZK-7 Mentone                   AL US,Sun Jul 11 16:17:47 PDT 2004,0.00,308.00
AP803,KE6AFE Santa Cruz                 CA US,Sun Jul 11 16:20:10 PDT 2004,2.68,111.00
AP806,N3EG Longview                     WA US,Sun Jul 11 16:12:59 PDT 2004,2.24,300.00
AP808,KG4YZY New Port Richey            FL US,Sun Jul 11 16:17:17 PDT 2004,0.00,78.00
AP809,K4NUT Port Richey                 FL US,Sun Jul 11 16:16:33 PDT 2004,1.79,130.00
AP811,KC2IXE Bayside Hills              NY US,Sun Jul 11 16:17:56 PDT 2004,1.34,207.00
AP812,VE3XF Stayner                    ONT CA,Sun Jul 11 16:20:07 PDT 2004,0.89,295.00
AP813,VE3PWZ Dundalk                   ONT CA,Sun Jul 11 16:15:45 PDT 2004,0.00,226.00
AP815,VA3HST Guelph                    ONT CA,Sun Jul 11 16:09:54 PDT 2004,3.13,211.00
AP817,VA3AT Renfrew                    ONT CA,Sun Jul 11 16:16:10 PDT 2004,0.00,112.00
AP818,VA3MWK Ashton                    ONT CA,Sun Jul 11 16:19:30 PDT 2004,2.24,97.00
AP819,VE3TEN Ottawa                    ONT CA,Sun Jul 11 16:15:56 PDT 2004,0.00,121.00
AP820,VE6BMR Sherwood Park             ALT CA,Sun Jul 11 16:18:54 PDT 2004,4.47,207.00
AP830,KA2FNK Merriam                    KS US,Sun Jul 11 16:13:23 PDT 2004,3.13,194.00
AP831,N9NJK Warsaw                      IN US,Sun Jul 11 16:18:47 PDT 2004,1.34,203.00
AP833,KE4CON-3 Woodstock                IL US,Sun Jul 11 16:16:58 PDT 2004,3.58,178.00
AP835,KB0HNR-3 California               MO US,Sun Jul 11 16:17:33 PDT 2004,4.02,215.00
AP838,W5MAI San Antonio                 TX US,Sun Jul 11 16:13:34 PDT 2004,0.00,95.00
AP840,KC0OGY-5 Bailey                   CO US,Sun Jul 11 16:18:00 PDT 2004,0.45,139.00
AP841,WE1A USAF Academy                 CO US,Sun Jul 11 16:14:47 PDT 2004,1.34,90.00
AP842,VE5VAP Dalmeny                    SK CA,Sun Jul 11 16:13:23 PDT 2004,2.68,148.00
AP846,WN5PFI N.Dallas                   TX US,Sun Jul 11 16:06:02 PDT 2004,0.89,194.00
AP847,KB1JKP Concord                    MA US,Sun Jul 11 16:15:02 PDT 2004,0.00,281.00
AP850,KC2GLZ Lowville                   NY US,Sun Jul 11 16:19:48 PDT 2004,0.00,18.00
AP852,WG4R Meadows of Dan               VA US,Sun Jul 11 16:20:19 PDT 2004,0.00,191.00
AP854,N4HHP-1 Plantation                FL US,Sun Jul 11 16:13:55 PDT 2004,2.68,117.00
AP855,N4HHP-2 Ft. Lauderdale            FL US,Sun Jul 11 16:16:58 PDT 2004,0.00,120.00
AP856,N4HHP-3 Hallandale Beach          FL US,Sun Jul 11 16:12:44 PDT 2004,2.68,111.00
AP860,AA5ED-10 Brandon                  MS US,Sun Jul 11 16:06:43 PDT 2004,0.00,254.00
AP862,KC0KOQ-1 Goodland                 KS US,Sun Jul 11 16:10:49 PDT 2004,1.79,68.00
AP864,AB0XM-1 Great Bend                KS US,Sun Jul 11 16:20:02 PDT 2004,6.71,203.00
AP866,KA0HJZ Van Meter                  IA US,Sun Jul 11 16:16:16 PDT 2004,1.34,5.00
AP867,N0VPR Johnston                    IA US,Sun Jul 11 16:18:34 PDT 2004,0.89,194.00
AP870,KC0LBV Farmington                 MN US,Sun Jul 11 16:11:18 PDT 2004,4.02,352.00
AP871,N0PFY Northfield                  MN US,Sun Jul 11 16:16:22 PDT 2004,1.34,17.00
AP872,N0EST Rochester                   MN US,Sun Jul 11 16:19:37 PDT 2004,0.00,6.00
AP873,N0ZOD Spring Valley               MN US,Sun Jul 11 16:19:27 PDT 2004,0.00,0.00
AP874,VK2AAK Forster                       AU,Sun Jul 11 16:07:32 PDT 2004,0.45,312.00
AP875,K9APR New Castle                  IN US,Sun Jul 11 16:14:12 PDT 2004,0.00,302.00
AP878,AB9FX Chicago                     IL US,Sun Jul 11 16:17:54 PDT 2004,0.00,238.00
AP879,N9VPV Galesburg                   IL US,Sun Jul 11 16:19:57 PDT 2004,0.45,191.00
AP881,KJ4W Murray                       KY US,Sun Jul 11 16:06:32 PDT 2004,0.45,277.00
AP885,W7GPL Maple Valley                WA US,Sun Jul 11 16:13:13 PDT 2004,0.00,136.00
AP890,KB7DZR Tigard                     OR US,Sun Jul 11 16:19:57 PDT 2004,2.68,301.00
AP892,KG6QHD Prineville                 OR US,Sun Jul 11 16:19:38 PDT 2004,2.24,44.00
AP893,KE6KYI Groveland                  CA US,Sun Jul 11 16:09:17 PDT 2004,0.00,277.00
AP895,KF6JJP Richmond                   CA US,Sun Jul 11 16:18:41 PDT 2004,4.92,295.00
AP896,WA6YLB Exeter                     CA US,Sun Jul 11 16:18:56 PDT 2004,1.79,337.00
AP897,WA6YLB-4 Govt.Peak                CA US,Sun Jul 11 16:19:13 PDT 2004,10.28,288.00
AP898,WA6YLB-6 Visalia                  CA US,Sun Jul 11 16:06:51 PDT 2004,0.00,0.00
AP901,KB6OQJ Santa Ynez                 CA US,Sun Jul 11 16:19:53 PDT 2004,2.24,255.00
AP902,N6HGA-1 Palmdale                  CA US,Sun Jul 11 16:20:36 PDT 2004,8.94,240.00
AP904,W6MAF Hesperia                    CA US,Sun Jul 11 16:15:53 PDT 2004,7.60,186.00
AP907,W9IF-4 Torry Pines                CA US,Sun Jul 11 16:20:19 PDT 2004,1.79,295.00
AP911,K4GIG-7 Brindley Mtn.             AL US,Sun Jul 11 16:18:35 PDT 2004,0.00,150.00
AP913,WB5SLA Ball Ground                GA US,Sun Jul 11 16:17:29 PDT 2004,0.00,324.00
AP917,W7NWS Billings                    MT US,Sun Jul 11 16:14:06 PDT 2004,0.00,0.00
AP918,KB0YUP Maryland Hts.              MO US,Sun Jul 11 16:17:06 PDT 2004,0.00,189.00
AP919,LB9ME Trondheim                      NO,Sun Jul 11 16:11:48 PDT 2004,0.00,110.00
AP921,OZ6GX-5 Roervig                      DK,Sun Jul 11 16:11:23 PDT 2004,0.89,322.00
AP932,MB7UHR Luton                         UK,Sun Jul 11 16:19:01 PDT 2004,0.00,341.00
AP937,MB7UEK Herne Bay                     UK,Sun Jul 11 16:18:30 PDT 2004,2.24,334.00
AP938,G3OJZ-6 Kent                         UK,Sun Jul 11 16:09:32 PDT 2004,3.13,328.00
AP941,LU5ABT-15 BuenosAries                AR,Sun Jul 11 16:15:56 PDT 2004,3.13,23.00
AP942,YV5KXE-2 Caracas                     VE,Sun Jul 11 16:20:37 PDT 2004,0.00,89.00
AP943,MTHEBO Mt. Hebo                   OR US,Sun Jul 11 16:18:19 PDT 2004,0.00,0.00
AP946,F1HCI-12 Versailles                  FR,Sun Jul 11 16:12:03 PDT 2004,0.00,296.00
AP949,F4CEP-12 Rubelles                    FR,Sun Jul 11 16:15:02 PDT 2004,2.24,270.00
AP952,N1NSI Contoocook                  NH US,Sun Jul 11 16:15:27 PDT 2004,0.00,175.00
AP953,ZF1EJ Savannah                       KY,Sun Jul 11 16:15:56 PDT 2004,1.34,66.00
AP956,K4TEM Tallahassee                 FL US,Sun Jul 11 16:16:47 PDT 2004,0.89,25.00
AP957,KA4EOC Tallahassee                FL US,Sun Jul 11 16:15:13 PDT 2004,0.89,300.00
AP960,HB9TJM-8 Vallorbe                    CH,Sun Jul 11 16:20:09 PDT 2004,0.00,67.00
AP962,EB2FGI-15 Irun                       ES,Sun Jul 11 16:12:56 PDT 2004,0.00,215.00
AP965,EB5ESX Sta Pola                      ES,Sun Jul 11 16:18:29 PDT 2004,3.13,68.00
AP967,EA3AYP-1 Girona                      ES,Sun Jul 11 16:14:42 PDT 2004,0.89,284.00
AP968,EA3FAJ-1 Girona                      ES,Sun Jul 11 16:11:22 PDT 2004,1.34,330.00
AP969,EA3RCK-1 Lleida                      ES,Sun Jul 11 16:19:05 PDT 2004,0.00,347.00
AP971,EB3GGU Balaguer                      ES,Sun Jul 11 16:19:56 PDT 2004,2.24,192.00
AP973,PE1NAT-1 Heerhugowaard               NL,Sun Jul 11 16:20:01 PDT 2004,1.79,248.00
AP974,DO6PA-5 Ahrweiler                    DE,Sun Jul 11 16:06:10 PDT 2004,2.24,230.00
AP976,DO7VLR-5 Zweibruecken                DE,Sun Jul 11 16:20:05 PDT 2004,0.00,32.00
AP979,KC9BWF-3 Sister Bay               MI US,Sun Jul 11 16:18:19 PDT 2004,5.36,48.00
AP984,N8QQ Cincinnati                   OH US,Sun Jul 11 16:20:03 PDT 2004,0.00,260.00
AP985,KB9QJM-11 Cloverdale              IN US,Sun Jul 11 16:20:28 PDT 2004,1.34,296.00
AP986,KB9QJM-12 Atlanta                 IN US,Sun Jul 11 16:17:02 PDT 2004,0.00,272.00
AP987,KC5CPO Keene                      TX US,Sun Jul 11 16:18:37 PDT 2004,3.13,120.00
AP990,KG6MOZ Sunnyvale                  CA US,Sun Jul 11 16:18:20 PDT 2004,1.34,312.00
AP991,W0BIS-3 Killdeer                  ND US,Sun Jul 11 16:18:24 PDT 2004,5.81,172.00
AP995,KI4BUM Burlington                 KY US,Sun Jul 11 16:20:02 PDT 2004,0.00,59.00
AP996,KC5YVU Lampasas                   TX US,Sun Jul 11 16:08:40 PDT 2004,4.47,158.00
AP998,DK1PR-6 Altenahr                     DE,Sun Jul 11 16:15:06 PDT 2004,1.79,305.00
AP999,DB5OY-15 Celle                       DE,Sun Jul 11 16:09:15 PDT 2004,0.00,90.00
AR003,DL9GJ-6 Burgrieden                   DE,Sun Jul 11 16:17:15 PDT 2004,1.34,248.00
AR006,HB9MZI Giubiasco                     CH,Sun Jul 11 16:12:41 PDT 2004,4.02,211.00
AR009,SR3TK-1 Gontyniec                    PL,Sun Jul 11 16:20:20 PDT 2004,6.26,231.00
AR011,IK1ZQJ Torino                        IT,Sun Jul 11 16:18:52 PDT 2004,0.00,351.00
AR014,IK1RDC Scurzolengo                   IT,Sun Jul 11 16:17:47 PDT 2004,1.79,351.00
AR016,IW4APJ-3 Soliera                     IT,Sun Jul 11 16:16:11 PDT 2004,0.89,50.00
AR017,IK4UPW S.Giovanni                    IT,Sun Jul 11 16:12:19 PDT 2004,1.79,164.00
AR020,IK3SVW-3 Treviso                     IT,Sun Jul 11 16:17:02 PDT 2004,1.34,41.00
AR022,IW5BFZ Lucca                         IT,Sun Jul 11 16:17:48 PDT 2004,0.00,328.00
AR025,IT9IPQ-2 Messina                     IT,Sun Jul 11 16:18:19 PDT 2004,0.00,329.00
AR027,IZ8GMP-2 Reggio Calabria             IT,Sun Jul 11 16:17:42 PDT 2004,5.36,5.00
AR028,IW8PCP-2 Gambarie d'Aspromonte       IT,Sun Jul 11 16:17:45 PDT 2004,0.00,106.00
AR029,KG4QXL-2 Fort Valley              VA US,Sun Jul 11 16:15:11 PDT 2004,0.00,337.00
AR030,N4HHP-4 Pompano Beach             FL US,Sun Jul 11 16:17:40 PDT 2004,2.24,139.00
AR031,SV2BNL-2 Thessaloniki                GR,Sun Jul 11 16:18:28 PDT 2004,3.58,292.00
AR033,SV4BHA-2 Larisa                      GR,Sun Jul 11 16:17:08 PDT 2004,0.89,169.00
AR034,SV1CIF-2 Aitoloakarnania             GR,Sun Jul 11 16:16:23 PDT 2004,0.89,339.00
AR035,SV3AQN-2 Patra                       GR,Sun Jul 11 16:11:26 PDT 2004,1.79,185.00
AR036,SV3BEF-2 Tripolis                    GR,Sun Jul 11 16:15:43 PDT 2004,1.34,288.00
AR039,VK4TMK Arana Hills                   AU,Sun Jul 11 16:18:45 PDT 2004,1.79,56.00
AR040,N3BSQ Bethel Park                 PA US,Sun Jul 11 16:20:32 PDT 2004,0.45,296.00
AR042,VK1AC Bywong                     NSW AU,Sun Jul 11 16:17:11 PDT 2004,1.79,246.00
AR043,K4ZZR Port St. Lucie              FL US,Sun Jul 11 16:15:17 PDT 2004,0.89,343.00
AR045,IW9ETI-2 Taormina                    IT,Sun Jul 11 16:17:29 PDT 2004,1.34,257.00
AR051,KE7TR-8 Mesa                      AZ US,Sun Jul 11 16:20:05 PDT 2004,2.24,337.00
AR052,KG4QXL Fort Valley                VA US,Sun Jul 11 16:17:06 PDT 2004,0.00,180.00
AR057,VK3XJB Shepparton                    AU,Sun Jul 11 16:12:22 PDT 2004,1.79,293.00
AR058,VK3YWY-1 Kyneton                     AU,Sun Jul 11 16:12:19 PDT 2004,0.89,246.00
AR060,VK3JTM-3 Ararat                      AU,Sun Jul 11 16:18:39 PDT 2004,1.34,216.00
