AP248,N2QJU Waterloo                    NY US,Sat Jul 17 16:25:33 PDT 2004,0.00,279.00
AP253,W5MPZ-4 Kirtland AFB              NM US,Sat Jul 17 16:26:08 PDT 2004,5.36,236.00
AP255,K5WPH El Paso                     TX US,Sat Jul 17 16:33:59 PDT 2004,5.81,117.00
AP260,N3OBQ Perryville                  MD US,Sat Jul 17 16:25:48 PDT 2004,1.79,113.00
AP264,W0WOB Colby                       KS US,Sat Jul 17 16:26:03 PDT 2004,1.79,180.00
AP267,KP3G Juncos                       PR US,Sat Jul 17 16:32:15 PDT 2004,0.00,104.00
AP268,N7QNM Sammamish                   WA US,Sat Jul 17 16:24:08 PDT 2004,0.45,179.00
AP271,W0BIS-7 New Salem                 ND US,Sat Jul 17 16:32:48 PDT 2004,8.94,132.00
AP272,N5TAM Granbury                    TX US,Sat Jul 17 16:31:02 PDT 2004,0.89,355.00
AP273,N1HRK N.Kingston                  RI US,Sat Jul 17 16:34:54 PDT 2004,0.00,148.00
AP277,WA6OFT Parker                     AZ US,Sat Jul 17 16:35:12 PDT 2004,3.13,228.00
AP279,KA1SNP Phippsburg                 ME US,Sat Jul 17 16:31:50 PDT 2004,0.89,254.00
AP284,WY1U Wallingford                  CT US,Sat Jul 17 16:34:39 PDT 2004,0.00,325.00
AP292,WU2Z N. Brunswick                 NJ US,Sat Jul 17 16:35:07 PDT 2004,0.00,19.00
AP295,K3WTF Potomac Hts.                MD US,Sat Jul 17 16:21:06 PDT 2004,1.34,267.00
AP302,N1TKK-1 San Juan                  PR US,Sat Jul 17 16:33:49 PDT 2004,2.24,84.00
AP303,W2DAV Red Hook                    NY US,Sat Jul 17 16:29:55 PDT 2004,0.00,12.00
AP304,KC5EZZ San Angelo                 TX US,Sat Jul 17 16:26:31 PDT 2004,1.34,77.00
AP307,WA3NNA Larchmont                  PA US,Sat Jul 17 16:31:05 PDT 2004,0.45,184.00
AP312,K2SLZ-5 East Aurora               NY US,Sat Jul 17 16:30:25 PDT 2004,0.00,305.00
AP313,AA2AC-2 Clarence Center           NY US,Sat Jul 17 16:29:10 PDT 2004,0.00,51.00
AP314,W2SO-1 Lancaster                  NY US,Sat Jul 17 16:33:28 PDT 2004,0.00,347.00
AP315,K2NV Grand Isle                   NY US,Sat Jul 17 16:29:00 PDT 2004,0.00,111.00
AP316,VE3GSI Napanee                   ONT CA,Sat Jul 17 16:33:00 PDT 2004,0.00,0.00
AP317,VE3ADJ Peterborough              ONT CA,Sat Jul 17 16:24:19 PDT 2004,0.00,55.00
AP319,VE3DTV Hamilton                  ONT CA,Sat Jul 17 16:28:45 PDT 2004,0.00,42.00
AP320,VE3EYR Nanticoke                 ONT CA,Sat Jul 17 16:34:04 PDT 2004,0.00,246.00
AP321,VE3KSR Kitchner                  ONT CA,Sat Jul 17 16:34:24 PDT 2004,4.47,1.00
AP326,WA8SIE Spring Hill                WV US,Sat Jul 17 16:32:01 PDT 2004,1.34,120.00
AP329,KB2AHZ Boydton                    VA US,Sat Jul 17 16:35:13 PDT 2004,0.00,128.00
AP340,W4HF-1 Wilkesboro                 NC US,Sat Jul 17 16:23:27 PDT 2004,0.00,168.00
AP341,WA4SSP-2 Linville                 NC US,Sat Jul 17 16:23:01 PDT 2004,0.00,121.00
AP343,N8FGR Orange                      OH US,Sat Jul 17 16:29:13 PDT 2004,0.00,81.00
AP345,N8UMU Waterville                  OH US,Sat Jul 17 16:33:02 PDT 2004,0.00,29.00
AP346,AB8KN-2 Upper Arlington           OH US,Sat Jul 17 16:22:15 PDT 2004,0.00,87.00
AP347,WA8ZWJ Union                      OH US,Sat Jul 17 16:35:15 PDT 2004,0.00,36.00
AP350,W8DYY Miamisburg                  OH US,Sat Jul 17 16:33:53 PDT 2004,1.34,45.00
AP352,N8NQF Middletown                  OH US,Sat Jul 17 16:26:29 PDT 2004,1.79,35.00
AP353,W8EH Blue Bell                    OH US,Sat Jul 17 16:34:54 PDT 2004,0.00,0.00
AP355,KB8SGF Detroit                    MI US,Sat Jul 17 16:31:57 PDT 2004,0.00,157.00
AP359,K7UHP West Point                  UT US,Sat Jul 17 16:27:28 PDT 2004,1.79,245.00
AP360,N9GKE Lafayette                   IN US,Sat Jul 17 16:35:19 PDT 2004,0.00,336.00
AP364,KM5GE Jackson                     MS US,Sat Jul 17 16:28:38 PDT 2004,0.00,69.00
AP365,KD4MWO Holly Ford                 FL US,Sat Jul 17 16:26:11 PDT 2004,0.00,0.00
AP368,KD4SVS Lakeland                   FL US,Sat Jul 17 16:34:58 PDT 2004,0.00,243.00
AP370,WL7CKY Manasota                   FL US,Sat Jul 17 16:20:41 PDT 2004,0.00,307.00
AP374,KG4JAC-2 Palm Shores              FL US,Sat Jul 17 16:35:17 PDT 2004,0.00,0.00
AP377,W9QL Druce Lake                   IL US,Sat Jul 17 16:32:59 PDT 2004,3.13,45.00
AP380,WO4U-10 Crossville                TN US,Sat Jul 17 16:33:23 PDT 2004,0.00,12.00
AP385,N1IP-4 Hog Mountain               GA US,Sat Jul 17 16:32:08 PDT 2004,0.00,11.00
AP386,WA4DSY Mountain Park              GA US,Sat Jul 17 16:31:09 PDT 2004,1.79,202.00
AP388,W4EPI-4 Snellville                GA US,Sat Jul 17 16:31:55 PDT 2004,0.00,270.00
AP390,KB7ZHE Apache Junction            AZ US,Sat Jul 17 16:35:05 PDT 2004,1.34,249.00
AP394,KN4YZ Peachtree City              GA US,Sat Jul 17 16:34:48 PDT 2004,0.00,264.00
AP395,AB4KN Peachtree City              GA US,Sat Jul 17 16:34:13 PDT 2004,0.89,86.00
AP399,WA9KCU Watertown                  WI US,Sat Jul 17 16:26:10 PDT 2004,0.89,325.00
AP400,WA9YVE Ixonia                     WI US,Sat Jul 17 16:27:20 PDT 2004,0.45,7.00
AP401,N9OIG Union Grove                 WI US,Sat Jul 17 16:31:24 PDT 2004,0.00,37.00
AP403,KF4CHG Ft.White                   FL US,Sat Jul 17 16:30:37 PDT 2004,0.45,117.00
AP406,AA3JY-3 LakeMontrose              PA US,Sat Jul 17 16:30:51 PDT 2004,0.00,18.00
AP407,KB2M Ocean View                   NJ US,Sat Jul 17 16:31:09 PDT 2004,0.00,181.00
AP408,W0GJB Conifer                     CO US,Sat Jul 17 16:31:05 PDT 2004,0.45,220.00
AP410,N4XI-5 Evansville                 IN US,Sat Jul 17 16:31:17 PDT 2004,2.68,311.00
AP411,N4XI-3 Evansville                 IN US,Sat Jul 17 16:33:06 PDT 2004,0.45,0.00
AP413,N2KBD Ringwood                    NJ US,Sat Jul 17 16:34:02 PDT 2004,0.00,289.00
AP417,N1RWY Frankfort                   ME US,Sat Jul 17 16:24:03 PDT 2004,0.00,236.00
AP423,WA6OFT-4 Poston                   AZ US,Sat Jul 17 16:27:42 PDT 2004,4.47,227.00
AP426,N0SLJ Harrisonville               MO US,Sat Jul 17 16:31:57 PDT 2004,0.00,5.00
AP427,KB0VZP Warrensburg                MO US,Sat Jul 17 16:26:16 PDT 2004,1.34,333.00
AP431,K0STL-15 Manchester               MO US,Sat Jul 17 16:31:41 PDT 2004,0.00,358.00
AP449,WB9BJQ Onalaska                   WI US,Sat Jul 17 16:33:00 PDT 2004,2.68,323.00
AP450,W9RPM La Crosse                   WI US,Sat Jul 17 16:34:01 PDT 2004,4.02,356.00
AP455,W0NSA Omaha                       NE US,Sat Jul 17 16:31:00 PDT 2004,0.45,67.00
AP458,N5RIG Fremont                     NE US,Sat Jul 17 16:34:41 PDT 2004,0.00,0.00
AP460,KB0VMZ Belmont                    NE US,Sat Jul 17 16:30:34 PDT 2004,0.45,315.00
AP462,MB7UIK Maidstone                     UK,Sat Jul 17 16:34:47 PDT 2004,0.00,0.00
AP463,K4RVH Madison                     AL US,Sat Jul 17 16:32:13 PDT 2004,0.00,339.00
AP464,KU4ME Andersonville               TN US,Sat Jul 17 16:27:46 PDT 2004,0.00,278.00
AP472,W7EPP Lynden                      WA US,Sat Jul 17 16:31:25 PDT 2004,0.00,261.00
AP474,AA7OA Astoria                     OR US,Sat Jul 17 16:27:21 PDT 2004,3.13,231.00
AP475,KB7OHO Tukwila                    WA US,Sat Jul 17 16:32:19 PDT 2004,0.45,119.00
AP476,W7DG Longview                     WA US,Sat Jul 17 16:34:18 PDT 2004,0.00,14.00
AP477,KC7ZPO Milwaukie                  OR US,Sat Jul 17 16:34:13 PDT 2004,0.45,58.00
AP479,KC7AM-10 Tollgate                 OR US,Sat Jul 17 16:35:22 PDT 2004,0.00,97.00
AP483,N9OSQ-7 Pensacola                 FL US,Sat Jul 17 16:33:38 PDT 2004,0.00,211.00
AP487,WX6X Springfield                  MO US,Sat Jul 17 16:34:03 PDT 2004,0.00,91.00
AP492,WA6OFT-5 Quartzsite               AZ US,Sat Jul 17 16:26:49 PDT 2004,2.24,101.00
AP496,WA5MMY McAllen                    TX US,Sat Jul 17 16:31:10 PDT 2004,1.79,92.00
AP499,KD4YJJ-2 Pensacola                FL US,Sat Jul 17 16:33:01 PDT 2004,0.00,180.00
AP500,N1SKZ Hillsboro                   NH US,Sat Jul 17 16:30:30 PDT 2004,0.00,161.00
AP504,N4BHM Roanoke                     VA US,Sat Jul 17 16:31:28 PDT 2004,0.89,17.00
AP510,KK6RW Gig Harbor                  WA US,Sat Jul 17 16:35:18 PDT 2004,0.00,329.00
AP517,WW7RA Gold Mountain               WA US,Sat Jul 17 16:30:50 PDT 2004,1.79,131.00
AP519,W2KB Lebanon Twp.                 NJ US,Sat Jul 17 16:34:28 PDT 2004,0.00,337.00
AP520,WA4LZC Orlando                    FL US,Sat Jul 17 16:31:44 PDT 2004,3.13,246.00
AP521,KD4K Cumming                      GA US,Sat Jul 17 16:34:48 PDT 2004,0.00,193.00
AP523,WA9UKW Boise                      ID US,Sat Jul 17 16:26:19 PDT 2004,1.34,316.00
AP525,N6RZR-2 Anderson                  CA US,Sat Jul 17 16:31:05 PDT 2004,1.79,245.00
AP526,KG4CVZ Tallulah Falls             GA US,Sat Jul 17 16:30:04 PDT 2004,0.00,172.00
AP527,WB0TAX Elm Grove                  LA US,Sat Jul 17 16:33:14 PDT 2004,2.24,185.00
AP528,W7IUC-4 Marathon                  FL US,Sat Jul 17 16:30:57 PDT 2004,0.00,35.00
AP530,W7IUC-3 Big Pine Key              FL US,Sat Jul 17 16:29:33 PDT 2004,4.02,235.00
AP534,W2MJD Hempstead                   NY US,Sat Jul 17 16:35:16 PDT 2004,0.00,285.00
AP535,N1LTP Norton                      MA US,Sat Jul 17 16:31:49 PDT 2004,0.00,172.00
AP537,KC6TYC Port St. John              FL US,Sat Jul 17 16:30:53 PDT 2004,0.00,276.00
AP538,WA3YML Thornhurst                 PA US,Sat Jul 17 16:30:55 PDT 2004,0.00,282.00
AP540,LU2VA-8 Neuquen                      AR,Sat Jul 17 16:30:11 PDT 2004,1.79,135.00
AP542,WM0F Berthoud                     CO US,Sat Jul 17 16:30:09 PDT 2004,2.68,255.00
AP550,N9LBG Edwardsville                IL US,Sat Jul 17 16:30:34 PDT 2004,0.00,337.00
AP554,N2XW Manahawkin                   NJ US,Sat Jul 17 16:35:18 PDT 2004,0.00,223.00
AP555,WA1LOU-15 Wolcott                 CT US,Sat Jul 17 16:35:14 PDT 2004,0.00,0.00
AP556,VE3PEW Mississauga               ONT CA,Sat Jul 17 16:26:40 PDT 2004,0.45,88.00
AP558,N9GTL Marion                      IN US,Sat Jul 17 16:32:13 PDT 2004,0.00,78.00
AP559,N9LYA-3 Mitchell                  IN US,Sat Jul 17 16:24:01 PDT 2004,0.00,356.00
AP561,AI9H-6 Mount Carmel               IL US,Sat Jul 17 16:35:03 PDT 2004,2.24,148.00
AP564,N1OTX Woburn                      MA US,Sat Jul 17 16:31:26 PDT 2004,0.00,302.00
AP565,KQ4YD White City                  FL US,Sat Jul 17 16:30:48 PDT 2004,0.00,196.00
AP566,KQ4KX Lakeland                    FL US,Sat Jul 17 16:31:30 PDT 2004,0.00,155.00
AP567,WB7SWW Dunkirk                    NY US,Sat Jul 17 16:32:05 PDT 2004,0.00,237.00
AP570,KF3BH Catawissa                   PA US,Sat Jul 17 16:33:32 PDT 2004,0.00,152.00
AP575,KB5WIO Amarillo                   TX US,Sat Jul 17 16:32:38 PDT 2004,4.47,118.00
AP577,K4MG Ocala                        FL US,Sat Jul 17 16:31:44 PDT 2004,0.00,271.00
AP584,KC9BWF-1 Green Bay                WI US,Sat Jul 17 16:34:09 PDT 2004,6.26,60.00
AP585,KC9BWF-3 Green Bay                WI US,Sat Jul 17 16:31:30 PDT 2004,4.47,333.00
AP586,N1EPX Jamaica Plain               MA US,Sat Jul 17 16:30:50 PDT 2004,0.00,210.00
AP588,WD4CD Pickens                     SC US,Sat Jul 17 16:28:05 PDT 2004,0.00,90.00
AP590,KD5RXP Ft.Worth                   TX US,Sat Jul 17 16:32:35 PDT 2004,0.00,0.00
AP593,KC5JIF Amarillo                   TX US,Sat Jul 17 16:26:51 PDT 2004,0.89,237.00
AP594,KC5JZG-2 Bryan                    TX US,Sat Jul 17 16:34:29 PDT 2004,1.34,181.00
AP599,N1HQ Panama City                  FL US,Sat Jul 17 16:35:08 PDT 2004,0.00,215.00
AP602,KG5RG Dickinson                   TX US,Sat Jul 17 16:33:06 PDT 2004,0.89,225.00
AP606,VE2SIL-2 Pierrefonds             QUE CA,Sat Jul 17 16:27:11 PDT 2004,0.00,0.00
AP610,WB9HLA-2 Hartford City            IN US,Sat Jul 17 16:34:34 PDT 2004,2.24,32.00
AP613,PA0OKE Neptunuslaan                  NL,Sat Jul 17 16:34:54 PDT 2004,1.34,214.00
AP614,ON4BDW Vaartdijk                     BE,Sat Jul 17 16:24:03 PDT 2004,1.79,197.00
AP619,IZ6ADZ Scalo                         IT,Sat Jul 17 16:21:42 PDT 2004,0.00,356.00
AP624,M0ADS Sheffield                      UK,Sat Jul 17 16:32:08 PDT 2004,0.00,0.00
AP626,G1YXH Kent                           UK,Sat Jul 17 16:31:38 PDT 2004,0.89,236.00
AP627,VE4UB Selkirk                     MB CA,Sat Jul 17 16:32:46 PDT 2004,0.00,165.00
AP629,VK3CSJ Dandenong                     AU,Sat Jul 17 16:33:38 PDT 2004,0.00,44.00
AP632,VK3ZV Moondarra                      AU,Sat Jul 17 16:32:23 PDT 2004,0.00,215.00
AP635,VK5BRC-7 Angaston                    AU,Sat Jul 17 16:28:25 PDT 2004,0.89,202.00
AP640,KC7MRW Lincoln                    ND US,Sat Jul 17 16:30:42 PDT 2004,4.47,176.00
AP641,KB0WBM-2 Arnold                   ND US,Sat Jul 17 16:32:53 PDT 2004,4.02,156.00
AP642,W0NWS-2 Mead                      NE US,Sat Jul 17 16:29:49 PDT 2004,1.34,3.00
AP643,W0HII-3 Cedar Creek               NE US,Sat Jul 17 16:34:15 PDT 2004,0.00,49.00
AP645,VP5DB-2 Carmen                       TC,Sat Jul 17 16:23:08 PDT 2004,7.15,129.00
AP646,VP5DB-1 Carmen                       TC,Sat Jul 17 16:34:03 PDT 2004,7.60,103.00
AP647,K5ZZT-5 San Antonio               TX US,Sat Jul 17 16:27:04 PDT 2004,0.45,163.00
AP648,KS5V Bulverde                     TX US,Sat Jul 17 16:27:49 PDT 2004,1.34,190.00
AP649,KA5KTH Austin                     TX US,Sat Jul 17 16:30:17 PDT 2004,2.24,20.00
AP651,WA5ZAI Valley Mills               TX US,Sat Jul 17 16:29:24 PDT 2004,1.34,358.00
AP654,N5YXO Granbury                    TX US,Sat Jul 17 16:31:10 PDT 2004,3.58,37.00
AP657,KC4WTI Carrolton                  TX US,Sat Jul 17 16:31:51 PDT 2004,0.45,178.00
AP669,PA0OKE Amsterdam                     NL,Sat Jul 17 16:34:54 PDT 2004,1.34,214.00
AP671,KD5FGW NW Oranjestad                 AW,Sat Jul 17 16:34:04 PDT 2004,4.47,13.00
AP679,ON5CT St-Niklaas                     BE,Sat Jul 17 16:30:41 PDT 2004,0.89,297.00
AP680,KA1GOZ Nashua                     NH US,Sat Jul 17 16:30:59 PDT 2004,0.00,59.00
AP681,N7RIG-6 Mt Vernon                 WA US,Sat Jul 17 16:26:40 PDT 2004,3.58,345.00
AP682,W7KKE-3 Road's End                OR US,Sat Jul 17 16:33:14 PDT 2004,2.24,197.00
AP685,KD7CTY Vancouver                  WA US,Sat Jul 17 16:31:30 PDT 2004,0.45,185.00
AP689,KF4TTB-2 Huntsville               AL US,Sat Jul 17 16:33:00 PDT 2004,1.79,294.00
AP690,KF4TTB-1 Huntsville               AL US,Sat Jul 17 16:26:13 PDT 2004,0.00,263.00
AP691,KE4ROC-9 Flemington Hts.          AL US,Sat Jul 17 16:34:19 PDT 2004,0.00,245.00
AP692,ZL1WPK Hamilton                      NZ,Sat Jul 17 16:25:50 PDT 2004,3.13,186.00
AP695,ZL3AQ Ashburton                      NZ,Sat Jul 17 16:26:23 PDT 2004,2.24,259.00
AP696,N4ARI Williamsburg                VA US,Sat Jul 17 16:31:31 PDT 2004,3.13,181.00
AP697,N1NLX Madison                     NH US,Sat Jul 17 16:26:54 PDT 2004,0.00,337.00
AP698,K3BAY Pasadena                    MD US,Sat Jul 17 16:34:35 PDT 2004,0.00,220.00
AP701,EA3ABN Barcelona                     ES,Sat Jul 17 16:32:35 PDT 2004,1.79,304.00
AP704,KA1UDX Collegeville               PA US,Sat Jul 17 16:21:51 PDT 2004,0.00,290.00
AP705,K4VVN Kingsport                   TN US,Sat Jul 17 16:35:09 PDT 2004,0.00,16.00
AP706,N0PJH Grand Island                NE US,Sat Jul 17 16:35:20 PDT 2004,0.89,58.00
AP710,N7XRD Renton                      WA US,Sat Jul 17 16:31:05 PDT 2004,0.00,106.00
AP712,KA1HEU Hudson                     NH US,Sat Jul 17 16:31:51 PDT 2004,0.00,35.00
AP715,K4DNM Clayton                     NC US,Sat Jul 17 16:28:58 PDT 2004,0.45,188.00
AP718,K4YK Greensboro                   GA US,Sat Jul 17 16:34:02 PDT 2004,0.00,168.00
AP720,KD4DLT-3 Lithonia                 GA US,Sat Jul 17 16:29:19 PDT 2004,0.00,59.00
AP722,KF4ORW Dade City                  FL US,Sat Jul 17 16:26:04 PDT 2004,0.00,211.00
AP723,KB2RC Orlando                     FL US,Sat Jul 17 16:32:05 PDT 2004,0.00,254.00
AP725,KD4BNP Palm Bay                   FL US,Sat Jul 17 16:35:10 PDT 2004,0.45,243.00
AP727,LA9QFA Trondheim                     NO,Sat Jul 17 16:30:48 PDT 2004,0.00,156.00
AP730,KG7CN Mtn. Home                   ID US,Sat Jul 17 16:26:38 PDT 2004,4.02,155.00
AP736,VK5RR Adelaide                       AU,Sat Jul 17 16:30:16 PDT 2004,0.00,123.00
AP739,WB0TWE Encinitas                  CA US,Sat Jul 17 16:35:11 PDT 2004,0.45,284.00
AP742,KC4ELV Honey Creek                GA US,Sat Jul 17 16:35:23 PDT 2004,0.00,223.00
AP745,K4GPS-1 Jupiter Farms             FL US,Sat Jul 17 16:31:07 PDT 2004,1.34,262.00
AP746,AA3H Avon                         OH US,Sat Jul 17 16:30:12 PDT 2004,0.00,176.00
AP747,KC4ANB Trussville                 AL US,Sat Jul 17 16:33:05 PDT 2004,1.34,321.00
AP749,N3FJA Mountain Top                PA US,Sat Jul 17 16:34:38 PDT 2004,0.00,244.00
AP750,W1OEM Flanders                    CT US,Sat Jul 17 16:35:01 PDT 2004,0.00,180.00
AP751,KC2KY Centereach                  NY US,Sat Jul 17 16:33:39 PDT 2004,0.45,172.00
AP752,WB2FTX Butler                     NJ US,Sat Jul 17 16:23:31 PDT 2004,0.00,200.00
AP758,KC7BWK Florence                   OR US,Sat Jul 17 16:34:55 PDT 2004,4.47,193.00
AP760,WB0BLV Security/Widefield         CO US,Sat Jul 17 16:35:07 PDT 2004,0.00,203.00
AP763,OX3HI Kangerlussuaq                  GL,Sat Jul 17 16:30:15 PDT 2004,3.13,82.00
AP765,N3EYQ Kingston                    NY US,Sat Jul 17 16:24:13 PDT 2004,1.79,185.00
AP767,N2XP Flanders                     NJ US,Sat Jul 17 16:33:40 PDT 2004,0.00,180.00
AP769,WC4PEM-10 Bartow                  FL US,Sat Jul 17 16:32:13 PDT 2004,0.00,180.00
AP771,WD9HDQ-2 Northfield               MN US,Sat Jul 17 16:35:23 PDT 2004,1.79,357.00
AP772,K4KAL Marietta                    GA US,Sat Jul 17 16:35:22 PDT 2004,0.00,292.00
AP773,KB4TOH-11 Columbia                NC US,Sat Jul 17 16:32:15 PDT 2004,3.58,187.00
AP774,N8OVD Wendell                     NC US,Sat Jul 17 16:30:54 PDT 2004,0.00,180.00
AP779,K4CCC-9 Cheraw                    SC US,Sat Jul 17 16:31:19 PDT 2004,0.89,134.00
AP780,W5VBQ Santa Fe                    NM US,Sat Jul 17 16:33:31 PDT 2004,1.79,192.00
AP782,WB5NZV-8 N.Denton                 TX US,Sat Jul 17 16:31:56 PDT 2004,0.00,351.00
AP783,KC5DPC-3 Slidell                  TX US,Sat Jul 17 16:27:54 PDT 2004,4.92,257.00
AP786,K5EBQ Houston                     TX US,Sat Jul 17 16:33:25 PDT 2004,1.34,184.00
AP787,KC5LPN Houston                    TX US,Sat Jul 17 16:28:34 PDT 2004,1.34,215.00
AP792,KB0TVJ-4 MeadowLake Airport       CO US,Sat Jul 17 16:34:33 PDT 2004,2.24,278.00
AP795,KD7TTL Greenbank                  WA US,Sat Jul 17 16:31:09 PDT 2004,0.00,216.00
AP799,AE0S-3 Columbia                   MO US,Sat Jul 17 16:34:57 PDT 2004,0.00,322.00
AP802,W4OZK-7 Mentone                   AL US,Sat Jul 17 16:35:28 PDT 2004,1.34,339.00
AP803,KE6AFE Santa Cruz                 CA US,Sat Jul 17 16:35:08 PDT 2004,2.68,119.00
AP806,N3EG Longview                     WA US,Sat Jul 17 16:31:03 PDT 2004,0.45,120.00
AP808,KG4YZY New Port Richey            FL US,Sat Jul 17 16:35:03 PDT 2004,0.45,224.00
AP809,K4NUT Port Richey                 FL US,Sat Jul 17 16:34:35 PDT 2004,2.24,271.00
AP811,KC2IXE Bayside Hills              NY US,Sat Jul 17 16:32:35 PDT 2004,2.24,216.00
AP812,VE3XF Stayner                    ONT CA,Sat Jul 17 16:35:28 PDT 2004,1.34,289.00
AP813,VE3PWZ Dundalk                   ONT CA,Sat Jul 17 16:21:42 PDT 2004,1.79,317.00
AP814,VA3GY Erin                       ONT CA,Sat Jul 17 16:33:46 PDT 2004,0.00,315.00
AP815,VA3HST Guelph                    ONT CA,Sat Jul 17 16:33:28 PDT 2004,2.68,9.00
AP817,VA3AT Renfrew                    ONT CA,Sat Jul 17 16:35:19 PDT 2004,2.68,30.00
AP818,VA3MWK Ashton                    ONT CA,Sat Jul 17 16:33:57 PDT 2004,2.24,342.00
AP819,VE3TEN Ottawa                    ONT CA,Sat Jul 17 16:31:05 PDT 2004,1.79,356.00
AP820,VE6BMR Sherwood Park             ALT CA,Sat Jul 17 16:30:05 PDT 2004,2.24,215.00
AP823,AD4BL Fairbanks                   AK US,Sat Jul 17 16:28:13 PDT 2004,0.00,269.00
AP824,K5WPN-10 Duncan                   OK US,Sat Jul 17 16:35:25 PDT 2004,2.24,338.00
AP827,W8LRC Lowell                      MI US,Sat Jul 17 16:23:05 PDT 2004,2.68,14.00
AP830,KA2FNK Merriam                    KS US,Sat Jul 17 16:35:11 PDT 2004,0.00,0.00
AP831,N9NJK Warsaw                      IN US,Sat Jul 17 16:33:45 PDT 2004,2.68,27.00
AP832,WB9TLH-11 Bloomington             IN US,Sat Jul 17 16:33:06 PDT 2004,0.00,0.00
AP833,KE4CON-3 Woodstock                IL US,Sat Jul 17 16:27:21 PDT 2004,7.15,7.00
AP838,W5MAI San Antonio                 TX US,Sat Jul 17 16:33:34 PDT 2004,1.34,199.00
AP840,KC0OGY-5 Bailey                   CO US,Sat Jul 17 16:25:40 PDT 2004,0.89,280.00
AP841,WE1A USAF Academy                 CO US,Sat Jul 17 16:29:42 PDT 2004,0.00,293.00
AP842,VE5VAP Dalmeny                    SK CA,Sat Jul 17 16:33:21 PDT 2004,4.02,209.00
AP845,K2TCO Binghamton                  NY US,Sat Jul 17 16:33:56 PDT 2004,0.00,189.00
AP846,WN5PFI N.Dallas                   TX US,Sat Jul 17 16:29:10 PDT 2004,1.34,28.00
AP850,KC2GLZ Lowville                   NY US,Sat Jul 17 16:31:05 PDT 2004,0.89,21.00
AP852,WG4R Meadows of Dan               VA US,Sat Jul 17 16:35:19 PDT 2004,0.00,247.00
AP854,N4HHP-1 Plantation                FL US,Sat Jul 17 16:34:05 PDT 2004,0.00,359.00
AP855,N4HHP-2 Ft. Lauderdale            FL US,Sat Jul 17 16:32:11 PDT 2004,2.68,169.00
AP856,N4HHP-3 Hallandale Beach          FL US,Sat Jul 17 16:33:00 PDT 2004,0.00,127.00
AP860,AA5ED-10 Brandon                  MS US,Sat Jul 17 16:30:54 PDT 2004,0.00,161.00
AP862,KC0KOQ-1 Goodland                 KS US,Sat Jul 17 16:31:01 PDT 2004,2.68,158.00
AP864,AB0XM-1 Great Bend                KS US,Sat Jul 17 16:33:53 PDT 2004,3.13,60.00
AP866,KA0HJZ Van Meter                  IA US,Sat Jul 17 16:33:47 PDT 2004,1.34,14.00
AP867,N0VPR Johnston                    IA US,Sat Jul 17 16:27:44 PDT 2004,1.34,23.00
AP872,N0EST Rochester                   MN US,Sat Jul 17 16:35:08 PDT 2004,0.00,17.00
AP874,VK2AAK Forster                       AU,Sat Jul 17 16:34:39 PDT 2004,4.92,210.00
AP877,KA8OAD-1 Fairlawn                 OH US,Sat Jul 17 16:22:20 PDT 2004,0.00,134.00
AP878,AB9FX Chicago                     IL US,Sat Jul 17 16:30:55 PDT 2004,3.13,132.00
AP888,N7QXO-2 Vancouver                 WA US,Sat Jul 17 16:33:59 PDT 2004,0.00,343.00
AP889,K7EWG Lincoln City                OR US,Sat Jul 17 16:31:01 PDT 2004,2.24,165.00
AP890,KB7DZR Tigard                     OR US,Sat Jul 17 16:31:07 PDT 2004,2.24,323.00
AP892,KG6QHD Prineville                 OR US,Sat Jul 17 16:31:13 PDT 2004,1.79,41.00
AP893,KE6KYI Groveland                  CA US,Sat Jul 17 16:21:35 PDT 2004,0.00,230.00
AP894,K6IMN Atwater                     CA US,Sat Jul 17 16:35:19 PDT 2004,1.79,46.00
AP895,KF6JJP Richmond                   CA US,Sat Jul 17 16:33:37 PDT 2004,3.58,285.00
AP896,WA6YLB Exeter                     CA US,Sat Jul 17 16:33:13 PDT 2004,2.68,265.00
AP897,WA6YLB-4 Govt.Peak                CA US,Sat Jul 17 16:35:03 PDT 2004,7.60,224.00
AP898,WA6YLB-6 Visalia                  CA US,Sat Jul 17 16:34:32 PDT 2004,0.00,0.00
AP901,KB6OQJ Santa Ynez                 CA US,Sat Jul 17 16:31:33 PDT 2004,0.89,260.00
AP902,N6HGA-1 Palmdale                  CA US,Sat Jul 17 16:30:11 PDT 2004,8.49,233.00
AP904,W6MAF Hesperia                    CA US,Sat Jul 17 16:32:45 PDT 2004,5.36,183.00
AP907,W9IF-4 Torry Pines                CA US,Sat Jul 17 16:34:11 PDT 2004,3.13,246.00
AP911,K4GIG-7 Brindley Mtn.             AL US,Sat Jul 17 16:34:22 PDT 2004,0.00,249.00
AP912,WB2JSH Eaton                      CO US,Sat Jul 17 16:35:22 PDT 2004,6.71,246.00
AP913,WB5SLA Ball Ground                GA US,Sat Jul 17 16:33:15 PDT 2004,0.45,260.00
AP919,LB9ME Trondheim                      NO,Sat Jul 17 16:29:39 PDT 2004,0.00,140.00
AP921,OZ6GX-5 Roervig                      DK,Sat Jul 17 16:26:20 PDT 2004,0.00,161.00
AP922,OZ1IEP-5 Jaegerspris                 DK,Sat Jul 17 16:22:10 PDT 2004,4.02,147.00
AP924,OH6GGL-3 Lppalahti                   FI,Sat Jul 17 16:34:11 PDT 2004,0.00,0.00
AP932,MB7UHR Luton                         UK,Sat Jul 17 16:35:20 PDT 2004,0.00,50.00
AP937,MB7UEK Herne Bay                     UK,Sat Jul 17 16:32:03 PDT 2004,0.00,251.00
AP938,G3OJZ-6 Kent                         UK,Sat Jul 17 16:31:41 PDT 2004,3.58,288.00
AP941,LU5ABT-15 BuenosAries                AR,Sat Jul 17 16:26:03 PDT 2004,3.13,134.00
AP942,YV5KXE-2 Caracas                     VE,Sat Jul 17 16:31:34 PDT 2004,0.45,25.00
AP943,MTHEBO Mt. Hebo                   OR US,Sat Jul 17 16:28:24 PDT 2004,0.00,0.00
AP949,F4CEP-12 Rubelles                    FR,Sat Jul 17 16:35:01 PDT 2004,1.34,350.00
AP952,N1NSI Contoocook                  NH US,Sat Jul 17 16:30:44 PDT 2004,0.00,8.00
AP956,K4TEM Tallahassee                 FL US,Sat Jul 17 16:35:06 PDT 2004,0.89,220.00
AP957,KA4EOC Tallahassee                FL US,Sat Jul 17 16:26:10 PDT 2004,0.00,177.00
AP960,HB9TJM-8 Vallorbe                    CH,Sat Jul 17 16:26:08 PDT 2004,0.00,112.00
AP962,EB2FGI-15 Irun                       ES,Sat Jul 17 16:23:07 PDT 2004,0.00,319.00
AP965,EB5ESX Sta Pola                      ES,Sat Jul 17 16:33:23 PDT 2004,9.83,91.00
AP973,PE1NAT-1 Heerhugowaard               NL,Sat Jul 17 16:30:03 PDT 2004,1.79,248.00
AP974,DO6PA-5 Ahrweiler                    DE,Sat Jul 17 16:32:45 PDT 2004,0.89,205.00
AP976,DO7VLR-5 Zweibruecken                DE,Sat Jul 17 16:28:45 PDT 2004,0.00,41.00
AP979,KC9BWF-3 Sister Bay               MI US,Sat Jul 17 16:31:30 PDT 2004,4.47,333.00
AP981,KG4SEY Niceville                  FL US,Sat Jul 17 16:29:36 PDT 2004,0.00,175.00
AP984,N8QQ Cincinnati                   OH US,Sat Jul 17 16:35:03 PDT 2004,1.34,175.00
AP985,KB9QJM-11 Cloverdale              IN US,Sat Jul 17 16:31:09 PDT 2004,1.34,336.00
AP986,KB9QJM-12 Atlanta                 IN US,Sat Jul 17 16:27:04 PDT 2004,1.34,72.00
AP989,KC9JWM Clam Lake                  WI US,Sat Jul 17 16:25:12 PDT 2004,0.00,222.00
AP990,KG6MOZ Sunnyvale                  CA US,Sat Jul 17 16:33:28 PDT 2004,1.34,248.00
AP991,W0BIS-3 Killdeer                  ND US,Sat Jul 17 16:33:37 PDT 2004,4.02,120.00
AP995,KI4BUM Burlington                 KY US,Sat Jul 17 16:35:03 PDT 2004,0.00,121.00
AP998,DK1PR-6 Altenahr                     DE,Sat Jul 17 16:30:08 PDT 2004,2.68,224.00
