AP479,KC7AM-10 Tollgate                 OR US,Sat Jul 17 16:45:23 PDT 2004,0.00,0.00
AP483,N9OSQ-7 Pensacola                 FL US,Sat Jul 17 16:48:08 PDT 2004,0.00,197.00
AP487,WX6X Springfield                  MO US,Sat Jul 17 16:49:03 PDT 2004,0.45,28.00
AP492,WA6OFT-5 Quartzsite               AZ US,Sat Jul 17 16:46:52 PDT 2004,2.68,39.00
AP496,WA5MMY McAllen                    TX US,Sat Jul 17 16:41:09 PDT 2004,2.68,124.00
AP499,KD4YJJ-2 Pensacola                FL US,Sat Jul 17 16:48:08 PDT 2004,0.00,180.00
AP500,N1SKZ Hillsboro                   NH US,Sat Jul 17 16:45:31 PDT 2004,0.00,161.00
AP510,KK6RW Gig Harbor                  WA US,Sat Jul 17 16:45:19 PDT 2004,1.34,298.00
AP517,WW7RA Gold Mountain               WA US,Sat Jul 17 16:40:40 PDT 2004,4.02,124.00
AP519,W2KB Lebanon Twp.                 NJ US,Sat Jul 17 16:49:27 PDT 2004,0.00,337.00
AP520,WA4LZC Orlando                    FL US,Sat Jul 17 16:46:43 PDT 2004,4.02,231.00
AP521,KD4K Cumming                      GA US,Sat Jul 17 16:49:49 PDT 2004,0.00,283.00
AP523,WA9UKW Boise                      ID US,Sat Jul 17 16:45:59 PDT 2004,0.45,293.00
AP525,N6RZR-2 Anderson                  CA US,Sat Jul 17 16:46:05 PDT 2004,1.34,208.00
AP526,KG4CVZ Tallulah Falls             GA US,Sat Jul 17 16:40:05 PDT 2004,0.00,172.00
AP527,WB0TAX Elm Grove                  LA US,Sat Jul 17 16:43:15 PDT 2004,2.24,209.00
AP528,W7IUC-4 Marathon                  FL US,Sat Jul 17 16:40:49 PDT 2004,0.00,269.00
AP529,W7IUC-1 Key West                  FL US,Sat Jul 17 16:41:13 PDT 2004,1.34,146.00
AP530,W7IUC-3 Big Pine Key              FL US,Sat Jul 17 16:49:35 PDT 2004,4.02,246.00
AP534,W2MJD Hempstead                   NY US,Sat Jul 17 16:49:16 PDT 2004,0.00,164.00
AP535,N1LTP Norton                      MA US,Sat Jul 17 16:46:48 PDT 2004,0.00,189.00
AP537,KC6TYC Port St. John              FL US,Sat Jul 17 16:45:41 PDT 2004,0.00,271.00
AP538,WA3YML Thornhurst                 PA US,Sat Jul 17 16:45:29 PDT 2004,0.00,282.00
AP540,LU2VA-8 Neuquen                      AR,Sat Jul 17 16:50:11 PDT 2004,1.34,113.00
AP542,WM0F Berthoud                     CO US,Sat Jul 17 16:45:08 PDT 2004,1.34,215.00
AP550,N9LBG Edwardsville                IL US,Sat Jul 17 16:46:40 PDT 2004,0.00,337.00
AP555,WA1LOU-15 Wolcott                 CT US,Sat Jul 17 16:46:09 PDT 2004,0.00,0.00
AP556,VE3PEW Mississauga               ONT CA,Sat Jul 17 16:41:42 PDT 2004,0.00,102.00
AP558,N9GTL Marion                      IN US,Sat Jul 17 16:47:12 PDT 2004,0.00,78.00
AP559,N9LYA-3 Mitchell                  IN US,Sat Jul 17 16:48:57 PDT 2004,0.45,325.00
AP560,KB9LHX-6 Jasper                   IN US,Sat Jul 17 16:43:34 PDT 2004,0.89,11.00
AP561,AI9H-6 Mount Carmel               IL US,Sat Jul 17 16:44:59 PDT 2004,1.34,139.00
AP564,N1OTX Woburn                      MA US,Sat Jul 17 16:46:27 PDT 2004,1.34,181.00
AP565,KQ4YD White City                  FL US,Sat Jul 17 16:45:36 PDT 2004,0.00,196.00
AP566,KQ4KX Lakeland                    FL US,Sat Jul 17 16:50:01 PDT 2004,0.00,186.00
AP570,KF3BH Catawissa                   PA US,Sat Jul 17 16:48:32 PDT 2004,0.00,151.00
AP574,K0JJV Hays                        KS US,Sat Jul 17 16:50:13 PDT 2004,1.34,138.00
AP575,KB5WIO Amarillo                   TX US,Sat Jul 17 16:47:41 PDT 2004,1.34,115.00
AP577,K4MG Ocala                        FL US,Sat Jul 17 16:46:41 PDT 2004,0.45,291.00
AP584,KC9BWF-1 Green Bay                WI US,Sat Jul 17 16:49:08 PDT 2004,6.71,55.00
AP585,KC9BWF-3 Green Bay                WI US,Sat Jul 17 16:46:30 PDT 2004,5.36,315.00
AP586,N1EPX Jamaica Plain               MA US,Sat Jul 17 16:45:41 PDT 2004,0.00,210.00
AP588,WD4CD Pickens                     SC US,Sat Jul 17 16:48:08 PDT 2004,0.00,90.00
AP590,KD5RXP Ft.Worth                   TX US,Sat Jul 17 16:47:57 PDT 2004,0.00,0.00
AP593,KC5JIF Amarillo                   TX US,Sat Jul 17 16:41:50 PDT 2004,0.89,269.00
AP594,KC5JZG-2 Bryan                    TX US,Sat Jul 17 16:49:24 PDT 2004,0.89,225.00
AP599,N1HQ Panama City                  FL US,Sat Jul 17 16:50:10 PDT 2004,0.00,216.00
AP602,KG5RG Dickinson                   TX US,Sat Jul 17 16:48:21 PDT 2004,1.79,225.00
AP606,VE2SIL-2 Pierrefonds             QUE CA,Sat Jul 17 16:47:18 PDT 2004,0.00,0.00
AP610,WB9HLA-2 Hartford City            IN US,Sat Jul 17 16:49:34 PDT 2004,1.34,27.00
AP613,PA0OKE Neptunuslaan                  NL,Sat Jul 17 16:49:53 PDT 2004,1.34,242.00
AP614,ON4BDW Vaartdijk                     BE,Sat Jul 17 16:39:02 PDT 2004,1.79,187.00
AP619,IZ6ADZ Scalo                         IT,Sat Jul 17 16:42:18 PDT 2004,0.00,356.00
AP620,IW0RQH Foligno                       IT,Sat Jul 17 16:42:44 PDT 2004,1.34,25.00
AP624,M0ADS Sheffield                      UK,Sat Jul 17 16:47:11 PDT 2004,0.00,0.00
AP626,G1YXH Kent                           UK,Sat Jul 17 16:49:47 PDT 2004,0.89,277.00
AP627,VE4UB Selkirk                     MB CA,Sat Jul 17 16:47:46 PDT 2004,1.34,200.00
AP628,VK3BUS Maldon                        AU,Sat Jul 17 16:48:23 PDT 2004,2.24,167.00
AP630,VK3MY Knox City                      AU,Sat Jul 17 16:35:49 PDT 2004,0.89,72.00
AP632,VK3ZV Moondarra                      AU,Sat Jul 17 16:47:25 PDT 2004,0.00,215.00
AP635,VK5BRC-7 Angaston                    AU,Sat Jul 17 16:48:26 PDT 2004,0.89,202.00
AP640,KC7MRW Lincoln                    ND US,Sat Jul 17 16:45:36 PDT 2004,4.47,160.00
AP641,KB0WBM-2 Arnold                   ND US,Sat Jul 17 16:46:23 PDT 2004,4.02,129.00
AP643,W0HII-3 Cedar Creek               NE US,Sat Jul 17 16:49:16 PDT 2004,0.00,49.00
AP647,K5ZZT-5 San Antonio               TX US,Sat Jul 17 16:47:01 PDT 2004,0.89,113.00
AP648,KS5V Bulverde                     TX US,Sat Jul 17 16:47:51 PDT 2004,0.89,212.00
AP649,KA5KTH Austin                     TX US,Sat Jul 17 16:50:18 PDT 2004,2.68,45.00
AP651,WA5ZAI Valley Mills               TX US,Sat Jul 17 16:49:22 PDT 2004,0.89,303.00
AP654,N5YXO Granbury                    TX US,Sat Jul 17 16:46:10 PDT 2004,2.24,20.00
AP657,KC4WTI Carrolton                  TX US,Sat Jul 17 16:46:52 PDT 2004,2.68,145.00
AP661,WA5KXX Plano                      TX US,Sat Jul 17 16:41:27 PDT 2004,2.24,351.00
AP669,PA0OKE Amsterdam                     NL,Sat Jul 17 16:49:53 PDT 2004,1.34,242.00
AP671,KD5FGW NW Oranjestad                 AW,Sat Jul 17 16:44:05 PDT 2004,5.36,347.00
AP675,OH6SJ-6 Korpilahti                   FI,Sat Jul 17 16:36:56 PDT 2004,0.00,315.00
AP679,ON5CT St-Niklaas                     BE,Sat Jul 17 16:40:36 PDT 2004,0.89,274.00
AP680,KA1GOZ Nashua                     NH US,Sat Jul 17 16:45:44 PDT 2004,0.00,61.00
AP681,N7RIG-6 Mt Vernon                 WA US,Sat Jul 17 16:36:41 PDT 2004,2.68,343.00
AP682,W7KKE-3 Road's End                OR US,Sat Jul 17 16:43:14 PDT 2004,3.58,190.00
AP685,KD7CTY Vancouver                  WA US,Sat Jul 17 16:46:30 PDT 2004,1.34,357.00
AP689,KF4TTB-2 Huntsville               AL US,Sat Jul 17 16:48:07 PDT 2004,1.79,350.00
AP690,KF4TTB-1 Huntsville               AL US,Sat Jul 17 16:46:13 PDT 2004,0.00,264.00
AP692,ZL1WPK Hamilton                      NZ,Sat Jul 17 16:47:46 PDT 2004,2.68,187.00
AP694,ZL1KRH Tauranga                      NZ,Sat Jul 17 16:49:50 PDT 2004,2.24,206.00
AP695,ZL3AQ Ashburton                      NZ,Sat Jul 17 16:43:23 PDT 2004,3.13,247.00
AP696,N4ARI Williamsburg                VA US,Sat Jul 17 16:46:31 PDT 2004,1.79,141.00
AP697,N1NLX Madison                     NH US,Sat Jul 17 16:41:51 PDT 2004,0.00,337.00
AP701,EA3ABN Barcelona                     ES,Sat Jul 17 16:47:32 PDT 2004,2.24,318.00
AP704,KA1UDX Collegeville               PA US,Sat Jul 17 16:36:51 PDT 2004,0.00,98.00
AP705,K4VVN Kingsport                   TN US,Sat Jul 17 16:50:09 PDT 2004,0.00,16.00
AP706,N0PJH Grand Island                NE US,Sat Jul 17 16:45:17 PDT 2004,2.24,61.00
AP710,N7XRD Renton                      WA US,Sat Jul 17 16:45:39 PDT 2004,0.00,100.00
AP712,KA1HEU Hudson                     NH US,Sat Jul 17 16:46:46 PDT 2004,0.00,35.00
AP715,K4DNM Clayton                     NC US,Sat Jul 17 16:48:59 PDT 2004,0.00,213.00
AP718,K4YK Greensboro                   GA US,Sat Jul 17 16:44:12 PDT 2004,0.00,168.00
AP722,KF4ORW Dade City                  FL US,Sat Jul 17 16:46:04 PDT 2004,0.00,197.00
AP723,KB2RC Orlando                     FL US,Sat Jul 17 16:46:12 PDT 2004,0.00,199.00
AP725,KD4BNP Palm Bay                   FL US,Sat Jul 17 16:50:10 PDT 2004,0.00,218.00
AP727,LA9QFA Trondheim                     NO,Sat Jul 17 16:45:36 PDT 2004,0.45,184.00
AP739,WB0TWE Encinitas                  CA US,Sat Jul 17 16:50:11 PDT 2004,3.13,217.00
AP742,KC4ELV Honey Creek                GA US,Sat Jul 17 16:45:17 PDT 2004,0.00,149.00
AP744,K0RM Colorado Springs             CO US,Sat Jul 17 16:43:30 PDT 2004,0.00,158.00
AP745,K4GPS-1 Jupiter Farms             FL US,Sat Jul 17 16:46:08 PDT 2004,0.45,170.00
AP746,AA3H Avon                         OH US,Sat Jul 17 16:50:15 PDT 2004,0.00,178.00
AP747,KC4ANB Trussville                 AL US,Sat Jul 17 16:48:14 PDT 2004,0.00,345.00
AP749,N3FJA Mountain Top                PA US,Sat Jul 17 16:49:38 PDT 2004,0.00,244.00
AP750,W1OEM Flanders                    CT US,Sat Jul 17 16:49:57 PDT 2004,0.00,248.00
AP751,KC2KY Centereach                  NY US,Sat Jul 17 16:48:49 PDT 2004,0.45,167.00
AP758,KC7BWK Florence                   OR US,Sat Jul 17 16:49:55 PDT 2004,2.24,166.00
AP760,WB0BLV Security/Widefield         CO US,Sat Jul 17 16:50:19 PDT 2004,0.00,203.00
AP763,OX3HI Kangerlussuaq                  GL,Sat Jul 17 16:45:09 PDT 2004,1.34,74.00
AP765,N3EYQ Kingston                    NY US,Sat Jul 17 16:39:22 PDT 2004,0.45,358.00
AP766,WB2CMF Farmingville               NY US,Sat Jul 17 16:35:34 PDT 2004,0.00,198.00
AP767,N2XP Flanders                     NJ US,Sat Jul 17 16:48:40 PDT 2004,0.00,180.00
AP769,WC4PEM-10 Bartow                  FL US,Sat Jul 17 16:42:14 PDT 2004,0.00,180.00
AP771,WD9HDQ-2 Northfield               MN US,Sat Jul 17 16:45:23 PDT 2004,3.58,345.00
AP772,K4KAL Marietta                    GA US,Sat Jul 17 16:45:29 PDT 2004,0.00,289.00
AP773,KB4TOH-11 Columbia                NC US,Sat Jul 17 16:46:16 PDT 2004,4.02,181.00
AP774,N8OVD Wendell                     NC US,Sat Jul 17 16:45:46 PDT 2004,0.00,180.00
AP779,K4CCC-9 Cheraw                    SC US,Sat Jul 17 16:46:19 PDT 2004,1.34,46.00
AP780,W5VBQ Santa Fe                    NM US,Sat Jul 17 16:43:38 PDT 2004,2.24,287.00
AP782,WB5NZV-8 N.Denton                 TX US,Sat Jul 17 16:41:59 PDT 2004,0.00,345.00
AP783,KC5DPC-3 Slidell                  TX US,Sat Jul 17 16:47:56 PDT 2004,4.92,257.00
AP786,K5EBQ Houston                     TX US,Sat Jul 17 16:48:25 PDT 2004,1.34,296.00
AP787,KC5LPN Houston                    TX US,Sat Jul 17 16:48:35 PDT 2004,1.34,207.00
AP792,KB0TVJ-4 MeadowLake Airport       CO US,Sat Jul 17 16:49:33 PDT 2004,2.24,278.00
AP795,KD7TTL Greenbank                  WA US,Sat Jul 17 16:46:02 PDT 2004,0.00,216.00
AP799,AE0S-3 Columbia                   MO US,Sat Jul 17 16:49:57 PDT 2004,0.00,14.00
AP802,W4OZK-7 Mentone                   AL US,Sat Jul 17 16:47:29 PDT 2004,2.68,332.00
AP803,KE6AFE Santa Cruz                 CA US,Sat Jul 17 16:50:09 PDT 2004,2.68,106.00
AP806,N3EG Longview                     WA US,Sat Jul 17 16:41:04 PDT 2004,0.89,180.00
AP808,KG4YZY New Port Richey            FL US,Sat Jul 17 16:49:04 PDT 2004,0.45,232.00
AP809,K4NUT Port Richey                 FL US,Sat Jul 17 16:48:36 PDT 2004,0.89,244.00
AP811,KC2IXE Bayside Hills              NY US,Sat Jul 17 16:47:44 PDT 2004,2.24,205.00
AP812,VE3XF Stayner                    ONT CA,Sat Jul 17 16:49:29 PDT 2004,1.34,1.00
AP813,VE3PWZ Dundalk                   ONT CA,Sat Jul 17 16:45:45 PDT 2004,1.34,344.00
AP814,VA3GY Erin                       ONT CA,Sat Jul 17 16:41:52 PDT 2004,0.00,315.00
AP815,VA3HST Guelph                    ONT CA,Sat Jul 17 16:43:31 PDT 2004,2.24,0.00
AP817,VA3AT Renfrew                    ONT CA,Sat Jul 17 16:45:19 PDT 2004,2.24,35.00
AP818,VA3MWK Ashton                    ONT CA,Sat Jul 17 16:49:26 PDT 2004,2.24,340.00
AP819,VE3TEN Ottawa                    ONT CA,Sat Jul 17 16:46:03 PDT 2004,2.24,10.00
AP820,VE6BMR Sherwood Park             ALT CA,Sat Jul 17 16:41:07 PDT 2004,0.00,211.00
AP823,AD4BL Fairbanks                   AK US,Sat Jul 17 16:43:13 PDT 2004,0.00,262.00
AP824,K5WPN-10 Duncan                   OK US,Sat Jul 17 16:49:25 PDT 2004,5.36,21.00
AP830,KA2FNK Merriam                    KS US,Sat Jul 17 16:46:55 PDT 2004,0.45,21.00
AP831,N9NJK Warsaw                      IN US,Sat Jul 17 16:48:47 PDT 2004,1.79,16.00
AP832,WB9TLH-11 Bloomington             IN US,Sat Jul 17 16:43:05 PDT 2004,0.00,0.00
AP833,KE4CON-3 Woodstock                IL US,Sat Jul 17 16:47:23 PDT 2004,4.92,33.00
AP838,W5MAI San Antonio                 TX US,Sat Jul 17 16:43:25 PDT 2004,0.45,195.00
AP840,KC0OGY-5 Bailey                   CO US,Sat Jul 17 16:45:29 PDT 2004,0.89,288.00
AP841,WE1A USAF Academy                 CO US,Sat Jul 17 16:44:40 PDT 2004,0.00,293.00
AP842,VE5VAP Dalmeny                    SK CA,Sat Jul 17 16:43:27 PDT 2004,4.92,199.00
AP850,KC2GLZ Lowville                   NY US,Sat Jul 17 16:46:04 PDT 2004,0.00,11.00
AP852,WG4R Meadows of Dan               VA US,Sat Jul 17 16:50:22 PDT 2004,0.45,246.00
AP854,N4HHP-1 Plantation                FL US,Sat Jul 17 16:49:08 PDT 2004,0.00,59.00
AP855,N4HHP-2 Ft. Lauderdale            FL US,Sat Jul 17 16:47:13 PDT 2004,2.24,170.00
AP856,N4HHP-3 Hallandale Beach          FL US,Sat Jul 17 16:47:57 PDT 2004,2.68,219.00
AP860,AA5ED-10 Brandon                  MS US,Sat Jul 17 16:45:45 PDT 2004,0.00,161.00
AP862,KC0KOQ-1 Goodland                 KS US,Sat Jul 17 16:41:00 PDT 2004,0.00,180.00
AP864,AB0XM-1 Great Bend                KS US,Sat Jul 17 16:48:54 PDT 2004,2.68,72.00
AP866,KA0HJZ Van Meter                  IA US,Sat Jul 17 16:48:47 PDT 2004,0.89,15.00
AP867,N0VPR Johnston                    IA US,Sat Jul 17 16:47:48 PDT 2004,1.79,19.00
AP872,N0EST Rochester                   MN US,Sat Jul 17 16:50:10 PDT 2004,0.00,333.00
AP874,VK2AAK Forster                       AU,Sat Jul 17 16:45:30 PDT 2004,4.02,218.00
AP878,AB9FX Chicago                     IL US,Sat Jul 17 16:45:42 PDT 2004,3.13,105.00
AP881,KJ4W Murray                       KY US,Sat Jul 17 16:36:32 PDT 2004,0.45,48.00
AP888,N7QXO-2 Vancouver                 WA US,Sat Jul 17 16:46:01 PDT 2004,0.00,244.00
AP890,KB7DZR Tigard                     OR US,Sat Jul 17 16:46:03 PDT 2004,0.89,322.00
AP892,KG6QHD Prineville                 OR US,Sat Jul 17 16:46:13 PDT 2004,1.79,314.00
AP893,KE6KYI Groveland                  CA US,Sat Jul 17 16:49:54 PDT 2004,0.00,246.00
AP894,K6IMN Atwater                     CA US,Sat Jul 17 16:44:59 PDT 2004,0.89,53.00
AP895,KF6JJP Richmond                   CA US,Sat Jul 17 16:48:33 PDT 2004,3.58,212.00
AP896,WA6YLB Exeter                     CA US,Sat Jul 17 16:41:53 PDT 2004,0.00,341.00
AP897,WA6YLB-4 Govt.Peak                CA US,Sat Jul 17 16:47:04 PDT 2004,8.05,264.00
AP898,WA6YLB-6 Visalia                  CA US,Sat Jul 17 16:49:19 PDT 2004,0.00,0.00
AP899,KF6IHL-3 Moody Canyon             CA US,Sat Jul 17 16:46:56 PDT 2004,2.68,298.00
AP900,KE6ZPS-1 Miranda Canyon           CA US,Sat Jul 17 16:43:50 PDT 2004,10.73,218.00
AP901,KB6OQJ Santa Ynez                 CA US,Sat Jul 17 16:47:11 PDT 2004,1.34,292.00
AP902,N6HGA-1 Palmdale                  CA US,Sat Jul 17 16:35:40 PDT 2004,3.13,226.00
AP904,W6MAF Hesperia                    CA US,Sat Jul 17 16:47:44 PDT 2004,6.71,184.00
AP907,W9IF-4 Torry Pines                CA US,Sat Jul 17 16:48:10 PDT 2004,4.02,266.00
AP911,K4GIG-7 Brindley Mtn.             AL US,Sat Jul 17 16:49:22 PDT 2004,0.00,249.00
AP912,WB2JSH Eaton                      CO US,Sat Jul 17 16:50:07 PDT 2004,4.92,237.00
AP913,WB5SLA Ball Ground                GA US,Sat Jul 17 16:48:15 PDT 2004,0.00,260.00
AP919,LB9ME Trondheim                      NO,Sat Jul 17 16:49:38 PDT 2004,0.00,122.00
AP921,OZ6GX-5 Roervig                      DK,Sat Jul 17 16:45:59 PDT 2004,0.00,127.00
AP922,OZ1IEP-5 Jaegerspris                 DK,Sat Jul 17 16:41:07 PDT 2004,4.02,142.00
AP924,OH6GGL-3 Lppalahti                   FI,Sat Jul 17 16:44:17 PDT 2004,0.00,0.00
AP932,MB7UHR Luton                         UK,Sat Jul 17 16:50:21 PDT 2004,0.00,50.00
AP937,MB7UEK Herne Bay                     UK,Sat Jul 17 16:47:03 PDT 2004,1.34,249.00
AP938,G3OJZ-6 Kent                         UK,Sat Jul 17 16:46:47 PDT 2004,3.13,291.00
AP941,LU5ABT-15 BuenosAries                AR,Sat Jul 17 16:45:50 PDT 2004,3.13,141.00
AP942,YV5KXE-2 Caracas                     VE,Sat Jul 17 16:40:41 PDT 2004,0.00,22.00
AP943,MTHEBO Mt. Hebo                   OR US,Sat Jul 17 16:48:21 PDT 2004,0.00,0.00
AP949,F4CEP-12 Rubelles                    FR,Sat Jul 17 16:45:06 PDT 2004,1.34,350.00
AP952,N1NSI Contoocook                  NH US,Sat Jul 17 16:45:37 PDT 2004,0.00,8.00
AP956,K4TEM Tallahassee                 FL US,Sat Jul 17 16:50:06 PDT 2004,0.00,267.00
AP957,KA4EOC Tallahassee                FL US,Sat Jul 17 16:46:09 PDT 2004,0.00,177.00
AP959,K7NPS Snowden                     WA US,Sat Jul 17 16:45:29 PDT 2004,0.00,180.00
AP960,HB9TJM-8 Vallorbe                    CH,Sat Jul 17 16:46:04 PDT 2004,0.00,112.00
AP962,EB2FGI-15 Irun                       ES,Sat Jul 17 16:38:06 PDT 2004,0.00,171.00
AP965,EB5ESX Sta Pola                      ES,Sat Jul 17 16:48:26 PDT 2004,8.05,40.00
AP967,EA3AYP-1 Girona                      ES,Sat Jul 17 16:45:57 PDT 2004,1.34,333.00
AP973,PE1NAT-1 Heerhugowaard               NL,Sat Jul 17 16:50:01 PDT 2004,1.79,248.00
AP974,DO6PA-5 Ahrweiler                    DE,Sat Jul 17 16:37:08 PDT 2004,1.34,205.00
AP976,DO7VLR-5 Zweibruecken                DE,Sat Jul 17 16:48:41 PDT 2004,0.00,41.00
AP979,KC9BWF-3 Sister Bay               MI US,Sat Jul 17 16:46:30 PDT 2004,5.36,315.00
AP981,KG4SEY Niceville                  FL US,Sat Jul 17 16:44:36 PDT 2004,0.00,175.00
AP984,N8QQ Cincinnati                   OH US,Sat Jul 17 16:50:03 PDT 2004,0.00,348.00
AP985,KB9QJM-11 Cloverdale              IN US,Sat Jul 17 16:46:09 PDT 2004,0.89,0.00
AP986,KB9QJM-12 Atlanta                 IN US,Sat Jul 17 16:47:03 PDT 2004,1.34,26.00
AP989,KC9JWM Clam Lake                  WI US,Sat Jul 17 16:49:12 PDT 2004,0.00,206.00
AP990,KG6MOZ Sunnyvale                  CA US,Sat Jul 17 16:48:17 PDT 2004,1.79,315.00
AP991,W0BIS-3 Killdeer                  ND US,Sat Jul 17 16:48:36 PDT 2004,5.81,107.00
AP995,KI4BUM Burlington                 KY US,Sat Jul 17 16:50:01 PDT 2004,0.89,14.00
AP998,DK1PR-6 Altenahr                     DE,Sat Jul 17 16:48:11 PDT 2004,1.79,278.00
AP999,DB5OY-15 Celle                       DE,Sat Jul 17 16:46:58 PDT 2004,0.00,360.00
AR003,DL9GJ-6 Burgrieden                   DE,Sat Jul 17 16:42:46 PDT 2004,1.34,135.00
AR005,HB9BA-8 Solothurn                    CH,Sat Jul 17 16:49:09 PDT 2004,0.00,0.00
AR006,HB9MZI Giubiasco                     CH,Sat Jul 17 16:42:33 PDT 2004,0.00,136.00
AR009,SR3TK-1 Gontyniec                    PL,Sat Jul 17 16:49:18 PDT 2004,4.02,156.00
AR011,IK1ZQJ Torino                        IT,Sat Jul 17 16:44:03 PDT 2004,0.00,3.00
AR016,IW4APJ-3 Soliera                     IT,Sat Jul 17 16:46:05 PDT 2004,1.34,309.00
AR022,IW5BFZ Lucca                         IT,Sat Jul 17 16:50:15 PDT 2004,0.00,253.00
AR023,I4GOS-3 Rimini                       IT,Sat Jul 17 16:50:07 PDT 2004,1.79,281.00
AR025,IT9IPQ-2 Messina                     IT,Sat Jul 17 16:48:22 PDT 2004,3.13,207.00
AR026,IK8ERL-2 Scilla                      IT,Sat Jul 17 16:44:13 PDT 2004,0.00,229.00
AR027,IZ8GMP-2 Reggio Calabria             IT,Sat Jul 17 16:45:40 PDT 2004,2.68,166.00
AR028,IW8PCP-2 Gambarie d'Aspromonte       IT,Sat Jul 17 16:47:09 PDT 2004,0.00,97.00
AR029,KG4QXL-2 Fort Valley              VA US,Sat Jul 17 16:45:16 PDT 2004,0.00,337.00
AR030,N4HHP-4 Pompano Beach             FL US,Sat Jul 17 16:48:07 PDT 2004,2.24,139.00
AR031,SV2BNL-2 Thessaloniki                GR,Sat Jul 17 16:45:44 PDT 2004,0.00,95.00
AR033,SV4BHA-2 Larisa                      GR,Sat Jul 17 16:36:09 PDT 2004,0.00,210.00
AR034,SV1CIF-2 Aitoloakarnania             GR,Sat Jul 17 16:38:52 PDT 2004,0.45,351.00
AR035,SV3AQN-2 Patra                       GR,Sat Jul 17 16:36:36 PDT 2004,3.13,43.00
AR040,N3BSQ Bethel Park                 PA US,Sat Jul 17 16:48:20 PDT 2004,0.00,93.00
AR042,VK1AC Bywong                     NSW AU,Sat Jul 17 16:47:51 PDT 2004,2.24,157.00
AR043,K4ZZR Port St. Lucie              FL US,Sat Jul 17 16:46:36 PDT 2004,1.34,236.00
AR044,N0QXY Ft.Lupton                   CO US,Sat Jul 17 16:42:41 PDT 2004,0.00,258.00
AR045,IW9ETI-2 Taormina                    IT,Sat Jul 17 16:48:11 PDT 2004,3.13,286.00
AR051,KE7TR-8 Mesa                      AZ US,Sat Jul 17 16:50:15 PDT 2004,0.00,34.00
AR052,KG4QXL Fort Valley                VA US,Sat Jul 17 16:35:48 PDT 2004,0.00,266.00
AR053,VK3AWA Paradise Beach                AU,Sat Jul 17 16:49:07 PDT 2004,2.24,197.00
AR058,VK3YWY-1 Kyneton                     AU,Sat Jul 17 16:39:42 PDT 2004,4.02,154.00
AR060,VK3JTM-3 Ararat                      AU,Sat Jul 17 16:49:59 PDT 2004,3.58,201.00
AR061,VK3YLV Horsham                       AU,Sat Jul 17 16:48:49 PDT 2004,0.00,183.00
AR062,VK5EX-1 Adelaide                     AU,Sat Jul 17 16:47:46 PDT 2004,1.79,139.00
AR066,KC0IVW Colorado Springs           CO US,Sat Jul 17 16:45:21 PDT 2004,0.00,0.00
AR071,KD4BJW Albertville                AL US,Sat Jul 17 16:50:10 PDT 2004,0.00,270.00
AR072,KB2KMM N. Babylon                 NY US,Sat Jul 17 16:50:13 PDT 2004,0.00,98.00
AR079,WX4BUY Elon                       NC US,Sat Jul 17 16:49:00 PDT 2004,1.34,122.00
AR082,WA2EIU Marietta                   GA US,Sat Jul 17 16:44:13 PDT 2004,0.00,101.00
AR084,W4ERC-10 Avon Park                FL US,Sat Jul 17 16:46:15 PDT 2004,1.34,273.00
AR085,N4HHP-5 Deerfield Beach           FL US,Sat Jul 17 16:44:30 PDT 2004,0.00,257.00
AR087,F8KDX Melun                          FR,Sat Jul 17 16:38:01 PDT 2004,0.00,357.00
AR091,DB0SAC-6 Bad Sackingen               DE,Sat Jul 17 16:39:59 PDT 2004,3.13,62.00
AR095,DO2UMM Gorlitz                       DE,Sat Jul 17 16:42:15 PDT 2004,0.00,270.00
AR097,EA3AGQ Lleida                        ES,Sat Jul 17 16:48:08 PDT 2004,4.47,67.00
AR098,EA3AGQ-1 Montsec d'Ares              ES,Sat Jul 17 16:47:12 PDT 2004,7.60,173.00
AR100,N1FWV Peabody                     MA US,Sat Jul 17 16:50:24 PDT 2004,0.00,126.00
AR103,W4SBO-7 Section                   AL US,Sat Jul 17 16:48:09 PDT 2004,1.34,359.00
AR106,N6FKW Auberry                     CA US,Sat Jul 17 16:48:41 PDT 2004,0.00,192.00
AR107,EA3AKS-15 SantPere de Ribes          ES,Sat Jul 17 16:50:01 PDT 2004,1.34,0.00
AR108,EA3BB Santpedor                      ES,Sat Jul 17 16:40:43 PDT 2004,0.45,55.00
AR109,EA3BSJ-1 Pinos                       ES,Sat Jul 17 16:43:58 PDT 2004,4.02,105.00
AR110,EA3CNO-1 Barcelona                   ES,Sat Jul 17 16:50:06 PDT 2004,0.89,288.00
AR111,EA3URE Figueres                      ES,Sat Jul 17 16:42:57 PDT 2004,1.34,21.00
AR112,EB3DMC-1 Belvis                      ES,Sat Jul 17 16:50:07 PDT 2004,2.68,84.00
AR115,EUGENE Eugene                     OR US,Sat Jul 17 16:40:44 PDT 2004,4.02,224.00
AR116,F1JXB-5 Villate                      FR,Sat Jul 17 16:48:13 PDT 2004,2.68,145.00
AR118,F6DEV-5 Rimont                       FR,Sat Jul 17 16:48:07 PDT 2004,0.00,212.00
AR122,N4HHP-6 Cooper City               FL US,Sat Jul 17 16:43:17 PDT 2004,0.00,184.00
AR126,KG4EUF Virginia Beach             VA US,Sat Jul 17 16:48:17 PDT 2004,1.79,50.00
AR130,IW4BMA Reggio Emilia                 IT,Sat Jul 17 16:41:09 PDT 2004,0.00,232.00
AR132,IZ1DBU-2 Favria                      IT,Sat Jul 17 16:43:26 PDT 2004,0.00,356.00
AR133,K0MXU-4 Hoxie                     KS US,Sat Jul 17 16:48:29 PDT 2004,0.00,23.00
AR134,K4JRG Miami                       FL US,Sat Jul 17 16:42:49 PDT 2004,2.24,270.00
AR135,K5MJE-1 Tijeras                   NM US,Sat Jul 17 16:42:13 PDT 2004,1.79,230.00
AR137,K6NE Ventura                      CA US,Sat Jul 17 16:43:31 PDT 2004,0.00,51.00
AR138,K7LHC-1 Lake Havasu               AZ US,Sat Jul 17 16:47:37 PDT 2004,1.79,91.00
AR140,KB0VYO-12 Winona                  MN US,Sat Jul 17 16:44:42 PDT 2004,2.68,0.00
AR141,KB5NMB-5 Fulton                   MS US,Sat Jul 17 16:45:58 PDT 2004,2.24,256.00
AR144,KB6CYS Cypress                    CA US,Sat Jul 17 16:44:40 PDT 2004,3.58,157.00
AR145,KB9KTD-1 Onalaska                 WI US,Sat Jul 17 16:44:07 PDT 2004,1.34,265.00
AR147,W0NWS-4 Colon                     NE US,Sat Jul 17 16:47:40 PDT 2004,0.00,0.00
AR148,K6DYC Meeker                      CO US,Sat Jul 17 16:50:07 PDT 2004,2.68,114.00
AR150,KC4WPS Hendersonville             TN US,Sat Jul 17 16:46:30 PDT 2004,0.00,325.00
AR156,KD4DLT-6 Lithonia                 GA US,Sat Jul 17 16:48:54 PDT 2004,0.00,0.00
AR159,KD6VLN-14 Tucson                  AZ US,Sat Jul 17 16:47:23 PDT 2004,2.24,306.00
AR160,NEWPRT Cape Foulweather           OR US,Sat Jul 17 16:45:44 PDT 2004,5.36,172.00
AR161,KD7DR-3 Tempe                     AZ US,Sat Jul 17 16:43:40 PDT 2004,2.24,346.00
AR162,KF4VTT Mebane                     NC US,Sat Jul 17 16:50:15 PDT 2004,0.00,73.00
AR164,KF6NY Mt. Ranch                   CA US,Sat Jul 17 16:45:08 PDT 2004,0.00,232.00
AR165,KF6YU-2 Tempe                     AZ US,Sat Jul 17 16:42:00 PDT 2004,0.00,0.00
AR166,KG4LXH-2 Miami                    FL US,Sat Jul 17 16:43:29 PDT 2004,0.00,311.00
AR167,KI0IO-2 Berthoud                  CO US,Sat Jul 17 16:46:30 PDT 2004,0.00,183.00
AR169,KK6RW Gig Harbor                  WA US,Sat Jul 17 16:45:19 PDT 2004,1.34,298.00
AR170,KO5Z Denton                       TX US,Sat Jul 17 16:47:27 PDT 2004,0.89,0.00
AR173,LA2YEA Hauglandshella                NO,Sat Jul 17 16:41:00 PDT 2004,4.92,158.00
AR177,K7UGT Cary                        NC US,Sat Jul 17 16:48:45 PDT 2004,0.00,158.00
AR178,KJ3L Erie                         PA US,Sat Jul 17 16:50:08 PDT 2004,0.45,7.00
