AP096,AE5PL Melissa                     TX US,Sat Jul 17 16:17:28 PDT 2004,3.13,340.00
AP105,KD4LXB-3 Boynton Beach            FL US,Sat Jul 17 16:19:58 PDT 2004,2.24,179.00
AP106,N9QGS Streamwood                  IL US,Sat Jul 17 16:19:19 PDT 2004,0.89,65.00
AP108,W8MAP-1 Middleburg                OH US,Sat Jul 17 16:18:57 PDT 2004,0.00,38.00
AP110,KB8SSH Columbus                   OH US,Sat Jul 17 16:16:09 PDT 2004,0.00,18.00
AP113,W4NHL-12 Pinellas Co              FL US,Sat Jul 17 16:20:04 PDT 2004,0.89,253.00
AP114,K4TCV-1 Miami                     FL US,Sat Jul 17 16:18:35 PDT 2004,2.68,59.00
AP117,N5FAZ-2 El Paso                   TX US,Sat Jul 17 16:19:24 PDT 2004,2.24,139.00
AP119,KC8LCP-9 Hudsonville              MI US,Sat Jul 17 16:16:13 PDT 2004,0.45,353.00
AP120,KC8LCP-10 Grand Haven             MI US,Sat Jul 17 16:18:12 PDT 2004,2.24,34.00
AP121,KC8LCP-11 Grand Haven             MI US,Sat Jul 17 16:19:09 PDT 2004,2.68,37.00
AP122,KC8LCP-12 Holland                 MI US,Sat Jul 17 16:19:41 PDT 2004,3.13,22.00
AP123,KC8LCP-13 Holland                 MI US,Sat Jul 17 16:18:36 PDT 2004,0.00,269.00
AP124,KC8LCP-14 West Olive              MI US,Sat Jul 17 16:13:49 PDT 2004,0.00,0.00
AP125,KC8LCP-15 West Olive              MI US,Sat Jul 17 16:13:01 PDT 2004,0.00,162.00
AP127,K35D Allegan                      MI US,Sat Jul 17 16:19:58 PDT 2004,4.47,316.00
AP129,K7D3 Baldwin                      MI US,Sat Jul 17 16:11:49 PDT 2004,4.02,264.00
AP130,K13C Lakeview                     MI US,Sat Jul 17 16:17:19 PDT 2004,2.24,336.00
AP133,K80D Harrison                     MI US,Sat Jul 17 16:15:28 PDT 2004,2.24,159.00
AP136,KC04 Oceana                       MI US,Sat Jul 17 16:18:08 PDT 2004,2.24,274.00
AP137,N0WPS Littleton                   CO US,Sat Jul 17 16:17:37 PDT 2004,2.68,176.00
AP138,WA0RTU Savannah                   MO US,Sat Jul 17 16:11:38 PDT 2004,0.89,350.00
AP139,AA5QJ-1 Las Vegas                 NV US,Sat Jul 17 16:11:01 PDT 2004,3.58,326.00
AP141,WN5PFI-8 Huntsville               UT US,Sat Jul 17 16:16:48 PDT 2004,0.00,323.00
AP145,K4VAE Plantation                  FL US,Sat Jul 17 16:06:07 PDT 2004,0.00,108.00
AP150,N9EE-1 New Port Richey            FL US,Sat Jul 17 16:19:54 PDT 2004,3.13,287.00
AP153,N6SSQ Alturas                     CA US,Sat Jul 17 16:20:16 PDT 2004,3.13,243.00
AP155,WX7YUM Yuma                       AZ US,Sat Jul 17 16:10:29 PDT 2004,3.58,192.00
AP156,WA6TK Rosamond                    CA US,Sat Jul 17 16:18:54 PDT 2004,5.81,247.00
AP157,SV2BBO-2 Thessaloniki                GR,Sat Jul 17 16:15:24 PDT 2004,0.00,60.00
AP159,WB7OND Fayetteville               NC US,Sat Jul 17 16:07:30 PDT 2004,2.24,309.00
AP163,KC5LXC Stillwater                 MN US,Sat Jul 17 16:20:18 PDT 2004,1.34,40.00
AP167,N3DXC Commodore                   PA US,Sat Jul 17 16:17:24 PDT 2004,0.45,113.00
AP172,KD7FBT Aberdeen                   WA US,Sat Jul 17 16:07:39 PDT 2004,1.79,234.00
AP176,KG0HM-2 Crystal Lakes             CO US,Sat Jul 17 16:18:03 PDT 2004,0.00,359.00
AP181,KG4FZO-5 Kissimmee                FL US,Sat Jul 17 16:17:09 PDT 2004,0.00,242.00
AP182,W5EUT-5 Antero Junction           CO US,Sat Jul 17 16:20:18 PDT 2004,0.00,354.00
AP184,WD4LSS Winston-Salem              NC US,Sat Jul 17 16:11:14 PDT 2004,0.00,341.00
AP185,N4BSA Clearwater                  FL US,Sat Jul 17 16:19:52 PDT 2004,1.34,236.00
AP186,KB9PKI Orland Park                IL US,Sat Jul 17 16:16:09 PDT 2004,0.45,189.00
AP187,KD4PMP Nashville                  TN US,Sat Jul 17 16:19:48 PDT 2004,0.00,332.00
AP190,K0ANI Denver                      CO US,Sat Jul 17 16:17:18 PDT 2004,0.00,226.00
AP191,WA6MWI Soquel                     CA US,Sat Jul 17 16:11:13 PDT 2004,0.89,102.00
AP193,N2TNN Somerset                    NJ US,Sat Jul 17 16:17:05 PDT 2004,0.00,247.00
AP194,WD9EKA Marshall                   IL US,Sat Jul 17 16:17:30 PDT 2004,0.45,0.00
AP198,W6PKT-3 No. Ukiah                 CA US,Sat Jul 17 16:17:43 PDT 2004,4.92,293.00
AP199,K6EKB-5 Cameron Park              CA US,Sat Jul 17 16:16:20 PDT 2004,1.79,18.00
AP200,N6TBQ Del Rey Oaks                CA US,Sat Jul 17 16:18:43 PDT 2004,2.24,288.00
AP201,KE6FOA-3 Hilmer                   CA US,Sat Jul 17 16:16:09 PDT 2004,6.26,317.00
AP202,W6BXN-3 Bear Valley               CA US,Sat Jul 17 16:19:36 PDT 2004,2.24,240.00
AP203,KF6HJO Selma                      CA US,Sat Jul 17 16:17:53 PDT 2004,2.24,298.00
AP204,KD6DSI San Luis Obispo            CA US,Sat Jul 17 16:19:02 PDT 2004,3.13,0.00
AP205,K1PIG Kent's Hill                 ME US,Sat Jul 17 16:15:19 PDT 2004,0.00,270.00
AP206,K1PIG-4 Kent's Hill               ME US,Sat Jul 17 16:14:44 PDT 2004,0.00,186.00
AP207,KD1KE Freedom                     ME US,Sat Jul 17 16:08:47 PDT 2004,0.00,194.00
AP208,WB7COX Nampa                      ID US,Sat Jul 17 16:15:51 PDT 2004,0.45,0.00
AP209,WA4USN-3 Summerville              SC US,Sat Jul 17 16:15:26 PDT 2004,0.00,187.00
AP210,WA1DLZ Mercer                     ME US,Sat Jul 17 16:20:20 PDT 2004,0.00,34.00
AP214,K1MGY Littleton                   MA US,Sat Jul 17 16:20:22 PDT 2004,0.00,246.00
AP215,W0BIS-2 Antelope                  ND US,Sat Jul 17 16:17:41 PDT 2004,8.94,156.00
AP216,W0BIS-8 St. Anthony               ND US,Sat Jul 17 16:18:54 PDT 2004,5.36,141.00
AP217,W0BIS-4 Flasher                   ND US,Sat Jul 17 16:15:41 PDT 2004,3.13,174.00
AP218,W0BIS-5 Selfridge                 ND US,Sat Jul 17 16:15:54 PDT 2004,6.71,159.00
AP219,W0BIS-6 Center                    ND US,Sat Jul 17 16:16:18 PDT 2004,3.58,139.00
AP221,VE4GLS Emerson                   MAN CA,Sat Jul 17 16:06:31 PDT 2004,0.00,158.00
AP222,WA0BAG-5 Bagg Mtn.                CO US,Sat Jul 17 16:14:58 PDT 2004,4.47,203.00
AP225,N0LRF Berryton                    KS US,Sat Jul 17 16:19:35 PDT 2004,1.34,18.00
AP227,KC5UNC W.Oklahoma City            OK US,Sat Jul 17 16:12:53 PDT 2004,2.68,40.00
AP228,KM5HG-3 Claremore                 OK US,Sat Jul 17 16:17:24 PDT 2004,4.47,330.00
AP232,WD4INS Hopkinsville               KY US,Sat Jul 17 16:20:30 PDT 2004,0.45,355.00
AP236,N1NAF Waterville                  ME US,Sat Jul 17 16:16:48 PDT 2004,0.00,0.00
AP240,N1JDU-3 Watertown                 MA US,Sat Jul 17 16:08:18 PDT 2004,0.45,202.00
AP243,VE2REQ Varennes                  QUE CA,Sat Jul 17 16:19:45 PDT 2004,2.68,32.00
AP245,W1SEM Easthampton                 MA US,Sat Jul 17 16:19:12 PDT 2004,0.00,210.00
AP247,ZL3AD N. Canterbury                  NZ,Sat Jul 17 16:14:22 PDT 2004,2.24,224.00
AP248,N2QJU Waterloo                    NY US,Sat Jul 17 16:15:32 PDT 2004,0.00,95.00
AP253,W5MPZ-4 Kirtland AFB              NM US,Sat Jul 17 16:11:05 PDT 2004,4.02,182.00
AP255,K5WPH El Paso                     TX US,Sat Jul 17 16:19:00 PDT 2004,1.34,139.00
AP264,W0WOB Colby                       KS US,Sat Jul 17 16:15:47 PDT 2004,0.00,360.00
AP267,KP3G Juncos                       PR US,Sat Jul 17 16:17:16 PDT 2004,0.00,72.00
AP271,W0BIS-7 New Salem                 ND US,Sat Jul 17 16:17:48 PDT 2004,6.71,142.00
AP273,N1HRK N.Kingston                  RI US,Sat Jul 17 16:19:52 PDT 2004,0.00,148.00
AP277,WA6OFT Parker                     AZ US,Sat Jul 17 16:20:18 PDT 2004,2.68,216.00
AP279,KA1SNP Phippsburg                 ME US,Sat Jul 17 16:16:53 PDT 2004,0.00,254.00
AP284,WY1U Wallingford                  CT US,Sat Jul 17 16:09:40 PDT 2004,0.45,53.00
AP286,N3YMW Fleetwood                   PA US,Sat Jul 17 16:19:25 PDT 2004,0.00,143.00
AP289,W2GWY Glen Falls                  NY US,Sat Jul 17 16:16:13 PDT 2004,0.00,0.00
AP292,WU2Z N. Brunswick                 NJ US,Sat Jul 17 16:13:07 PDT 2004,0.00,19.00
AP294,WX2NJ Pinewald                    NJ US,Sat Jul 17 16:17:28 PDT 2004,0.45,250.00
AP302,N1TKK-1 San Juan                  PR US,Sat Jul 17 16:18:59 PDT 2004,1.79,65.00
AP303,W2DAV Red Hook                    NY US,Sat Jul 17 16:14:53 PDT 2004,0.00,11.00
AP304,KC5EZZ San Angelo                 TX US,Sat Jul 17 16:16:35 PDT 2004,2.68,101.00
AP307,WA3NNA Larchmont                  PA US,Sat Jul 17 16:11:05 PDT 2004,0.89,181.00
AP312,K2SLZ-5 East Aurora               NY US,Sat Jul 17 16:20:13 PDT 2004,0.00,325.00
AP313,AA2AC-2 Clarence Center           NY US,Sat Jul 17 16:19:10 PDT 2004,0.00,51.00
AP314,W2SO-1 Lancaster                  NY US,Sat Jul 17 16:18:29 PDT 2004,0.89,345.00
AP315,K2NV Grand Isle                   NY US,Sat Jul 17 16:18:59 PDT 2004,0.00,112.00
AP316,VE3GSI Napanee                   ONT CA,Sat Jul 17 16:15:01 PDT 2004,0.00,0.00
AP319,VE3DTV Hamilton                  ONT CA,Sat Jul 17 16:18:46 PDT 2004,1.34,44.00
AP320,VE3EYR Nanticoke                 ONT CA,Sat Jul 17 16:19:03 PDT 2004,0.00,246.00
AP321,VE3KSR Kitchner                  ONT CA,Sat Jul 17 16:19:18 PDT 2004,4.92,4.00
AP326,WA8SIE Spring Hill                WV US,Sat Jul 17 16:17:05 PDT 2004,0.89,110.00
AP329,KB2AHZ Boydton                    VA US,Sat Jul 17 16:14:17 PDT 2004,0.89,119.00
AP340,W4HF-1 Wilkesboro                 NC US,Sat Jul 17 16:18:28 PDT 2004,0.00,168.00
AP341,WA4SSP-2 Linville                 NC US,Sat Jul 17 16:08:10 PDT 2004,0.00,121.00
AP343,N8FGR Orange                      OH US,Sat Jul 17 16:17:19 PDT 2004,0.00,81.00
AP345,N8UMU Waterville                  OH US,Sat Jul 17 16:18:03 PDT 2004,2.68,57.00
AP346,AB8KN-2 Upper Arlington           OH US,Sat Jul 17 16:07:14 PDT 2004,0.00,87.00
AP349,W8GUC Vandalia                    OH US,Sat Jul 17 16:19:17 PDT 2004,3.13,25.00
AP350,W8DYY Miamisburg                  OH US,Sat Jul 17 16:18:54 PDT 2004,1.79,94.00
AP352,N8NQF Middletown                  OH US,Sat Jul 17 16:16:27 PDT 2004,0.00,1.00
AP353,W8EH Blue Bell                    OH US,Sat Jul 17 16:14:56 PDT 2004,0.00,315.00
AP355,KB8SGF Detroit                    MI US,Sat Jul 17 16:19:57 PDT 2004,0.00,157.00
AP359,K7UHP West Point                  UT US,Sat Jul 17 16:19:28 PDT 2004,1.79,196.00
AP364,KM5GE Jackson                     MS US,Sat Jul 17 16:18:38 PDT 2004,0.00,69.00
AP365,KD4MWO Holly Ford                 FL US,Sat Jul 17 16:16:11 PDT 2004,0.00,0.00
AP370,WL7CKY Manasota                   FL US,Sat Jul 17 16:05:32 PDT 2004,0.00,323.00
AP377,W9QL Druce Lake                   IL US,Sat Jul 17 16:17:51 PDT 2004,3.13,68.00
AP380,WO4U-10 Crossville                TN US,Sat Jul 17 16:18:23 PDT 2004,0.00,326.00
AP385,N1IP-4 Hog Mountain               GA US,Sat Jul 17 16:12:09 PDT 2004,0.00,0.00
AP386,WA4DSY Mountain Park              GA US,Sat Jul 17 16:16:09 PDT 2004,2.24,225.00
AP388,W4EPI-4 Snellville                GA US,Sat Jul 17 16:17:51 PDT 2004,0.00,270.00
AP390,KB7ZHE Apache Junction            AZ US,Sat Jul 17 16:15:05 PDT 2004,2.24,257.00
AP394,KN4YZ Peachtree City              GA US,Sat Jul 17 16:09:47 PDT 2004,1.34,227.00
AP395,AB4KN Peachtree City              GA US,Sat Jul 17 16:11:11 PDT 2004,1.34,170.00
AP399,WA9KCU Watertown                  WI US,Sat Jul 17 16:06:07 PDT 2004,2.68,49.00
AP400,WA9YVE Ixonia                     WI US,Sat Jul 17 16:17:19 PDT 2004,0.00,10.00
AP401,N9OIG Union Grove                 WI US,Sat Jul 17 16:16:06 PDT 2004,0.00,57.00
AP403,KF4CHG Ft.White                   FL US,Sat Jul 17 16:20:37 PDT 2004,0.89,52.00
AP407,KB2M Ocean View                   NJ US,Sat Jul 17 16:11:09 PDT 2004,0.00,181.00
AP408,W0GJB Conifer                     CO US,Sat Jul 17 16:15:51 PDT 2004,0.89,211.00
AP410,N4XI-5 Evansville                 IN US,Sat Jul 17 16:11:14 PDT 2004,3.13,300.00
AP411,N4XI-3 Evansville                 IN US,Sat Jul 17 16:13:05 PDT 2004,0.45,320.00
AP413,N2KBD Ringwood                    NJ US,Sat Jul 17 16:14:04 PDT 2004,0.00,289.00
AP417,N1RWY Frankfort                   ME US,Sat Jul 17 16:14:07 PDT 2004,0.00,236.00
AP423,WA6OFT-4 Poston                   AZ US,Sat Jul 17 16:19:23 PDT 2004,3.13,235.00
AP426,N0SLJ Harrisonville               MO US,Sat Jul 17 16:16:59 PDT 2004,0.00,343.00
AP427,KB0VZP Warrensburg                MO US,Sat Jul 17 16:16:18 PDT 2004,2.24,34.00
AP431,K0STL-15 Manchester               MO US,Sat Jul 17 16:11:41 PDT 2004,0.00,80.00
AP433,WK1P Walpole                      NH US,Sat Jul 17 16:15:20 PDT 2004,0.00,0.00
AP449,WB9BJQ Onalaska                   WI US,Sat Jul 17 16:17:54 PDT 2004,1.34,33.00
AP450,W9RPM La Crosse                   WI US,Sat Jul 17 16:18:02 PDT 2004,0.89,19.00
AP455,W0NSA Omaha                       NE US,Sat Jul 17 16:15:54 PDT 2004,0.00,51.00
AP458,N5RIG Fremont                     NE US,Sat Jul 17 16:19:40 PDT 2004,0.00,0.00
AP460,KB0VMZ Belmont                    NE US,Sat Jul 17 16:16:32 PDT 2004,0.45,135.00
AP462,MB7UIK Maidstone                     UK,Sat Jul 17 16:19:43 PDT 2004,0.00,0.00
AP463,K4RVH Madison                     AL US,Sat Jul 17 16:17:08 PDT 2004,0.00,251.00
AP464,KU4ME Andersonville               TN US,Sat Jul 17 16:11:08 PDT 2004,0.00,278.00
AP469,WA7QFR Bothell                    WA US,Sat Jul 17 16:15:45 PDT 2004,0.00,151.00
AP472,W7EPP Lynden                      WA US,Sat Jul 17 16:20:18 PDT 2004,0.00,260.00
AP474,AA7OA Astoria                     OR US,Sat Jul 17 16:17:19 PDT 2004,2.68,229.00
AP475,KB7OHO Tukwila                    WA US,Sat Jul 17 16:14:28 PDT 2004,0.89,241.00
AP476,W7DG Longview                     WA US,Sat Jul 17 16:19:14 PDT 2004,0.00,175.00
AP477,KC7ZPO Milwaukie                  OR US,Sat Jul 17 16:14:17 PDT 2004,0.45,130.00
AP479,KC7AM-10 Tollgate                 OR US,Sat Jul 17 16:20:22 PDT 2004,0.00,0.00
AP483,N9OSQ-7 Pensacola                 FL US,Sat Jul 17 16:18:17 PDT 2004,0.00,196.00
AP487,WX6X Springfield                  MO US,Sat Jul 17 16:14:03 PDT 2004,0.89,29.00
AP492,WA6OFT-5 Quartzsite               AZ US,Sat Jul 17 16:16:53 PDT 2004,5.36,65.00
AP496,WA5MMY McAllen                    TX US,Sat Jul 17 16:11:09 PDT 2004,3.13,114.00
AP499,KD4YJJ-2 Pensacola                FL US,Sat Jul 17 16:18:03 PDT 2004,0.00,180.00
AP500,N1SKZ Hillsboro                   NH US,Sat Jul 17 16:15:27 PDT 2004,0.00,161.00
AP510,KK6RW Gig Harbor                  WA US,Sat Jul 17 16:15:26 PDT 2004,1.34,14.00
AP517,WW7RA Gold Mountain               WA US,Sat Jul 17 16:20:38 PDT 2004,0.00,103.00
AP519,W2KB Lebanon Twp.                 NJ US,Sat Jul 17 16:19:26 PDT 2004,0.00,337.00
AP520,WA4LZC Orlando                    FL US,Sat Jul 17 16:16:44 PDT 2004,1.34,255.00
AP521,KD4K Cumming                      GA US,Sat Jul 17 16:19:48 PDT 2004,0.00,202.00
AP523,WA9UKW Boise                      ID US,Sat Jul 17 16:15:59 PDT 2004,0.45,269.00
AP525,N6RZR-2 Anderson                  CA US,Sat Jul 17 16:16:05 PDT 2004,1.34,212.00
AP526,KG4CVZ Tallulah Falls             GA US,Sat Jul 17 16:20:04 PDT 2004,0.00,205.00
AP527,WB0TAX Elm Grove                  LA US,Sat Jul 17 16:13:14 PDT 2004,1.34,131.00
AP528,W7IUC-4 Marathon                  FL US,Sat Jul 17 16:15:50 PDT 2004,1.34,17.00
AP530,W7IUC-3 Big Pine Key              FL US,Sat Jul 17 16:14:34 PDT 2004,2.24,162.00
AP534,W2MJD Hempstead                   NY US,Sat Jul 17 16:19:16 PDT 2004,0.00,295.00
AP535,N1LTP Norton                      MA US,Sat Jul 17 16:16:48 PDT 2004,0.00,172.00
AP537,KC6TYC Port St. John              FL US,Sat Jul 17 16:20:42 PDT 2004,0.00,257.00
AP538,WA3YML Thornhurst                 PA US,Sat Jul 17 16:15:29 PDT 2004,0.00,282.00
AP540,LU2VA-8 Neuquen                      AR,Sat Jul 17 16:20:16 PDT 2004,1.79,135.00
AP541,AD6NH Placentia                   CA US,Sat Jul 17 16:17:09 PDT 2004,2.68,191.00
AP542,WM0F Berthoud                     CO US,Sat Jul 17 16:15:04 PDT 2004,3.13,265.00
AP550,N9LBG Edwardsville                IL US,Sat Jul 17 16:13:57 PDT 2004,0.00,337.00
AP554,N2XW Manahawkin                   NJ US,Sat Jul 17 16:15:18 PDT 2004,0.00,217.00
AP555,WA1LOU-15 Wolcott                 CT US,Sat Jul 17 16:20:45 PDT 2004,0.00,0.00
AP556,VE3PEW Mississauga               ONT CA,Sat Jul 17 16:11:39 PDT 2004,0.45,80.00
AP558,N9GTL Marion                      IN US,Sat Jul 17 16:17:10 PDT 2004,0.45,37.00
AP559,N9LYA-3 Mitchell                  IN US,Sat Jul 17 16:14:00 PDT 2004,0.00,221.00
AP560,KB9LHX-6 Jasper                   IN US,Sat Jul 17 16:18:31 PDT 2004,0.89,17.00
AP561,AI9H-6 Mount Carmel               IL US,Sat Jul 17 16:20:04 PDT 2004,2.68,145.00
AP564,N1OTX Woburn                      MA US,Sat Jul 17 16:16:26 PDT 2004,0.00,270.00
AP565,KQ4YD White City                  FL US,Sat Jul 17 16:15:53 PDT 2004,0.00,196.00
AP566,KQ4KX Lakeland                    FL US,Sat Jul 17 16:20:04 PDT 2004,1.79,223.00
AP567,WB7SWW Dunkirk                    NY US,Sat Jul 17 16:12:05 PDT 2004,0.00,249.00
AP570,KF3BH Catawissa                   PA US,Sat Jul 17 16:18:34 PDT 2004,0.00,152.00
AP574,K0JJV Hays                        KS US,Sat Jul 17 16:20:18 PDT 2004,0.00,49.00
AP575,KB5WIO Amarillo                   TX US,Sat Jul 17 16:20:33 PDT 2004,2.68,70.00
AP577,K4MG Ocala                        FL US,Sat Jul 17 16:16:41 PDT 2004,0.00,263.00
AP584,KC9BWF-1 Green Bay                WI US,Sat Jul 17 16:19:08 PDT 2004,6.71,58.00
AP585,KC9BWF-3 Green Bay                WI US,Sat Jul 17 16:16:30 PDT 2004,5.36,318.00
AP586,N1EPX Jamaica Plain               MA US,Sat Jul 17 16:20:41 PDT 2004,0.00,210.00
AP588,WD4CD Pickens                     SC US,Sat Jul 17 16:18:07 PDT 2004,0.00,90.00
AP590,KD5RXP Ft.Worth                   TX US,Sat Jul 17 16:17:55 PDT 2004,0.00,0.00
AP593,KC5JIF Amarillo                   TX US,Sat Jul 17 16:16:49 PDT 2004,1.79,239.00
AP594,KC5JZG-2 Bryan                    TX US,Sat Jul 17 16:19:24 PDT 2004,0.00,0.00
AP599,N1HQ Panama City                  FL US,Sat Jul 17 16:20:04 PDT 2004,0.00,285.00
AP602,KG5RG Dickinson                   TX US,Sat Jul 17 16:17:52 PDT 2004,0.89,268.00
AP606,VE2SIL-2 Pierrefonds             QUE CA,Sat Jul 17 16:17:05 PDT 2004,0.00,0.00
AP610,WB9HLA-2 Hartford City            IN US,Sat Jul 17 16:20:35 PDT 2004,3.13,57.00
AP613,PA0OKE Neptunuslaan                  NL,Sat Jul 17 16:19:53 PDT 2004,0.00,169.00
AP614,ON4BDW Vaartdijk                     BE,Sat Jul 17 16:09:38 PDT 2004,1.79,175.00
AP618,IT9OBK Messina                       IT,Sat Jul 17 16:10:49 PDT 2004,1.79,292.00
AP620,IW0RQH Foligno                       IT,Sat Jul 17 16:12:42 PDT 2004,1.79,14.00
AP624,M0ADS Sheffield                      UK,Sat Jul 17 16:17:07 PDT 2004,0.00,0.00
AP626,G1YXH Kent                           UK,Sat Jul 17 16:13:41 PDT 2004,1.79,281.00
AP627,VE4UB Selkirk                     MB CA,Sat Jul 17 16:17:46 PDT 2004,0.00,173.00
AP628,VK3BUS Maldon                        AU,Sat Jul 17 16:18:25 PDT 2004,2.68,177.00
AP629,VK3CSJ Dandenong                     AU,Sat Jul 17 16:18:41 PDT 2004,0.00,44.00
AP630,VK3MY Knox City                      AU,Sat Jul 17 16:20:50 PDT 2004,0.00,167.00
AP632,VK3ZV Moondarra                      AU,Sat Jul 17 16:17:24 PDT 2004,0.00,215.00
AP635,VK5BRC-7 Angaston                    AU,Sat Jul 17 16:08:27 PDT 2004,0.89,202.00
AP640,KC7MRW Lincoln                    ND US,Sat Jul 17 16:20:34 PDT 2004,5.36,194.00
AP641,KB0WBM-2 Arnold                   ND US,Sat Jul 17 16:19:23 PDT 2004,4.02,153.00
AP642,W0NWS-2 Mead                      NE US,Sat Jul 17 16:14:30 PDT 2004,2.68,13.00
AP643,W0HII-3 Cedar Creek               NE US,Sat Jul 17 16:16:15 PDT 2004,0.00,49.00
AP645,VP5DB-2 Carmen                       TC,Sat Jul 17 16:13:08 PDT 2004,5.36,124.00
AP647,K5ZZT-5 San Antonio               TX US,Sat Jul 17 16:07:01 PDT 2004,1.34,82.00
AP648,KS5V Bulverde                     TX US,Sat Jul 17 16:17:49 PDT 2004,1.34,236.00
AP649,KA5KTH Austin                     TX US,Sat Jul 17 16:20:18 PDT 2004,2.24,300.00
AP651,WA5ZAI Valley Mills               TX US,Sat Jul 17 16:19:23 PDT 2004,1.34,343.00
AP654,N5YXO Granbury                    TX US,Sat Jul 17 16:16:10 PDT 2004,2.24,52.00
AP656,KC5TIL Rendon                     TX US,Sat Jul 17 16:20:42 PDT 2004,0.89,0.00
AP657,KC4WTI Carrolton                  TX US,Sat Jul 17 16:16:53 PDT 2004,1.34,157.00
AP661,WA5KXX Plano                      TX US,Sat Jul 17 16:11:29 PDT 2004,0.00,336.00
AP669,PA0OKE Amsterdam                     NL,Sat Jul 17 16:19:53 PDT 2004,0.00,169.00
AP671,KD5FGW NW Oranjestad                 AW,Sat Jul 17 16:14:02 PDT 2004,5.81,229.00
AP679,ON5CT St-Niklaas                     BE,Sat Jul 17 16:20:33 PDT 2004,1.34,294.00
AP680,KA1GOZ Nashua                     NH US,Sat Jul 17 16:20:51 PDT 2004,0.00,47.00
AP681,N7RIG-6 Mt Vernon                 WA US,Sat Jul 17 16:16:39 PDT 2004,4.02,352.00
AP682,W7KKE-3 Road's End                OR US,Sat Jul 17 16:18:15 PDT 2004,3.13,186.00
AP685,KD7CTY Vancouver                  WA US,Sat Jul 17 16:16:30 PDT 2004,0.89,230.00
AP689,KF4TTB-2 Huntsville               AL US,Sat Jul 17 16:17:57 PDT 2004,1.79,257.00
AP690,KF4TTB-1 Huntsville               AL US,Sat Jul 17 16:16:08 PDT 2004,0.45,256.00
AP692,ZL1WPK Hamilton                      NZ,Sat Jul 17 16:14:43 PDT 2004,3.13,184.00
AP694,ZL1KRH Tauranga                      NZ,Sat Jul 17 16:19:50 PDT 2004,3.13,207.00
AP695,ZL3AQ Ashburton                      NZ,Sat Jul 17 16:09:23 PDT 2004,3.13,263.00
AP697,N1NLX Madison                     NH US,Sat Jul 17 16:11:51 PDT 2004,0.00,338.00
AP698,K3BAY Pasadena                    MD US,Sat Jul 17 16:13:35 PDT 2004,0.00,229.00
AP701,EA3ABN Barcelona                     ES,Sat Jul 17 16:17:37 PDT 2004,1.79,271.00
AP704,KA1UDX Collegeville               PA US,Sat Jul 17 16:06:54 PDT 2004,0.00,182.00
AP705,K4VVN Kingsport                   TN US,Sat Jul 17 16:20:16 PDT 2004,0.00,16.00
AP706,N0PJH Grand Island                NE US,Sat Jul 17 16:20:18 PDT 2004,1.34,55.00
AP710,N7XRD Renton                      WA US,Sat Jul 17 16:15:41 PDT 2004,0.00,66.00
AP712,KA1HEU Hudson                     NH US,Sat Jul 17 16:20:36 PDT 2004,0.00,35.00
AP715,K4DNM Clayton                     NC US,Sat Jul 17 16:18:59 PDT 2004,0.89,186.00
AP718,K4YK Greensboro                   GA US,Sat Jul 17 16:14:02 PDT 2004,0.00,138.00
AP720,KD4DLT-3 Lithonia                 GA US,Sat Jul 17 16:09:16 PDT 2004,0.89,219.00
AP722,KF4ORW Dade City                  FL US,Sat Jul 17 16:16:05 PDT 2004,0.00,214.00
AP723,KB2RC Orlando                     FL US,Sat Jul 17 16:17:02 PDT 2004,0.00,254.00
AP725,KD4BNP Palm Bay                   FL US,Sat Jul 17 16:20:16 PDT 2004,0.45,272.00
AP727,LA9QFA Trondheim                     NO,Sat Jul 17 16:15:40 PDT 2004,0.89,154.00
AP731,WW6HAM Pacifica                   CA US,Sat Jul 17 16:09:56 PDT 2004,4.02,223.00
AP739,WB0TWE Encinitas                  CA US,Sat Jul 17 16:20:17 PDT 2004,2.24,292.00
AP742,KC4ELV Honey Creek                GA US,Sat Jul 17 16:19:44 PDT 2004,0.00,194.00
AP744,K0RM Colorado Springs             CO US,Sat Jul 17 16:13:31 PDT 2004,0.00,158.00
AP745,K4GPS-1 Jupiter Farms             FL US,Sat Jul 17 16:16:07 PDT 2004,0.00,131.00
AP746,AA3H Avon                         OH US,Sat Jul 17 16:15:08 PDT 2004,0.00,176.00
AP747,KC4ANB Trussville                 AL US,Sat Jul 17 16:18:15 PDT 2004,1.34,345.00
AP749,N3FJA Mountain Top                PA US,Sat Jul 17 16:19:37 PDT 2004,0.00,244.00
AP750,W1OEM Flanders                    CT US,Sat Jul 17 16:19:56 PDT 2004,0.00,248.00
AP751,KC2KY Centereach                  NY US,Sat Jul 17 16:18:48 PDT 2004,0.45,126.00
AP752,WB2FTX Butler                     NJ US,Sat Jul 17 16:13:30 PDT 2004,0.00,188.00
AP758,KC7BWK Florence                   OR US,Sat Jul 17 16:19:55 PDT 2004,1.79,232.00
AP760,WB0BLV Security/Widefield         CO US,Sat Jul 17 16:20:19 PDT 2004,0.00,203.00
AP763,OX3HI Kangerlussuaq                  GL,Sat Jul 17 16:15:08 PDT 2004,4.02,90.00
AP765,N3EYQ Kingston                    NY US,Sat Jul 17 16:09:21 PDT 2004,1.34,195.00
AP767,N2XP Flanders                     NJ US,Sat Jul 17 16:18:39 PDT 2004,0.00,180.00
AP769,WC4PEM-10 Bartow                  FL US,Sat Jul 17 16:12:13 PDT 2004,0.00,180.00
AP771,WD9HDQ-2 Northfield               MN US,Sat Jul 17 16:20:24 PDT 2004,1.79,306.00
AP772,K4KAL Marietta                    GA US,Sat Jul 17 16:20:28 PDT 2004,0.00,292.00
AP773,KB4TOH-11 Columbia                NC US,Sat Jul 17 16:16:16 PDT 2004,4.47,150.00
AP774,N8OVD Wendell                     NC US,Sat Jul 17 16:20:45 PDT 2004,0.00,180.00
AP777,KD4CCO Briston                    VA US,Sat Jul 17 16:15:48 PDT 2004,0.00,232.00
AP779,K4CCC-9 Cheraw                    SC US,Sat Jul 17 16:16:20 PDT 2004,0.00,163.00
AP780,W5VBQ Santa Fe                    NM US,Sat Jul 17 16:13:22 PDT 2004,1.34,267.00
AP782,WB5NZV-8 N.Denton                 TX US,Sat Jul 17 16:11:57 PDT 2004,0.00,351.00
AP783,KC5DPC-3 Slidell                  TX US,Sat Jul 17 16:17:54 PDT 2004,4.92,257.00
AP786,K5EBQ Houston                     TX US,Sat Jul 17 16:18:25 PDT 2004,1.34,209.00
AP787,KC5LPN Houston                    TX US,Sat Jul 17 16:18:34 PDT 2004,0.89,219.00
AP792,KB0TVJ-4 MeadowLake Airport       CO US,Sat Jul 17 16:19:35 PDT 2004,3.13,245.00
AP795,KD7TTL Greenbank                  WA US,Sat Jul 17 16:16:14 PDT 2004,0.00,145.00
AP799,AE0S-3 Columbia                   MO US,Sat Jul 17 16:19:56 PDT 2004,1.79,358.00
AP802,W4OZK-7 Mentone                   AL US,Sat Jul 17 16:20:29 PDT 2004,0.00,207.00
AP803,KE6AFE Santa Cruz                 CA US,Sat Jul 17 16:20:28 PDT 2004,2.24,146.00
AP806,N3EG Longview                     WA US,Sat Jul 17 16:11:01 PDT 2004,0.89,190.00
AP808,KG4YZY New Port Richey            FL US,Sat Jul 17 16:19:03 PDT 2004,1.79,240.00
AP809,K4NUT Port Richey                 FL US,Sat Jul 17 16:20:36 PDT 2004,2.24,285.00
AP811,KC2IXE Bayside Hills              NY US,Sat Jul 17 16:17:45 PDT 2004,3.13,205.00
AP812,VE3XF Stayner                    ONT CA,Sat Jul 17 16:20:33 PDT 2004,0.00,220.00
AP813,VE3PWZ Dundalk                   ONT CA,Sat Jul 17 16:12:42 PDT 2004,0.00,300.00
AP814,VA3GY Erin                       ONT CA,Sat Jul 17 16:13:47 PDT 2004,0.00,315.00
AP815,VA3HST Guelph                    ONT CA,Sat Jul 17 16:20:44 PDT 2004,2.24,5.00
AP817,VA3AT Renfrew                    ONT CA,Sat Jul 17 16:20:23 PDT 2004,2.24,29.00
