AR421,DB9AZ-5 Hamburg                      DE,Sat Aug 07 16:09:22 PDT 2004,1.79,104.00
AR422,DF0BLM Gosen                         DE,Sat Aug 07 16:17:11 PDT 2004,0.00,35.00
AR426,K4BS Dahlonega                    GA US,Sat Aug 07 16:15:13 PDT 2004,0.00,158.00
AR427,AH6GR Maui                        HI US,Sat Aug 07 16:17:44 PDT 2004,3.58,17.00
AR428,KF4YYH Largo                      FL US,Sat Aug 07 16:19:00 PDT 2004,2.24,80.00
AR429,KD5NFW Midlothian                 TX US,Sat Aug 07 16:20:20 PDT 2004,1.79,18.00
AR430,N4JDB-1 Youngtown                 AL US,Sat Aug 07 16:19:48 PDT 2004,0.00,182.00
AR431,KB9RQD Hawthorne                  WI US,Sat Aug 07 16:20:23 PDT 2004,0.89,82.00
AR433,KC8YFO Strongsville               OH US,Sat Aug 07 16:19:22 PDT 2004,0.45,270.00
AR434,KD5RWX Glenwood                   NM US,Sat Aug 07 16:15:51 PDT 2004,0.45,158.00
AR435,KB8UBG Saint Bernard              OH US,Sat Aug 07 16:16:11 PDT 2004,1.34,270.00
AR436,N0KTA-2 Mulvane                   KS US,Sat Aug 07 16:18:38 PDT 2004,0.00,178.00
AR437,N0OHO-1 Sioux Center              IA US,Sat Aug 07 16:18:39 PDT 2004,3.58,186.00
AR438,N0RGA-2 Tea                       SD US,Sat Aug 07 16:18:52 PDT 2004,0.00,359.00
AR439,N0VHU Howells                     NE US,Sat Aug 07 16:17:38 PDT 2004,0.00,203.00
AR441,N1CNV Newington                   CT US,Sat Aug 07 16:18:37 PDT 2004,0.45,295.00
AR444,KC2KWK Somerville                 NJ US,Sat Aug 07 16:17:53 PDT 2004,1.34,296.00
AR445,N4XI-9 Owensboro                  KY US,Sat Aug 07 16:17:59 PDT 2004,1.34,252.00
AR446,N4XI-3 Evansville                 IN US,Sat Aug 07 16:13:07 PDT 2004,0.45,90.00
AR447,N4XI-5 Evansville                 IN US,Sat Aug 07 16:16:45 PDT 2004,0.00,0.00
AR448,KA4NES Littleton                  NC US,Sat Aug 07 16:20:24 PDT 2004,0.00,256.00
AR449,N4ZOI Cheraw                      SC US,Sat Aug 07 16:17:59 PDT 2004,0.00,356.00
AR450,WB0RXX Montevideo                 MN US,Sat Aug 07 16:17:02 PDT 2004,0.45,168.00
AR451,WA4ROX Largo                      FL US,Sat Aug 07 16:16:26 PDT 2004,1.34,62.00
AR452,N5SKU-1 Richardson                TX US,Sat Aug 07 16:17:14 PDT 2004,0.00,202.00
AR454,N7RFA Cornelius                   OR US,Sat Aug 07 16:20:26 PDT 2004,1.34,350.00
AR456,N7ZGO Sierra Vista                AZ US,Sat Aug 07 16:12:33 PDT 2004,0.00,227.00
AR458,N8XHZ-4 Tiffin                    OH US,Sat Aug 07 16:18:08 PDT 2004,0.00,207.00
AR460,N9VP Greensboro                   NC US,Sat Aug 07 16:08:13 PDT 2004,0.00,202.00
AR461,KF4ZUX-4 London                   KY US,Sat Aug 07 16:18:31 PDT 2004,0.00,359.00
AR464,EMRWX Goodyear                    AZ US,Sat Aug 07 16:12:08 PDT 2004,4.02,25.00
AR466,AB3BE Hagerstown                  MD US,Sat Aug 07 16:16:56 PDT 2004,0.45,319.00
AR467,VE3WXR Verona                    ONT CA,Sat Aug 07 16:20:22 PDT 2004,1.34,289.00
AR470,K9DC Indianapolis                 IN US,Sat Aug 07 16:14:24 PDT 2004,0.00,0.00
AR471,WA4PHY Martinez                   GA US,Sat Aug 07 16:17:42 PDT 2004,0.00,341.00
AR472,N6MVS Hutchins                    TX US,Sat Aug 07 16:18:54 PDT 2004,0.45,110.00
AR473,KC2EUS Gloversville               NY US,Sat Aug 07 16:15:04 PDT 2004,1.34,267.00
AR476,N5ZPR Arlington                   TX US,Sat Aug 07 16:17:17 PDT 2004,0.00,86.00
AR477,KD5FHA-1 Mansfield                TX US,Sat Aug 07 16:17:57 PDT 2004,1.34,61.00
AR478,KG4VDR Simpsonville               SC US,Sat Aug 07 16:16:32 PDT 2004,0.00,56.00
AR480,KC0OWW Mystic                     IA US,Sat Aug 07 16:19:23 PDT 2004,4.47,134.00
AR481,KA1TOX Braintree                  MA US,Sat Aug 07 16:20:23 PDT 2004,0.00,270.00
C0001,CW0001 Evansville                 IN US,Sat Aug 07 16:20:17 PDT 2004,2.24,91.00
C0004,CW0004 Denver                     CO US,Sat Aug 07 16:15:46 PDT 2004,0.89,158.00
C0009,CW0009 Antwerp                       BE,Sat Aug 07 16:15:18 PDT 2004,0.45,150.00
C0013,CW0013 Inverness                  CA US,Sat Aug 07 16:11:14 PDT 2004,4.02,210.00
C0018,CW0018 Smithville                 TX US,Sat Aug 07 16:20:19 PDT 2004,1.34,258.00
C0020,CW0020 Trondheim                     NO,Sat Aug 07 16:20:18 PDT 2004,0.45,45.00
C0028,CW0028 Great Neck                 NY US,Sat Aug 07 16:20:25 PDT 2004,0.00,309.00
C0031,CW0031 Chicago                    IL US,Sat Aug 07 16:15:22 PDT 2004,0.00,278.00
C0041,CW0041 Brunswick                  GA US,Sat Aug 07 16:15:21 PDT 2004,0.89,84.00
C0052,CW0052 Bath                       ME US,Sat Aug 07 16:11:58 PDT 2004,0.00,268.00
C0053,CW0053 Wamic                      OR US,Sat Aug 07 16:11:22 PDT 2004,0.00,12.00
C0061,CW0061 Wellington                    NZ,Sat Aug 07 16:07:53 PDT 2004,2.68,345.00
C0062,CW0062 Decatur                    TX US,Sat Aug 07 16:15:44 PDT 2004,0.00,134.00
C0066,CW0066 Hoffman Estates            IL US,Sat Aug 07 16:15:17 PDT 2004,0.45,255.00
C0068,CW0068 Fort Davis                 TX US,Sat Aug 07 16:15:30 PDT 2004,5.36,136.00
C0069,CW0069 Diamondhead                MS US,Sat Aug 07 16:15:21 PDT 2004,0.00,278.00
C0078,CW0078 Estes Park                 CO US,Sat Aug 07 16:17:26 PDT 2004,1.34,158.00
C0082,CW0082 Albuquerque                NM US,Sat Aug 07 16:20:16 PDT 2004,3.13,198.00
C0099,CW0099 Affton                     MO US,Sat Aug 07 16:13:26 PDT 2004,0.00,129.00
C0101,CW0101 Eau Clair                  WI US,Sat Aug 07 16:19:29 PDT 2004,0.00,111.00
C0104,CW0104 Dedham                     MA US,Sat Aug 07 16:18:44 PDT 2004,0.00,355.00
C0115,CW0115 Lucas                      TX US,Sat Aug 07 16:15:10 PDT 2004,2.68,37.00
C0117,CW0117 Thornlie                      AU,Sat Aug 07 16:17:11 PDT 2004,0.00,207.00
C0118,CW0118 Scituate                   MA US,Sat Aug 07 16:16:26 PDT 2004,0.00,215.00
C0121,CW0121 Groton                     SD US,Sat Aug 07 16:20:27 PDT 2004,1.34,306.00
C0138,CW0138 Brier                      WA US,Sat Aug 07 16:15:08 PDT 2004,0.45,2.00
C0141,CW0141 Bloomington                IL US,Sat Aug 07 16:19:05 PDT 2004,0.00,178.00
C0146,CW0146 Ashburn                    VA US,Sat Aug 07 16:20:19 PDT 2004,0.00,226.00
C0149,CW0149 Richmond                   MN US,Sat Aug 07 16:15:46 PDT 2004,0.00,175.00
C0153,CW0153 Floral Park                NY US,Sat Aug 07 16:18:09 PDT 2004,1.34,340.00
C0154,CW0154 Cedar Knolls               NJ US,Sat Aug 07 16:11:49 PDT 2004,0.45,331.00
C0156,CW0156 Grimsby                   ONT CA,Sat Aug 07 16:20:16 PDT 2004,0.00,296.00
C0160,CW0160 Palatine Bridge            NY US,Sat Aug 07 16:20:13 PDT 2004,1.34,308.00
C0162,CW0162 Kress                      TX US,Sat Aug 07 16:15:18 PDT 2004,5.36,195.00
C0168,CW0168 Florence                   AL US,Sat Aug 07 16:19:14 PDT 2004,0.00,90.00
C0169,CW0169 Beverly                    MA US,Sat Aug 07 16:20:13 PDT 2004,0.00,0.00
C0180,CW0180 Golden City                MO US,Sat Aug 07 16:15:04 PDT 2004,0.89,208.00
C0181,CW0181 Seal Beach                 CA US,Sat Aug 07 16:16:58 PDT 2004,3.58,235.00
C0189,CW0189 Cirero                     NY US,Sat Aug 07 16:20:18 PDT 2004,2.24,283.00
C0198,CW0198 Littleton                  NC US,Sat Aug 07 16:19:52 PDT 2004,0.00,86.00
C0210,CW0210 Malden                     MA US,Sat Aug 07 16:15:13 PDT 2004,0.00,356.00
C0213,CW0213 Ferndale                   WA US,Sat Aug 07 16:16:39 PDT 2004,2.24,234.00
C0214,CW0214 Abrantes                      PT,Sat Aug 07 16:06:28 PDT 2004,0.00,303.00
C0217,CW0217 Ramsey                     MN US,Sat Aug 07 16:19:13 PDT 2004,4.02,143.00
C0222,CW0222 Karval                     CO US,Sat Aug 07 16:15:30 PDT 2004,3.13,276.00
C0228,CW0228 Highwood                   MT US,Sat Aug 07 16:15:00 PDT 2004,13.86,284.00
C0230,CW0230 Yeovil                        UK,Sat Aug 07 16:15:53 PDT 2004,0.89,117.00
C0234,CW0234 Canyon Country             CA US,Sat Aug 07 16:18:36 PDT 2004,2.68,240.00
C0237,CW0237 Walpole                    MA US,Sat Aug 07 16:15:19 PDT 2004,0.00,283.00
C0241,CW0241 Kalamazoo                  MI US,Sat Aug 07 16:19:52 PDT 2004,0.45,262.00
C0242,CW0242 Cincinnati                 OH US,Sat Aug 07 16:14:04 PDT 2004,0.45,291.00
C0261,CW0261 Clearwater Beach           FL US,Sat Aug 07 16:20:24 PDT 2004,4.02,164.00
C0262,CW0262 Port St. Lucie             FL US,Sat Aug 07 16:15:39 PDT 2004,1.34,208.00
C0265,CW0265 Williamstown               NJ US,Sat Aug 07 16:20:11 PDT 2004,0.00,345.00
C0272,CW0272 Rome                          IT,Sat Aug 07 16:15:04 PDT 2004,0.00,263.00
C0275,CW0275 Lelystad                      NL,Sat Aug 07 16:15:46 PDT 2004,0.00,0.00
C0288,CW0288 Gilman                     MN US,Sat Aug 07 16:11:06 PDT 2004,3.58,101.00
C0318,CW0318 Broken Arrow               OK US,Sat Aug 07 16:20:24 PDT 2004,0.45,179.00
C0333,CW0333 Kittery Point              ME US,Sat Aug 07 16:10:34 PDT 2004,0.45,181.00
C0334,CW0334 Penzberg                      DE,Sat Aug 07 16:19:29 PDT 2004,0.00,102.00
C0338,CW0338 Seattle                    WA US,Sat Aug 07 16:16:58 PDT 2004,0.89,298.00
C0342,CW0342 Lincoln City               OR US,Sat Aug 07 16:15:06 PDT 2004,5.36,350.00
C0346,CW0346 Ft. Collins                CO US,Sat Aug 07 16:20:18 PDT 2004,0.45,255.00
C0351,CW0351 Brookeville                MD US,Sat Aug 07 16:20:09 PDT 2004,0.00,240.00
C0352,CW0352 Colby                      KS US,Sat Aug 07 16:19:06 PDT 2004,2.68,8.00
C0354,CW0354 West Islip                 NY US,Sat Aug 07 16:16:11 PDT 2004,0.45,4.00
C0356,CW0356 Seaside                    OR US,Sat Aug 07 16:13:13 PDT 2004,1.34,280.00
C0357,CW0357 Conway                     NH US,Sat Aug 07 16:15:21 PDT 2004,0.00,109.00
C0361,CW0361 Marietta                   GA US,Sat Aug 07 16:18:19 PDT 2004,0.00,35.00
C0364,CW0364 Greenbrier                 AR US,Sat Aug 07 16:10:21 PDT 2004,1.79,77.00
C0375,CW0375 Bartlett                   TN US,Sat Aug 07 16:19:04 PDT 2004,0.00,356.00
C0386,CW0386 Tatum                      NM US,Sat Aug 07 16:20:24 PDT 2004,4.47,115.00
C0405,CW0405 Salisbury                  MA US,Sat Aug 07 16:18:38 PDT 2004,0.00,216.00
C0415,CW0415 Savage                     MD US,Sat Aug 07 16:15:24 PDT 2004,0.00,321.00
C0416,CW0416 Bellevue                   WA US,Sat Aug 07 16:11:55 PDT 2004,0.45,45.00
C0425,CW0425 Saratoga                   CA US,Sat Aug 07 16:15:04 PDT 2004,0.89,315.00
C0430,CW0430 Newnan                     GA US,Sat Aug 07 16:17:00 PDT 2004,0.45,329.00
C0443,CW0443 Sacramento                 CA US,Sat Aug 07 16:19:47 PDT 2004,0.89,304.00
C0444,CW0444 Marlborough                CT US,Sat Aug 07 16:20:16 PDT 2004,0.00,314.00
C0451,CW0451 Taunton                    MA US,Sat Aug 07 16:19:52 PDT 2004,2.24,224.00
C0453,CW0453 Gretna                     NE US,Sat Aug 07 16:15:39 PDT 2004,4.92,164.00
C0454,CW0454 Millersville               MD US,Sat Aug 07 16:20:02 PDT 2004,0.00,11.00
C0456,CW0456 Brandon                    MS US,Sat Aug 07 16:16:02 PDT 2004,0.00,192.00
C0458,CW0458 Rancho Cordova             CA US,Sat Aug 07 16:11:44 PDT 2004,2.68,270.00
C0464,CW0464 Tehachapi                  CA US,Sat Aug 07 16:19:52 PDT 2004,3.13,315.00
C0465,CW0465 Sherman                    CT US,Sat Aug 07 16:15:47 PDT 2004,0.00,278.00
C0467,CW0467 Duxbury                    MA US,Sat Aug 07 16:15:09 PDT 2004,0.00,107.00
C0476,CW0476 De Graff                   OH US,Sat Aug 07 16:19:37 PDT 2004,0.00,248.00
C0479,CW0479 E. Brunswick               NJ US,Sat Aug 07 16:20:01 PDT 2004,0.89,304.00
C0485,CW0485 San Antonio                TX US,Sat Aug 07 16:13:28 PDT 2004,1.34,192.00
C0498,CW0498 Powder Springs             GA US,Sat Aug 07 16:18:58 PDT 2004,0.00,67.00
C0499,CW0499 Monticello                 MN US,Sat Aug 07 16:19:52 PDT 2004,1.34,178.00
C0506,CW0506 Canton                     CT US,Sat Aug 07 16:17:45 PDT 2004,0.00,287.00
C0508,CW0508 Troy                       NY US,Sat Aug 07 16:17:08 PDT 2004,2.24,30.00
C0512,CW0512 Torino                        IT,Sat Aug 07 16:13:47 PDT 2004,0.00,131.00
C0521,CW0521 Morecambe                     UK,Sat Aug 07 16:19:27 PDT 2004,4.47,100.00
C0527,CW0527 Lexington                  VA US,Sat Aug 07 16:18:11 PDT 2004,0.00,346.00
C0529,CW0529 West Paterson              NJ US,Sat Aug 07 16:14:51 PDT 2004,0.00,277.00
C0531,CW0531 Plainfield                 IL US,Sat Aug 07 16:15:46 PDT 2004,0.89,230.00
C0537,CW0537 Bel Air                    MD US,Sat Aug 07 16:18:57 PDT 2004,0.00,291.00
C0538,CW0538 Hayward                    CA US,Sat Aug 07 16:18:37 PDT 2004,0.00,196.00
C0539,CW0539 Dansweiler                    DE,Sat Aug 07 16:19:54 PDT 2004,2.24,115.00
C0541,CW0541 Hornell                    NY US,Sat Aug 07 16:19:25 PDT 2004,0.00,0.00
C0546,CW0546 Lincoln                    NE US,Sat Aug 07 16:17:49 PDT 2004,0.45,200.00
C0547,CW0547 Westfield                  IN US,Sat Aug 07 16:15:53 PDT 2004,0.89,24.00
C0548,CW0548 Frisco                     TX US,Sat Aug 07 16:12:03 PDT 2004,0.00,71.00
C0555,CW0555 Omaha                      NE US,Sat Aug 07 16:17:47 PDT 2004,2.24,159.00
C0556,CW0556 Stow                       MA US,Sat Aug 07 16:20:18 PDT 2004,0.00,260.00
C0561,CW0561 Coon Rapids                MN US,Sat Aug 07 16:20:00 PDT 2004,0.00,100.00
C0565,CW0565 Kristiansand                  NO,Sat Aug 07 16:15:39 PDT 2004,0.00,354.00
C0566,CW0566 Mullica Hill               NJ US,Sat Aug 07 16:15:25 PDT 2004,0.89,313.00
C0568,CW0568 Ponca City                 OK US,Sat Aug 07 16:13:42 PDT 2004,3.13,110.00
C0569,CW0569 Jacksonville               FL US,Sat Aug 07 16:16:33 PDT 2004,0.00,90.00
C0570,CW0570 Blue Lake                  CA US,Sat Aug 07 16:20:16 PDT 2004,1.34,298.00
C0571,CW0571 Batavia                    IL US,Sat Aug 07 16:08:13 PDT 2004,3.13,315.00
C0572,CW0572 Orlando                    FL US,Sat Aug 07 16:13:35 PDT 2004,0.00,28.00
C0573,CW0573 Brocton                    IL US,Sat Aug 07 16:14:37 PDT 2004,0.00,134.00
C0577,CW0577 Elkridge                   MD US,Sat Aug 07 16:12:13 PDT 2004,0.89,340.00
C0584,CW0584 Northampton                   UK,Sat Aug 07 16:07:41 PDT 2004,0.45,127.00
C0588,CW0588 Parma                         IT,Sat Aug 07 16:13:56 PDT 2004,0.89,196.00
C0597,CW0597 Tehachapi                  CA US,Sat Aug 07 16:15:18 PDT 2004,5.81,355.00
C0599,CW0599 Corrales                   NM US,Sat Aug 07 16:14:12 PDT 2004,2.24,302.00
C0605,CW0605 Pistoia                       IT,Sat Aug 07 16:15:46 PDT 2004,0.00,138.00
C0608,CW0608 Perry Hall                 MD US,Sat Aug 07 16:20:29 PDT 2004,0.45,299.00
C0613,CW0613 Maiden                     NC US,Sat Aug 07 16:17:37 PDT 2004,0.45,354.00
C0615,CW0615 South Portland             ME US,Sat Aug 07 16:11:23 PDT 2004,0.00,346.00
C0617,CW0617 Plover                     WI US,Sat Aug 07 16:18:25 PDT 2004,0.45,169.00
C0630,CW0630 Annandale                  VA US,Sat Aug 07 16:19:21 PDT 2004,0.00,305.00
C0639,CW0639 Jacksonville               FL US,Sat Aug 07 16:06:37 PDT 2004,0.89,0.00
C0641,CW0641 Jerusalem                     IL,Sat Aug 07 16:11:12 PDT 2004,5.81,232.00
C0643,CW0643 Goldvein                   VA US,Sat Aug 07 16:15:17 PDT 2004,0.00,100.00
C0645,CW0645 Whittier                   CA US,Sat Aug 07 16:15:38 PDT 2004,3.13,237.00
C0646,CW0646 Guilderland                NY US,Sat Aug 07 16:15:07 PDT 2004,2.68,318.00
C0653,CW0653 Tracy                      MN US,Sat Aug 07 16:19:34 PDT 2004,0.00,285.00
C0655,CW0655 Salem                      NH US,Sat Aug 07 16:18:04 PDT 2004,0.00,232.00
C0657,CW0657 Madeira Park               BC CA,Sat Aug 07 16:15:52 PDT 2004,0.89,172.00
C0672,CW0672 Sumner                     WA US,Sat Aug 07 16:06:14 PDT 2004,0.00,280.00
C0675,CW0675 Antwerp                       BE,Sat Aug 07 16:10:58 PDT 2004,0.45,38.00
C0677,CW0677 Santa Rosa                 CA US,Sat Aug 07 16:18:51 PDT 2004,2.68,224.00
C0681,CW0681 Breckenridge               MI US,Sat Aug 07 16:19:32 PDT 2004,0.00,239.00
C0692,CW0692 Little Switzerland         NC US,Sat Aug 07 16:10:54 PDT 2004,0.00,198.00
C0693,CW0693 Henderson                  NV US,Sat Aug 07 16:17:21 PDT 2004,0.89,185.00
C0694,CW0694 Alligator Point            FL US,Sat Aug 07 16:20:18 PDT 2004,3.13,68.00
C0698,CW0698 Apple Valley               MN US,Sat Aug 07 16:15:46 PDT 2004,0.00,65.00
C0699,CW0699 Largo                      FL US,Sat Aug 07 16:16:22 PDT 2004,0.00,0.00
C0710,CW0710 Salford                       UK,Sat Aug 07 16:07:55 PDT 2004,1.79,80.00
C0713,CW0713 Auburn                     CA US,Sat Aug 07 16:13:29 PDT 2004,1.34,239.00
C0714,CW0714 Plymouth                   MI US,Sat Aug 07 16:17:06 PDT 2004,0.00,263.00
C0720,CW0720 Bellflower                 CA US,Sat Aug 07 16:16:21 PDT 2004,1.79,287.00
C0725,CW0725 Wimberley                  TX US,Sat Aug 07 16:20:16 PDT 2004,2.68,59.00
C0728,CW0728 Avon                       CT US,Sat Aug 07 16:18:13 PDT 2004,0.89,289.00
C0732,CW0732 Seneca                     OR US,Sat Aug 07 16:15:46 PDT 2004,2.24,11.00
C0734,CW0734 Middleboro                 MA US,Sat Aug 07 16:12:21 PDT 2004,0.00,250.00
C0736,CW0736 Rochester                  NY US,Sat Aug 07 16:18:38 PDT 2004,0.00,203.00
C0752,CW0752 Norman                     OK US,Sat Aug 07 16:06:58 PDT 2004,2.24,172.00
C0755,CW0755 Charlotte                  NC US,Sat Aug 07 16:16:41 PDT 2004,0.00,288.00
C0756,CW0756 Benjamin                   UT US,Sat Aug 07 16:17:53 PDT 2004,3.13,349.00
C0757,CW0757 Columbia                   SC US,Sat Aug 07 16:15:00 PDT 2004,0.00,332.00
C0760,CW0760 Mullica Hill               NJ US,Sat Aug 07 16:15:14 PDT 2004,0.00,306.00
C0762,CW0762 Flower Mound               TX US,Sat Aug 07 16:16:29 PDT 2004,0.45,72.00
C0766,CW0766 Raymond                    NH US,Sat Aug 07 16:15:46 PDT 2004,0.00,45.00
C0777,CW0777 St Augustine               FL US,Sat Aug 07 16:17:52 PDT 2004,2.68,62.00
C0779,CW0779 Trabuco Canyon             CA US,Sat Aug 07 16:15:52 PDT 2004,2.24,288.00
C0783,CW0783 Valparaiso                 IN US,Sat Aug 07 16:18:56 PDT 2004,0.00,298.00
C0786,CW0786 Smithtown                  NY US,Sat Aug 07 16:17:54 PDT 2004,0.00,24.00
C0791,CW0791 Belmont                    CA US,Sat Aug 07 16:18:27 PDT 2004,2.24,263.00
C0793,CW0793 Seattle                    WA US,Sat Aug 07 16:18:20 PDT 2004,1.34,0.00
C0796,CW0796 Savage                     MN US,Sat Aug 07 16:20:13 PDT 2004,3.58,153.00
C0801,CW0801 South Portland             ME US,Sat Aug 07 16:08:19 PDT 2004,0.89,301.00
C0804,CW0804 Juneau                     AK US,Sat Aug 07 16:08:10 PDT 2004,0.45,10.00
C0811,CW0811 West Hartford              CT US,Sat Aug 07 16:19:31 PDT 2004,0.89,329.00
C0825,CW0825 Sweet Home                 OR US,Sat Aug 07 16:20:16 PDT 2004,1.34,333.00
C0829,CW0829 Olin                       IA US,Sat Aug 07 16:18:47 PDT 2004,1.34,123.00
C0832,CW0832 Clovis                     CA US,Sat Aug 07 16:17:38 PDT 2004,2.24,323.00
C0834,CW0834 Gackle                     ND US,Sat Aug 07 16:17:49 PDT 2004,0.00,47.00
C0835,CW0835 Dijon                         FR,Sat Aug 07 16:20:02 PDT 2004,0.00,346.00
C0837,CW0837 Hays                       KS US,Sat Aug 07 16:15:47 PDT 2004,2.68,113.00
C0845,CW0845 East Hampton               MA US,Sat Aug 07 16:15:34 PDT 2004,0.00,234.00
C0856,CW0856 Kingwood                   TX US,Sat Aug 07 16:18:23 PDT 2004,0.00,145.00
C0857,CW0857 Hancock                    NH US,Sat Aug 07 16:18:10 PDT 2004,0.00,257.00
C0863,CW0863 Mendon                     MA US,Sat Aug 07 16:20:19 PDT 2004,0.00,281.00
C0870,CW0870 Victoria                   BC CA,Sat Aug 07 16:19:32 PDT 2004,1.34,90.00
C0873,CW0873 Chenango Bridge            NY US,Sat Aug 07 16:17:16 PDT 2004,0.00,246.00
C0877,CW0877 Bynum                      NC US,Sat Aug 07 16:18:22 PDT 2004,0.00,34.00
C0892,CW0892 Soldier                    IA US,Sat Aug 07 16:15:39 PDT 2004,4.02,261.00
C0900,FSUMET Tallahassee                FL US,Sat Aug 07 16:20:13 PDT 2004,4.02,234.00
C0901,NORLND Miami                      FL US,Sat Aug 07 16:19:07 PDT 2004,2.24,263.00
C0902,STEVNS Carol City                 FL US,Sat Aug 07 16:17:50 PDT 2004,2.24,0.00
C0903,YOUTH Hialeah Gardens             FL US,Sat Aug 07 16:20:20 PDT 2004,1.79,277.00
C0906,MADSON Miami                      FL US,Sat Aug 07 16:19:25 PDT 2004,1.79,246.00
C0908,BRWNVL Miami                      FL US,Sat Aug 07 16:17:34 PDT 2004,1.34,265.00
C0909,DORAL Miami                       FL US,Sat Aug 07 16:19:54 PDT 2004,0.45,224.00
C0910,SPRNGS Miami Springs              FL US,Sat Aug 07 16:16:57 PDT 2004,0.89,328.00
C0913,CITRUS Miami                      FL US,Sat Aug 07 16:19:36 PDT 2004,1.79,322.00
C0917,ARVIDA Miami                      FL US,Sat Aug 07 16:17:11 PDT 2004,0.45,226.00
C0927,CW0927 Apopka                     FL US,Sat Aug 07 16:20:10 PDT 2004,0.00,0.00
C0929,CW0929 Arouville les mantes          FR,Sat Aug 07 16:19:21 PDT 2004,2.24,131.00
C0930,CW0930 Highlands                  NC US,Sat Aug 07 16:16:08 PDT 2004,1.34,170.00
C0934,CW0934 Lynn                       MA US,Sat Aug 07 16:19:52 PDT 2004,0.00,148.00
C0937,CW0937 Bree                          BE,Sat Aug 07 16:11:26 PDT 2004,1.34,337.00
C0947,CW0947 Yorktown                   VA US,Sat Aug 07 16:20:07 PDT 2004,0.00,0.00
C0949,CW0949 Heist-op-den-Berg             BE,Sat Aug 07 16:16:26 PDT 2004,0.00,137.00
C0956,CW0956 Worthington                WV US,Sat Aug 07 16:18:38 PDT 2004,0.00,213.00
C0960,CW0960 Hackensack                 NJ US,Sat Aug 07 16:20:30 PDT 2004,0.00,10.00
C0964,CW0964 Georgetown                 TX US,Sat Aug 07 16:20:16 PDT 2004,2.68,93.00
C0965,CW0965 Hastings                   NE US,Sat Aug 07 16:20:07 PDT 2004,4.47,150.00
C0968,CW0968 Alleman                    IA US,Sat Aug 07 16:15:55 PDT 2004,2.24,190.00
C0973,CW0973 Calgary                   ALB CA,Sat Aug 07 16:18:55 PDT 2004,0.89,350.00
C0979,CW0979 Mobile                     AL US,Sat Aug 07 16:19:12 PDT 2004,0.00,106.00
C1000,CW1000 Porterville                CA US,Sat Aug 07 16:11:36 PDT 2004,0.89,254.00
C1002,CW1002 Tacoma                     WA US,Sat Aug 07 16:07:39 PDT 2004,0.89,357.00
C1004,CW1004 Auburn                     NY US,Sat Aug 07 16:20:09 PDT 2004,0.45,293.00
C1007,CW1007 Chestatee                  GA US,Sat Aug 07 16:15:27 PDT 2004,0.00,24.00
C1012,CW1012 Boxford                    MA US,Sat Aug 07 16:16:45 PDT 2004,0.00,219.00
C1014,CW1014 Crystal Lake               IL US,Sat Aug 07 16:17:54 PDT 2004,0.00,317.00
C1015,CW1015 Aston                      PA US,Sat Aug 07 16:16:16 PDT 2004,0.00,102.00
C1017,CW1017 Arlington                  MA US,Sat Aug 07 16:19:25 PDT 2004,0.00,248.00
C1020,CW1020 Tehachapi                  CA US,Sat Aug 07 16:13:27 PDT 2004,6.26,320.00
C1021,CW1021 Delfzijl                      NL,Sat Aug 07 16:11:24 PDT 2004,2.68,110.00
C1028,CW1028 Friendswood                TX US,Sat Aug 07 16:19:52 PDT 2004,1.79,119.00
C1032,CW1032 Timonium                   MD US,Sat Aug 07 16:14:28 PDT 2004,0.00,292.00
C1033,CW1033 Lebanon                    TN US,Sat Aug 07 16:19:08 PDT 2004,1.34,16.00
C1035,CW1035 Port Townsend              WA US,Sat Aug 07 16:20:05 PDT 2004,0.00,0.00
C1040,CW1040 Mannheim                      DE,Sat Aug 07 16:14:16 PDT 2004,0.00,135.00
C1043,CW1043 La Pine                    OR US,Sat Aug 07 16:17:21 PDT 2004,0.00,32.00
C1053,CW1053 Monroe Twp                 NJ US,Sat Aug 07 16:18:51 PDT 2004,0.00,309.00
C1055,CW1055 Oxford                     GA US,Sat Aug 07 16:10:03 PDT 2004,0.45,38.00
C1057,CW1057 Racine                     WI US,Sat Aug 07 16:15:46 PDT 2004,0.00,255.00
C1064,CW1064 Newport                    NH US,Sat Aug 07 16:12:49 PDT 2004,0.00,311.00
C1066,CW1066 Blackpool                     UK,Sat Aug 07 16:15:24 PDT 2004,3.13,74.00
C1074,CW1074 Wasilla                    AK US,Sat Aug 07 16:20:13 PDT 2004,0.45,182.00
C1081,CW1081 Charlotte                  NC US,Sat Aug 07 16:07:56 PDT 2004,0.00,78.00
C1085,CW1085 Mifflinburg                PA US,Sat Aug 07 16:16:12 PDT 2004,0.89,313.00
C1091,CW1091 Toms River                 NJ US,Sat Aug 07 16:19:08 PDT 2004,2.24,300.00
C1096,CW1096 Bay View                   WI US,Sat Aug 07 16:15:45 PDT 2004,0.00,253.00
C1097,CW1097 Billerica                  MA US,Sat Aug 07 16:20:27 PDT 2004,0.00,291.00
C1100,CW1100 Regina                    SAS CA,Sat Aug 07 16:16:23 PDT 2004,4.92,304.00
C1104,CW1104 Ennis                      TX US,Sat Aug 07 16:20:20 PDT 2004,0.45,47.00
C1108,CW1108 Salina                     KS US,Sat Aug 07 16:16:15 PDT 2004,0.00,149.00
C1110,CW1110 Townsville                    AU,Sat Aug 07 16:17:10 PDT 2004,0.45,268.00
C1115,CW1115 Wallington                    UK,Sat Aug 07 16:20:24 PDT 2004,0.89,97.00
C1120,CW1120 Goteborg                      SE,Sat Aug 07 16:11:29 PDT 2004,2.24,75.00
C1121,CW1121 Boras                         SE,Sat Aug 07 16:11:30 PDT 2004,0.45,171.00
C1122,CW1122 Page                       AZ US,Sat Aug 07 16:16:59 PDT 2004,0.00,261.00
C1126,CW1126 Earlwood                  NSW AU,Sat Aug 07 16:18:05 PDT 2004,2.24,263.00
C1129,CW1129 Woburn                     MA US,Sat Aug 07 16:20:17 PDT 2004,0.00,254.00
C1130,CW1130 Kanab                      UT US,Sat Aug 07 16:17:01 PDT 2004,3.13,338.00
C1134,CW1134 Pierce                     NE US,Sat Aug 07 16:19:12 PDT 2004,7.60,224.00
C1136,CW1136 Nagu/Nauvo                    FI,Sat Aug 07 16:20:19 PDT 2004,1.79,200.00
C1138,CW1138 Otis Orchards              WA US,Sat Aug 07 16:17:33 PDT 2004,0.45,253.00
C1139,CW1139 Middletown                 NY US,Sat Aug 07 16:19:25 PDT 2004,0.89,347.00
C1141,CW1141 Pensacola                  FL US,Sat Aug 07 16:15:28 PDT 2004,0.45,140.00
C1151,CW1151 Grand Marais               MN US,Sat Aug 07 16:17:10 PDT 2004,0.89,165.00
C1162,CW1162 Ely                        MN US,Sat Aug 07 16:20:09 PDT 2004,3.13,111.00
C1166,CW1166 Saratoga                   CA US,Sat Aug 07 16:18:35 PDT 2004,1.79,6.00
C1169,CW1169 Monument                   CO US,Sat Aug 07 16:18:11 PDT 2004,1.34,284.00
C1170,CW1170 Antwerp                       BE,Sat Aug 07 16:16:11 PDT 2004,0.00,100.00
