AP704,KA1UDX Collegeville               PA US,Sat Aug 07 16:32:07 PDT 2004,1.34,299.00
AP705,K4VVN Kingsport                   TN US,Sat Aug 07 16:35:08 PDT 2004,0.00,64.00
AP706,N0PJH Grand Island                NE US,Sat Aug 07 16:35:22 PDT 2004,2.68,181.00
AP710,N7XRD Renton                      WA US,Sat Aug 07 16:31:03 PDT 2004,0.00,102.00
AP711,W0DVM Divide                      CO US,Sat Aug 07 16:33:42 PDT 2004,0.89,219.00
AP712,KA1HEU Hudson                     NH US,Sat Aug 07 16:30:46 PDT 2004,0.00,50.00
AP715,K4DNM Clayton                     NC US,Sat Aug 07 16:34:40 PDT 2004,0.00,27.00
AP718,K4YK Greensboro                   GA US,Sat Aug 07 16:27:20 PDT 2004,0.00,316.00
AP722,KF4ORW Dade City                  FL US,Sat Aug 07 16:34:27 PDT 2004,0.00,91.00
AP723,KB2RC Orlando                     FL US,Sat Aug 07 16:31:01 PDT 2004,0.00,45.00
AP725,KD4BNP Palm Bay                   FL US,Sat Aug 07 16:35:12 PDT 2004,0.00,314.00
AP732,KC9AVZ Jackson                    WI US,Sat Aug 07 16:20:49 PDT 2004,2.24,312.00
AP736,VK5RR Adelaide                       AU,Sat Aug 07 16:30:12 PDT 2004,1.34,356.00
AP739,WB0TWE Encinitas                  CA US,Sat Aug 07 16:31:02 PDT 2004,4.47,188.00
AP742,KC4ELV Honey Creek                GA US,Sat Aug 07 16:34:24 PDT 2004,0.00,127.00
AP745,K4GPS-1 Jupiter Farms             FL US,Sat Aug 07 16:35:21 PDT 2004,0.00,305.00
AP747,KC4ANB Trussville                 AL US,Sat Aug 07 16:34:59 PDT 2004,0.00,107.00
AP749,N3FJA Mountain Top                PA US,Sat Aug 07 16:34:30 PDT 2004,0.00,233.00
AP750,W1OEM Flanders                    CT US,Sat Aug 07 16:32:05 PDT 2004,0.00,203.00
AP751,KC2KY Centereach                  NY US,Sat Aug 07 16:34:10 PDT 2004,0.00,296.00
AP752,WB2FTX Butler                     NJ US,Sat Aug 07 16:34:47 PDT 2004,0.00,188.00
AP758,KC7BWK Florence                   OR US,Sat Aug 07 16:34:47 PDT 2004,2.68,251.00
AP760,WB0BLV Security/Widefield         CO US,Sat Aug 07 16:35:09 PDT 2004,0.89,110.00
AP763,OX3HI Kangerlussuaq                  GL,Sat Aug 07 16:30:11 PDT 2004,0.00,250.00
AP765,N3EYQ Kingston                    NY US,Sat Aug 07 16:20:44 PDT 2004,0.89,27.00
AP767,N2XP Flanders                     NJ US,Sat Aug 07 16:33:53 PDT 2004,0.00,270.00
AP769,WC4PEM-10 Bartow                  FL US,Sat Aug 07 16:32:29 PDT 2004,0.00,180.00
AP771,WD9HDQ-2 Northfield               MN US,Sat Aug 07 16:35:22 PDT 2004,4.02,165.00
AP772,K4KAL Marietta                    GA US,Sat Aug 07 16:35:31 PDT 2004,0.00,8.00
AP773,KB4TOH-11 Columbia                NC US,Sat Aug 07 16:31:58 PDT 2004,0.00,0.00
AP774,N8OVD Wendell                     NC US,Sat Aug 07 16:34:17 PDT 2004,0.00,213.00
AP779,K4CCC-9 Cheraw                    SC US,Sat Aug 07 16:30:20 PDT 2004,0.00,7.00
AP780,W5VBQ Santa Fe                    NM US,Sat Aug 07 16:33:24 PDT 2004,0.00,215.00
AP782,WB5NZV-8 N.Denton                 TX US,Sat Aug 07 16:30:22 PDT 2004,0.00,162.00
AP783,KC5DPC-3 Slidell                  TX US,Sat Aug 07 16:33:05 PDT 2004,4.92,257.00
AP786,K5EBQ Houston                     TX US,Sat Aug 07 16:34:43 PDT 2004,0.00,100.00
AP787,KC5LPN Houston                    TX US,Sat Aug 07 16:31:43 PDT 2004,1.34,37.00
AP789,W0HVA Minot                       ND US,Sat Aug 07 16:31:59 PDT 2004,0.00,180.00
AP792,KB0TVJ-4 MeadowLake Airport       CO US,Sat Aug 07 16:33:36 PDT 2004,3.13,288.00
AP795,KD7TTL Greenbank                  WA US,Sat Aug 07 16:33:22 PDT 2004,0.00,234.00
AP799,AE0S-3 Columbia                   MO US,Sat Aug 07 16:29:12 PDT 2004,0.00,144.00
AP802,W4OZK-7 Mentone                   AL US,Sat Aug 07 16:35:29 PDT 2004,0.00,68.00
AP803,KE6AFE Santa Cruz                 CA US,Sat Aug 07 16:35:09 PDT 2004,2.24,110.00
AP806,N3EG Longview                     WA US,Sat Aug 07 16:27:00 PDT 2004,1.79,320.00
AP808,KG4YZY New Port Richey            FL US,Sat Aug 07 16:35:23 PDT 2004,0.00,8.00
AP809,K4NUT Port Richey                 FL US,Sat Aug 07 16:34:36 PDT 2004,1.79,76.00
AP812,VE3XF Stayner                    ONT CA,Sat Aug 07 16:34:38 PDT 2004,2.24,335.00
AP813,VE3PWZ Dundalk                   ONT CA,Sat Aug 07 16:35:20 PDT 2004,2.68,337.00
AP815,VA3HST Guelph                    ONT CA,Sat Aug 07 16:32:31 PDT 2004,2.68,318.00
AP818,VA3MWK Ashton                    ONT CA,Sat Aug 07 16:34:47 PDT 2004,0.00,274.00
AP819,VE3TEN Ottawa                    ONT CA,Sat Aug 07 16:31:28 PDT 2004,0.00,301.00
AP820,VE6BMR Sherwood Park             ALT CA,Sat Aug 07 16:30:41 PDT 2004,5.36,325.00
AP824,K5WPN-10 Duncan                   OK US,Sat Aug 07 16:34:53 PDT 2004,6.71,141.00
AP831,N9NJK Warsaw                      IN US,Sat Aug 07 16:33:32 PDT 2004,1.79,359.00
AP832,WB9TLH-11 Bloomington             IN US,Sat Aug 07 16:31:13 PDT 2004,0.00,0.00
AP833,KE4CON-3 Woodstock                IL US,Sat Aug 07 16:31:47 PDT 2004,0.00,189.00
AP835,KB0HNR-3 California               MO US,Sat Aug 07 16:31:05 PDT 2004,1.79,115.00
AP838,W5MAI San Antonio                 TX US,Sat Aug 07 16:33:29 PDT 2004,0.00,78.00
AP840,KC0OGY-5 Bailey                   CO US,Sat Aug 07 16:32:16 PDT 2004,0.45,102.00
AP841,WE1A USAF Academy                 CO US,Sat Aug 07 16:30:01 PDT 2004,0.00,23.00
AP842,VE5VAP Dalmeny                    SK CA,Sat Aug 07 16:33:17 PDT 2004,4.92,284.00
AP845,K2TCO Binghamton                  NY US,Sat Aug 07 16:33:15 PDT 2004,0.00,90.00
AP846,WN5PFI N.Dallas                   TX US,Sat Aug 07 16:34:47 PDT 2004,0.00,60.00
AP852,WG4R Meadows of Dan               VA US,Sat Aug 07 16:35:17 PDT 2004,0.45,266.00
AP854,N4HHP-1 Plantation                FL US,Sat Aug 07 16:35:10 PDT 2004,0.89,283.00
AP855,N4HHP-2 Ft. Lauderdale            FL US,Sat Aug 07 16:32:33 PDT 2004,3.58,235.00
AP856,N4HHP-3 Hallandale Beach          FL US,Sat Aug 07 16:33:40 PDT 2004,2.68,294.00
AP859,KF4LQQ Sarasota                   FL US,Sat Aug 07 16:29:30 PDT 2004,0.00,264.00
AP860,AA5ED-10 Brandon                  MS US,Sat Aug 07 16:33:42 PDT 2004,0.00,192.00
AP861,N1IV Plainville                   MA US,Sat Aug 07 16:33:25 PDT 2004,0.00,304.00
AP864,AB0XM-1 Great Bend                KS US,Sat Aug 07 16:33:09 PDT 2004,5.81,174.00
AP866,KA0HJZ Van Meter                  IA US,Sat Aug 07 16:33:39 PDT 2004,0.00,143.00
AP867,N0VPR Johnston                    IA US,Sat Aug 07 16:27:50 PDT 2004,4.02,182.00
AP870,KC0LBV Farmington                 MN US,Sat Aug 07 16:31:29 PDT 2004,6.26,133.00
AP871,N0PFY Northfield                  MN US,Sat Aug 07 16:33:29 PDT 2004,4.02,174.00
AP872,N0EST Rochester                   MN US,Sat Aug 07 16:35:13 PDT 2004,0.45,106.00
AP877,KA8OAD-1 Fairlawn                 OH US,Sat Aug 07 16:32:53 PDT 2004,0.00,241.00
AP878,AB9FX Chicago                     IL US,Sat Aug 07 16:32:16 PDT 2004,0.45,194.00
AP879,N9VPV Galesburg                   IL US,Sat Aug 07 16:34:11 PDT 2004,0.89,92.00
AP883,KK7MQ Twin Falls                  ID US,Sat Aug 07 16:33:20 PDT 2004,4.47,276.00
AP888,N7QXO-2 Vancouver                 WA US,Sat Aug 07 16:27:59 PDT 2004,0.00,11.00
AP890,KB7DZR Tigard                     OR US,Sat Aug 07 16:31:54 PDT 2004,2.24,299.00
AP892,KG6QHD Prineville                 OR US,Sat Aug 07 16:20:33 PDT 2004,1.79,4.00
AP893,KE6KYI Groveland                  CA US,Sat Aug 07 16:34:42 PDT 2004,0.00,225.00
AP894,K6IMN Atwater                     CA US,Sat Aug 07 16:26:03 PDT 2004,0.89,325.00
AP896,WA6YLB Exeter                     CA US,Sat Aug 07 16:31:48 PDT 2004,0.89,4.00
AP897,WA6YLB-4 Govt.Peak                CA US,Sat Aug 07 16:34:36 PDT 2004,6.26,217.00
AP898,WA6YLB-6 Visalia                  CA US,Sat Aug 07 16:32:18 PDT 2004,0.00,0.00
AP901,KB6OQJ Santa Ynez                 CA US,Sat Aug 07 16:35:30 PDT 2004,1.34,268.00
AP902,N6HGA-1 Palmdale                  CA US,Sat Aug 07 16:34:10 PDT 2004,2.68,271.00
AP904,W6MAF Hesperia                    CA US,Sat Aug 07 16:34:20 PDT 2004,4.92,186.00
AP907,W9IF-4 Torry Pines                CA US,Sat Aug 07 16:28:20 PDT 2004,3.13,283.00
AP911,K4GIG-7 Brindley Mtn.             AL US,Sat Aug 07 16:34:10 PDT 2004,0.00,80.00
AP912,WB2JSH Eaton                      CO US,Sat Aug 07 16:35:14 PDT 2004,3.13,109.00
AP913,WB5SLA Ball Ground                GA US,Sat Aug 07 16:34:39 PDT 2004,0.00,319.00
AP916,KE4YGK Fort Payne                 AL US,Sat Aug 07 16:31:20 PDT 2004,0.00,73.00
AP917,W7NWS Billings                    MT US,Sat Aug 07 16:27:53 PDT 2004,4.47,314.00
AP919,LB9ME Trondheim                      NO,Sat Aug 07 16:35:16 PDT 2004,0.00,220.00
AP921,OZ6GX-5 Roervig                      DK,Sat Aug 07 16:27:04 PDT 2004,0.00,62.00
AP922,OZ1IEP-5 Jaegerspris                 DK,Sat Aug 07 16:25:29 PDT 2004,2.68,82.00
AP924,OH6GGL-3 Lppalahti                   FI,Sat Aug 07 16:21:14 PDT 2004,0.00,0.00
AP925,M0RDC Liverpool                      UK,Sat Aug 07 16:26:16 PDT 2004,0.00,112.00
AP930,G8TQH Devon                          UK,Sat Aug 07 16:30:03 PDT 2004,13.41,93.00
AP932,MB7UHR Luton                         UK,Sat Aug 07 16:34:49 PDT 2004,1.79,144.00
AP936,G3RJI Essex                          UK,Sat Aug 07 16:23:44 PDT 2004,1.34,75.00
AP937,MB7UEK Herne Bay                     UK,Sat Aug 07 16:31:40 PDT 2004,0.00,112.00
AP938,G3OJZ-6 Kent                         UK,Sat Aug 07 16:23:26 PDT 2004,1.34,76.00
AP942,YV5KXE-2 Caracas                     VE,Sat Aug 07 16:31:23 PDT 2004,0.00,92.00
AP943,MTHEBO Mt. Hebo                   OR US,Sat Aug 07 16:28:35 PDT 2004,0.00,0.00
AP946,F1HCI-12 Versailles                  FR,Sat Aug 07 16:32:25 PDT 2004,0.00,113.00
AP952,N1NSI Contoocook                  NH US,Sat Aug 07 16:30:36 PDT 2004,0.00,260.00
AP956,K4TEM Tallahassee                 FL US,Sat Aug 07 16:31:33 PDT 2004,0.45,326.00
AP962,EB2FGI-15 Irun                       ES,Sat Aug 07 16:22:29 PDT 2004,0.45,244.00
AP965,EB5ESX Sta Pola                      ES,Sat Aug 07 16:33:51 PDT 2004,5.81,57.00
AP967,EA3AYP-1 Girona                      ES,Sat Aug 07 16:34:00 PDT 2004,3.58,174.00
AP968,EA3FAJ-1 Girona                      ES,Sat Aug 07 16:32:06 PDT 2004,1.79,195.00
AP969,EA3RCK-1 Lleida                      ES,Sat Aug 07 16:31:23 PDT 2004,0.00,351.00
AP971,EB3GGU Balaguer                      ES,Sat Aug 07 16:35:07 PDT 2004,2.68,22.00
AP973,PE1NAT-1 Heerhugowaard               NL,Sat Aug 07 16:30:03 PDT 2004,0.00,323.00
AP976,DO7VLR-5 Zweibruecken                DE,Sat Aug 07 16:30:21 PDT 2004,0.00,179.00
AP979,KC9BWF-3 Sister Bay               MI US,Sat Aug 07 16:33:14 PDT 2004,4.47,127.00
AP981,KG4SEY Niceville                  FL US,Sat Aug 07 16:31:10 PDT 2004,3.58,49.00
AP984,N8QQ Cincinnati                   OH US,Sat Aug 07 16:35:03 PDT 2004,0.00,335.00
AP985,KB9QJM-11 Cloverdale              IN US,Sat Aug 07 16:33:09 PDT 2004,1.34,215.00
AP986,KB9QJM-12 Atlanta                 IN US,Sat Aug 07 16:27:01 PDT 2004,0.00,81.00
AP987,KC5CPO Keene                      TX US,Sat Aug 07 16:30:51 PDT 2004,0.00,12.00
AP989,KC9JWM Clam Lake                  WI US,Sat Aug 07 16:33:09 PDT 2004,0.45,278.00
AP991,W0BIS-3 Killdeer                  ND US,Sat Aug 07 16:34:37 PDT 2004,4.47,172.00
AP993,F6CNB Frelsburg                   TX US,Sat Aug 07 16:22:14 PDT 2004,0.00,33.00
AP996,KC5YVU Lampasas                   TX US,Sat Aug 07 16:34:28 PDT 2004,1.79,110.00
AP998,DK1PR-6 Altenahr                     DE,Sat Aug 07 16:23:50 PDT 2004,0.00,125.00
AP999,DB5OY-15 Celle                       DE,Sat Aug 07 16:32:13 PDT 2004,0.00,360.00
AR005,HB9BA-8 Solothurn                    CH,Sat Aug 07 16:33:10 PDT 2004,0.00,0.00
AR006,HB9MZI Giubiasco                     CH,Sat Aug 07 16:27:49 PDT 2004,0.00,120.00
AR009,SR3TK-1 Gontyniec                    PL,Sat Aug 07 16:34:53 PDT 2004,4.02,68.00
AR011,IK1ZQJ Torino                        IT,Sat Aug 07 16:34:27 PDT 2004,0.00,30.00
AR014,IK1RDC Scurzolengo                   IT,Sat Aug 07 16:28:10 PDT 2004,2.24,351.00
AR016,IW4APJ-3 Soliera                     IT,Sat Aug 07 16:33:07 PDT 2004,2.68,54.00
AR017,IK4UPW S.Giovanni                    IT,Sat Aug 07 16:32:54 PDT 2004,0.00,30.00
AR020,IK3SVW-3 Treviso                     IT,Sat Aug 07 16:31:03 PDT 2004,1.79,321.00
AR021,I3OVD Scaltenigo                     IT,Sat Aug 07 16:30:47 PDT 2004,2.24,25.00
AR022,IW5BFZ Lucca                         IT,Sat Aug 07 16:31:18 PDT 2004,0.00,312.00
AR028,IW8PCP-2 Gambarie d'Aspromonte       IT,Sat Aug 07 16:33:18 PDT 2004,0.00,134.00
AR030,N4HHP-4 Pompano Beach             FL US,Sat Aug 07 16:33:58 PDT 2004,2.24,139.00
AR031,SV2BNL-2 Thessaloniki                GR,Sat Aug 07 16:21:59 PDT 2004,0.00,99.00
AR033,SV4BHA-2 Larisa                      GR,Sat Aug 07 16:26:10 PDT 2004,0.00,205.00
AR034,SV1CIF-2 Aitoloakarnania             GR,Sat Aug 07 16:31:28 PDT 2004,0.00,356.00
AR035,SV3AQN-2 Patra                       GR,Sat Aug 07 16:32:18 PDT 2004,0.00,146.00
AR036,SV3BEF-2 Tripolis                    GR,Sat Aug 07 16:31:01 PDT 2004,0.00,224.00
AR040,N3BSQ Bethel Park                 PA US,Sat Aug 07 16:33:54 PDT 2004,0.00,330.00
AR043,K4ZZR Port St. Lucie              FL US,Sat Aug 07 16:34:05 PDT 2004,0.00,189.00
AR044,N0QXY Ft.Lupton                   CO US,Sat Aug 07 16:28:16 PDT 2004,2.24,193.00
AR045,IW9ETI-2 Taormina                    IT,Sat Aug 07 16:33:35 PDT 2004,1.34,294.00
AR051,KE7TR-8 Mesa                      AZ US,Sat Aug 07 16:34:53 PDT 2004,1.34,287.00
AR052,KG4QXL Fort Valley                VA US,Sat Aug 07 16:34:11 PDT 2004,0.00,174.00
AR053,VK3AWA Paradise Beach                AU,Sat Aug 07 16:27:43 PDT 2004,0.45,247.00
AR066,KC0IVW Colorado Springs           CO US,Sat Aug 07 16:30:36 PDT 2004,0.00,0.00
AR068,WA2MAK Bolton                     MA US,Sat Aug 07 16:34:27 PDT 2004,0.00,265.00
AR069,KF7KN-7 Red Lodge                 MT US,Sat Aug 07 16:35:09 PDT 2004,0.00,59.00
AR070,KI0BJ-2 Fort Smith                MT US,Sat Aug 07 16:33:37 PDT 2004,3.13,284.00
AR071,KD4BJW Albertville                AL US,Sat Aug 07 16:21:23 PDT 2004,0.00,78.00
AR072,KB2KMM N. Babylon                 NY US,Sat Aug 07 16:35:09 PDT 2004,0.00,275.00
AR075,W3UGI Ambler                      PA US,Sat Aug 07 16:27:30 PDT 2004,0.00,154.00
AR078,N9NYF-6 Evansville                IN US,Sat Aug 07 16:29:44 PDT 2004,0.89,20.00
AR079,WX4BUY Elon                       NC US,Sat Aug 07 16:33:18 PDT 2004,0.00,316.00
AR084,W4ERC-10 Avon Park                FL US,Sat Aug 07 16:30:51 PDT 2004,0.00,35.00
AR090,DB0BGD-3 Berchtesgaden               DE,Sat Aug 07 16:30:32 PDT 2004,2.24,215.00
AR091,DB0SAC-6 Bad Sackingen               DE,Sat Aug 07 16:22:01 PDT 2004,4.47,57.00
AR095,DO2UMM Gorlitz                       DE,Sat Aug 07 16:35:10 PDT 2004,0.00,112.00
AR097,EA3AGQ Lleida                        ES,Sat Aug 07 16:33:38 PDT 2004,3.58,79.00
AR098,EA3AGQ-1 Montsec d'Ares              ES,Sat Aug 07 16:34:09 PDT 2004,8.49,183.00
AR100,N1FWV Peabody                     MA US,Sat Aug 07 16:35:15 PDT 2004,0.00,92.00
AR103,W4SBO-7 Section                   AL US,Sat Aug 07 16:34:55 PDT 2004,0.00,200.00
AR106,N6FKW Auberry                     CA US,Sat Aug 07 16:33:33 PDT 2004,0.00,265.00
AR107,EA3AKS-15 SantPere de Ribes          ES,Sat Aug 07 16:35:01 PDT 2004,0.00,3.00
AR108,EA3BB Santpedor                      ES,Sat Aug 07 16:26:20 PDT 2004,0.00,287.00
AR109,EA3BSJ-1 Pinos                       ES,Sat Aug 07 16:35:24 PDT 2004,1.34,127.00
AR112,EB3DMC-1 Belvis                      ES,Sat Aug 07 16:26:39 PDT 2004,1.34,97.00
AR115,EUGENE Eugene                     OR US,Sat Aug 07 16:31:21 PDT 2004,8.49,55.00
AR122,N4HHP-6 Cooper City               FL US,Sat Aug 07 16:28:34 PDT 2004,0.00,207.00
AR127,ZL1RED Tauranga Bay                  NZ,Sat Aug 07 16:31:46 PDT 2004,2.68,256.00
AR132,IZ1DBU-2 Favria                      IT,Sat Aug 07 16:34:10 PDT 2004,0.45,352.00
AR133,K0MXU-4 Hoxie                     KS US,Sat Aug 07 16:20:48 PDT 2004,2.68,158.00
AR134,K4JRG Miami                       FL US,Sat Aug 07 16:27:52 PDT 2004,0.89,248.00
AR137,K6NE Ventura                      CA US,Sat Aug 07 16:28:35 PDT 2004,1.34,299.00
AR138,K7LHC-1 Lake Havasu               AZ US,Sat Aug 07 16:33:38 PDT 2004,2.68,79.00
AR140,KB0VYO-12 Winona                  MN US,Sat Aug 07 16:25:57 PDT 2004,0.45,0.00
AR141,KB5NMB-5 Fulton                   MS US,Sat Aug 07 16:32:56 PDT 2004,0.00,28.00
AR144,KB6CYS Cypress                    CA US,Sat Aug 07 16:32:31 PDT 2004,3.58,157.00
AR147,W0NWS-4 Colon                     NE US,Sat Aug 07 16:35:30 PDT 2004,1.34,172.00
AR148,K6DYC Meeker                      CO US,Sat Aug 07 16:35:19 PDT 2004,1.79,313.00
AR150,KC4WPS Hendersonville             TN US,Sat Aug 07 16:30:43 PDT 2004,0.00,286.00
AR152,KC5LIO West Point                 MS US,Sat Aug 07 16:30:21 PDT 2004,0.00,0.00
AR156,KD4DLT-6 Lithonia                 GA US,Sat Aug 07 16:29:03 PDT 2004,0.00,0.00
AR160,NEWPRT Cape Foulweather           OR US,Sat Aug 07 16:33:23 PDT 2004,6.71,321.00
AR161,KD7DR-3 Tempe                     AZ US,Sat Aug 07 16:26:40 PDT 2004,1.34,6.00
AR162,KF4VTT Mebane                     NC US,Sat Aug 07 16:35:21 PDT 2004,0.00,247.00
AR164,KF6NY Mt. Ranch                   CA US,Sat Aug 07 16:30:04 PDT 2004,0.00,271.00
AR165,KF6YU-2 Tempe                     AZ US,Sat Aug 07 16:31:40 PDT 2004,0.00,0.00
AR166,KG4LXH-2 Miami                    FL US,Sat Aug 07 16:26:54 PDT 2004,1.34,251.00
AR167,KI0IO-2 Berthoud                  CO US,Sat Aug 07 16:32:30 PDT 2004,0.89,191.00
AR168,KK5CA-2 Spring                    TX US,Sat Aug 07 16:31:00 PDT 2004,0.45,204.00
AR169,KK6RW Gig Harbor                  WA US,Sat Aug 07 16:31:36 PDT 2004,2.24,54.00
AR170,KO5Z Denton                       TX US,Sat Aug 07 16:34:10 PDT 2004,0.89,22.00
AR172,W6TQP Soquel                      CA US,Sat Aug 07 16:30:17 PDT 2004,2.24,113.00
AR173,LA2YEA Hauglandshella                NO,Sat Aug 07 16:35:34 PDT 2004,0.00,22.00
AR177,K7UGT Cary                        NC US,Sat Aug 07 16:30:47 PDT 2004,0.00,359.00
AR178,KJ3L Erie                         PA US,Sat Aug 07 16:35:07 PDT 2004,0.89,228.00
AR179,KC9AAG Fond Du Lac                WI US,Sat Aug 07 16:35:22 PDT 2004,0.00,286.00
AR182,GW4TJC Caerphilly                    UK,Sat Aug 07 16:35:13 PDT 2004,0.89,214.00
AR183,N7LUF Hansville                   WA US,Sat Aug 07 16:33:25 PDT 2004,0.45,32.00
AR184,W7PG-10 Forsyth                   MT US,Sat Aug 07 16:26:55 PDT 2004,5.81,314.00
AR185,N1XH-15 Spencer                   MA US,Sat Aug 07 16:33:30 PDT 2004,0.00,248.00
AR186,N2LBT-7 Albany                    NY US,Sat Aug 07 16:35:29 PDT 2004,0.00,0.00
AR189,N5JEI-8 Spicewood                 TX US,Sat Aug 07 16:32:37 PDT 2004,0.00,4.00
AR191,WA4BPS Huntsville                 AL US,Sat Aug 07 16:33:23 PDT 2004,0.45,75.00
AR195,N7BIV Glendale                    AZ US,Sat Aug 07 16:27:01 PDT 2004,0.45,45.00
AR196,N7CK San Manuel                   AZ US,Sat Aug 07 16:31:05 PDT 2004,2.24,344.00
AR197,N7FZA-15 Boise                    ID US,Sat Aug 07 16:27:24 PDT 2004,2.24,39.00
AR199,N7TCF Phoenix                     AZ US,Sat Aug 07 16:27:30 PDT 2004,1.34,5.00
AR200,N7TQZ Tacoma                      WA US,Sat Aug 07 16:35:27 PDT 2004,0.00,304.00
AR201,N8NQF-1 Middletown                OH US,Sat Aug 07 16:23:00 PDT 2004,0.00,296.00
AR202,N8VIM Pepperell                   MA US,Sat Aug 07 16:25:04 PDT 2004,0.00,0.00
AR203,N9UDO-2 Baraboo                   WI US,Sat Aug 07 16:35:39 PDT 2004,0.00,140.00
AR204,N9YWZ Kimberly                    WI US,Sat Aug 07 16:32:28 PDT 2004,0.89,278.00
AR208,KD7WIS Miles City                 MT US,Sat Aug 07 16:26:41 PDT 2004,0.00,301.00
AR209,K0OQ Northfield                   MN US,Sat Aug 07 16:31:00 PDT 2004,0.00,178.00
AR214,KB0RPX Wood River                 NE US,Sat Aug 07 16:30:20 PDT 2004,2.24,185.00
AR216,W7PG-12 Home Creek                MT US,Sat Aug 07 16:29:39 PDT 2004,0.00,0.00
AR218,KD7YTJ Brownstown                 WA US,Sat Aug 07 16:35:09 PDT 2004,2.68,137.00
AR220,KB6KJX Ellensburg                 WA US,Sat Aug 07 16:31:21 PDT 2004,0.45,90.00
AR221,K6TVI-1 Onyx Peak                 CA US,Sat Aug 07 16:26:43 PDT 2004,0.89,108.00
AR223,W7IUC-5 Grassy Key                FL US,Sat Aug 07 16:31:30 PDT 2004,0.00,177.00
AR225,KG6QHS Shingletown                CA US,Sat Aug 07 16:33:07 PDT 2004,0.00,329.00
AR226,W4RL-1 Pensacola                  FL US,Sat Aug 07 16:34:24 PDT 2004,2.68,75.00
AR227,WA5SJW-10 E.Albuquerque           NM US,Sat Aug 07 16:31:57 PDT 2004,2.24,322.00
AR228,N0ERG Littleton                   CO US,Sat Aug 07 16:30:09 PDT 2004,0.00,205.00
AR230,K4DIG-7 Sardis Springs            AL US,Sat Aug 07 16:34:33 PDT 2004,0.00,104.00
AR232,KC7RJK Eugene                     OR US,Sat Aug 07 16:32:52 PDT 2004,2.68,351.00
AR233,N4BK-5 Hartselle                  AL US,Sat Aug 07 16:35:37 PDT 2004,0.00,292.00
AR234,NK7W Reno                         NV US,Sat Aug 07 16:33:29 PDT 2004,2.24,23.00
AR235,K6SUD Hesperia                    CA US,Sat Aug 07 16:27:43 PDT 2004,0.45,233.00
AR238,N5YXO Granbury                    TX US,Sat Aug 07 16:31:43 PDT 2004,0.89,79.00
AR241,K2LCA-1 Chappaqua                 NY US,Sat Aug 07 16:35:23 PDT 2004,0.00,144.00
AR245,K7HRT Greenacres                  WA US,Sat Aug 07 16:33:12 PDT 2004,0.00,205.00
AR248,K7VIP Tucson                      AZ US,Sat Aug 07 16:35:08 PDT 2004,4.02,315.00
AR249,KA5WRG Oklahoma City              OK US,Sat Aug 07 16:33:11 PDT 2004,1.34,180.00
AR250,KA8SCP Westford                   MA US,Sat Aug 07 16:33:12 PDT 2004,0.00,272.00
AR252,KB7IPU-2 Payson                   AZ US,Sat Aug 07 16:32:19 PDT 2004,2.24,339.00
AR253,KB8WFH Springfield                OH US,Sat Aug 07 16:33:51 PDT 2004,0.00,325.00
AR254,KB9TPG Viroqua                    WI US,Sat Aug 07 16:27:11 PDT 2004,2.24,162.00
AR255,KC4YLE Efland                     NC US,Sat Aug 07 16:30:39 PDT 2004,0.00,1.00
AR256,W5HKR Schertz                     TX US,Sat Aug 07 16:34:59 PDT 2004,0.89,105.00
AR257,N1ETY New Britain                 CT US,Sat Aug 07 16:30:35 PDT 2004,0.00,337.00
AR258,KC8HJN Ludington                  MI US,Sat Aug 07 16:31:40 PDT 2004,0.45,289.00
AR259,KD5CUW-1 Copperas Cove            TX US,Sat Aug 07 16:26:16 PDT 2004,0.45,44.00
AR260,KD5FDE Runaway Bay                TX US,Sat Aug 07 16:27:24 PDT 2004,1.34,75.00
AR261,KD6RXY Calimesa                   CA US,Sat Aug 07 16:34:59 PDT 2004,3.58,278.00
AR262,KD7GXO-7 Seattle                  WA US,Sat Aug 07 16:30:20 PDT 2004,0.45,327.00
AR264,K0JDN Phoenix                     AZ US,Sat Aug 07 16:33:15 PDT 2004,1.34,297.00
AR266,KJ7XE Port Angeles                WA US,Sat Aug 07 16:35:41 PDT 2004,2.68,338.00
AR267,N3WNZ Brandon                        UK,Sat Aug 07 16:31:43 PDT 2004,0.45,99.00
AR269,KC7PHC Orofino                    ID US,Sat Aug 07 16:30:07 PDT 2004,2.24,180.00
AR270,KF4UXI Southern Shores            NC US,Sat Aug 07 16:30:25 PDT 2004,0.00,75.00
AR271,AA0MM-2 Holton                    KS US,Sat Aug 07 16:35:35 PDT 2004,4.02,219.00
AR272,KG4JPL Hudson                     FL US,Sat Aug 07 16:32:11 PDT 2004,1.34,164.00
AR273,N1JJX Southington                 CT US,Sat Aug 07 16:31:46 PDT 2004,0.00,268.00
AR274,W4RP Palm Bay                     FL US,Sat Aug 07 16:31:32 PDT 2004,0.00,274.00
AR275,W1CWS-1 Cos Cob                   CT US,Sat Aug 07 16:30:14 PDT 2004,0.00,337.00
AR277,VE2GAT-2 St.Hyacinthe             QB CA,Sat Aug 07 16:31:21 PDT 2004,2.68,294.00
AR279,VE3COE Kincardine                ONT CA,Sat Aug 07 16:35:34 PDT 2004,0.00,263.00
AR280,VE3JON Kincardine                ONT CA,Sat Aug 07 16:35:06 PDT 2004,0.00,328.00
AR282,VE7IMD-2 Delta                    BC CA,Sat Aug 07 16:34:18 PDT 2004,0.00,255.00
AR283,VE7MKF-3 Surry                    BC CA,Sat Aug 07 16:31:07 PDT 2004,0.89,188.00
AR284,VE7MMG-1 Crystal Mt.              BC CA,Sat Aug 07 16:24:59 PDT 2004,1.34,56.00
AR286,K0NSA Omaha                       NE US,Sat Aug 07 16:26:37 PDT 2004,4.02,172.00
AR290,AB4KN Peachtree City              GA US,Sat Aug 07 16:31:08 PDT 2004,0.00,347.00
AR300,KB8GQ Galloway                    OH US,Sat Aug 07 16:34:44 PDT 2004,0.00,338.00
AR301,N5KUK Norman                      OK US,Sat Aug 07 16:26:54 PDT 2004,1.79,143.00
AR302,N4NW Stafford                     VA US,Sat Aug 07 16:33:03 PDT 2004,0.00,61.00
AR303,DL1BLU Schortens                     DE,Sat Aug 07 16:30:32 PDT 2004,0.00,94.00
AR304,AA6HF-5 Cathedral City            CA US,Sat Aug 07 16:26:59 PDT 2004,0.00,0.00
AR305,KF6ZGH Fremont                    CA US,Sat Aug 07 16:30:56 PDT 2004,1.79,326.00
AR306,KQ6DI-15 Livermore                CA US,Sat Aug 07 16:31:27 PDT 2004,3.13,264.00
AR307,W6KL Burbank                      CA US,Sat Aug 07 16:29:47 PDT 2004,2.68,210.00
AR308,W8EHH Winter Garden               FL US,Sat Aug 07 16:35:12 PDT 2004,1.34,79.00
AR310,K4ROK-10 Fountain                 NC US,Sat Aug 07 16:26:20 PDT 2004,0.00,259.00
AR312,WA6BAY-1 Soquel                   CA US,Sat Aug 07 16:25:49 PDT 2004,2.24,172.00
AR313,WB6AHC-1 San Jose                 CA US,Sat Aug 07 16:35:28 PDT 2004,2.24,302.00
AR314,N7NAT Yakima                      WA US,Sat Aug 07 16:29:29 PDT 2004,0.00,105.00
AR315,OH6GPB Pietarsaari                   FI,Sat Aug 07 16:31:22 PDT 2004,0.00,305.00
AR316,N7OKG Deer Park                   WA US,Sat Aug 07 16:34:41 PDT 2004,0.89,180.00
AR320,K6TZ Diablo Peak                  CA US,Sat Aug 07 16:28:12 PDT 2004,2.24,314.00
AR321,K6DJR W.Menlo Park                CA US,Sat Aug 07 16:30:09 PDT 2004,0.89,79.00
AR323,KF6YUA Sebastopol                 CA US,Sat Aug 07 16:35:30 PDT 2004,4.02,260.00
AR326,N2KTO Sparta                      NJ US,Sat Aug 07 16:31:23 PDT 2004,0.00,225.00
AR327,WB1FYE Weirs Beach                NH US,Sat Aug 07 16:35:34 PDT 2004,0.00,68.00
AR328,N1EO Center Harbor                NH US,Sat Aug 07 16:32:59 PDT 2004,0.00,7.00
AR329,KA1RVR Epping                     NH US,Sat Aug 07 16:30:19 PDT 2004,0.00,277.00
AR330,KC1EO Hollis                      NH US,Sat Aug 07 16:30:37 PDT 2004,0.00,147.00
