AP751,KC2KY Centereach                  NY US,Tue Jul 20 15:48:42 PDT 2004,0.00,161.00
AP758,KC7BWK Florence                   OR US,Tue Jul 20 15:50:17 PDT 2004,4.02,275.00
AP760,WB0BLV Security/Widefield         CO US,Tue Jul 20 15:45:17 PDT 2004,2.24,323.00
AP765,N3EYQ Kingston                    NY US,Tue Jul 20 15:39:17 PDT 2004,0.00,285.00
AP766,WB2CMF Farmingville               NY US,Tue Jul 20 15:35:42 PDT 2004,0.00,230.00
AP767,N2XP Flanders                     NJ US,Tue Jul 20 15:49:06 PDT 2004,0.00,248.00
AP769,WC4PEM-10 Bartow                  FL US,Tue Jul 20 15:42:03 PDT 2004,0.00,180.00
AP772,K4KAL Marietta                    GA US,Tue Jul 20 15:45:17 PDT 2004,0.00,340.00
AP773,KB4TOH-11 Columbia                NC US,Tue Jul 20 15:47:25 PDT 2004,1.79,80.00
AP774,N8OVD Wendell                     NC US,Tue Jul 20 15:45:31 PDT 2004,0.00,180.00
AP779,K4CCC-9 Cheraw                    SC US,Tue Jul 20 15:46:11 PDT 2004,0.00,32.00
AP780,W5VBQ Santa Fe                    NM US,Tue Jul 20 15:43:33 PDT 2004,1.79,265.00
AP782,WB5NZV-8 N.Denton                 TX US,Tue Jul 20 15:43:02 PDT 2004,0.00,153.00
AP783,KC5DPC-3 Slidell                  TX US,Tue Jul 20 15:47:48 PDT 2004,4.92,257.00
AP786,K5EBQ Houston                     TX US,Tue Jul 20 15:48:25 PDT 2004,0.00,120.00
AP787,KC5LPN Houston                    TX US,Tue Jul 20 15:48:45 PDT 2004,0.00,174.00
AP792,KB0TVJ-4 MeadowLake Airport       CO US,Tue Jul 20 15:44:35 PDT 2004,3.58,232.00
AP795,KD7TTL Greenbank                  WA US,Tue Jul 20 15:48:19 PDT 2004,0.45,196.00
AP802,W4OZK-7 Mentone                   AL US,Tue Jul 20 15:47:29 PDT 2004,0.00,349.00
AP803,KE6AFE Santa Cruz                 CA US,Tue Jul 20 15:50:14 PDT 2004,3.13,103.00
AP808,KG4YZY New Port Richey            FL US,Tue Jul 20 15:50:13 PDT 2004,1.34,227.00
AP809,K4NUT Port Richey                 FL US,Tue Jul 20 15:49:46 PDT 2004,0.45,220.00
AP811,KC2IXE Bayside Hills              NY US,Tue Jul 20 15:47:43 PDT 2004,1.34,275.00
AP812,VE3XF Stayner                    ONT CA,Tue Jul 20 15:49:45 PDT 2004,1.34,207.00
AP813,VE3PWZ Dundalk                   ONT CA,Tue Jul 20 15:42:15 PDT 2004,2.24,136.00
AP815,VA3HST Guelph                    ONT CA,Tue Jul 20 15:49:00 PDT 2004,3.58,317.00
AP817,VA3AT Renfrew                    ONT CA,Tue Jul 20 15:49:59 PDT 2004,0.00,315.00
AP818,VA3MWK Ashton                    ONT CA,Tue Jul 20 15:48:45 PDT 2004,1.79,172.00
AP819,VE3TEN Ottawa                    ONT CA,Tue Jul 20 15:46:07 PDT 2004,2.68,257.00
AP820,VE6BMR Sherwood Park             ALT CA,Tue Jul 20 15:46:11 PDT 2004,6.26,326.00
AP823,AD4BL Fairbanks                   AK US,Tue Jul 20 15:43:10 PDT 2004,0.00,200.00
AP824,K5WPN-10 Duncan                   OK US,Tue Jul 20 15:49:55 PDT 2004,7.15,114.00
AP830,KA2FNK Merriam                    KS US,Tue Jul 20 15:48:44 PDT 2004,1.34,212.00
AP831,N9NJK Warsaw                      IN US,Tue Jul 20 15:48:43 PDT 2004,1.34,260.00
AP832,WB9TLH-11 Bloomington             IN US,Tue Jul 20 15:48:07 PDT 2004,0.00,0.00
AP833,KE4CON-3 Woodstock                IL US,Tue Jul 20 15:44:34 PDT 2004,2.68,237.00
AP835,KB0HNR-3 California               MO US,Tue Jul 20 15:46:01 PDT 2004,3.58,257.00
AP838,W5MAI San Antonio                 TX US,Tue Jul 20 15:43:33 PDT 2004,0.45,99.00
AP840,KC0OGY-5 Bailey                   CO US,Tue Jul 20 15:37:31 PDT 2004,1.34,210.00
AP846,WN5PFI N.Dallas                   TX US,Tue Jul 20 15:47:36 PDT 2004,0.00,181.00
AP852,WG4R Meadows of Dan               VA US,Tue Jul 20 15:50:20 PDT 2004,0.45,330.00
AP854,N4HHP-1 Plantation                FL US,Tue Jul 20 15:49:15 PDT 2004,0.00,301.00
AP855,N4HHP-2 Ft. Lauderdale            FL US,Tue Jul 20 15:46:53 PDT 2004,2.68,252.00
AP856,N4HHP-3 Hallandale Beach          FL US,Tue Jul 20 15:48:01 PDT 2004,0.00,322.00
AP858,KD5WEB Port Allen                 LA US,Tue Jul 20 15:46:44 PDT 2004,1.79,244.00
AP860,AA5ED-10 Brandon                  MS US,Tue Jul 20 15:39:18 PDT 2004,0.00,200.00
AP864,AB0XM-1 Great Bend                KS US,Tue Jul 20 15:49:39 PDT 2004,7.60,192.00
AP866,KA0HJZ Van Meter                  IA US,Tue Jul 20 15:48:04 PDT 2004,0.00,213.00
AP867,N0VPR Johnston                    IA US,Tue Jul 20 15:42:56 PDT 2004,2.68,117.00
AP870,KC0LBV Farmington                 MN US,Tue Jul 20 15:41:34 PDT 2004,3.13,175.00
AP872,N0EST Rochester                   MN US,Tue Jul 20 15:49:38 PDT 2004,0.00,71.00
AP874,VK2AAK Forster                       AU,Tue Jul 20 15:46:37 PDT 2004,0.00,218.00
AP877,KA8OAD-1 Fairlawn                 OH US,Tue Jul 20 15:45:11 PDT 2004,1.79,243.00
AP878,AB9FX Chicago                     IL US,Tue Jul 20 15:47:31 PDT 2004,0.00,359.00
AP879,N9VPV Galesburg                   IL US,Tue Jul 20 15:49:46 PDT 2004,0.45,176.00
AP881,KJ4W Murray                       KY US,Tue Jul 20 15:36:25 PDT 2004,1.34,227.00
AP888,N7QXO-2 Vancouver                 WA US,Tue Jul 20 15:44:02 PDT 2004,0.00,358.00
AP890,KB7DZR Tigard                     OR US,Tue Jul 20 15:50:02 PDT 2004,0.89,214.00
AP892,KG6QHD Prineville                 OR US,Tue Jul 20 15:46:39 PDT 2004,0.00,41.00
AP893,KE6KYI Groveland                  CA US,Tue Jul 20 15:39:05 PDT 2004,1.34,109.00
AP894,K6IMN Atwater                     CA US,Tue Jul 20 15:50:03 PDT 2004,2.24,39.00
AP895,KF6JJP Richmond                   CA US,Tue Jul 20 15:48:29 PDT 2004,3.58,284.00
AP896,WA6YLB Exeter                     CA US,Tue Jul 20 15:44:09 PDT 2004,0.89,250.00
AP897,WA6YLB-4 Govt.Peak                CA US,Tue Jul 20 15:48:27 PDT 2004,11.18,305.00
AP898,WA6YLB-6 Visalia                  CA US,Tue Jul 20 15:46:52 PDT 2004,0.00,0.00
AP900,KE6ZPS-1 Miranda Canyon           CA US,Tue Jul 20 15:49:11 PDT 2004,8.49,225.00
AP901,KB6OQJ Santa Ynez                 CA US,Tue Jul 20 15:43:36 PDT 2004,3.13,264.00
AP902,N6HGA-1 Palmdale                  CA US,Tue Jul 20 15:49:29 PDT 2004,3.13,237.00
AP904,W6MAF Hesperia                    CA US,Tue Jul 20 15:48:53 PDT 2004,5.81,181.00
AP907,W9IF-4 Torry Pines                CA US,Tue Jul 20 15:49:42 PDT 2004,3.13,271.00
AP911,K4GIG-7 Brindley Mtn.             AL US,Tue Jul 20 15:49:49 PDT 2004,0.00,242.00
AP912,WB2JSH Eaton                      CO US,Tue Jul 20 15:45:10 PDT 2004,5.81,0.00
AP913,WB5SLA Ball Ground                GA US,Tue Jul 20 15:47:00 PDT 2004,0.00,235.00
AP917,W7NWS Billings                    MT US,Tue Jul 20 15:44:18 PDT 2004,0.00,0.00
AP919,LB9ME Trondheim                      NO,Tue Jul 20 15:48:58 PDT 2004,0.89,221.00
AP921,OZ6GX-5 Roervig                      DK,Tue Jul 20 15:49:07 PDT 2004,1.34,174.00
AP932,MB7UHR Luton                         UK,Tue Jul 20 15:44:51 PDT 2004,1.79,259.00
AP936,G3RJI Essex                          UK,Tue Jul 20 15:49:01 PDT 2004,2.68,203.00
AP938,G3OJZ-6 Kent                         UK,Tue Jul 20 15:42:15 PDT 2004,1.34,229.00
AP942,YV5KXE-2 Caracas                     VE,Tue Jul 20 15:43:25 PDT 2004,0.45,304.00
AP943,MTHEBO Mt. Hebo                   OR US,Tue Jul 20 15:48:23 PDT 2004,0.00,0.00
AP949,F4CEP-12 Rubelles                    FR,Tue Jul 20 15:45:02 PDT 2004,0.45,140.00
AP952,N1NSI Contoocook                  NH US,Tue Jul 20 15:45:35 PDT 2004,0.00,318.00
AP953,ZF1EJ Savannah                       KY,Tue Jul 20 15:50:14 PDT 2004,2.24,56.00
AP956,K4TEM Tallahassee                 FL US,Tue Jul 20 15:47:46 PDT 2004,0.45,298.00
AP957,KA4EOC Tallahassee                FL US,Tue Jul 20 15:46:08 PDT 2004,1.34,338.00
AP959,K7NPS Snowden                     WA US,Tue Jul 20 15:45:37 PDT 2004,3.13,135.00
AP960,HB9TJM-8 Vallorbe                    CH,Tue Jul 20 15:47:53 PDT 2004,0.00,270.00
AP962,EB2FGI-15 Irun                       ES,Tue Jul 20 15:38:07 PDT 2004,0.00,260.00
AP965,EB5ESX Sta Pola                      ES,Tue Jul 20 15:47:35 PDT 2004,0.89,168.00
AP968,EA3FAJ-1 Girona                      ES,Tue Jul 20 15:50:14 PDT 2004,1.34,12.00
AP971,EB3GGU Balaguer                      ES,Tue Jul 20 15:49:58 PDT 2004,2.24,28.00
AP973,PE1NAT-1 Heerhugowaard               NL,Tue Jul 20 15:50:01 PDT 2004,1.79,248.00
AP974,DO6PA-5 Ahrweiler                    DE,Tue Jul 20 15:50:12 PDT 2004,0.89,75.00
AP976,DO7VLR-5 Zweibruecken                DE,Tue Jul 20 15:49:19 PDT 2004,0.00,24.00
AP979,KC9BWF-3 Sister Bay               MI US,Tue Jul 20 15:46:44 PDT 2004,4.02,31.00
AP981,KG4SEY Niceville                  FL US,Tue Jul 20 15:44:32 PDT 2004,1.34,210.00
AP984,N8QQ Cincinnati                   OH US,Tue Jul 20 15:50:06 PDT 2004,0.00,315.00
AP985,KB9QJM-11 Cloverdale              IN US,Tue Jul 20 15:46:11 PDT 2004,1.34,221.00
AP986,KB9QJM-12 Atlanta                 IN US,Tue Jul 20 15:47:02 PDT 2004,0.45,263.00
AP987,KC5CPO Keene                      TX US,Tue Jul 20 15:46:49 PDT 2004,1.79,124.00
AP989,KC9JWM Clam Lake                  WI US,Tue Jul 20 15:38:50 PDT 2004,0.45,172.00
AP990,KG6MOZ Sunnyvale                  CA US,Tue Jul 20 15:48:26 PDT 2004,0.89,285.00
AP991,W0BIS-3 Killdeer                  ND US,Tue Jul 20 15:48:46 PDT 2004,3.58,252.00
AP995,KI4BUM Burlington                 KY US,Tue Jul 20 15:50:01 PDT 2004,0.00,300.00
AP996,KC5YVU Lampasas                   TX US,Tue Jul 20 15:45:29 PDT 2004,2.68,121.00
AP998,DK1PR-6 Altenahr                     DE,Tue Jul 20 15:45:45 PDT 2004,0.00,312.00
AP999,DB5OY-15 Celle                       DE,Tue Jul 20 15:43:34 PDT 2004,0.00,360.00
AR003,DL9GJ-6 Burgrieden                   DE,Tue Jul 20 15:45:40 PDT 2004,0.00,113.00
AR004,DK1MAW Bad Reichenhall               DE,Tue Jul 20 15:50:06 PDT 2004,2.68,70.00
AR005,HB9BA-8 Solothurn                    CH,Tue Jul 20 15:44:36 PDT 2004,0.00,0.00
AR006,HB9MZI Giubiasco                     CH,Tue Jul 20 15:36:24 PDT 2004,2.24,222.00
AR009,SR3TK-1 Gontyniec                    PL,Tue Jul 20 15:47:55 PDT 2004,6.26,110.00
AR011,IK1ZQJ Torino                        IT,Tue Jul 20 15:44:05 PDT 2004,0.00,295.00
AR014,IK1RDC Scurzolengo                   IT,Tue Jul 20 15:44:47 PDT 2004,2.68,351.00
AR016,IW4APJ-3 Soliera                     IT,Tue Jul 20 15:41:07 PDT 2004,2.68,267.00
AR017,IK4UPW S.Giovanni                    IT,Tue Jul 20 15:46:59 PDT 2004,0.00,220.00
AR020,IK3SVW-3 Treviso                     IT,Tue Jul 20 15:48:09 PDT 2004,0.00,336.00
AR021,I3OVD Scaltenigo                     IT,Tue Jul 20 15:41:09 PDT 2004,0.00,196.00
AR022,IW5BFZ Lucca                         IT,Tue Jul 20 15:48:38 PDT 2004,0.00,250.00
AR023,I4GOS-3 Rimini                       IT,Tue Jul 20 15:49:06 PDT 2004,1.34,298.00
AR025,IT9IPQ-2 Messina                     IT,Tue Jul 20 15:38:24 PDT 2004,0.00,312.00
AR028,IW8PCP-2 Gambarie d'Aspromonte       IT,Tue Jul 20 15:47:16 PDT 2004,0.00,110.00
AR029,KG4QXL-2 Fort Valley              VA US,Tue Jul 20 15:45:17 PDT 2004,0.00,337.00
AR030,N4HHP-4 Pompano Beach             FL US,Tue Jul 20 15:38:06 PDT 2004,2.24,139.00
AR031,SV2BNL-2 Thessaloniki                GR,Tue Jul 20 15:47:43 PDT 2004,0.00,320.00
AR033,SV4BHA-2 Larisa                      GR,Tue Jul 20 15:45:40 PDT 2004,1.34,314.00
AR034,SV1CIF-2 Aitoloakarnania             GR,Tue Jul 20 15:48:36 PDT 2004,1.34,8.00
AR035,SV3AQN-2 Patra                       GR,Tue Jul 20 15:46:42 PDT 2004,1.34,5.00
AR038,VK4AGS-3 Calliope                    AU,Tue Jul 20 15:48:24 PDT 2004,1.79,154.00
AR039,VK4TMK Arana Hills                   AU,Tue Jul 20 15:41:01 PDT 2004,2.24,31.00
AR040,N3BSQ Bethel Park                 PA US,Tue Jul 20 15:46:17 PDT 2004,0.00,332.00
AR042,VK1AC Bywong                     NSW AU,Tue Jul 20 15:42:42 PDT 2004,0.00,258.00
AR043,K4ZZR Port St. Lucie              FL US,Tue Jul 20 15:47:59 PDT 2004,3.13,256.00
AR044,N0QXY Ft.Lupton                   CO US,Tue Jul 20 15:38:37 PDT 2004,2.24,292.00
AR045,IW9ETI-2 Taormina                    IT,Tue Jul 20 15:43:18 PDT 2004,1.79,17.00
AR051,KE7TR-8 Mesa                      AZ US,Tue Jul 20 15:50:19 PDT 2004,2.68,16.00
AR052,KG4QXL Fort Valley                VA US,Tue Jul 20 15:47:06 PDT 2004,0.00,157.00
AR057,VK3XJB Shepparton                    AU,Tue Jul 20 15:39:59 PDT 2004,0.00,165.00
AR060,VK3JTM-3 Ararat                      AU,Tue Jul 20 15:45:47 PDT 2004,0.00,351.00
AR062,VK5EX-1 Adelaide                     AU,Tue Jul 20 15:49:45 PDT 2004,0.00,351.00
AR066,KC0IVW Colorado Springs           CO US,Tue Jul 20 15:45:30 PDT 2004,0.00,0.00
AR069,KF7KN-7 Red Lodge                 MT US,Tue Jul 20 15:44:07 PDT 2004,0.00,60.00
AR070,KI0BJ-2 Fort Smith                MT US,Tue Jul 20 15:48:30 PDT 2004,0.89,204.00
AR072,KB2KMM N. Babylon                 NY US,Tue Jul 20 15:50:12 PDT 2004,0.45,244.00
AR079,WX4BUY Elon                       NC US,Tue Jul 20 15:48:54 PDT 2004,0.00,300.00
AR082,WA2EIU Marietta                   GA US,Tue Jul 20 15:46:54 PDT 2004,0.00,334.00
AR084,W4ERC-10 Avon Park                FL US,Tue Jul 20 15:46:23 PDT 2004,0.00,202.00
AR085,N4HHP-5 Deerfield Beach           FL US,Tue Jul 20 15:49:29 PDT 2004,2.68,269.00
AR087,F8KDX Melun                          FR,Tue Jul 20 15:38:03 PDT 2004,0.00,357.00
AR097,EA3AGQ Lleida                        ES,Tue Jul 20 15:40:57 PDT 2004,4.47,66.00
AR098,EA3AGQ-1 Montsec d'Ares              ES,Tue Jul 20 15:49:37 PDT 2004,4.47,149.00
AR100,N1FWV Peabody                     MA US,Tue Jul 20 15:45:25 PDT 2004,0.00,198.00
AR103,W4SBO-7 Section                   AL US,Tue Jul 20 15:49:07 PDT 2004,0.00,238.00
AR106,N6FKW Auberry                     CA US,Tue Jul 20 15:48:22 PDT 2004,0.00,55.00
AR107,EA3AKS-15 SantPere de Ribes          ES,Tue Jul 20 15:50:24 PDT 2004,1.79,351.00
AR108,EA3BB Santpedor                      ES,Tue Jul 20 15:43:28 PDT 2004,0.00,238.00
AR109,EA3BSJ-1 Pinos                       ES,Tue Jul 20 15:48:04 PDT 2004,2.24,106.00
AR110,EA3CNO-1 Barcelona                   ES,Tue Jul 20 15:43:56 PDT 2004,0.89,299.00
AR111,EA3URE Figueres                      ES,Tue Jul 20 15:49:02 PDT 2004,0.00,45.00
AR112,EB3DMC-1 Belvis                      ES,Tue Jul 20 15:50:08 PDT 2004,1.79,51.00
AR115,EUGENE Eugene                     OR US,Tue Jul 20 15:44:32 PDT 2004,0.00,8.00
AR122,N4HHP-6 Cooper City               FL US,Tue Jul 20 15:48:20 PDT 2004,0.00,248.00
AR126,KG4EUF Virginia Beach             VA US,Tue Jul 20 15:48:22 PDT 2004,0.89,63.00
AR127,ZL1RED Tauranga Bay                  NZ,Tue Jul 20 15:42:50 PDT 2004,2.24,199.00
AR130,IW4BMA Reggio Emilia                 IT,Tue Jul 20 15:47:42 PDT 2004,1.34,287.00
AR132,IZ1DBU-2 Favria                      IT,Tue Jul 20 15:46:26 PDT 2004,1.34,354.00
AR133,K0MXU-4 Hoxie                     KS US,Tue Jul 20 15:46:41 PDT 2004,3.58,158.00
AR134,K4JRG Miami                       FL US,Tue Jul 20 15:43:25 PDT 2004,1.34,215.00
AR137,K6NE Ventura                      CA US,Tue Jul 20 15:44:06 PDT 2004,1.34,288.00
AR138,K7LHC-1 Lake Havasu               AZ US,Tue Jul 20 15:50:24 PDT 2004,4.47,155.00
AR140,KB0VYO-12 Winona                  MN US,Tue Jul 20 15:45:42 PDT 2004,1.34,0.00
AR141,KB5NMB-5 Fulton                   MS US,Tue Jul 20 15:43:09 PDT 2004,1.79,168.00
AR147,W0NWS-4 Colon                     NE US,Tue Jul 20 15:47:52 PDT 2004,4.02,221.00
AR148,K6DYC Meeker                      CO US,Tue Jul 20 15:50:09 PDT 2004,1.34,179.00
AR150,KC4WPS Hendersonville             TN US,Tue Jul 20 15:46:26 PDT 2004,0.00,198.00
AR157,KD4WLI Orlando                    FL US,Tue Jul 20 15:38:27 PDT 2004,0.00,238.00
AR159,KD6VLN-14 Tucson                  AZ US,Tue Jul 20 15:43:10 PDT 2004,2.24,282.00
AR160,NEWPRT Cape Foulweather           OR US,Tue Jul 20 15:44:14 PDT 2004,4.02,309.00
AR162,KF4VTT Mebane                     NC US,Tue Jul 20 15:50:24 PDT 2004,0.00,1.00
AR164,KF6NY Mt. Ranch                   CA US,Tue Jul 20 15:49:07 PDT 2004,1.79,279.00
AR167,KI0IO-2 Berthoud                  CO US,Tue Jul 20 15:45:50 PDT 2004,1.34,263.00
AR169,KK6RW Gig Harbor                  WA US,Tue Jul 20 15:47:11 PDT 2004,0.45,6.00
AR170,KO5Z Denton                       TX US,Tue Jul 20 15:40:42 PDT 2004,1.34,180.00
AR173,LA2YEA Hauglandshella                NO,Tue Jul 20 15:48:22 PDT 2004,0.00,90.00
AR177,K7UGT Cary                        NC US,Tue Jul 20 15:48:43 PDT 2004,0.00,60.00
AR178,KJ3L Erie                         PA US,Tue Jul 20 15:45:11 PDT 2004,0.45,246.00
AR179,KC9AAG Fond Du Lac                WI US,Tue Jul 20 15:50:23 PDT 2004,1.34,81.00
AR180,WB6YPF Altadena                   CA US,Tue Jul 20 15:43:25 PDT 2004,1.79,183.00
AR181,KE6ONT Duarte                     CA US,Tue Jul 20 15:49:04 PDT 2004,3.13,240.00
AR182,GW4TJC Caerphilly                    UK,Tue Jul 20 15:50:15 PDT 2004,0.45,231.00
AR183,N7LUF Hansville                   WA US,Tue Jul 20 15:48:21 PDT 2004,0.45,8.00
AR184,W7PG-10 Forsyth                   MT US,Tue Jul 20 15:46:28 PDT 2004,6.71,318.00
AR185,N1XH-15 Spencer                   MA US,Tue Jul 20 15:49:17 PDT 2004,0.00,13.00
AR186,N2LBT-7 Albany                    NY US,Tue Jul 20 15:44:35 PDT 2004,0.00,233.00
AR189,N5JEI-8 Spicewood                 TX US,Tue Jul 20 15:45:33 PDT 2004,2.24,351.00
AR190,N6GIW Joshua Tree                 CA US,Tue Jul 20 15:50:04 PDT 2004,4.92,240.00
AR191,WA4BPS Huntsville                 AL US,Tue Jul 20 15:48:39 PDT 2004,0.00,178.00
AR195,N7BIV Glendale                    AZ US,Tue Jul 20 15:46:49 PDT 2004,1.34,45.00
AR196,N7CK San Manuel                   AZ US,Tue Jul 20 15:44:09 PDT 2004,4.92,351.00
AR197,N7FZA-15 Boise                    ID US,Tue Jul 20 15:42:25 PDT 2004,2.24,343.00
AR200,N7TQZ Tacoma                      WA US,Tue Jul 20 15:47:31 PDT 2004,0.00,29.00
AR201,N8NQF-1 Middletown                OH US,Tue Jul 20 15:42:58 PDT 2004,1.79,248.00
AR202,N8VIM Pepperell                   MA US,Tue Jul 20 15:39:15 PDT 2004,0.00,0.00
AR203,N9UDO-2 Baraboo                   WI US,Tue Jul 20 15:48:09 PDT 2004,0.00,38.00
AR206,OK1MX-7 Praha                        CZ,Tue Jul 20 15:42:09 PDT 2004,0.00,17.00
AR208,KD7WIS Miles City                 MT US,Tue Jul 20 15:46:57 PDT 2004,2.68,310.00
AR209,K0OQ Northfield                   MN US,Tue Jul 20 15:50:11 PDT 2004,0.89,186.00
AR212,WX4MAP Phenix City                AL US,Tue Jul 20 15:49:58 PDT 2004,0.45,56.00
AR213,W4HSV Huntsville                  AL US,Tue Jul 20 15:48:20 PDT 2004,0.45,253.00
AR216,W7PG-12 Home Creek                MT US,Tue Jul 20 15:45:58 PDT 2004,1.79,292.00
AR218,KD7YTJ Brownstown                 WA US,Tue Jul 20 15:49:46 PDT 2004,2.68,168.00
AR220,KB6KJX Ellensburg                 WA US,Tue Jul 20 15:41:36 PDT 2004,3.13,315.00
AR221,K6TVI-1 Onyx Peak                 CA US,Tue Jul 20 15:43:55 PDT 2004,1.79,169.00
AR222,W7IUC-2 Big Coppitt Key           FL US,Tue Jul 20 15:43:56 PDT 2004,1.34,330.00
AR223,W7IUC-5 Grassy Key                FL US,Tue Jul 20 15:46:41 PDT 2004,0.00,177.00
AR225,KG6QHS Shingletown                CA US,Tue Jul 20 15:45:43 PDT 2004,0.00,126.00
AR228,N0ERG Littleton                   CO US,Tue Jul 20 15:45:09 PDT 2004,1.34,255.00
AR229,N9RLR Tampa                       FL US,Tue Jul 20 15:43:23 PDT 2004,0.00,212.00
AR230,K4DIG-7 Sardis Springs            AL US,Tue Jul 20 15:50:14 PDT 2004,0.00,246.00
AR232,KC7RJK Eugene                     OR US,Tue Jul 20 15:47:35 PDT 2004,1.79,287.00
AR233,N4BK-5 Hartselle                  AL US,Tue Jul 20 15:37:12 PDT 2004,0.00,292.00
AR234,NK7W Reno                         NV US,Tue Jul 20 15:49:51 PDT 2004,1.34,198.00
AR235,K6SUD Hesperia                    CA US,Tue Jul 20 15:47:33 PDT 2004,2.68,253.00
AR238,N5YXO Granbury                    TX US,Tue Jul 20 15:46:44 PDT 2004,0.00,175.00
AR241,K2LCA-1 Chappaqua                 NY US,Tue Jul 20 15:49:38 PDT 2004,0.00,130.00
AR243,K4TPD-5 Tallahassee               FL US,Tue Jul 20 15:48:30 PDT 2004,1.34,359.00
AR245,K7HRT Greenacres                  WA US,Tue Jul 20 15:49:29 PDT 2004,0.00,0.00
AR248,K7VIP Tucson                      AZ US,Tue Jul 20 15:48:47 PDT 2004,0.45,292.00
AR249,KA5WRG Oklahoma City              OK US,Tue Jul 20 15:49:51 PDT 2004,2.68,180.00
AR250,KA8SCP Westford                   MA US,Tue Jul 20 15:48:47 PDT 2004,0.00,299.00
AR252,KB7IPU-2 Payson                   AZ US,Tue Jul 20 15:47:33 PDT 2004,0.89,185.00
AR253,KB8WFH Springfield                OH US,Tue Jul 20 15:48:10 PDT 2004,0.00,179.00
AR254,KB9TPG Viroqua                    WI US,Tue Jul 20 15:45:14 PDT 2004,0.00,147.00
AR255,KC4YLE Efland                     NC US,Tue Jul 20 15:41:23 PDT 2004,0.00,0.00
AR256,W5HKR Schertz                     TX US,Tue Jul 20 15:48:09 PDT 2004,0.89,99.00
AR258,KC8HJN Ludington                  MI US,Tue Jul 20 15:46:42 PDT 2004,0.00,268.00
AR259,KD5CUW-1 Copperas Cove            TX US,Tue Jul 20 15:46:23 PDT 2004,0.00,169.00
AR260,KD5FDE Runaway Bay                TX US,Tue Jul 20 15:48:56 PDT 2004,2.24,103.00
AR261,KD6RXY Calimesa                   CA US,Tue Jul 20 15:39:53 PDT 2004,1.79,303.00
AR262,KD7GXO-7 Seattle                  WA US,Tue Jul 20 15:50:25 PDT 2004,0.45,94.00
AR264,K0JDN Phoenix                     AZ US,Tue Jul 20 15:45:57 PDT 2004,1.79,215.00
AR266,KJ7XE Port Angeles                WA US,Tue Jul 20 15:49:53 PDT 2004,0.89,248.00
AR267,N3WNZ Brandon                        UK,Tue Jul 20 15:46:25 PDT 2004,0.00,140.00
AR269,KC7PHC Orofino                    ID US,Tue Jul 20 15:45:11 PDT 2004,0.45,270.00
AR270,KF4UXI Southern Shores            NC US,Tue Jul 20 15:45:17 PDT 2004,0.00,121.00
AR271,AA0MM-2 Holton                    KS US,Tue Jul 20 15:49:40 PDT 2004,2.24,205.00
AR272,KG4JPL Hudson                     FL US,Tue Jul 20 15:46:38 PDT 2004,0.00,191.00
AR273,N1JJX Southington                 CT US,Tue Jul 20 15:49:15 PDT 2004,0.00,311.00
AR274,W4RP Palm Bay                     FL US,Tue Jul 20 15:46:50 PDT 2004,0.45,264.00
AR277,VE2GAT-2 St.Hyacinthe             QB CA,Tue Jul 20 15:44:30 PDT 2004,2.24,210.00
AR280,VE3JON Kincardine                ONT CA,Tue Jul 20 15:38:08 PDT 2004,1.34,265.00
AR282,VE7IMD-2 Delta                    BC CA,Tue Jul 20 15:49:06 PDT 2004,0.00,145.00
AR284,VE7MMG-1 Crystal Mt.              BC CA,Tue Jul 20 15:40:59 PDT 2004,1.79,128.00
AR286,K0NSA Omaha                       NE US,Tue Jul 20 15:39:37 PDT 2004,2.68,204.00
AR290,AB4KN Peachtree City              GA US,Tue Jul 20 15:47:01 PDT 2004,0.00,352.00
AR299,KB5NMB-15 Belmont                 MS US,Tue Jul 20 15:44:22 PDT 2004,0.00,206.00
AR300,KB8GQ Galloway                    OH US,Tue Jul 20 15:45:41 PDT 2004,0.45,180.00
AR301,N5KUK Norman                      OK US,Tue Jul 20 15:41:01 PDT 2004,2.24,155.00
AR302,N4NW Stafford                     VA US,Tue Jul 20 15:46:06 PDT 2004,0.00,239.00
AR304,AA6HF-5 Cathedral City            CA US,Tue Jul 20 15:47:07 PDT 2004,0.00,0.00
AR305,KF6ZGH Fremont                    CA US,Tue Jul 20 15:50:09 PDT 2004,4.47,270.00
AR306,KQ6DI-15 Livermore                CA US,Tue Jul 20 15:44:29 PDT 2004,4.02,262.00
AR307,W6KL Burbank                      CA US,Tue Jul 20 15:49:53 PDT 2004,2.68,215.00
AR308,W8EHH Winter Garden               FL US,Tue Jul 20 15:46:49 PDT 2004,1.34,215.00
AR309,WB6ABE-4 Benicia                  CA US,Tue Jul 20 15:47:54 PDT 2004,6.26,287.00
AR310,K4ROK-10 Fountain                 NC US,Tue Jul 20 15:46:32 PDT 2004,0.00,49.00
AR311,KD4DLT-3 Lithonia                 GA US,Tue Jul 20 15:49:23 PDT 2004,0.00,233.00
AR312,WA6BAY-1 Soquel                   CA US,Tue Jul 20 15:48:46 PDT 2004,3.13,173.00
AR313,WB6AHC-1 San Jose                 CA US,Tue Jul 20 15:47:46 PDT 2004,4.02,309.00
AR314,N7NAT Yakima                      WA US,Tue Jul 20 15:47:03 PDT 2004,0.00,130.00
AR315,OH6GPB Pietarsaari                   FI,Tue Jul 20 15:40:59 PDT 2004,0.00,349.00
AR317,KV4EE New Prospect                SC US,Tue Jul 20 15:45:54 PDT 2004,0.00,322.00
AR320,K6TZ Diablo Peak                  CA US,Tue Jul 20 15:47:27 PDT 2004,4.47,354.00
AR323,KF6YUA Sebastopol                 CA US,Tue Jul 20 15:49:09 PDT 2004,0.89,255.00
AR326,N2KTO Sparta                      NJ US,Tue Jul 20 15:45:47 PDT 2004,0.00,33.00
AR327,WB1FYE Weirs Beach                NH US,Tue Jul 20 15:45:27 PDT 2004,0.00,68.00
AR329,KA1RVR Epping                     NH US,Tue Jul 20 15:50:18 PDT 2004,0.00,273.00
AR333,WO4U-10 Crossville                TN US,Tue Jul 20 15:48:25 PDT 2004,0.00,237.00
AR335,KB0RF San Jose                    CA US,Tue Jul 20 15:48:22 PDT 2004,3.13,343.00
AR338,N3WKE Baltimore                   MD US,Tue Jul 20 15:48:22 PDT 2004,0.45,157.00
AR339,AB0YW Blair                       NE US,Tue Jul 20 15:46:41 PDT 2004,1.79,185.00
AR342,N2NZD Copake                      NY US,Tue Jul 20 15:46:56 PDT 2004,0.00,182.00
AR343,WA1OUI West Simsbury              CT US,Tue Jul 20 15:48:45 PDT 2004,0.00,4.00
AR345,KD5ZLP Rowlett                    TX US,Tue Jul 20 15:50:11 PDT 2004,2.24,178.00
AR346,TG9RB Guatemala City                 GT,Tue Jul 20 15:49:01 PDT 2004,0.00,112.00
AR347,KC5ZJO-1 Madison                  AL US,Tue Jul 20 15:49:03 PDT 2004,0.00,208.00
AR348,KG4VVU Helena                     AL US,Tue Jul 20 15:40:51 PDT 2004,0.00,243.00
AR351,ON7EQ-1 Brugge                       BE,Tue Jul 20 15:47:24 PDT 2004,0.00,105.00
AR354,W7PAQ Missoula                    MT US,Tue Jul 20 15:50:23 PDT 2004,0.00,279.00
AR356,AG1C Westborough                  MA US,Tue Jul 20 15:46:24 PDT 2004,0.00,331.00
AR357,WB1ETW Plainville                 MA US,Tue Jul 20 15:47:39 PDT 2004,0.00,1.00
AR358,N1MZX Peterborough                NH US,Tue Jul 20 15:46:32 PDT 2004,2.68,277.00
AR363,KC0MKS-10 Knife River             MN US,Tue Jul 20 15:41:48 PDT 2004,2.24,80.00
AR365,KM6GE Allenspark                  CO US,Tue Jul 20 15:48:49 PDT 2004,0.89,208.00
AR366,KB9VSQ Reedsburg                  WI US,Tue Jul 20 15:48:50 PDT 2004,0.00,227.00
AR367,KB0KQA Duluth                     MN US,Tue Jul 20 15:50:06 PDT 2004,0.00,358.00
AR368,WA0VSL Monument                   CO US,Tue Jul 20 15:45:11 PDT 2004,0.00,279.00
AR369,VA4GD Pinawa                     MAN CA,Tue Jul 20 15:50:27 PDT 2004,0.00,344.00
