AP570,KF3BH Catawissa                   PA US,Tue Jul 20 15:33:42 PDT 2004,0.00,154.00
AP574,K0JJV Hays                        KS US,Tue Jul 20 15:28:10 PDT 2004,1.34,167.00
AP575,KB5WIO Amarillo                   TX US,Tue Jul 20 15:33:28 PDT 2004,0.00,350.00
AP577,K4MG Ocala                        FL US,Tue Jul 20 15:33:44 PDT 2004,0.00,240.00
AP583,W9HOI Kickapoo                    IL US,Tue Jul 20 15:30:42 PDT 2004,0.00,352.00
AP584,KC9BWF-1 Green Bay                WI US,Tue Jul 20 15:34:13 PDT 2004,7.15,98.00
AP585,KC9BWF-3 Green Bay                WI US,Tue Jul 20 15:31:45 PDT 2004,4.02,80.00
AP586,N1EPX Jamaica Plain               MA US,Tue Jul 20 15:35:03 PDT 2004,0.00,200.00
AP588,WD4CD Pickens                     SC US,Tue Jul 20 15:28:50 PDT 2004,0.00,285.00
AP590,KD5RXP Ft.Worth                   TX US,Tue Jul 20 15:32:41 PDT 2004,0.00,0.00
AP593,KC5JIF Amarillo                   TX US,Tue Jul 20 15:25:42 PDT 2004,0.00,18.00
AP594,KC5JZG-2 Bryan                    TX US,Tue Jul 20 15:34:23 PDT 2004,0.45,107.00
AP602,KG5RG Dickinson                   TX US,Tue Jul 20 15:33:48 PDT 2004,1.79,136.00
AP606,VE2SIL-2 Pierrefonds             QUE CA,Tue Jul 20 15:27:22 PDT 2004,0.00,0.00
AP610,WB9HLA-2 Hartford City            IN US,Tue Jul 20 15:34:36 PDT 2004,2.68,252.00
AP613,PA0OKE Neptunuslaan                  NL,Tue Jul 20 15:34:53 PDT 2004,1.34,159.00
AP614,ON4BDW Vaartdijk                     BE,Tue Jul 20 15:24:09 PDT 2004,1.79,118.00
AP624,M0ADS Sheffield                      UK,Tue Jul 20 15:20:58 PDT 2004,0.00,0.00
AP627,VE4UB Selkirk                     MB CA,Tue Jul 20 15:32:56 PDT 2004,0.00,174.00
AP628,VK3BUS Maldon                        AU,Tue Jul 20 15:34:05 PDT 2004,0.45,172.00
AP630,VK3MY Knox City                      AU,Tue Jul 20 15:28:39 PDT 2004,0.45,199.00
AP632,VK3ZV Moondarra                      AU,Tue Jul 20 15:32:11 PDT 2004,2.68,256.00
AP640,KC7MRW Lincoln                    ND US,Tue Jul 20 15:20:43 PDT 2004,7.15,309.00
AP641,KB0WBM-2 Arnold                   ND US,Tue Jul 20 15:34:32 PDT 2004,7.15,316.00
AP642,W0NWS-2 Mead                      NE US,Tue Jul 20 15:32:53 PDT 2004,5.36,183.00
AP643,W0HII-3 Cedar Creek               NE US,Tue Jul 20 15:30:46 PDT 2004,2.24,239.00
AP647,K5ZZT-5 San Antonio               TX US,Tue Jul 20 15:27:05 PDT 2004,0.89,117.00
AP648,KS5V Bulverde                     TX US,Tue Jul 20 15:28:18 PDT 2004,2.24,149.00
AP650,N5CWM Montgomery                  TX US,Tue Jul 20 15:26:11 PDT 2004,0.00,101.00
AP651,WA5ZAI Valley Mills               TX US,Tue Jul 20 15:23:06 PDT 2004,0.00,81.00
AP654,N5YXO Granbury                    TX US,Tue Jul 20 15:31:44 PDT 2004,0.45,130.00
AP656,KC5TIL Rendon                     TX US,Tue Jul 20 15:29:48 PDT 2004,2.24,182.00
AP657,KC4WTI Carrolton                  TX US,Tue Jul 20 15:31:51 PDT 2004,2.24,116.00
AP661,WA5KXX Plano                      TX US,Tue Jul 20 15:22:32 PDT 2004,0.00,89.00
AP669,PA0OKE Amsterdam                     NL,Tue Jul 20 15:34:53 PDT 2004,1.34,159.00
AP671,KD5FGW NW Oranjestad                 AW,Tue Jul 20 15:26:40 PDT 2004,4.02,341.00
AP677,NR0A-4 Norfolk                    NE US,Tue Jul 20 15:32:50 PDT 2004,0.45,156.00
AP679,ON5CT St-Niklaas                     BE,Tue Jul 20 15:30:11 PDT 2004,2.24,145.00
AP680,KA1GOZ Nashua                     NH US,Tue Jul 20 15:30:50 PDT 2004,0.00,37.00
AP682,W7KKE-3 Road's End                OR US,Tue Jul 20 15:33:11 PDT 2004,5.36,322.00
AP685,KD7CTY Vancouver                  WA US,Tue Jul 20 15:31:26 PDT 2004,1.34,253.00
AP689,KF4TTB-2 Huntsville               AL US,Tue Jul 20 15:32:59 PDT 2004,1.34,153.00
AP690,KF4TTB-1 Huntsville               AL US,Tue Jul 20 15:25:27 PDT 2004,0.00,202.00
AP691,KE4ROC-9 Flemington Hts.          AL US,Tue Jul 20 15:24:16 PDT 2004,0.00,211.00
AP692,ZL1WPK Hamilton                      NZ,Tue Jul 20 15:33:50 PDT 2004,2.24,183.00
AP693,ZL1RED Tauranga                      NZ,Tue Jul 20 15:32:46 PDT 2004,2.24,195.00
AP696,N4ARI Williamsburg                VA US,Tue Jul 20 15:31:41 PDT 2004,3.13,42.00
AP697,N1NLX Madison                     NH US,Tue Jul 20 15:27:29 PDT 2004,0.00,33.00
AP698,K3BAY Pasadena                    MD US,Tue Jul 20 15:26:07 PDT 2004,0.00,223.00
AP701,EA3ABN Barcelona                     ES,Tue Jul 20 15:32:36 PDT 2004,1.79,326.00
AP704,KA1UDX Collegeville               PA US,Tue Jul 20 15:29:11 PDT 2004,1.34,302.00
AP705,K4VVN Kingsport                   TN US,Tue Jul 20 15:32:13 PDT 2004,0.00,113.00
AP706,N0PJH Grand Island                NE US,Tue Jul 20 15:35:23 PDT 2004,2.24,169.00
AP710,N7XRD Renton                      WA US,Tue Jul 20 15:31:11 PDT 2004,0.00,288.00
AP712,KA1HEU Hudson                     NH US,Tue Jul 20 15:35:23 PDT 2004,0.00,67.00
AP715,K4DNM Clayton                     NC US,Tue Jul 20 15:29:16 PDT 2004,0.00,24.00
AP718,K4YK Greensboro                   GA US,Tue Jul 20 15:35:09 PDT 2004,0.00,229.00
AP720,KD4DLT-3 Lithonia                 GA US,Tue Jul 20 15:29:27 PDT 2004,0.00,233.00
AP722,KF4ORW Dade City                  FL US,Tue Jul 20 15:31:09 PDT 2004,0.00,75.00
AP725,KD4BNP Palm Bay                   FL US,Tue Jul 20 15:35:10 PDT 2004,1.34,191.00
AP736,VK5RR Adelaide                       AU,Tue Jul 20 15:30:12 PDT 2004,1.34,87.00
AP738,KB0VBZ Aurora                     CO US,Tue Jul 20 15:23:10 PDT 2004,0.45,127.00
AP739,WB0TWE Encinitas                  CA US,Tue Jul 20 15:33:37 PDT 2004,1.34,313.00
AP742,KC4ELV Honey Creek                GA US,Tue Jul 20 15:35:05 PDT 2004,0.00,282.00
AP745,K4GPS-1 Jupiter Farms             FL US,Tue Jul 20 15:33:57 PDT 2004,0.00,260.00
AP747,KC4ANB Trussville                 AL US,Tue Jul 20 15:33:27 PDT 2004,1.79,342.00
AP749,N3FJA Mountain Top                PA US,Tue Jul 20 15:26:21 PDT 2004,0.00,168.00
AP750,W1OEM Flanders                    CT US,Tue Jul 20 15:33:53 PDT 2004,0.00,180.00
AP751,KC2KY Centereach                  NY US,Tue Jul 20 15:33:50 PDT 2004,0.00,175.00
AP752,WB2FTX Butler                     NJ US,Tue Jul 20 15:34:42 PDT 2004,0.00,338.00
AP758,KC7BWK Florence                   OR US,Tue Jul 20 15:35:17 PDT 2004,4.02,208.00
AP760,WB0BLV Security/Widefield         CO US,Tue Jul 20 15:35:13 PDT 2004,2.24,325.00
AP763,OX3HI Kangerlussuaq                  GL,Tue Jul 20 15:30:12 PDT 2004,1.34,81.00
AP765,N3EYQ Kingston                    NY US,Tue Jul 20 15:24:07 PDT 2004,0.00,285.00
AP767,N2XP Flanders                     NJ US,Tue Jul 20 15:34:07 PDT 2004,0.00,248.00
AP769,WC4PEM-10 Bartow                  FL US,Tue Jul 20 15:32:00 PDT 2004,0.00,180.00
AP771,WD9HDQ-2 Northfield               MN US,Tue Jul 20 15:32:25 PDT 2004,4.47,154.00
AP773,KB4TOH-11 Columbia                NC US,Tue Jul 20 15:33:11 PDT 2004,3.13,66.00
AP774,N8OVD Wendell                     NC US,Tue Jul 20 15:30:32 PDT 2004,0.00,180.00
AP779,K4CCC-9 Cheraw                    SC US,Tue Jul 20 15:31:11 PDT 2004,1.34,49.00
AP780,W5VBQ Santa Fe                    NM US,Tue Jul 20 15:33:30 PDT 2004,0.89,312.00
AP782,WB5NZV-8 N.Denton                 TX US,Tue Jul 20 15:23:06 PDT 2004,0.00,127.00
AP783,KC5DPC-3 Slidell                  TX US,Tue Jul 20 15:32:49 PDT 2004,4.92,257.00
AP786,K5EBQ Houston                     TX US,Tue Jul 20 15:33:25 PDT 2004,0.00,40.00
AP787,KC5LPN Houston                    TX US,Tue Jul 20 15:28:47 PDT 2004,0.00,106.00
AP792,KB0TVJ-4 MeadowLake Airport       CO US,Tue Jul 20 15:34:32 PDT 2004,4.02,231.00
AP795,KD7TTL Greenbank                  WA US,Tue Jul 20 15:33:14 PDT 2004,0.45,329.00
AP802,W4OZK-7 Mentone                   AL US,Tue Jul 20 15:35:30 PDT 2004,0.00,349.00
AP803,KE6AFE Santa Cruz                 CA US,Tue Jul 20 15:35:34 PDT 2004,3.13,111.00
AP806,N3EG Longview                     WA US,Tue Jul 20 15:31:00 PDT 2004,1.79,320.00
AP808,KG4YZY New Port Richey            FL US,Tue Jul 20 15:34:13 PDT 2004,1.34,237.00
AP809,K4NUT Port Richey                 FL US,Tue Jul 20 15:33:43 PDT 2004,1.34,274.00
AP811,KC2IXE Bayside Hills              NY US,Tue Jul 20 15:32:08 PDT 2004,0.89,220.00
AP812,VE3XF Stayner                    ONT CA,Tue Jul 20 15:34:46 PDT 2004,2.68,168.00
AP813,VE3PWZ Dundalk                   ONT CA,Tue Jul 20 15:33:15 PDT 2004,0.00,132.00
AP814,VA3GY Erin                       ONT CA,Tue Jul 20 15:22:56 PDT 2004,0.00,97.00
AP815,VA3HST Guelph                    ONT CA,Tue Jul 20 15:34:01 PDT 2004,2.68,273.00
AP817,VA3AT Renfrew                    ONT CA,Tue Jul 20 15:34:54 PDT 2004,0.00,286.00
AP818,VA3MWK Ashton                    ONT CA,Tue Jul 20 15:33:15 PDT 2004,3.58,210.00
AP819,VE3TEN Ottawa                    ONT CA,Tue Jul 20 15:31:06 PDT 2004,2.24,266.00
AP820,VE6BMR Sherwood Park             ALT CA,Tue Jul 20 15:35:11 PDT 2004,3.13,292.00
AP823,AD4BL Fairbanks                   AK US,Tue Jul 20 15:28:09 PDT 2004,0.00,200.00
AP824,K5WPN-10 Duncan                   OK US,Tue Jul 20 15:34:46 PDT 2004,4.92,118.00
AP830,KA2FNK Merriam                    KS US,Tue Jul 20 15:33:04 PDT 2004,1.34,243.00
AP831,N9NJK Warsaw                      IN US,Tue Jul 20 15:33:45 PDT 2004,1.34,178.00
AP832,WB9TLH-11 Bloomington             IN US,Tue Jul 20 15:33:09 PDT 2004,0.00,0.00
AP833,KE4CON-3 Woodstock                IL US,Tue Jul 20 15:34:36 PDT 2004,3.13,227.00
AP835,KB0HNR-3 California               MO US,Tue Jul 20 15:31:02 PDT 2004,3.13,289.00
AP838,W5MAI San Antonio                 TX US,Tue Jul 20 15:33:28 PDT 2004,0.00,99.00
AP845,K2TCO Binghamton                  NY US,Tue Jul 20 15:34:13 PDT 2004,0.00,175.00
AP846,WN5PFI N.Dallas                   TX US,Tue Jul 20 15:32:35 PDT 2004,2.68,181.00
AP852,WG4R Meadows of Dan               VA US,Tue Jul 20 15:35:21 PDT 2004,1.34,268.00
AP854,N4HHP-1 Plantation                FL US,Tue Jul 20 15:34:16 PDT 2004,3.13,266.00
AP855,N4HHP-2 Ft. Lauderdale            FL US,Tue Jul 20 15:31:54 PDT 2004,0.00,183.00
AP856,N4HHP-3 Hallandale Beach          FL US,Tue Jul 20 15:33:02 PDT 2004,0.00,291.00
AP858,KD5WEB Port Allen                 LA US,Tue Jul 20 15:32:22 PDT 2004,1.34,208.00
AP860,AA5ED-10 Brandon                  MS US,Tue Jul 20 15:24:18 PDT 2004,0.00,152.00
AP864,AB0XM-1 Great Bend                KS US,Tue Jul 20 15:34:39 PDT 2004,6.71,184.00
AP866,KA0HJZ Van Meter                  IA US,Tue Jul 20 15:33:04 PDT 2004,0.45,213.00
AP867,N0VPR Johnston                    IA US,Tue Jul 20 15:32:57 PDT 2004,1.79,103.00
AP870,KC0LBV Farmington                 MN US,Tue Jul 20 15:31:20 PDT 2004,3.58,178.00
AP871,N0PFY Northfield                  MN US,Tue Jul 20 15:33:25 PDT 2004,2.24,230.00
AP872,N0EST Rochester                   MN US,Tue Jul 20 15:34:41 PDT 2004,0.00,71.00
AP874,VK2AAK Forster                       AU,Tue Jul 20 15:31:19 PDT 2004,0.00,218.00
AP877,KA8OAD-1 Fairlawn                 OH US,Tue Jul 20 15:29:12 PDT 2004,0.00,303.00
AP878,AB9FX Chicago                     IL US,Tue Jul 20 15:32:29 PDT 2004,0.00,58.00
AP879,N9VPV Galesburg                   IL US,Tue Jul 20 15:34:55 PDT 2004,0.45,134.00
AP888,N7QXO-2 Vancouver                 WA US,Tue Jul 20 15:23:00 PDT 2004,0.00,21.00
AP889,K7EWG Lincoln City                OR US,Tue Jul 20 15:34:29 PDT 2004,3.58,295.00
AP890,KB7DZR Tigard                     OR US,Tue Jul 20 15:31:21 PDT 2004,2.24,280.00
AP892,KG6QHD Prineville                 OR US,Tue Jul 20 15:31:40 PDT 2004,0.00,238.00
AP893,KE6KYI Groveland                  CA US,Tue Jul 20 15:26:49 PDT 2004,0.00,248.00
AP895,KF6JJP Richmond                   CA US,Tue Jul 20 15:33:37 PDT 2004,3.13,296.00
AP896,WA6YLB Exeter                     CA US,Tue Jul 20 15:33:08 PDT 2004,1.34,184.00
AP897,WA6YLB-4 Govt.Peak                CA US,Tue Jul 20 15:34:57 PDT 2004,12.07,298.00
AP898,WA6YLB-6 Visalia                  CA US,Tue Jul 20 15:32:07 PDT 2004,0.00,0.00
AP899,KF6IHL-3 Moody Canyon             CA US,Tue Jul 20 15:32:01 PDT 2004,2.24,313.00
AP900,KE6ZPS-1 Miranda Canyon           CA US,Tue Jul 20 15:24:18 PDT 2004,6.71,238.00
AP901,KB6OQJ Santa Ynez                 CA US,Tue Jul 20 15:33:35 PDT 2004,3.13,259.00
AP902,N6HGA-1 Palmdale                  CA US,Tue Jul 20 15:29:03 PDT 2004,6.26,242.00
AP904,W6MAF Hesperia                    CA US,Tue Jul 20 15:33:57 PDT 2004,6.26,179.00
AP907,W9IF-4 Torry Pines                CA US,Tue Jul 20 15:29:42 PDT 2004,2.68,257.00
AP911,K4GIG-7 Brindley Mtn.             AL US,Tue Jul 20 15:34:46 PDT 2004,0.00,242.00
AP912,WB2JSH Eaton                      CO US,Tue Jul 20 15:35:20 PDT 2004,7.15,344.00
AP913,WB5SLA Ball Ground                GA US,Tue Jul 20 15:32:00 PDT 2004,0.00,235.00
AP917,W7NWS Billings                    MT US,Tue Jul 20 15:24:34 PDT 2004,0.00,0.00
AP919,LB9ME Trondheim                      NO,Tue Jul 20 15:29:01 PDT 2004,0.89,222.00
AP921,OZ6GX-5 Roervig                      DK,Tue Jul 20 15:29:07 PDT 2004,0.89,96.00
AP922,OZ1IEP-5 Jaegerspris                 DK,Tue Jul 20 15:33:52 PDT 2004,4.02,101.00
AP924,OH6GGL-3 Lppalahti                   FI,Tue Jul 20 15:22:35 PDT 2004,0.00,0.00
AP932,MB7UHR Luton                         UK,Tue Jul 20 15:34:51 PDT 2004,1.79,261.00
AP938,G3OJZ-6 Kent                         UK,Tue Jul 20 15:28:11 PDT 2004,0.89,214.00
AP943,MTHEBO Mt. Hebo                   OR US,Tue Jul 20 15:28:26 PDT 2004,0.00,0.00
AP949,F4CEP-12 Rubelles                    FR,Tue Jul 20 15:35:02 PDT 2004,0.45,30.00
AP952,N1NSI Contoocook                  NH US,Tue Jul 20 15:30:33 PDT 2004,0.00,318.00
AP953,ZF1EJ Savannah                       KY,Tue Jul 20 15:35:12 PDT 2004,2.68,89.00
AP956,K4TEM Tallahassee                 FL US,Tue Jul 20 15:32:46 PDT 2004,0.00,301.00
AP957,KA4EOC Tallahassee                FL US,Tue Jul 20 15:26:08 PDT 2004,0.00,1.00
AP960,HB9TJM-8 Vallorbe                    CH,Tue Jul 20 15:32:54 PDT 2004,0.00,270.00
AP962,EB2FGI-15 Irun                       ES,Tue Jul 20 15:23:06 PDT 2004,0.00,323.00
AP965,EB5ESX Sta Pola                      ES,Tue Jul 20 15:32:32 PDT 2004,0.89,162.00
AP967,EA3AYP-1 Girona                      ES,Tue Jul 20 15:26:38 PDT 2004,1.34,26.00
AP968,EA3FAJ-1 Girona                      ES,Tue Jul 20 15:34:42 PDT 2004,0.00,7.00
AP971,EB3GGU Balaguer                      ES,Tue Jul 20 15:35:01 PDT 2004,0.45,18.00
AP973,PE1NAT-1 Heerhugowaard               NL,Tue Jul 20 15:30:03 PDT 2004,1.79,248.00
AP974,DO6PA-5 Ahrweiler                    DE,Tue Jul 20 15:30:15 PDT 2004,0.00,330.00
AP976,DO7VLR-5 Zweibruecken                DE,Tue Jul 20 15:29:25 PDT 2004,0.00,31.00
AP979,KC9BWF-3 Sister Bay               MI US,Tue Jul 20 15:31:45 PDT 2004,4.02,80.00
AP981,KG4SEY Niceville                  FL US,Tue Jul 20 15:29:32 PDT 2004,0.45,158.00
AP984,N8QQ Cincinnati                   OH US,Tue Jul 20 15:35:07 PDT 2004,0.89,283.00
AP985,KB9QJM-11 Cloverdale              IN US,Tue Jul 20 15:31:12 PDT 2004,1.34,182.00
AP986,KB9QJM-12 Atlanta                 IN US,Tue Jul 20 15:27:02 PDT 2004,0.45,170.00
AP987,KC5CPO Keene                      TX US,Tue Jul 20 15:31:55 PDT 2004,1.34,113.00
AP989,KC9JWM Clam Lake                  WI US,Tue Jul 20 15:26:50 PDT 2004,1.34,281.00
AP990,KG6MOZ Sunnyvale                  CA US,Tue Jul 20 15:33:15 PDT 2004,1.34,263.00
AP991,W0BIS-3 Killdeer                  ND US,Tue Jul 20 15:33:46 PDT 2004,2.68,208.00
AP995,KI4BUM Burlington                 KY US,Tue Jul 20 15:35:01 PDT 2004,0.00,284.00
AP996,KC5YVU Lampasas                   TX US,Tue Jul 20 15:35:17 PDT 2004,2.68,146.00
AP998,DK1PR-6 Altenahr                     DE,Tue Jul 20 15:33:47 PDT 2004,0.00,312.00
AP999,DB5OY-15 Celle                       DE,Tue Jul 20 15:28:35 PDT 2004,0.00,360.00
AR003,DL9GJ-6 Burgrieden                   DE,Tue Jul 20 15:29:34 PDT 2004,0.00,135.00
AR005,HB9BA-8 Solothurn                    CH,Tue Jul 20 15:34:15 PDT 2004,0.00,0.00
AR006,HB9MZI Giubiasco                     CH,Tue Jul 20 15:31:19 PDT 2004,0.89,246.00
AR009,SR3TK-1 Gontyniec                    PL,Tue Jul 20 15:32:57 PDT 2004,8.49,79.00
AR011,IK1ZQJ Torino                        IT,Tue Jul 20 15:33:59 PDT 2004,0.00,294.00
AR014,IK1RDC Scurzolengo                   IT,Tue Jul 20 15:28:50 PDT 2004,3.13,351.00
AR016,IW4APJ-3 Soliera                     IT,Tue Jul 20 15:31:05 PDT 2004,2.68,261.00
AR017,IK4UPW S.Giovanni                    IT,Tue Jul 20 15:32:01 PDT 2004,0.00,220.00
AR020,IK3SVW-3 Treviso                     IT,Tue Jul 20 15:26:08 PDT 2004,0.00,336.00
AR021,I3OVD Scaltenigo                     IT,Tue Jul 20 15:31:07 PDT 2004,0.00,196.00
AR022,IW5BFZ Lucca                         IT,Tue Jul 20 15:33:57 PDT 2004,0.45,286.00
AR023,I4GOS-3 Rimini                       IT,Tue Jul 20 15:34:07 PDT 2004,0.00,311.00
AR025,IT9IPQ-2 Messina                     IT,Tue Jul 20 15:28:26 PDT 2004,0.00,346.00
AR028,IW8PCP-2 Gambarie d'Aspromonte       IT,Tue Jul 20 15:32:08 PDT 2004,0.00,82.00
AR029,KG4QXL-2 Fort Valley              VA US,Tue Jul 20 15:33:15 PDT 2004,0.00,337.00
AR030,N4HHP-4 Pompano Beach             FL US,Tue Jul 20 15:23:06 PDT 2004,2.24,139.00
AR031,SV2BNL-2 Thessaloniki                GR,Tue Jul 20 15:32:29 PDT 2004,0.00,268.00
AR033,SV4BHA-2 Larisa                      GR,Tue Jul 20 15:34:09 PDT 2004,1.34,314.00
AR034,SV1CIF-2 Aitoloakarnania             GR,Tue Jul 20 15:29:40 PDT 2004,0.89,102.00
AR036,SV3BEF-2 Tripolis                    GR,Tue Jul 20 15:23:23 PDT 2004,3.58,139.00
AR039,VK4TMK Arana Hills                   AU,Tue Jul 20 15:30:57 PDT 2004,1.79,143.00
AR040,N3BSQ Bethel Park                 PA US,Tue Jul 20 15:35:35 PDT 2004,0.00,299.00
AR043,K4ZZR Port St. Lucie              FL US,Tue Jul 20 15:29:59 PDT 2004,2.68,213.00
AR044,N0QXY Ft.Lupton                   CO US,Tue Jul 20 15:33:37 PDT 2004,1.34,275.00
AR045,IW9ETI-2 Taormina                    IT,Tue Jul 20 15:28:14 PDT 2004,2.24,290.00
AR051,KE7TR-8 Mesa                      AZ US,Tue Jul 20 15:35:18 PDT 2004,1.79,283.00
AR052,KG4QXL Fort Valley                VA US,Tue Jul 20 15:35:23 PDT 2004,0.00,180.00
AR060,VK3JTM-3 Ararat                      AU,Tue Jul 20 15:30:48 PDT 2004,0.00,351.00
AR061,VK3YLV Horsham                       AU,Tue Jul 20 15:34:22 PDT 2004,0.00,237.00
AR062,VK5EX-1 Adelaide                     AU,Tue Jul 20 15:34:44 PDT 2004,0.00,351.00
AR066,KC0IVW Colorado Springs           CO US,Tue Jul 20 15:30:32 PDT 2004,0.00,0.00
AR069,KF7KN-7 Red Lodge                 MT US,Tue Jul 20 15:24:25 PDT 2004,0.00,179.00
AR071,KD4BJW Albertville                AL US,Tue Jul 20 15:27:00 PDT 2004,0.00,171.00
AR072,KB2KMM N. Babylon                 NY US,Tue Jul 20 15:35:08 PDT 2004,1.34,253.00
AR079,WX4BUY Elon                       NC US,Tue Jul 20 15:35:20 PDT 2004,2.68,293.00
AR084,W4ERC-10 Avon Park                FL US,Tue Jul 20 15:26:24 PDT 2004,0.00,255.00
AR085,N4HHP-5 Deerfield Beach           FL US,Tue Jul 20 15:34:32 PDT 2004,2.68,278.00
AR087,F8KDX Melun                          FR,Tue Jul 20 15:23:08 PDT 2004,0.00,357.00
AR097,EA3AGQ Lleida                        ES,Tue Jul 20 15:33:03 PDT 2004,4.47,66.00
AR100,N1FWV Peabody                     MA US,Tue Jul 20 15:33:26 PDT 2004,0.00,198.00
AR103,W4SBO-7 Section                   AL US,Tue Jul 20 15:34:07 PDT 2004,0.00,238.00
AR105,K5BV Aransas Pass                 TX US,Tue Jul 20 15:30:18 PDT 2004,4.47,105.00
AR106,N6FKW Auberry                     CA US,Tue Jul 20 15:33:22 PDT 2004,0.00,344.00
AR107,EA3AKS-15 SantPere de Ribes          ES,Tue Jul 20 15:35:24 PDT 2004,0.00,334.00
AR108,EA3BB Santpedor                      ES,Tue Jul 20 15:35:30 PDT 2004,0.00,0.00
AR109,EA3BSJ-1 Pinos                       ES,Tue Jul 20 15:21:28 PDT 2004,2.68,129.00
AR110,EA3CNO-1 Barcelona                   ES,Tue Jul 20 15:34:20 PDT 2004,0.45,309.00
AR112,EB3DMC-1 Belvis                      ES,Tue Jul 20 15:35:44 PDT 2004,1.79,55.00
AR115,EUGENE Eugene                     OR US,Tue Jul 20 15:34:36 PDT 2004,1.34,324.00
AR122,N4HHP-6 Cooper City               FL US,Tue Jul 20 15:28:21 PDT 2004,0.00,174.00
AR126,KG4EUF Virginia Beach             VA US,Tue Jul 20 15:28:25 PDT 2004,1.34,63.00
AR127,ZL1RED Tauranga Bay                  NZ,Tue Jul 20 15:32:46 PDT 2004,2.24,195.00
AR130,IW4BMA Reggio Emilia                 IT,Tue Jul 20 15:32:41 PDT 2004,1.34,287.00
AR132,IZ1DBU-2 Favria                      IT,Tue Jul 20 15:34:07 PDT 2004,0.89,354.00
AR134,K4JRG Miami                       FL US,Tue Jul 20 15:28:27 PDT 2004,0.89,187.00
AR135,K5MJE-1 Tijeras                   NM US,Tue Jul 20 15:28:13 PDT 2004,3.13,280.00
AR136,N6TW Chatsworth Lake Manor        CA US,Tue Jul 20 15:35:42 PDT 2004,1.79,320.00
AR137,K6NE Ventura                      CA US,Tue Jul 20 15:24:08 PDT 2004,0.00,310.00
AR138,K7LHC-1 Lake Havasu               AZ US,Tue Jul 20 15:34:13 PDT 2004,3.13,257.00
AR140,KB0VYO-12 Winona                  MN US,Tue Jul 20 15:29:27 PDT 2004,0.00,0.00
AR141,KB5NMB-5 Fulton                   MS US,Tue Jul 20 15:33:12 PDT 2004,0.00,139.00
AR144,KB6CYS Cypress                    CA US,Tue Jul 20 15:30:03 PDT 2004,2.24,205.00
AR145,KB9KTD-1 Onalaska                 WI US,Tue Jul 20 15:25:08 PDT 2004,0.00,87.00
AR147,W0NWS-4 Colon                     NE US,Tue Jul 20 15:31:35 PDT 2004,4.02,217.00
AR148,K6DYC Meeker                      CO US,Tue Jul 20 15:35:08 PDT 2004,0.00,332.00
AR150,KC4WPS Hendersonville             TN US,Tue Jul 20 15:31:27 PDT 2004,0.45,195.00
AR152,KC5LIO West Point                 MS US,Tue Jul 20 15:30:18 PDT 2004,0.00,135.00
AR156,KD4DLT-6 Lithonia                 GA US,Tue Jul 20 15:28:55 PDT 2004,0.00,0.00
AR159,KD6VLN-14 Tucson                  AZ US,Tue Jul 20 15:33:10 PDT 2004,3.58,318.00
AR160,NEWPRT Cape Foulweather           OR US,Tue Jul 20 15:34:16 PDT 2004,4.92,284.00
AR162,KF4VTT Mebane                     NC US,Tue Jul 20 15:35:23 PDT 2004,0.00,1.00
AR164,KF6NY Mt. Ranch                   CA US,Tue Jul 20 15:32:52 PDT 2004,0.00,241.00
AR166,KG4LXH-2 Miami                    FL US,Tue Jul 20 15:23:06 PDT 2004,1.79,223.00
AR169,KK6RW Gig Harbor                  WA US,Tue Jul 20 15:31:59 PDT 2004,1.34,70.00
AR170,KO5Z Denton                       TX US,Tue Jul 20 15:30:43 PDT 2004,1.34,180.00
AR172,W6TQP Soquel                      CA US,Tue Jul 20 15:31:04 PDT 2004,1.34,137.00
AR173,LA2YEA Hauglandshella                NO,Tue Jul 20 15:28:19 PDT 2004,0.00,68.00
AR174,K4AG-6 Miami                      FL US,Tue Jul 20 15:29:13 PDT 2004,0.00,122.00
AR177,K7UGT Cary                        NC US,Tue Jul 20 15:33:42 PDT 2004,0.00,60.00
AR178,KJ3L Erie                         PA US,Tue Jul 20 15:35:08 PDT 2004,2.24,229.00
AR179,KC9AAG Fond Du Lac                WI US,Tue Jul 20 15:35:21 PDT 2004,1.34,64.00
AR180,WB6YPF Altadena                   CA US,Tue Jul 20 15:33:20 PDT 2004,1.34,207.00
AR181,KE6ONT Duarte                     CA US,Tue Jul 20 15:28:55 PDT 2004,2.68,238.00
AR182,GW4TJC Caerphilly                    UK,Tue Jul 20 15:35:12 PDT 2004,1.34,236.00
AR183,N7LUF Hansville                   WA US,Tue Jul 20 15:33:39 PDT 2004,1.34,0.00
AR185,N1XH-15 Spencer                   MA US,Tue Jul 20 15:35:14 PDT 2004,0.00,13.00
AR186,N2LBT-7 Albany                    NY US,Tue Jul 20 15:34:39 PDT 2004,2.24,248.00
AR189,N5JEI-8 Spicewood                 TX US,Tue Jul 20 15:35:34 PDT 2004,3.13,4.00
AR190,N6GIW Joshua Tree                 CA US,Tue Jul 20 15:30:59 PDT 2004,6.71,235.00
AR191,WA4BPS Huntsville                 AL US,Tue Jul 20 15:33:24 PDT 2004,1.34,178.00
AR195,N7BIV Glendale                    AZ US,Tue Jul 20 15:26:37 PDT 2004,0.45,45.00
AR196,N7CK San Manuel                   AZ US,Tue Jul 20 15:29:07 PDT 2004,5.36,19.00
AR197,N7FZA-15 Boise                    ID US,Tue Jul 20 15:27:27 PDT 2004,1.34,11.00
AR200,N7TQZ Tacoma                      WA US,Tue Jul 20 15:27:37 PDT 2004,0.00,297.00
AR201,N8NQF-1 Middletown                OH US,Tue Jul 20 15:22:59 PDT 2004,2.24,227.00
AR202,N8VIM Pepperell                   MA US,Tue Jul 20 15:29:12 PDT 2004,0.00,0.00
AR203,N9UDO-2 Baraboo                   WI US,Tue Jul 20 15:33:04 PDT 2004,0.00,18.00
AR205,OE9FWV Feldkirch                     AT,Tue Jul 20 15:31:19 PDT 2004,1.79,233.00
AR206,OK1MX-7 Praha                        CZ,Tue Jul 20 15:32:10 PDT 2004,0.00,23.00
AR209,K0OQ Northfield                   MN US,Tue Jul 20 15:35:09 PDT 2004,0.00,198.00
AR212,WX4MAP Phenix City                AL US,Tue Jul 20 15:34:48 PDT 2004,0.00,35.00
AR213,W4HSV Huntsville                  AL US,Tue Jul 20 15:33:21 PDT 2004,0.45,250.00
AR218,KD7YTJ Brownstown                 WA US,Tue Jul 20 15:35:49 PDT 2004,2.68,168.00
AR220,KB6KJX Ellensburg                 WA US,Tue Jul 20 15:31:38 PDT 2004,2.68,315.00
AR221,K6TVI-1 Onyx Peak                 CA US,Tue Jul 20 15:33:54 PDT 2004,0.00,330.00
AR222,W7IUC-2 Big Coppitt Key           FL US,Tue Jul 20 15:33:57 PDT 2004,2.24,359.00
AR223,W7IUC-5 Grassy Key                FL US,Tue Jul 20 15:31:41 PDT 2004,0.00,177.00
AR224,W7IUC-6 Plantation Key            FL US,Tue Jul 20 15:32:35 PDT 2004,0.00,307.00
AR225,KG6QHS Shingletown                CA US,Tue Jul 20 15:35:42 PDT 2004,3.13,207.00
AR228,N0ERG Littleton                   CO US,Tue Jul 20 15:30:09 PDT 2004,0.45,230.00
AR229,N9RLR Tampa                       FL US,Tue Jul 20 15:33:40 PDT 2004,0.00,212.00
AR230,K4DIG-7 Sardis Springs            AL US,Tue Jul 20 15:35:14 PDT 2004,0.00,246.00
AR232,KC7RJK Eugene                     OR US,Tue Jul 20 15:32:23 PDT 2004,1.79,277.00
AR234,NK7W Reno                         NV US,Tue Jul 20 15:34:51 PDT 2004,1.34,230.00
AR235,K6SUD Hesperia                    CA US,Tue Jul 20 15:32:31 PDT 2004,3.58,221.00
AR238,N5YXO Granbury                    TX US,Tue Jul 20 15:31:44 PDT 2004,0.45,130.00
AR241,K2LCA-1 Chappaqua                 NY US,Tue Jul 20 15:34:37 PDT 2004,0.00,130.00
AR242,K2LGJ Buffalo                     NY US,Tue Jul 20 15:22:59 PDT 2004,1.34,228.00
AR243,K4TPD-5 Tallahassee               FL US,Tue Jul 20 15:33:27 PDT 2004,1.34,145.00
