AP957,KA4EOC Tallahassee                FL US,Mon Jul 26 15:29:08 PDT 2004,1.79,279.00
AP960,HB9TJM-8 Vallorbe                    CH,Mon Jul 26 15:33:34 PDT 2004,0.00,292.00
AP962,EB2FGI-15 Irun                       ES,Mon Jul 26 15:21:24 PDT 2004,0.00,353.00
AP965,EB5ESX Sta Pola                      ES,Mon Jul 26 15:31:14 PDT 2004,0.89,233.00
AP967,EA3AYP-1 Girona                      ES,Mon Jul 26 15:26:03 PDT 2004,2.24,327.00
AP968,EA3FAJ-1 Girona                      ES,Mon Jul 26 15:33:44 PDT 2004,0.00,334.00
AP976,DO7VLR-5 Zweibruecken                DE,Mon Jul 26 15:26:29 PDT 2004,0.00,38.00
AP979,KC9BWF-3 Sister Bay               MI US,Mon Jul 26 15:32:16 PDT 2004,5.36,125.00
AP984,N8QQ Cincinnati                   OH US,Mon Jul 26 15:35:07 PDT 2004,0.00,145.00
AP985,KB9QJM-11 Cloverdale              IN US,Mon Jul 26 15:31:15 PDT 2004,1.34,24.00
AP986,KB9QJM-12 Atlanta                 IN US,Mon Jul 26 15:27:02 PDT 2004,0.00,64.00
AP987,KC5CPO Keene                      TX US,Mon Jul 26 15:35:19 PDT 2004,0.00,25.00
AP989,KC9JWM Clam Lake                  WI US,Mon Jul 26 15:32:41 PDT 2004,0.00,277.00
AP990,KG6MOZ Sunnyvale                  CA US,Mon Jul 26 15:33:17 PDT 2004,1.34,246.00
AP991,W0BIS-3 Killdeer                  ND US,Mon Jul 26 15:34:03 PDT 2004,5.36,163.00
AP993,F6CNB Frelsburg                   TX US,Mon Jul 26 15:29:18 PDT 2004,0.00,0.00
AP994,DL2YED-6 Recklinghausen              DE,Mon Jul 26 15:26:07 PDT 2004,0.00,299.00
AP995,KI4BUM Burlington                 KY US,Mon Jul 26 15:35:02 PDT 2004,0.00,268.00
AP996,KC5YVU Lampasas                   TX US,Mon Jul 26 15:31:44 PDT 2004,4.02,18.00
AP998,DK1PR-6 Altenahr                     DE,Mon Jul 26 15:31:26 PDT 2004,0.00,204.00
AP999,DB5OY-15 Celle                       DE,Mon Jul 26 15:28:48 PDT 2004,0.00,360.00
AR003,DL9GJ-6 Burgrieden                   DE,Mon Jul 26 15:31:30 PDT 2004,0.00,180.00
AR006,HB9MZI Giubiasco                     CH,Mon Jul 26 15:28:16 PDT 2004,5.36,253.00
AR009,SR3TK-1 Gontyniec                    PL,Mon Jul 26 15:34:22 PDT 2004,0.00,243.00
AR013,IK1ZYQ Dusino                        IT,Mon Jul 26 15:31:55 PDT 2004,0.00,130.00
AR014,IK1RDC Scurzolengo                   IT,Mon Jul 26 15:29:44 PDT 2004,2.24,351.00
AR016,IW4APJ-3 Soliera                     IT,Mon Jul 26 15:34:05 PDT 2004,0.00,126.00
AR017,IK4UPW S.Giovanni                    IT,Mon Jul 26 15:30:19 PDT 2004,0.00,142.00
AR020,IK3SVW-3 Treviso                     IT,Mon Jul 26 15:31:02 PDT 2004,4.02,41.00
AR021,I3OVD Scaltenigo                     IT,Mon Jul 26 15:20:39 PDT 2004,3.13,31.00
AR022,IW5BFZ Lucca                         IT,Mon Jul 26 15:30:36 PDT 2004,0.00,331.00
AR025,IT9IPQ-2 Messina                     IT,Mon Jul 26 15:28:28 PDT 2004,4.47,304.00
AR027,IZ8GMP-2 Reggio Calabria             IT,Mon Jul 26 15:30:45 PDT 2004,6.71,356.00
AR028,IW8PCP-2 Gambarie d'Aspromonte       IT,Mon Jul 26 15:33:11 PDT 2004,0.00,351.00
AR029,KG4QXL-2 Fort Valley              VA US,Mon Jul 26 15:32:22 PDT 2004,0.00,337.00
AR030,N4HHP-4 Pompano Beach             FL US,Mon Jul 26 15:28:27 PDT 2004,2.24,139.00
AR031,SV2BNL-2 Thessaloniki                GR,Mon Jul 26 15:23:34 PDT 2004,2.68,316.00
AR034,SV1CIF-2 Aitoloakarnania             GR,Mon Jul 26 15:29:46 PDT 2004,2.68,128.00
AR035,SV3AQN-2 Patra                       GR,Mon Jul 26 15:26:56 PDT 2004,0.00,271.00
AR039,VK4TMK Arana Hills                   AU,Mon Jul 26 15:33:30 PDT 2004,2.68,250.00
AR040,N3BSQ Bethel Park                 PA US,Mon Jul 26 15:35:01 PDT 2004,0.00,300.00
AR042,VK1AC Bywong                     NSW AU,Mon Jul 26 15:35:08 PDT 2004,0.00,296.00
AR043,K4ZZR Port St. Lucie              FL US,Mon Jul 26 15:30:21 PDT 2004,3.13,124.00
AR045,IW9ETI-2 Taormina                    IT,Mon Jul 26 15:35:21 PDT 2004,4.02,322.00
AR051,KE7TR-8 Mesa                      AZ US,Mon Jul 26 15:34:54 PDT 2004,0.00,343.00
AR052,KG4QXL Fort Valley                VA US,Mon Jul 26 15:31:45 PDT 2004,0.00,184.00
AR053,VK3AWA Paradise Beach                AU,Mon Jul 26 15:30:49 PDT 2004,0.00,288.00
AR057,VK3XJB Shepparton                    AU,Mon Jul 26 15:22:43 PDT 2004,0.00,0.00
AR058,VK3YWY-1 Kyneton                     AU,Mon Jul 26 15:21:16 PDT 2004,0.00,118.00
AR060,VK3JTM-3 Ararat                      AU,Mon Jul 26 15:31:21 PDT 2004,1.34,311.00
AR062,VK5EX-1 Adelaide                     AU,Mon Jul 26 15:32:47 PDT 2004,0.00,127.00
AR066,KC0IVW Colorado Springs           CO US,Mon Jul 26 15:30:27 PDT 2004,0.00,0.00
AR068,WA2MAK Bolton                     MA US,Mon Jul 26 15:34:50 PDT 2004,0.00,42.00
AR069,KF7KN-7 Red Lodge                 MT US,Mon Jul 26 15:34:42 PDT 2004,0.00,129.00
AR070,KI0BJ-2 Fort Smith                MT US,Mon Jul 26 15:25:50 PDT 2004,0.00,295.00
AR071,KD4BJW Albertville                AL US,Mon Jul 26 15:30:55 PDT 2004,0.00,158.00
AR072,KB2KMM N. Babylon                 NY US,Mon Jul 26 15:35:11 PDT 2004,0.45,133.00
AR075,W3UGI Ambler                      PA US,Mon Jul 26 15:27:29 PDT 2004,1.34,351.00
AR078,N9NYF-6 Evansville                IN US,Mon Jul 26 15:28:20 PDT 2004,1.34,10.00
AR079,WX4BUY Elon                       NC US,Mon Jul 26 15:34:10 PDT 2004,1.34,208.00
AR082,WA2EIU Marietta                   GA US,Mon Jul 26 15:29:42 PDT 2004,0.00,351.00
AR084,W4ERC-10 Avon Park                FL US,Mon Jul 26 15:26:43 PDT 2004,0.00,59.00
AR085,N4HHP-5 Deerfield Beach           FL US,Mon Jul 26 15:24:32 PDT 2004,4.02,155.00
AR087,F8KDX Melun                          FR,Mon Jul 26 15:23:53 PDT 2004,0.00,354.00
AR091,DB0SAC-6 Bad Sackingen               DE,Mon Jul 26 15:34:00 PDT 2004,2.24,289.00
AR095,DO2UMM Gorlitz                       DE,Mon Jul 26 15:21:30 PDT 2004,0.00,292.00
AR097,EA3AGQ Lleida                        ES,Mon Jul 26 15:31:40 PDT 2004,6.71,228.00
AR098,EA3AGQ-1 Montsec d'Ares              ES,Mon Jul 26 15:27:12 PDT 2004,5.36,41.00
AR100,N1FWV Peabody                     MA US,Mon Jul 26 15:34:55 PDT 2004,0.00,119.00
AR103,W4SBO-7 Section                   AL US,Mon Jul 26 15:33:54 PDT 2004,0.00,235.00
AR106,N6FKW Auberry                     CA US,Mon Jul 26 15:33:32 PDT 2004,0.00,206.00
AR107,EA3AKS-15 SantPere de Ribes          ES,Mon Jul 26 15:34:58 PDT 2004,1.79,356.00
AR108,EA3BB Santpedor                      ES,Mon Jul 26 15:30:02 PDT 2004,0.45,215.00
AR109,EA3BSJ-1 Pinos                       ES,Mon Jul 26 15:34:10 PDT 2004,1.34,277.00
AR110,EA3CNO-1 Barcelona                   ES,Mon Jul 26 15:25:59 PDT 2004,0.89,251.00
AR111,EA3URE Figueres                      ES,Mon Jul 26 15:32:43 PDT 2004,7.60,4.00
AR112,EB3DMC-1 Belvis                      ES,Mon Jul 26 15:35:06 PDT 2004,1.79,216.00
AR115,EUGENE Eugene                     OR US,Mon Jul 26 15:27:25 PDT 2004,3.58,324.00
AR118,F6DEV-5 Rimont                       FR,Mon Jul 26 15:32:09 PDT 2004,1.34,262.00
AR127,ZL1RED Tauranga Bay                  NZ,Mon Jul 26 15:30:33 PDT 2004,0.89,223.00
AR132,IZ1DBU-2 Favria                      IT,Mon Jul 26 15:28:25 PDT 2004,0.00,343.00
AR133,K0MXU-4 Hoxie                     KS US,Mon Jul 26 15:28:04 PDT 2004,3.58,135.00
AR138,K7LHC-1 Lake Havasu               AZ US,Mon Jul 26 15:35:25 PDT 2004,2.24,110.00
AR140,KB0VYO-12 Winona                  MN US,Mon Jul 26 15:27:29 PDT 2004,0.00,0.00
AR141,KB5NMB-5 Fulton                   MS US,Mon Jul 26 15:32:08 PDT 2004,2.68,360.00
AR144,KB6CYS Cypress                    CA US,Mon Jul 26 15:30:53 PDT 2004,1.79,250.00
AR145,KB9KTD-1 Onalaska                 WI US,Mon Jul 26 15:35:08 PDT 2004,0.00,285.00
AR147,W0NWS-4 Colon                     NE US,Mon Jul 26 15:33:56 PDT 2004,3.13,197.00
AR148,K6DYC Meeker                      CO US,Mon Jul 26 15:31:29 PDT 2004,4.47,311.00
AR150,KC4WPS Hendersonville             TN US,Mon Jul 26 15:32:57 PDT 2004,0.00,336.00
AR152,KC5LIO West Point                 MS US,Mon Jul 26 15:30:19 PDT 2004,0.45,352.00
AR156,KD4DLT-6 Lithonia                 GA US,Mon Jul 26 15:28:59 PDT 2004,0.00,0.00
AR157,KD4WLI Orlando                    FL US,Mon Jul 26 15:29:13 PDT 2004,0.89,271.00
AR159,KD6VLN-14 Tucson                  AZ US,Mon Jul 26 15:34:54 PDT 2004,1.34,24.00
AR161,KD7DR-3 Tempe                     AZ US,Mon Jul 26 15:31:54 PDT 2004,0.00,0.00
AR162,KF4VTT Mebane                     NC US,Mon Jul 26 15:25:30 PDT 2004,0.00,107.00
AR163,KF6JSV San Bernardino             CA US,Mon Jul 26 15:30:56 PDT 2004,0.89,236.00
AR164,KF6NY Mt. Ranch                   CA US,Mon Jul 26 15:30:06 PDT 2004,2.24,236.00
AR165,KF6YU-2 Tempe                     AZ US,Mon Jul 26 15:25:17 PDT 2004,2.24,53.00
AR166,KG4LXH-2 Miami                    FL US,Mon Jul 26 15:20:33 PDT 2004,1.79,251.00
AR167,KI0IO-2 Berthoud                  CO US,Mon Jul 26 15:30:54 PDT 2004,2.68,217.00
AR169,KK6RW Gig Harbor                  WA US,Mon Jul 26 15:28:53 PDT 2004,2.24,252.00
AR170,KO5Z Denton                       TX US,Mon Jul 26 15:27:15 PDT 2004,1.79,337.00
AR172,W6TQP Soquel                      CA US,Mon Jul 26 15:31:10 PDT 2004,0.89,117.00
AR173,LA2YEA Hauglandshella                NO,Mon Jul 26 15:35:23 PDT 2004,0.00,0.00
AR174,K4AG-6 Miami                      FL US,Mon Jul 26 15:29:27 PDT 2004,0.00,80.00
AR177,K7UGT Cary                        NC US,Mon Jul 26 15:35:00 PDT 2004,0.00,155.00
AR178,KJ3L Erie                         PA US,Mon Jul 26 15:35:09 PDT 2004,0.00,37.00
AR179,KC9AAG Fond Du Lac                WI US,Mon Jul 26 15:30:45 PDT 2004,0.00,57.00
AR180,WB6YPF Altadena                   CA US,Mon Jul 26 15:28:13 PDT 2004,2.24,200.00
AR181,KE6ONT Duarte                     CA US,Mon Jul 26 15:27:50 PDT 2004,2.68,234.00
AR182,GW4TJC Caerphilly                    UK,Mon Jul 26 15:35:10 PDT 2004,0.00,241.00
AR183,N7LUF Hansville                   WA US,Mon Jul 26 15:33:30 PDT 2004,0.45,40.00
AR185,N1XH-15 Spencer                   MA US,Mon Jul 26 15:32:27 PDT 2004,0.00,13.00
AR186,N2LBT-7 Albany                    NY US,Mon Jul 26 15:32:50 PDT 2004,0.00,319.00
AR189,N5JEI-8 Spicewood                 TX US,Mon Jul 26 15:22:15 PDT 2004,0.00,18.00
AR190,N6GIW Joshua Tree                 CA US,Mon Jul 26 15:26:47 PDT 2004,4.47,274.00
AR191,WA4BPS Huntsville                 AL US,Mon Jul 26 15:33:23 PDT 2004,2.68,295.00
AR195,N7BIV Glendale                    AZ US,Mon Jul 26 15:29:05 PDT 2004,1.34,45.00
AR196,N7CK San Manuel                   AZ US,Mon Jul 26 15:23:42 PDT 2004,3.58,87.00
AR197,N7FZA-15 Boise                    ID US,Mon Jul 26 15:27:29 PDT 2004,2.24,132.00
AR199,N7TCF Phoenix                     AZ US,Mon Jul 26 15:27:42 PDT 2004,0.89,54.00
AR200,N7TQZ Tacoma                      WA US,Mon Jul 26 15:33:53 PDT 2004,1.79,56.00
AR201,N8NQF-1 Middletown                OH US,Mon Jul 26 15:33:59 PDT 2004,0.00,288.00
AR202,N8VIM Pepperell                   MA US,Mon Jul 26 15:34:28 PDT 2004,0.00,0.00
AR203,N9UDO-2 Baraboo                   WI US,Mon Jul 26 15:30:43 PDT 2004,1.34,78.00
AR204,N9YWZ Kimberly                    WI US,Mon Jul 26 15:32:28 PDT 2004,0.00,97.00
AR205,OE9FWV Feldkirch                     AT,Mon Jul 26 15:28:09 PDT 2004,0.00,93.00
AR206,OK1MX-7 Praha                        CZ,Mon Jul 26 15:32:22 PDT 2004,0.00,90.00
AR208,KD7WIS Miles City                 MT US,Mon Jul 26 15:33:42 PDT 2004,0.00,253.00
AR209,K0OQ Northfield                   MN US,Mon Jul 26 15:35:00 PDT 2004,0.00,166.00
AR210,N4IDX-7 Youngtown                 AL US,Mon Jul 26 15:32:57 PDT 2004,0.00,316.00
AR212,WX4MAP Phenix City                AL US,Mon Jul 26 15:34:55 PDT 2004,0.00,145.00
AR213,W4HSV Huntsville                  AL US,Mon Jul 26 15:33:17 PDT 2004,3.58,11.00
AR216,W7PG-12 Home Creek                MT US,Mon Jul 26 15:26:36 PDT 2004,0.45,316.00
AR220,KB6KJX Ellensburg                 WA US,Mon Jul 26 15:31:16 PDT 2004,2.68,315.00
AR221,K6TVI-1 Onyx Peak                 CA US,Mon Jul 26 15:34:55 PDT 2004,0.45,338.00
AR222,W7IUC-2 Big Coppitt Key           FL US,Mon Jul 26 15:35:03 PDT 2004,3.13,94.00
AR223,W7IUC-5 Grassy Key                FL US,Mon Jul 26 15:32:24 PDT 2004,0.00,177.00
AR224,W7IUC-6 Plantation Key            FL US,Mon Jul 26 15:32:24 PDT 2004,1.79,132.00
AR225,KG6QHS Shingletown                CA US,Mon Jul 26 15:34:48 PDT 2004,0.00,58.00
AR226,W4RL-1 Pensacola                  FL US,Mon Jul 26 15:31:08 PDT 2004,0.00,58.00
AR228,N0ERG Littleton                   CO US,Mon Jul 26 15:30:06 PDT 2004,4.02,223.00
AR230,K4DIG-7 Sardis Springs            AL US,Mon Jul 26 15:34:10 PDT 2004,0.00,357.00
AR231,KB5GAS-1 Balloon Fiesta           NM US,Mon Jul 26 15:34:04 PDT 2004,2.24,202.00
AR232,KC7RJK Eugene                     OR US,Mon Jul 26 15:32:16 PDT 2004,1.79,321.00
AR234,NK7W Reno                         NV US,Mon Jul 26 15:31:02 PDT 2004,2.24,257.00
AR235,K6SUD Hesperia                    CA US,Mon Jul 26 15:34:16 PDT 2004,0.00,144.00
AR238,N5YXO Granbury                    TX US,Mon Jul 26 15:31:17 PDT 2004,0.89,210.00
AR239,OZ9WC-5 Lejre                        DK,Mon Jul 26 15:33:47 PDT 2004,0.00,268.00
AR242,K2LGJ Buffalo                     NY US,Mon Jul 26 15:23:08 PDT 2004,1.34,66.00
AR243,K4TPD-5 Tallahassee               FL US,Mon Jul 26 15:33:23 PDT 2004,1.79,260.00
AR245,K7HRT Greenacres                  WA US,Mon Jul 26 15:31:25 PDT 2004,0.00,219.00
AR248,K7VIP Tucson                      AZ US,Mon Jul 26 15:33:33 PDT 2004,3.13,90.00
AR249,KA5WRG Oklahoma City              OK US,Mon Jul 26 15:34:56 PDT 2004,0.00,90.00
AR250,KA8SCP Westford                   MA US,Mon Jul 26 15:31:53 PDT 2004,0.00,320.00
AR252,KB7IPU-2 Payson                   AZ US,Mon Jul 26 15:32:28 PDT 2004,4.02,42.00
AR253,KB8WFH Springfield                OH US,Mon Jul 26 15:34:20 PDT 2004,0.00,90.00
AR254,KB9TPG Viroqua                    WI US,Mon Jul 26 15:30:23 PDT 2004,0.00,234.00
AR255,KC4YLE Efland                     NC US,Mon Jul 26 15:30:27 PDT 2004,0.00,182.00
AR256,W5HKR Schertz                     TX US,Mon Jul 26 15:34:10 PDT 2004,0.45,72.00
AR257,N1ETY New Britain                 CT US,Mon Jul 26 15:30:31 PDT 2004,0.00,337.00
AR258,KC8HJN Ludington                  MI US,Mon Jul 26 15:33:50 PDT 2004,1.79,312.00
AR259,KD5CUW-1 Copperas Cove            TX US,Mon Jul 26 15:35:30 PDT 2004,0.89,41.00
AR261,KD6RXY Calimesa                   CA US,Mon Jul 26 15:26:33 PDT 2004,6.26,307.00
AR264,K0JDN Phoenix                     AZ US,Mon Jul 26 15:32:41 PDT 2004,1.34,202.00
AR266,KJ7XE Port Angeles                WA US,Mon Jul 26 15:34:53 PDT 2004,2.68,22.00
AR267,N3WNZ Brandon                        UK,Mon Jul 26 15:35:06 PDT 2004,0.00,172.00
AR269,KC7PHC Orofino                    ID US,Mon Jul 26 15:30:06 PDT 2004,1.34,315.00
AR271,AA0MM-2 Holton                    KS US,Mon Jul 26 15:35:01 PDT 2004,1.34,181.00
AR272,KG4JPL Hudson                     FL US,Mon Jul 26 15:30:39 PDT 2004,0.00,161.00
AR273,N1JJX Southington                 CT US,Mon Jul 26 15:34:34 PDT 2004,0.00,134.00
AR274,W4RP Palm Bay                     FL US,Mon Jul 26 15:32:21 PDT 2004,0.00,138.00
AR275,W1CWS-1 Cos Cob                   CT US,Mon Jul 26 15:30:33 PDT 2004,0.00,45.00
AR277,VE2GAT-2 St.Hyacinthe             QB CA,Mon Jul 26 15:30:33 PDT 2004,1.79,182.00
AR279,VE3COE Kincardine                ONT CA,Mon Jul 26 15:32:35 PDT 2004,0.89,52.00
AR280,VE3JON Kincardine                ONT CA,Mon Jul 26 15:31:07 PDT 2004,0.89,57.00
AR282,VE7IMD-2 Delta                    BC CA,Mon Jul 26 15:33:56 PDT 2004,0.00,216.00
AR283,VE7MKF-3 Surry                    BC CA,Mon Jul 26 15:30:42 PDT 2004,0.89,210.00
AR286,K0NSA Omaha                       NE US,Mon Jul 26 15:20:53 PDT 2004,3.13,169.00
AR290,AB4KN Peachtree City              GA US,Mon Jul 26 15:31:19 PDT 2004,0.00,165.00
AR300,KB8GQ Galloway                    OH US,Mon Jul 26 15:32:47 PDT 2004,0.00,338.00
AR301,N5KUK Norman                      OK US,Mon Jul 26 15:32:10 PDT 2004,1.34,47.00
AR302,N4NW Stafford                     VA US,Mon Jul 26 15:34:20 PDT 2004,0.00,289.00
AR303,DL1BLU Schortens                     DE,Mon Jul 26 15:30:17 PDT 2004,0.00,268.00
AR305,KF6ZGH Fremont                    CA US,Mon Jul 26 15:32:10 PDT 2004,4.02,271.00
AR306,KQ6DI-15 Livermore                CA US,Mon Jul 26 15:32:40 PDT 2004,3.58,284.00
AR307,W6KL Burbank                      CA US,Mon Jul 26 15:29:50 PDT 2004,1.34,194.00
AR308,W8EHH Winter Garden               FL US,Mon Jul 26 15:33:01 PDT 2004,4.02,115.00
AR309,WB6ABE-4 Benicia                  CA US,Mon Jul 26 15:26:44 PDT 2004,6.71,305.00
AR310,K4ROK-10 Fountain                 NC US,Mon Jul 26 15:26:33 PDT 2004,0.00,35.00
AR312,WA6BAY-1 Soquel                   CA US,Mon Jul 26 15:26:32 PDT 2004,3.13,166.00
AR313,WB6AHC-1 San Jose                 CA US,Mon Jul 26 15:35:23 PDT 2004,2.68,307.00
AR314,N7NAT Yakima                      WA US,Mon Jul 26 15:34:26 PDT 2004,0.45,153.00
AR315,OH6GPB Pietarsaari                   FI,Mon Jul 26 15:30:40 PDT 2004,0.45,333.00
AR318,ND1Q Concord                      NH US,Mon Jul 26 15:24:47 PDT 2004,0.45,160.00
AR319,VK7HDM-5 Hobart                  TAS AU,Mon Jul 26 15:35:12 PDT 2004,3.13,273.00
AR320,K6TZ Diablo Peak                  CA US,Mon Jul 26 15:25:34 PDT 2004,0.00,166.00
AR321,K6DJR W.Menlo Park                CA US,Mon Jul 26 15:32:08 PDT 2004,0.89,32.00
AR323,KF6YUA Sebastopol                 CA US,Mon Jul 26 15:31:33 PDT 2004,2.68,254.00
AR327,WB1FYE Weirs Beach                NH US,Mon Jul 26 15:35:05 PDT 2004,0.00,90.00
AR328,N1EO Center Harbor                NH US,Mon Jul 26 15:32:03 PDT 2004,0.00,251.00
AR329,KA1RVR Epping                     NH US,Mon Jul 26 15:30:21 PDT 2004,0.00,213.00
AR330,KC1EO Hollis                      NH US,Mon Jul 26 15:30:38 PDT 2004,0.00,72.00
AR332,KD2KB Coudersport                 PA US,Mon Jul 26 15:35:12 PDT 2004,0.89,127.00
AR333,WO4U-10 Crossville                TN US,Mon Jul 26 15:32:33 PDT 2004,0.00,248.00
AR334,W4OZK-8 Collinsville              AL US,Mon Jul 26 15:29:37 PDT 2004,0.00,179.00
AR335,KB0RF San Jose                    CA US,Mon Jul 26 15:33:46 PDT 2004,3.13,316.00
AR338,N3WKE Baltimore                   MD US,Mon Jul 26 15:33:19 PDT 2004,1.79,134.00
AR339,AB0YW Blair                       NE US,Mon Jul 26 15:31:54 PDT 2004,0.45,172.00
AR340,AB8CY Scottville                  MI US,Mon Jul 26 15:34:26 PDT 2004,0.45,335.00
AR342,N2NZD Copake                      NY US,Mon Jul 26 15:32:37 PDT 2004,0.00,351.00
AR343,WA1OUI West Simsbury              CT US,Mon Jul 26 15:32:20 PDT 2004,0.00,76.00
AR345,KD5ZLP Rowlett                    TX US,Mon Jul 26 15:35:09 PDT 2004,0.45,23.00
AR346,TG9RB Guatemala City                 GT,Mon Jul 26 15:33:23 PDT 2004,1.34,352.00
AR347,KC5ZJO-1 Madison                  AL US,Mon Jul 26 15:33:20 PDT 2004,4.02,309.00
AR348,KG4VVU Helena                     AL US,Mon Jul 26 15:31:08 PDT 2004,0.00,40.00
AR350,W6MAR Galt                        CA US,Mon Jul 26 15:21:01 PDT 2004,0.00,222.00
AR351,ON7EQ-1 Brugge                       BE,Mon Jul 26 15:35:32 PDT 2004,0.00,50.00
AR354,W7PAQ Missoula                    MT US,Mon Jul 26 15:32:44 PDT 2004,0.00,115.00
AR355,KC4CSX-9 Holly Springs            GA US,Mon Jul 26 15:34:34 PDT 2004,0.00,71.00
AR356,AG1C Westborough                  MA US,Mon Jul 26 15:34:43 PDT 2004,0.00,40.00
AR357,WB1ETW Plainville                 MA US,Mon Jul 26 15:34:16 PDT 2004,0.00,145.00
AR358,N1MZX Peterborough                NH US,Mon Jul 26 15:35:29 PDT 2004,0.45,86.00
AR363,KC0MKS-10 Knife River             MN US,Mon Jul 26 15:32:55 PDT 2004,2.24,210.00
AR365,KM6GE Allenspark                  CO US,Mon Jul 26 15:34:04 PDT 2004,0.45,213.00
AR366,KB9VSQ Reedsburg                  WI US,Mon Jul 26 15:33:23 PDT 2004,0.45,336.00
AR367,KB0KQA Duluth                     MN US,Mon Jul 26 15:25:45 PDT 2004,0.00,358.00
AR368,WA0VSL Monument                   CO US,Mon Jul 26 15:30:19 PDT 2004,0.45,165.00
AR369,VA4GD Pinawa                     MAN CA,Mon Jul 26 15:35:17 PDT 2004,1.34,173.00
AR370,K7RKT Lake Oswego                 OR US,Mon Jul 26 15:32:34 PDT 2004,0.00,0.00
AR376,N9QIP Arlington                   WI US,Mon Jul 26 15:35:11 PDT 2004,2.68,59.00
AR377,N9WWR Racine                      WI US,Mon Jul 26 15:31:50 PDT 2004,0.00,91.00
AR378,WD8JVQ Petoskey                   MI US,Mon Jul 26 15:34:20 PDT 2004,2.24,321.00
AR380,KC8YHQ Sanford                    MI US,Mon Jul 26 15:28:38 PDT 2004,2.24,79.00
AR382,K8SWR Battle Creek                MI US,Mon Jul 26 15:27:18 PDT 2004,0.00,68.00
AR383,K5WPN-10 Duncan                   OK US,Mon Jul 26 15:34:11 PDT 2004,2.24,42.00
AR384,KB5AWM Cedar Park                 TX US,Mon Jul 26 15:34:56 PDT 2004,0.00,323.00
AR385,N1NAZ-1 Derry                     NH US,Mon Jul 26 15:33:18 PDT 2004,0.00,112.00
AR388,KB8UNF Twin Lake                  MI US,Mon Jul 26 15:30:45 PDT 2004,1.34,235.00
AR390,KE6JDC Long Beach                 CA US,Mon Jul 26 15:35:26 PDT 2004,1.79,308.00
AR392,K0NY-2 Winona                     MN US,Mon Jul 26 15:35:18 PDT 2004,2.24,0.00
AR394,N9ZWY-2 Prairie Du Chien          WI US,Mon Jul 26 15:35:27 PDT 2004,0.89,7.00
AR397,K0MCA-4 California                MO US,Mon Jul 26 15:33:31 PDT 2004,0.00,315.00
AR398,W0RED Ballwin                     MO US,Mon Jul 26 15:31:43 PDT 2004,0.00,331.00
AR400,KM5HG Claremore                   OK US,Mon Jul 26 15:33:53 PDT 2004,0.00,48.00
AR402,KN4CI-1 Moulton                   AL US,Mon Jul 26 15:30:18 PDT 2004,0.00,314.00
AR403,KB7TBT Phoenix                    AZ US,Mon Jul 26 15:27:21 PDT 2004,3.13,136.00
AR404,KI4AOA Gladys                     VA US,Mon Jul 26 15:34:43 PDT 2004,1.79,33.00
AR409,KQ3F Harrisburg                   PA US,Mon Jul 26 15:33:57 PDT 2004,0.00,145.00
AR410,WB3W Schnecksville                PA US,Mon Jul 26 15:30:42 PDT 2004,0.00,1.00
AR412,KL1SF-7 Healy                     AK US,Mon Jul 26 15:31:31 PDT 2004,3.58,184.00
AR413,W5JWW Sumner                      MS US,Mon Jul 26 15:32:50 PDT 2004,1.34,296.00
AR417,K4EKG Hamilton                    AL US,Mon Jul 26 15:23:33 PDT 2004,0.00,285.00
AR418,NK7I Las Vegas                    NV US,Mon Jul 26 15:25:33 PDT 2004,1.34,219.00
AR421,DB9AZ-5 Hamburg                      DE,Mon Jul 26 15:34:32 PDT 2004,1.34,295.00
AR422,DF0BLM Gosen                         DE,Mon Jul 26 15:27:15 PDT 2004,1.34,245.00
AR423,DG2KB Wilhelmshaven                  DE,Mon Jul 26 15:30:15 PDT 2004,0.00,336.00
AR424,K0FJ-5 Colby                      KS US,Mon Jul 26 15:20:36 PDT 2004,3.13,218.00
AR426,K4BS Dahlonega                    GA US,Mon Jul 26 15:30:39 PDT 2004,0.00,140.00
AR427,AH6GR Maui                        HI US,Mon Jul 26 15:32:04 PDT 2004,4.47,316.00
AR428,KF4YYH Largo                      FL US,Mon Jul 26 15:35:35 PDT 2004,0.00,24.00
AR429,KD5NFW Midlothian                 TX US,Mon Jul 26 15:34:33 PDT 2004,2.24,44.00
AR430,N4JDB-1 Youngtown                 AL US,Mon Jul 26 15:31:10 PDT 2004,0.00,255.00
AR431,KB9RQD Hawthorne                  WI US,Mon Jul 26 15:30:22 PDT 2004,2.24,144.00
AR433,KC8YFO Strongsville               OH US,Mon Jul 26 15:30:48 PDT 2004,0.45,23.00
AR434,KD5RWX Glenwood                   NM US,Mon Jul 26 15:30:53 PDT 2004,0.45,249.00
AR435,KB8UBG Saint Bernard              OH US,Mon Jul 26 15:32:02 PDT 2004,0.00,338.00
AR436,N0KTA-2 Mulvane                   KS US,Mon Jul 26 15:35:07 PDT 2004,0.00,90.00
AR437,N0OHO-1 Sioux Center              IA US,Mon Jul 26 15:33:42 PDT 2004,3.13,167.00
AR438,N0RGA-2 Tea                       SD US,Mon Jul 26 15:30:13 PDT 2004,0.00,359.00
AR439,N0VHU Howells                     NE US,Mon Jul 26 15:32:32 PDT 2004,3.58,141.00
AR441,N1CNV Newington                   CT US,Mon Jul 26 15:33:33 PDT 2004,0.45,133.00
AR442,N1DJS Williamsburg                OH US,Mon Jul 26 15:30:46 PDT 2004,0.00,0.00
AR443,N4BCB-2 Roanoke                   AL US,Mon Jul 26 15:23:02 PDT 2004,0.00,0.00
AR444,KC2KWK Somerville                 NJ US,Mon Jul 26 15:34:06 PDT 2004,2.24,140.00
AR445,N4XI-9 Owensboro                  KY US,Mon Jul 26 15:31:53 PDT 2004,2.24,60.00
AR446,N4XI-3 Evansville                 IN US,Mon Jul 26 15:33:06 PDT 2004,0.00,100.00
AR447,N4XI-5 Evansville                 IN US,Mon Jul 26 15:35:06 PDT 2004,1.79,239.00
AR448,KA4NES Littleton                  NC US,Mon Jul 26 15:35:19 PDT 2004,0.00,167.00
AR449,N4ZOI Cheraw                      SC US,Mon Jul 26 15:27:59 PDT 2004,0.00,220.00
AR450,WB0RXX Montevideo                 MN US,Mon Jul 26 15:32:02 PDT 2004,0.89,201.00
AR451,WA4ROX Largo                      FL US,Mon Jul 26 15:31:43 PDT 2004,0.00,75.00
AR452,N5SKU-1 Richardson                TX US,Mon Jul 26 15:34:12 PDT 2004,0.00,225.00
AR454,N7RFA Cornelius                   OR US,Mon Jul 26 15:31:18 PDT 2004,0.00,68.00
AR456,N7ZGO Sierra Vista                AZ US,Mon Jul 26 15:28:48 PDT 2004,0.00,106.00
AR458,N8XHZ-4 Tiffin                    OH US,Mon Jul 26 15:33:06 PDT 2004,0.00,46.00
AR459,N9SVO-1 East Peoria               IL US,Mon Jul 26 15:28:22 PDT 2004,2.68,70.00
AR460,N9VP Greensboro                   NC US,Mon Jul 26 15:24:23 PDT 2004,0.00,180.00
AR461,KF4ZUX-4 London                   KY US,Mon Jul 26 15:33:44 PDT 2004,0.00,198.00
AR464,EMRWX Goodyear                    AZ US,Mon Jul 26 15:35:07 PDT 2004,0.00,245.00
AR466,AB3BE Hagerstown                  MD US,Mon Jul 26 15:31:22 PDT 2004,0.45,83.00
AR467,VE3WXR Verona                    ONT CA,Mon Jul 26 15:21:30 PDT 2004,0.00,145.00
AR468,KA9QVW Galena                     IL US,Mon Jul 26 15:30:45 PDT 2004,0.00,272.00
AR470,K9DC Indianapolis                 IN US,Mon Jul 26 15:29:15 PDT 2004,0.00,28.00
AR471,WA4PHY Martinez                   GA US,Mon Jul 26 15:34:55 PDT 2004,1.34,153.00
AR472,N6MVS Hutchins                    TX US,Mon Jul 26 15:27:39 PDT 2004,0.89,61.00
AR473,KC2EUS Gloversville               NY US,Mon Jul 26 15:30:19 PDT 2004,0.45,83.00
AR474,N3IDX Huntingtown                 MD US,Mon Jul 26 15:34:36 PDT 2004,0.00,141.00
AR476,N5ZPR Arlington                   TX US,Mon Jul 26 15:31:54 PDT 2004,0.45,319.00
