AP799,AE0S-3 Columbia                   MO US,Tue Jul 27 15:17:08 PDT 2004,0.00,16.00
AP802,W4OZK-7 Mentone                   AL US,Tue Jul 27 15:20:29 PDT 2004,3.13,3.00
AP803,KE6AFE Santa Cruz                 CA US,Tue Jul 27 15:20:08 PDT 2004,2.24,218.00
AP806,N3EG Longview                     WA US,Tue Jul 27 15:11:02 PDT 2004,2.24,300.00
AP808,KG4YZY New Port Richey            FL US,Tue Jul 27 15:19:29 PDT 2004,0.45,264.00
AP809,K4NUT Port Richey                 FL US,Tue Jul 27 15:19:41 PDT 2004,1.34,270.00
AP811,KC2IXE Bayside Hills              NY US,Tue Jul 27 15:16:59 PDT 2004,0.45,31.00
AP813,VE3PWZ Dundalk                   ONT CA,Tue Jul 27 15:18:43 PDT 2004,1.34,64.00
AP814,VA3GY Erin                       ONT CA,Tue Jul 27 15:19:58 PDT 2004,0.00,47.00
AP815,VA3HST Guelph                    ONT CA,Tue Jul 27 15:15:44 PDT 2004,3.13,58.00
AP817,VA3AT Renfrew                    ONT CA,Tue Jul 27 15:19:19 PDT 2004,0.00,113.00
AP818,VA3MWK Ashton                    ONT CA,Tue Jul 27 15:19:38 PDT 2004,0.45,0.00
AP819,VE3TEN Ottawa                    ONT CA,Tue Jul 27 15:16:15 PDT 2004,1.79,73.00
AP820,VE6BMR Sherwood Park             ALT CA,Tue Jul 27 15:13:22 PDT 2004,7.60,333.00
AP823,AD4BL Fairbanks                   AK US,Tue Jul 27 15:12:25 PDT 2004,0.45,53.00
AP824,K5WPN-10 Duncan                   OK US,Tue Jul 27 15:20:32 PDT 2004,5.36,135.00
AP827,W8LRC Lowell                      MI US,Tue Jul 27 15:18:13 PDT 2004,0.89,3.00
AP830,KA2FNK Merriam                    KS US,Tue Jul 27 15:17:13 PDT 2004,1.34,160.00
AP831,N9NJK Warsaw                      IN US,Tue Jul 27 15:18:43 PDT 2004,1.79,328.00
AP832,WB9TLH-11 Bloomington             IN US,Tue Jul 27 15:17:01 PDT 2004,0.45,253.00
AP833,KE4CON-3 Woodstock                IL US,Tue Jul 27 15:16:30 PDT 2004,0.00,310.00
AP838,W5MAI San Antonio                 TX US,Tue Jul 27 15:13:28 PDT 2004,0.89,144.00
AP840,KC0OGY-5 Bailey                   CO US,Tue Jul 27 15:18:09 PDT 2004,0.89,86.00
AP841,WE1A USAF Academy                 CO US,Tue Jul 27 15:14:22 PDT 2004,1.34,270.00
AP842,VE5VAP Dalmeny                    SK CA,Tue Jul 27 15:13:37 PDT 2004,8.49,268.00
AP846,WN5PFI N.Dallas                   TX US,Tue Jul 27 15:17:24 PDT 2004,1.34,44.00
AP847,KB1JKP Concord                    MA US,Tue Jul 27 15:15:28 PDT 2004,0.00,319.00
AP850,KC2GLZ Lowville                   NY US,Tue Jul 27 15:17:35 PDT 2004,1.79,138.00
AP852,WG4R Meadows of Dan               VA US,Tue Jul 27 15:20:24 PDT 2004,0.89,248.00
AP854,N4HHP-1 Plantation                FL US,Tue Jul 27 15:14:38 PDT 2004,3.13,135.00
AP855,N4HHP-2 Ft. Lauderdale            FL US,Tue Jul 27 15:17:08 PDT 2004,0.00,148.00
AP856,N4HHP-3 Hallandale Beach          FL US,Tue Jul 27 15:18:15 PDT 2004,2.24,188.00
AP858,KD5WEB Port Allen                 LA US,Tue Jul 27 15:17:28 PDT 2004,2.68,333.00
AP860,AA5ED-10 Brandon                  MS US,Tue Jul 27 15:17:25 PDT 2004,0.45,288.00
AP862,KC0KOQ-1 Goodland                 KS US,Tue Jul 27 15:11:18 PDT 2004,5.81,158.00
AP864,AB0XM-1 Great Bend                KS US,Tue Jul 27 15:13:11 PDT 2004,5.36,163.00
AP866,KA0HJZ Van Meter                  IA US,Tue Jul 27 15:17:06 PDT 2004,0.45,190.00
AP867,N0VPR Johnston                    IA US,Tue Jul 27 15:15:58 PDT 2004,0.00,167.00
AP870,KC0LBV Farmington                 MN US,Tue Jul 27 15:11:23 PDT 2004,4.92,186.00
AP871,N0PFY Northfield                  MN US,Tue Jul 27 15:18:35 PDT 2004,4.02,233.00
AP872,N0EST Rochester                   MN US,Tue Jul 27 15:19:21 PDT 2004,0.00,59.00
AP874,VK2AAK Forster                       AU,Tue Jul 27 15:15:49 PDT 2004,0.00,308.00
AP877,KA8OAD-1 Fairlawn                 OH US,Tue Jul 27 15:15:22 PDT 2004,1.79,322.00
AP878,AB9FX Chicago                     IL US,Tue Jul 27 15:19:35 PDT 2004,0.00,146.00
AP879,N9VPV Galesburg                   IL US,Tue Jul 27 15:18:23 PDT 2004,0.89,274.00
AP881,KJ4W Murray                       KY US,Tue Jul 27 15:08:34 PDT 2004,0.89,359.00
AP890,KB7DZR Tigard                     OR US,Tue Jul 27 15:20:03 PDT 2004,4.02,312.00
AP892,KG6QHD Prineville                 OR US,Tue Jul 27 15:09:09 PDT 2004,1.34,51.00
AP893,KE6KYI Groveland                  CA US,Tue Jul 27 15:13:47 PDT 2004,1.34,236.00
AP894,K6IMN Atwater                     CA US,Tue Jul 27 15:20:02 PDT 2004,1.79,351.00
AP896,WA6YLB Exeter                     CA US,Tue Jul 27 15:13:07 PDT 2004,0.89,271.00
AP897,WA6YLB-4 Govt.Peak                CA US,Tue Jul 27 15:18:51 PDT 2004,7.15,283.00
AP898,WA6YLB-6 Visalia                  CA US,Tue Jul 27 15:16:01 PDT 2004,0.00,0.00
AP900,KE6ZPS-1 Miranda Canyon           CA US,Tue Jul 27 15:20:01 PDT 2004,9.39,211.00
AP901,KB6OQJ Santa Ynez                 CA US,Tue Jul 27 15:14:04 PDT 2004,2.24,264.00
AP902,N6HGA-1 Palmdale                  CA US,Tue Jul 27 15:16:02 PDT 2004,7.15,245.00
AP904,W6MAF Hesperia                    CA US,Tue Jul 27 15:18:14 PDT 2004,6.26,207.00
AP907,W9IF-4 Torry Pines                CA US,Tue Jul 27 15:19:00 PDT 2004,4.47,240.00
AP911,K4GIG-7 Brindley Mtn.             AL US,Tue Jul 27 15:20:32 PDT 2004,0.00,359.00
AP912,WB2JSH Eaton                      CO US,Tue Jul 27 15:20:35 PDT 2004,1.34,260.00
AP913,WB5SLA Ball Ground                GA US,Tue Jul 27 15:17:08 PDT 2004,0.00,155.00
AP917,W7NWS Billings                    MT US,Tue Jul 27 15:20:13 PDT 2004,3.58,88.00
AP919,LB9ME Trondheim                      NO,Tue Jul 27 15:19:17 PDT 2004,1.34,215.00
AP921,OZ6GX-5 Roervig                      DK,Tue Jul 27 15:12:56 PDT 2004,0.00,278.00
AP922,OZ1IEP-5 Jaegerspris                 DK,Tue Jul 27 15:16:53 PDT 2004,2.68,338.00
AP932,MB7UHR Luton                         UK,Tue Jul 27 15:19:56 PDT 2004,0.00,34.00
AP936,G3RJI Essex                          UK,Tue Jul 27 15:09:17 PDT 2004,0.00,0.00
AP937,MB7UEK Herne Bay                     UK,Tue Jul 27 15:20:30 PDT 2004,0.00,122.00
AP941,LU5ABT-15 BuenosAries                AR,Tue Jul 27 15:10:16 PDT 2004,4.47,73.00
AP943,MTHEBO Mt. Hebo                   OR US,Tue Jul 27 15:18:29 PDT 2004,0.00,0.00
AP946,F1HCI-12 Versailles                  FR,Tue Jul 27 15:12:14 PDT 2004,0.00,316.00
AP949,F4CEP-12 Rubelles                    FR,Tue Jul 27 15:15:02 PDT 2004,1.79,30.00
AP953,ZF1EJ Savannah                       KY,Tue Jul 27 15:19:38 PDT 2004,0.00,97.00
AP956,K4TEM Tallahassee                 FL US,Tue Jul 27 15:19:01 PDT 2004,0.45,287.00
AP957,KA4EOC Tallahassee                FL US,Tue Jul 27 15:12:08 PDT 2004,0.00,306.00
AP962,EB2FGI-15 Irun                       ES,Tue Jul 27 15:06:23 PDT 2004,0.45,213.00
AP965,EB5ESX Sta Pola                      ES,Tue Jul 27 15:15:58 PDT 2004,0.89,112.00
AP967,EA3AYP-1 Girona                      ES,Tue Jul 27 15:16:57 PDT 2004,2.68,309.00
AP968,EA3FAJ-1 Girona                      ES,Tue Jul 27 15:09:24 PDT 2004,0.00,172.00
AP969,EA3RCK-1 Lleida                      ES,Tue Jul 27 15:10:03 PDT 2004,0.00,347.00
AP971,EB3GGU Balaguer                      ES,Tue Jul 27 15:15:05 PDT 2004,2.24,30.00
AP976,DO7VLR-5 Zweibruecken                DE,Tue Jul 27 15:16:39 PDT 2004,1.34,137.00
AP979,KC9BWF-3 Sister Bay               MI US,Tue Jul 27 15:19:40 PDT 2004,2.68,111.00
AP981,KG4SEY Niceville                  FL US,Tue Jul 27 15:07:27 PDT 2004,0.00,134.00
AP984,N8QQ Cincinnati                   OH US,Tue Jul 27 15:20:03 PDT 2004,0.00,320.00
AP985,KB9QJM-11 Cloverdale              IN US,Tue Jul 27 15:16:16 PDT 2004,2.24,315.00
AP986,KB9QJM-12 Atlanta                 IN US,Tue Jul 27 15:17:02 PDT 2004,1.79,26.00
AP989,KC9JWM Clam Lake                  WI US,Tue Jul 27 15:08:41 PDT 2004,4.47,296.00
AP990,KG6MOZ Sunnyvale                  CA US,Tue Jul 27 15:18:27 PDT 2004,1.34,298.00
AP991,W0BIS-3 Killdeer                  ND US,Tue Jul 27 15:19:06 PDT 2004,8.05,354.00
AP993,F6CNB Frelsburg                   TX US,Tue Jul 27 15:14:23 PDT 2004,0.00,40.00
AP994,DL2YED-6 Recklinghausen              DE,Tue Jul 27 15:19:56 PDT 2004,0.00,310.00
AP995,KI4BUM Burlington                 KY US,Tue Jul 27 15:20:02 PDT 2004,0.00,109.00
AP996,KC5YVU Lampasas                   TX US,Tue Jul 27 15:20:32 PDT 2004,2.68,143.00
AP998,DK1PR-6 Altenahr                     DE,Tue Jul 27 15:13:27 PDT 2004,0.00,274.00
AP999,DB5OY-15 Celle                       DE,Tue Jul 27 15:13:56 PDT 2004,0.00,360.00
AR005,HB9BA-8 Solothurn                    CH,Tue Jul 27 15:11:35 PDT 2004,0.00,0.00
AR009,SR3TK-1 Gontyniec                    PL,Tue Jul 27 15:20:27 PDT 2004,5.36,332.00
AR011,IK1ZQJ Torino                        IT,Tue Jul 27 15:14:07 PDT 2004,0.00,61.00
AR013,IK1ZYQ Dusino                        IT,Tue Jul 27 15:11:57 PDT 2004,0.00,341.00
AR014,IK1RDC Scurzolengo                   IT,Tue Jul 27 15:17:43 PDT 2004,3.13,351.00
AR016,IW4APJ-3 Soliera                     IT,Tue Jul 27 15:14:05 PDT 2004,1.34,133.00
AR017,IK4UPW S.Giovanni                    IT,Tue Jul 27 15:17:33 PDT 2004,1.34,105.00
AR020,IK3SVW-3 Treviso                     IT,Tue Jul 27 15:15:03 PDT 2004,0.00,149.00
AR022,IW5BFZ Lucca                         IT,Tue Jul 27 15:17:36 PDT 2004,0.45,15.00
AR023,I4GOS-3 Rimini                       IT,Tue Jul 27 15:20:09 PDT 2004,0.00,298.00
AR025,IT9IPQ-2 Messina                     IT,Tue Jul 27 15:18:28 PDT 2004,0.00,266.00
AR027,IZ8GMP-2 Reggio Calabria             IT,Tue Jul 27 15:15:45 PDT 2004,4.47,45.00
AR028,IW8PCP-2 Gambarie d'Aspromonte       IT,Tue Jul 27 15:08:12 PDT 2004,0.00,100.00
AR029,KG4QXL-2 Fort Valley              VA US,Tue Jul 27 15:20:27 PDT 2004,0.00,337.00
AR030,N4HHP-4 Pompano Beach             FL US,Tue Jul 27 15:08:28 PDT 2004,2.24,139.00
AR032,SV2BZQ-3 Thessaloniki                GR,Tue Jul 27 15:14:10 PDT 2004,8.49,36.00
AR033,SV4BHA-2 Larisa                      GR,Tue Jul 27 15:14:22 PDT 2004,1.34,116.00
AR034,SV1CIF-2 Aitoloakarnania             GR,Tue Jul 27 15:11:28 PDT 2004,1.34,349.00
AR035,SV3AQN-2 Patra                       GR,Tue Jul 27 15:11:54 PDT 2004,1.79,152.00
AR036,SV3BEF-2 Tripolis                    GR,Tue Jul 27 15:16:11 PDT 2004,0.00,304.00
AR038,VK4AGS-3 Calliope                    AU,Tue Jul 27 15:11:11 PDT 2004,2.24,302.00
AR039,VK4TMK Arana Hills                   AU,Tue Jul 27 15:14:29 PDT 2004,0.89,230.00
AR040,N3BSQ Bethel Park                 PA US,Tue Jul 27 15:20:04 PDT 2004,0.00,351.00
AR042,VK1AC Bywong                     NSW AU,Tue Jul 27 15:17:43 PDT 2004,0.89,245.00
AR043,K4ZZR Port St. Lucie              FL US,Tue Jul 27 15:18:23 PDT 2004,2.68,148.00
AR044,N0QXY Ft.Lupton                   CO US,Tue Jul 27 15:17:12 PDT 2004,0.89,106.00
AR045,IW9ETI-2 Taormina                    IT,Tue Jul 27 15:13:21 PDT 2004,2.68,293.00
AR051,KE7TR-8 Mesa                      AZ US,Tue Jul 27 15:20:31 PDT 2004,3.58,347.00
AR052,KG4QXL Fort Valley                VA US,Tue Jul 27 15:19:30 PDT 2004,0.00,247.00
AR053,VK3AWA Paradise Beach                AU,Tue Jul 27 15:13:30 PDT 2004,0.00,196.00
AR057,VK3XJB Shepparton                    AU,Tue Jul 27 15:12:12 PDT 2004,0.89,343.00
AR058,VK3YWY-1 Kyneton                     AU,Tue Jul 27 15:17:48 PDT 2004,1.79,295.00
AR060,VK3JTM-3 Ararat                      AU,Tue Jul 27 15:19:03 PDT 2004,2.24,333.00
AR061,VK3YLV Horsham                       AU,Tue Jul 27 15:07:37 PDT 2004,0.00,328.00
AR062,VK5EX-1 Adelaide                     AU,Tue Jul 27 15:18:44 PDT 2004,0.00,249.00
AR066,KC0IVW Colorado Springs           CO US,Tue Jul 27 15:15:20 PDT 2004,0.00,0.00
AR068,WA2MAK Bolton                     MA US,Tue Jul 27 15:19:56 PDT 2004,0.45,35.00
AR069,KF7KN-7 Red Lodge                 MT US,Tue Jul 27 15:14:48 PDT 2004,1.34,90.00
AR070,KI0BJ-2 Fort Smith                MT US,Tue Jul 27 15:17:10 PDT 2004,0.45,319.00
AR071,KD4BJW Albertville                AL US,Tue Jul 27 15:12:21 PDT 2004,0.00,296.00
AR072,KB2KMM N. Babylon                 NY US,Tue Jul 27 15:20:10 PDT 2004,0.89,81.00
AR075,W3UGI Ambler                      PA US,Tue Jul 27 15:12:06 PDT 2004,0.00,4.00
AR078,N9NYF-6 Evansville                IN US,Tue Jul 27 15:09:41 PDT 2004,2.68,350.00
AR079,WX4BUY Elon                       NC US,Tue Jul 27 15:19:39 PDT 2004,0.45,66.00
AR082,WA2EIU Marietta                   GA US,Tue Jul 27 15:11:42 PDT 2004,0.00,36.00
AR084,W4ERC-10 Avon Park                FL US,Tue Jul 27 15:16:46 PDT 2004,0.00,101.00
AR085,N4HHP-5 Deerfield Beach           FL US,Tue Jul 27 15:19:31 PDT 2004,6.26,132.00
AR087,F8KDX Melun                          FR,Tue Jul 27 15:09:51 PDT 2004,1.79,48.00
AR091,DB0SAC-6 Bad Sackingen               DE,Tue Jul 27 15:08:02 PDT 2004,5.81,52.00
AR095,DO2UMM Gorlitz                       DE,Tue Jul 27 15:11:21 PDT 2004,0.00,112.00
AR097,EA3AGQ Lleida                        ES,Tue Jul 27 15:20:24 PDT 2004,4.02,42.00
AR098,EA3AGQ-1 Montsec d'Ares              ES,Tue Jul 27 15:17:13 PDT 2004,2.24,254.00
AR100,N1FWV Peabody                     MA US,Tue Jul 27 15:14:47 PDT 2004,0.00,104.00
AR103,W4SBO-7 Section                   AL US,Tue Jul 27 15:19:09 PDT 2004,0.00,6.00
AR108,EA3BB Santpedor                      ES,Tue Jul 27 15:14:07 PDT 2004,1.79,242.00
AR109,EA3BSJ-1 Pinos                       ES,Tue Jul 27 15:13:19 PDT 2004,3.58,130.00
AR110,EA3CNO-1 Barcelona                   ES,Tue Jul 27 15:06:38 PDT 2004,0.00,0.00
AR112,EB3DMC-1 Belvis                      ES,Tue Jul 27 15:15:09 PDT 2004,2.24,85.00
AR115,EUGENE Eugene                     OR US,Tue Jul 27 15:14:29 PDT 2004,3.13,327.00
AR116,F1JXB-5 Villate                      FR,Tue Jul 27 15:13:08 PDT 2004,0.00,343.00
AR118,F6DEV-5 Rimont                       FR,Tue Jul 27 15:14:49 PDT 2004,0.89,180.00
AR122,N4HHP-6 Cooper City               FL US,Tue Jul 27 15:13:24 PDT 2004,3.58,139.00
AR127,ZL1RED Tauranga Bay                  NZ,Tue Jul 27 15:17:20 PDT 2004,0.00,158.00
AR132,IZ1DBU-2 Favria                      IT,Tue Jul 27 15:14:15 PDT 2004,1.34,0.00
AR133,K0MXU-4 Hoxie                     KS US,Tue Jul 27 15:17:28 PDT 2004,2.68,158.00
AR134,K4JRG Miami                       FL US,Tue Jul 27 15:13:33 PDT 2004,1.79,137.00
AR137,K6NE Ventura                      CA US,Tue Jul 27 15:19:44 PDT 2004,0.89,279.00
AR138,K7LHC-1 Lake Havasu               AZ US,Tue Jul 27 15:19:04 PDT 2004,1.34,260.00
AR140,KB0VYO-12 Winona                  MN US,Tue Jul 27 15:13:19 PDT 2004,1.34,0.00
AR141,KB5NMB-5 Fulton                   MS US,Tue Jul 27 15:11:01 PDT 2004,0.00,72.00
AR144,KB6CYS Cypress                    CA US,Tue Jul 27 15:16:01 PDT 2004,2.24,180.00
AR145,KB9KTD-1 Onalaska                 WI US,Tue Jul 27 15:10:08 PDT 2004,0.00,175.00
AR147,W0NWS-4 Colon                     NE US,Tue Jul 27 15:19:49 PDT 2004,5.36,190.00
AR148,K6DYC Meeker                      CO US,Tue Jul 27 15:16:29 PDT 2004,9.83,227.00
AR150,KC4WPS Hendersonville             TN US,Tue Jul 27 15:17:56 PDT 2004,0.89,350.00
AR156,KD4DLT-6 Lithonia                 GA US,Tue Jul 27 15:18:58 PDT 2004,0.00,0.00
AR157,KD4WLI Orlando                    FL US,Tue Jul 27 15:15:22 PDT 2004,1.34,73.00
AR160,NEWPRT Cape Foulweather           OR US,Tue Jul 27 15:15:49 PDT 2004,8.05,350.00
AR161,KD7DR-3 Tempe                     AZ US,Tue Jul 27 15:11:52 PDT 2004,0.89,298.00
AR164,KF6NY Mt. Ranch                   CA US,Tue Jul 27 15:09:04 PDT 2004,2.68,264.00
AR166,KG4LXH-2 Miami                    FL US,Tue Jul 27 15:12:44 PDT 2004,2.24,157.00
AR167,KI0IO-2 Berthoud                  CO US,Tue Jul 27 15:16:36 PDT 2004,1.34,212.00
AR169,KK6RW Gig Harbor                  WA US,Tue Jul 27 15:20:28 PDT 2004,0.45,132.00
AR170,KO5Z Denton                       TX US,Tue Jul 27 15:09:11 PDT 2004,0.89,225.00
AR173,LA2YEA Hauglandshella                NO,Tue Jul 27 15:15:34 PDT 2004,0.00,158.00
AR174,K4AG-6 Miami                      FL US,Tue Jul 27 15:19:16 PDT 2004,2.24,53.00
AR177,K7UGT Cary                        NC US,Tue Jul 27 15:20:00 PDT 2004,0.00,217.00
AR178,KJ3L Erie                         PA US,Tue Jul 27 15:20:08 PDT 2004,2.68,224.00
AR179,KC9AAG Fond Du Lac                WI US,Tue Jul 27 15:20:27 PDT 2004,1.34,51.00
AR180,WB6YPF Altadena                   CA US,Tue Jul 27 15:11:09 PDT 2004,1.79,166.00
AR181,KE6ONT Duarte                     CA US,Tue Jul 27 15:16:02 PDT 2004,2.68,248.00
AR182,GW4TJC Caerphilly                    UK,Tue Jul 27 15:20:09 PDT 2004,0.89,263.00
AR183,N7LUF Hansville                   WA US,Tue Jul 27 15:18:35 PDT 2004,1.79,350.00
AR184,W7PG-10 Forsyth                   MT US,Tue Jul 27 15:16:39 PDT 2004,2.24,27.00
AR185,N1XH-15 Spencer                   MA US,Tue Jul 27 15:19:13 PDT 2004,0.00,13.00
AR190,N6GIW Joshua Tree                 CA US,Tue Jul 27 15:20:01 PDT 2004,9.83,233.00
AR191,WA4BPS Huntsville                 AL US,Tue Jul 27 15:18:24 PDT 2004,1.34,329.00
AR195,N7BIV Glendale                    AZ US,Tue Jul 27 15:19:01 PDT 2004,0.45,45.00
AR196,N7CK San Manuel                   AZ US,Tue Jul 27 15:10:17 PDT 2004,1.79,226.00
AR197,N7FZA-15 Boise                    ID US,Tue Jul 27 15:12:25 PDT 2004,3.13,351.00
AR198,N7GLR Grand Isle                  ME US,Tue Jul 27 15:17:12 PDT 2004,0.89,178.00
AR199,N7TCF Phoenix                     AZ US,Tue Jul 27 15:09:01 PDT 2004,1.34,291.00
AR200,N7TQZ Tacoma                      WA US,Tue Jul 27 15:19:01 PDT 2004,1.34,234.00
AR201,N8NQF-1 Middletown                OH US,Tue Jul 27 15:20:02 PDT 2004,0.00,303.00
AR202,N8VIM Pepperell                   MA US,Tue Jul 27 15:09:32 PDT 2004,0.00,118.00
AR203,N9UDO-2 Baraboo                   WI US,Tue Jul 27 15:18:44 PDT 2004,1.34,259.00
AR205,OE9FWV Feldkirch                     AT,Tue Jul 27 15:18:44 PDT 2004,0.00,342.00
AR206,OK1MX-7 Praha                        CZ,Tue Jul 27 15:12:23 PDT 2004,0.00,232.00
AR208,KD7WIS Miles City                 MT US,Tue Jul 27 15:13:53 PDT 2004,0.45,66.00
AR209,K0OQ Northfield                   MN US,Tue Jul 27 15:16:17 PDT 2004,4.47,196.00
AR212,WX4MAP Phenix City                AL US,Tue Jul 27 15:19:44 PDT 2004,0.89,193.00
AR213,W4HSV Huntsville                  AL US,Tue Jul 27 15:06:42 PDT 2004,0.45,329.00
AR220,KB6KJX Ellensburg                 WA US,Tue Jul 27 15:11:25 PDT 2004,0.89,356.00
AR221,K6TVI-1 Onyx Peak                 CA US,Tue Jul 27 15:13:48 PDT 2004,3.58,248.00
AR223,W7IUC-5 Grassy Key                FL US,Tue Jul 27 15:16:36 PDT 2004,0.00,177.00
AR224,W7IUC-6 Plantation Key            FL US,Tue Jul 27 15:16:49 PDT 2004,0.00,166.00
AR225,KG6QHS Shingletown                CA US,Tue Jul 27 15:18:53 PDT 2004,0.00,264.00
AR226,W4RL-1 Pensacola                  FL US,Tue Jul 27 15:16:11 PDT 2004,0.00,69.00
AR228,N0ERG Littleton                   CO US,Tue Jul 27 15:15:04 PDT 2004,0.00,150.00
AR230,K4DIG-7 Sardis Springs            AL US,Tue Jul 27 15:19:25 PDT 2004,0.00,326.00
AR231,KB5GAS-1 Balloon Fiesta           NM US,Tue Jul 27 15:19:14 PDT 2004,0.89,112.00
AR232,KC7RJK Eugene                     OR US,Tue Jul 27 15:16:08 PDT 2004,1.79,21.00
AR233,N4BK-5 Hartselle                  AL US,Tue Jul 27 15:19:08 PDT 2004,0.45,292.00
AR234,NK7W Reno                         NV US,Tue Jul 27 15:19:42 PDT 2004,1.34,284.00
AR238,N5YXO Granbury                    TX US,Tue Jul 27 15:15:51 PDT 2004,1.34,82.00
AR243,K4TPD-5 Tallahassee               FL US,Tue Jul 27 15:18:28 PDT 2004,0.45,339.00
AR245,K7HRT Greenacres                  WA US,Tue Jul 27 15:19:22 PDT 2004,19.22,347.00
AR248,K7VIP Tucson                      AZ US,Tue Jul 27 15:17:54 PDT 2004,3.58,225.00
AR249,KA5WRG Oklahoma City              OK US,Tue Jul 27 15:18:55 PDT 2004,0.45,158.00
AR250,KA8SCP Westford                   MA US,Tue Jul 27 15:16:32 PDT 2004,0.00,140.00
AR252,KB7IPU-2 Payson                   AZ US,Tue Jul 27 15:17:22 PDT 2004,3.58,309.00
AR254,KB9TPG Viroqua                    WI US,Tue Jul 27 15:20:27 PDT 2004,0.00,289.00
AR255,KC4YLE Efland                     NC US,Tue Jul 27 15:20:35 PDT 2004,0.00,272.00
AR256,W5HKR Schertz                     TX US,Tue Jul 27 15:15:59 PDT 2004,0.00,66.00
AR257,N1ETY New Britain                 CT US,Tue Jul 27 15:20:31 PDT 2004,0.00,337.00
AR258,KC8HJN Ludington                  MI US,Tue Jul 27 15:18:57 PDT 2004,1.34,234.00
AR259,KD5CUW-1 Copperas Cove            TX US,Tue Jul 27 15:20:27 PDT 2004,0.00,165.00
AR260,KD5FDE Runaway Bay                TX US,Tue Jul 27 15:15:19 PDT 2004,0.45,92.00
AR261,KD6RXY Calimesa                   CA US,Tue Jul 27 15:08:47 PDT 2004,4.92,277.00
AR264,K0JDN Phoenix                     AZ US,Tue Jul 27 15:17:51 PDT 2004,2.68,208.00
AR266,KJ7XE Port Angeles                WA US,Tue Jul 27 15:19:54 PDT 2004,0.00,0.00
AR269,KC7PHC Orofino                    ID US,Tue Jul 27 15:15:06 PDT 2004,0.45,270.00
AR271,AA0MM-2 Holton                    KS US,Tue Jul 27 15:20:02 PDT 2004,2.24,139.00
AR272,KG4JPL Hudson                     FL US,Tue Jul 27 15:20:38 PDT 2004,1.34,66.00
AR273,N1JJX Southington                 CT US,Tue Jul 27 15:16:33 PDT 2004,0.00,55.00
AR274,W4RP Palm Bay                     FL US,Tue Jul 27 15:17:30 PDT 2004,1.79,88.00
AR276,W2RZS Hawthorn                    NY US,Tue Jul 27 15:08:16 PDT 2004,0.89,6.00
AR277,VE2GAT-2 St.Hyacinthe             QB CA,Tue Jul 27 15:20:16 PDT 2004,1.34,135.00
AR279,VE3COE Kincardine                ONT CA,Tue Jul 27 15:10:41 PDT 2004,0.89,47.00
AR280,VE3JON Kincardine                ONT CA,Tue Jul 27 15:08:57 PDT 2004,0.00,15.00
AR282,VE7IMD-2 Delta                    BC CA,Tue Jul 27 15:18:58 PDT 2004,0.00,21.00
AR286,K0NSA Omaha                       NE US,Tue Jul 27 15:20:39 PDT 2004,5.81,171.00
AR290,AB4KN Peachtree City              GA US,Tue Jul 27 15:17:00 PDT 2004,1.34,269.00
AR299,KB5NMB-15 Belmont                 MS US,Tue Jul 27 15:15:33 PDT 2004,0.00,99.00
AR300,KB8GQ Galloway                    OH US,Tue Jul 27 15:16:05 PDT 2004,1.79,0.00
AR301,N5KUK Norman                      OK US,Tue Jul 27 15:20:39 PDT 2004,1.79,152.00
AR302,N4NW Stafford                     VA US,Tue Jul 27 15:19:19 PDT 2004,0.00,189.00
AR303,DL1BLU Schortens                     DE,Tue Jul 27 15:15:21 PDT 2004,0.00,324.00
AR304,AA6HF-5 Cathedral City            CA US,Tue Jul 27 15:12:03 PDT 2004,1.34,352.00
AR305,KF6ZGH Fremont                    CA US,Tue Jul 27 15:20:30 PDT 2004,4.47,281.00
AR306,KQ6DI-15 Livermore                CA US,Tue Jul 27 15:11:46 PDT 2004,4.92,243.00
AR308,W8EHH Winter Garden               FL US,Tue Jul 27 15:19:46 PDT 2004,0.89,32.00
AR309,WB6ABE-4 Benicia                  CA US,Tue Jul 27 15:15:54 PDT 2004,9.39,280.00
AR310,K4ROK-10 Fountain                 NC US,Tue Jul 27 15:16:28 PDT 2004,1.34,27.00
AR311,KD4DLT-3 Lithonia                 GA US,Tue Jul 27 15:19:38 PDT 2004,0.00,198.00
AR312,WA6BAY-1 Soquel                   CA US,Tue Jul 27 15:16:27 PDT 2004,0.00,143.00
AR313,WB6AHC-1 San Jose                 CA US,Tue Jul 27 15:15:22 PDT 2004,2.68,291.00
AR314,N7NAT Yakima                      WA US,Tue Jul 27 15:19:21 PDT 2004,0.00,255.00
AR315,OH6GPB Pietarsaari                   FI,Tue Jul 27 15:10:49 PDT 2004,0.45,45.00
AR319,VK7HDM-5 Hobart                  TAS AU,Tue Jul 27 15:20:32 PDT 2004,1.79,303.00
AR320,K6TZ Diablo Peak                  CA US,Tue Jul 27 15:16:31 PDT 2004,0.00,321.00
AR323,KF6YUA Sebastopol                 CA US,Tue Jul 27 15:16:08 PDT 2004,4.02,261.00
AR327,WB1FYE Weirs Beach                NH US,Tue Jul 27 15:20:07 PDT 2004,0.00,90.00
AR328,N1EO Center Harbor                NH US,Tue Jul 27 15:17:00 PDT 2004,0.00,295.00
AR329,KA1RVR Epping                     NH US,Tue Jul 27 15:20:24 PDT 2004,0.00,108.00
AR332,KD2KB Coudersport                 PA US,Tue Jul 27 15:20:27 PDT 2004,0.00,151.00
AR333,WO4U-10 Crossville                TN US,Tue Jul 27 15:20:34 PDT 2004,0.89,40.00
AR334,W4OZK-8 Collinsville              AL US,Tue Jul 27 15:16:33 PDT 2004,0.00,46.00
AR335,KB0RF San Jose                    CA US,Tue Jul 27 15:18:45 PDT 2004,1.79,282.00
AR338,N3WKE Baltimore                   MD US,Tue Jul 27 15:18:35 PDT 2004,2.24,92.00
AR339,AB0YW Blair                       NE US,Tue Jul 27 15:19:26 PDT 2004,3.13,124.00
AR342,N2NZD Copake                      NY US,Tue Jul 27 15:19:43 PDT 2004,0.00,351.00
AR343,WA1OUI West Simsbury              CT US,Tue Jul 27 15:17:26 PDT 2004,0.00,15.00
AR345,KD5ZLP Rowlett                    TX US,Tue Jul 27 15:20:14 PDT 2004,0.00,82.00
AR346,TG9RB Guatemala City                 GT,Tue Jul 27 15:18:31 PDT 2004,1.79,346.00
AR347,KC5ZJO-1 Madison                  AL US,Tue Jul 27 15:15:07 PDT 2004,1.34,72.00
AR348,KG4VVU Helena                     AL US,Tue Jul 27 15:11:21 PDT 2004,0.45,171.00
AR351,ON7EQ-1 Brugge                       BE,Tue Jul 27 15:16:56 PDT 2004,0.00,32.00
AR354,W7PAQ Missoula                    MT US,Tue Jul 27 15:20:39 PDT 2004,0.00,268.00
AR356,AG1C Westborough                  MA US,Tue Jul 27 15:10:56 PDT 2004,0.00,45.00
AR357,WB1ETW Plainville                 MA US,Tue Jul 27 15:16:10 PDT 2004,0.45,73.00
AR358,N1MZX Peterborough                NH US,Tue Jul 27 15:20:27 PDT 2004,0.45,58.00
AR363,KC0MKS-10 Knife River             MN US,Tue Jul 27 15:13:06 PDT 2004,4.47,230.00
AR365,KM6GE Allenspark                  CO US,Tue Jul 27 15:18:54 PDT 2004,0.45,233.00
AR366,KB9VSQ Reedsburg                  WI US,Tue Jul 27 15:19:36 PDT 2004,1.34,251.00
AR368,WA0VSL Monument                   CO US,Tue Jul 27 15:15:18 PDT 2004,0.00,209.00
AR369,VA4GD Pinawa                     MAN CA,Tue Jul 27 15:20:29 PDT 2004,0.89,196.00
AR370,K7RKT Lake Oswego                 OR US,Tue Jul 27 15:18:16 PDT 2004,0.00,0.00
AR375,W4OSC Cope                        SC US,Tue Jul 27 15:06:17 PDT 2004,2.24,87.00
AR376,N9QIP Arlington                   WI US,Tue Jul 27 15:20:27 PDT 2004,1.79,282.00
AR377,N9WWR Racine                      WI US,Tue Jul 27 15:19:00 PDT 2004,0.00,248.00
AR378,WD8JVQ Petoskey                   MI US,Tue Jul 27 15:14:20 PDT 2004,3.13,313.00
AR380,KC8YHQ Sanford                    MI US,Tue Jul 27 15:20:05 PDT 2004,0.89,299.00
AR383,K5WPN-10 Duncan                   OK US,Tue Jul 27 15:20:32 PDT 2004,5.36,135.00
