QURC2,Quincy_Res,Mon Jul 26 15:00:00 PDT 2004,1.43,276.00
DHPC2,Diamond_Hill,Mon Jul 26 15:00:00 PDT 2004,5.59,214.00
BHNC2,Brighton,Mon Jul 26 15:00:00 PDT 2004,0.76,259.00
SQWC2,Squaw_Mountain,Mon Jul 26 15:00:00 PDT 2004,4.56,183.00
HGCC2,Hiwan_G.C.,Mon Jul 26 15:00:00 PDT 2004,0.45,18.00
HIGC2,Highlands_Ranch_WTP,Mon Jul 26 15:00:00 PDT 2004,6.66,326.00
SAPC2,Salisbury_Park,Mon Jul 26 15:00:00 PDT 2004,1.30,152.00
COKC2,Castle_Rock,Mon Jul 26 15:00:00 PDT 2004,1.56,191.00
WRDC2,Ward_C-1,Mon Jul 26 15:00:00 PDT 2004,2.19,264.00
SFSC2,Sugarloaf,Mon Jul 26 15:00:00 PDT 2004,1.79,197.00
LEWC2,Louisville_Lake,Mon Jul 26 15:00:00 PDT 2004,4.60,264.00
CALC2,Cal-Wood_Ranch,Mon Jul 26 15:00:00 PDT 2004,0.98,180.00
AURC2,Aurora_Reservoir,Mon Jul 26 15:00:00 PDT 2004,2.59,124.00
MSTC2,Marston_Lake_North,Mon Jul 26 15:00:00 PDT 2004,0.58,288.00
CSUF,CSU Foothills Campus                   ColoState,Mon Jul 26 15:00:00 PDT 2004,2.06,128.00
NWTM6,Newton MS/Jackson State University     MS-Mesonet,Mon Jul 26 15:00:00 PDT 2004,4.80,144.00
JAYF1,Jay                                    FAWN,Mon Jul 26 15:00:00 PDT 2004,2.52,216.30
QUIF1,Quincy                                 FAWN,Mon Jul 26 15:00:00 PDT 2004,1.85,266.70
CARF1,Carrabelle                             FAWN,Mon Jul 26 15:00:00 PDT 2004,1.76,192.40
LIOF1,Live Oak                               FAWN,Mon Jul 26 15:00:00 PDT 2004,1.37,79.09
MACF1,Macclenny                              FAWN,Mon Jul 26 15:00:00 PDT 2004,2.01,175.90
BRZF1,Bronson                                FAWN,Mon Jul 26 15:00:00 PDT 2004,2.64,251.00
PHAF1,Putnam Hall                            FAWN,Mon Jul 26 15:00:00 PDT 2004,2.01,98.60
TRAF1,Citra                                  FAWN,Mon Jul 26 15:00:00 PDT 2004,1.10,21.14
ALHF1,Alachua                                FAWN,Mon Jul 26 15:00:00 PDT 2004,0.56,279.70
STNF1,Hastings                               FAWN,Mon Jul 26 15:00:00 PDT 2004,5.19,81.70
CKHF1,Ocklawaha                              FAWN,Mon Jul 26 15:00:00 PDT 2004,0.73,101.10
EPRF1,Pierson                                FAWN,Mon Jul 26 15:00:00 PDT 2004,1.79,81.50
VRSF1,Tavares                                FAWN,Mon Jul 26 15:00:00 PDT 2004,3.52,251.10
UMLF1,Umatilla                               FAWN,Mon Jul 26 15:00:00 PDT 2004,3.27,66.62
KHPF1,Okahumpka                              FAWN,Mon Jul 26 15:00:00 PDT 2004,4.63,242.30
VLNF1,Avalon                                 FAWN,Mon Jul 26 15:00:00 PDT 2004,2.71,264.30
KSLF1,Brooksville                            FAWN,Mon Jul 26 15:00:00 PDT 2004,4.35,275.80
POPF1,Apopka                                 FAWN,Mon Jul 26 15:00:00 PDT 2004,4.71,66.06
KALF1,Lake Alfred                            FAWN,Mon Jul 26 15:00:00 PDT 2004,2.34,222.20
KENF1,Kenansville                            FAWN,Mon Jul 26 15:00:00 PDT 2004,2.66,108.30
DOVF1,Dover                                  FAWN,Mon Jul 26 15:00:00 PDT 2004,1.01,215.60
DNTF1,Bradenton                              FAWN,Mon Jul 26 15:00:00 PDT 2004,1.17,224.40
FDLF1,Fort Lauderdale                        FAWN,Mon Jul 26 15:00:00 PDT 2004,3.20,147.90
PCEF1,Fort Pierce                            FAWN,Mon Jul 26 15:00:00 PDT 2004,2.86,121.40
STDF1,Homestead                              FAWN,Mon Jul 26 15:00:00 PDT 2004,4.41,292.39
PALF1,Palmdale                               FAWN,Mon Jul 26 15:00:00 PDT 2004,0.40,348.10
SEBF1,Sebring                                FAWN,Mon Jul 26 15:00:00 PDT 2004,0.77,75.40
CO085,Shoshone Dam (8),Mon Jul 26 15:01:00 PDT 2004,4.92,260.00
CO086,West Tunnel Portal (8),Mon Jul 26 15:00:00 PDT 2004,3.13,245.00
CO092,Dowd Junction (10),Mon Jul 26 15:04:00 PDT 2004,4.02,95.00
CO100,Aspen (10),Mon Jul 26 15:05:00 PDT 2004,0.89,265.00
CO104,Shale Bluffs (10),Mon Jul 26 15:01:00 PDT 2004,4.02,335.00
H0038,Kennesaw      GA,Mon Jul 26 15:01:00 PDT 2004,0.00,120.00
H0491,Greensboro   NC,Mon Jul 26 15:03:00 PDT 2004,0.45,280.00
H0396,Williamson          County Franklin TN,Mon Jul 26 15:00:00 PDT 2004,1.34,300.00
MN015,Alexandria I-94 Mile Post 104,Mon Jul 26 15:00:00 PDT 2004,6.67,155.00
AP003,N0XGA Aurora                      CO US,Mon Jul 26 15:03:52 PDT 2004,1.34,44.00
AP005,W0MAF-1 Lee's Summit              MO US,Mon Jul 26 15:04:55 PDT 2004,0.45,303.00
AP013,W0LED-1 Crystal                   MN US,Mon Jul 26 15:01:29 PDT 2004,0.89,201.00
AP015,WA2GUG-2 Cairo                    NY US,Mon Jul 26 15:03:00 PDT 2004,0.00,3.00
AP017,N7ZEF Sinclair                    WY US,Mon Jul 26 15:01:45 PDT 2004,0.45,250.00
AP018,N3HPR Erie                        PA US,Mon Jul 26 15:04:04 PDT 2004,0.00,358.00
AP022,WB2WPA-4 Naples                   FL US,Mon Jul 26 15:04:12 PDT 2004,0.00,295.00
AP023,WA4PDM Henderson SCMR             NV US,Mon Jul 26 15:03:39 PDT 2004,1.34,148.00
AP028,KG4DUC-5 Mulberry                 FL US,Mon Jul 26 15:01:04 PDT 2004,0.89,0.00
AP030,NA4AR Seminole                    FL US,Mon Jul 26 15:01:06 PDT 2004,0.00,28.00
AP036,N7YT Bremerton                    WA US,Mon Jul 26 15:05:13 PDT 2004,1.34,286.00
AP043,WB0NKX Faribault                  MN US,Mon Jul 26 15:04:32 PDT 2004,0.00,270.00
AP044,KD4SFD Greer                      SC US,Mon Jul 26 15:04:19 PDT 2004,1.79,96.00
AP046,WA5RRN Topeka                     KS US,Mon Jul 26 15:02:46 PDT 2004,0.45,104.00
AP053,W5VEX-1 Belton                    TX US,Mon Jul 26 15:05:02 PDT 2004,3.13,309.00
AP058,N0BKB Greenfield                  IA US,Mon Jul 26 15:03:40 PDT 2004,1.34,266.00
AP061,KG6TQ Sacramento                  CA US,Mon Jul 26 15:02:36 PDT 2004,1.34,194.00
AP063,N4JCV Orlando                     FL US,Mon Jul 26 15:05:22 PDT 2004,0.00,107.00
AP065,KC5GOI Denton                     TX US,Mon Jul 26 15:05:07 PDT 2004,2.24,0.00
AP067,N4WDH Wesley Chapel               FL US,Mon Jul 26 15:04:10 PDT 2004,1.34,242.00
AP069,WX3I Eagleville                   PA US,Mon Jul 26 15:02:29 PDT 2004,0.00,66.00
AP076,W5NGU-3 Denton                    TX US,Mon Jul 26 15:00:32 PDT 2004,1.34,358.00
AP078,K0DSP-7 Lincoln                   NE US,Mon Jul 26 15:02:39 PDT 2004,1.79,112.00
AP085,VK3JFK Kyneton                       AU,Mon Jul 26 15:00:45 PDT 2004,0.00,172.00
AP089,OH2GAX Tuusula                       FI,Mon Jul 26 15:00:44 PDT 2004,0.00,225.00
AP093,W0NWS Valley                      NE US,Mon Jul 26 15:04:18 PDT 2004,3.58,165.00
AP094,W0NWS-3 Omaha                     NE US,Mon Jul 26 15:05:21 PDT 2004,4.02,221.00
AP095,AJ0A Papillion                    NE US,Mon Jul 26 15:02:23 PDT 2004,1.34,91.00
AP096,AE5PL Melissa                     TX US,Mon Jul 26 15:02:41 PDT 2004,4.02,80.00
AP101,W2FAR Nunda                       NY US,Mon Jul 26 15:00:56 PDT 2004,2.24,105.00
AP105,KD4LXB-3 Boynton Beach            FL US,Mon Jul 26 15:03:50 PDT 2004,3.58,148.00
AP110,KB8SSH Columbus                   OH US,Mon Jul 26 15:03:50 PDT 2004,1.34,47.00
AP113,W4NHL-12 Pinellas Co              FL US,Mon Jul 26 15:04:14 PDT 2004,0.45,247.00
AP117,N5FAZ-2 El Paso                   TX US,Mon Jul 26 15:01:17 PDT 2004,1.34,128.00
AP120,KC8LCP-10 Grand Haven             MI US,Mon Jul 26 15:02:59 PDT 2004,2.68,325.00
AP121,KC8LCP-11 Grand Haven             MI US,Mon Jul 26 15:04:08 PDT 2004,5.81,308.00
AP129,K7D3 Baldwin                      MI US,Mon Jul 26 15:05:05 PDT 2004,4.02,34.00
AP133,K80D Harrison                     MI US,Mon Jul 26 15:00:50 PDT 2004,3.58,87.00
AP136,KC04 Oceana                       MI US,Mon Jul 26 15:03:36 PDT 2004,4.47,343.00
AP137,N0WPS Littleton                   CO US,Mon Jul 26 15:02:58 PDT 2004,4.02,15.00
AP138,WA0RTU Savannah                   MO US,Mon Jul 26 15:03:26 PDT 2004,0.00,129.00
AP139,AA5QJ-1 Las Vegas                 NV US,Mon Jul 26 15:02:30 PDT 2004,5.81,241.00
AP141,WN5PFI-8 Huntsville               UT US,Mon Jul 26 15:00:38 PDT 2004,0.00,190.00
AP143,K5BL McKinney                     TX US,Mon Jul 26 15:00:58 PDT 2004,2.68,47.00
AP150,N9EE-1 New Port Richey            FL US,Mon Jul 26 15:04:06 PDT 2004,0.00,149.00
AP155,WX7YUM Yuma                       AZ US,Mon Jul 26 15:00:33 PDT 2004,1.79,275.00
AP156,WA6TK Rosamond                    CA US,Mon Jul 26 15:04:35 PDT 2004,7.60,213.00
AP163,KC5LXC Stillwater                 MN US,Mon Jul 26 15:00:28 PDT 2004,1.34,154.00
AP164,WB7UVH Washougal                  WA US,Mon Jul 26 15:00:59 PDT 2004,0.89,140.00
AP167,N3DXC Commodore                   PA US,Mon Jul 26 15:03:39 PDT 2004,1.79,135.00
AP172,KD7FBT Aberdeen                   WA US,Mon Jul 26 15:03:02 PDT 2004,0.00,247.00
AP176,KG0HM-2 Crystal Lakes             CO US,Mon Jul 26 15:03:24 PDT 2004,0.00,13.00
AP181,KG4FZO-5 Kissimmee                FL US,Mon Jul 26 15:04:38 PDT 2004,0.00,112.00
AP182,W5EUT-5 Antero Junction           CO US,Mon Jul 26 15:03:05 PDT 2004,0.00,180.00
AP183,NN5DX-5 Fort Stockton             TX US,Mon Jul 26 15:01:16 PDT 2004,1.79,46.00
AP185,N4BSA Clearwater                  FL US,Mon Jul 26 15:04:51 PDT 2004,0.00,196.00
AP187,KD4PMP Nashville                  TN US,Mon Jul 26 15:05:13 PDT 2004,0.45,35.00
AP190,K0ANI Denver                      CO US,Mon Jul 26 15:01:11 PDT 2004,1.34,293.00
AP194,WD9EKA Marshall                   IL US,Mon Jul 26 15:02:22 PDT 2004,0.00,274.00
AP198,W6PKT-3 No. Ukiah                 CA US,Mon Jul 26 15:04:01 PDT 2004,4.02,313.00
AP199,K6EKB-5 Cameron Park              CA US,Mon Jul 26 15:04:31 PDT 2004,2.68,345.00
AP200,N6TBQ Del Rey Oaks                CA US,Mon Jul 26 15:04:26 PDT 2004,3.58,285.00
AP202,W6BXN-3 Bear Valley               CA US,Mon Jul 26 15:00:29 PDT 2004,3.13,218.00
AP203,KF6HJO Selma                      CA US,Mon Jul 26 15:00:27 PDT 2004,0.00,240.00
AP204,KD6DSI San Luis Obispo            CA US,Mon Jul 26 15:04:03 PDT 2004,2.24,359.00
AP206,K1PIG-4 Kent's Hill               ME US,Mon Jul 26 15:05:15 PDT 2004,0.00,267.00
AP207,KD1KE Freedom                     ME US,Mon Jul 26 15:00:39 PDT 2004,0.00,208.00
AP208,WB7COX Nampa                      ID US,Mon Jul 26 15:00:14 PDT 2004,1.34,183.00
AP214,K1MGY Littleton                   MA US,Mon Jul 26 15:00:20 PDT 2004,0.00,195.00
AP216,W0BIS-8 St. Anthony               ND US,Mon Jul 26 15:04:26 PDT 2004,9.39,153.00
AP217,W0BIS-4 Flasher                   ND US,Mon Jul 26 15:00:58 PDT 2004,6.26,162.00
AP218,W0BIS-5 Selfridge                 ND US,Mon Jul 26 15:00:26 PDT 2004,9.83,180.00
AP219,W0BIS-6 Center                    ND US,Mon Jul 26 15:01:30 PDT 2004,3.58,181.00
AP225,N0LRF Berryton                    KS US,Mon Jul 26 15:00:58 PDT 2004,0.00,137.00
AP227,KC5UNC W.Oklahoma City            OK US,Mon Jul 26 15:02:30 PDT 2004,0.45,21.00
AP228,KM5HG-3 Claremore                 OK US,Mon Jul 26 15:04:08 PDT 2004,2.68,11.00
AP245,W1SEM Easthampton                 MA US,Mon Jul 26 15:00:26 PDT 2004,0.00,20.00
AP248,N2QJU Waterloo                    NY US,Mon Jul 26 15:02:55 PDT 2004,0.00,65.00
AP255,K5WPH El Paso                     TX US,Mon Jul 26 15:01:16 PDT 2004,0.00,359.00
AP264,W0WOB Colby                       KS US,Mon Jul 26 15:00:58 PDT 2004,5.36,135.00
AP267,KP3G Juncos                       PR US,Mon Jul 26 15:00:14 PDT 2004,0.00,89.00
AP271,W0BIS-7 New Salem                 ND US,Mon Jul 26 15:03:04 PDT 2004,8.05,174.00
AP273,N1HRK N.Kingston                  RI US,Mon Jul 26 15:04:15 PDT 2004,0.00,17.00
AP277,WA6OFT Parker                     AZ US,Mon Jul 26 15:05:10 PDT 2004,2.24,205.00
AP278,N1WTQ Bangor                      ME US,Mon Jul 26 15:04:54 PDT 2004,0.00,281.00
AP283,KA1WTS-15 Salem                   CT US,Mon Jul 26 15:04:36 PDT 2004,1.34,0.00
AP284,WY1U Wallingford                  CT US,Mon Jul 26 15:00:55 PDT 2004,0.45,171.00
AP292,WU2Z N. Brunswick                 NJ US,Mon Jul 26 15:02:02 PDT 2004,0.00,18.00
AP302,N1TKK-1 San Juan                  PR US,Mon Jul 26 15:02:07 PDT 2004,3.58,63.00
AP307,WA3NNA Larchmont                  PA US,Mon Jul 26 15:01:05 PDT 2004,1.79,120.00
AP312,K2SLZ-5 East Aurora               NY US,Mon Jul 26 15:01:24 PDT 2004,1.34,76.00
AP313,AA2AC-2 Clarence Center           NY US,Mon Jul 26 15:00:13 PDT 2004,1.34,73.00
AP314,W2SO-1 Lancaster                  NY US,Mon Jul 26 15:03:37 PDT 2004,3.58,64.00
AP319,VE3DTV Hamilton                  ONT CA,Mon Jul 26 15:01:05 PDT 2004,3.58,62.00
AP321,VE3KSR Kitchner                  ONT CA,Mon Jul 26 15:03:53 PDT 2004,4.92,117.00
AP326,WA8SIE Spring Hill                WV US,Mon Jul 26 15:02:00 PDT 2004,0.89,310.00
AP340,W4HF-1 Wilkesboro                 NC US,Mon Jul 26 15:03:56 PDT 2004,0.00,97.00
AP345,N8UMU Waterville                  OH US,Mon Jul 26 15:04:40 PDT 2004,2.68,16.00
AP346,AB8KN-2 Upper Arlington           OH US,Mon Jul 26 15:04:59 PDT 2004,3.13,319.00
AP347,WA8ZWJ Union                      OH US,Mon Jul 26 15:02:25 PDT 2004,0.00,1.00
AP349,W8GUC Vandalia                    OH US,Mon Jul 26 15:02:47 PDT 2004,2.24,7.00
AP350,W8DYY Miamisburg                  OH US,Mon Jul 26 15:04:25 PDT 2004,0.00,33.00
AP352,N8NQF Middletown                  OH US,Mon Jul 26 15:04:42 PDT 2004,3.13,49.00
AP355,KB8SGF Detroit                    MI US,Mon Jul 26 15:05:21 PDT 2004,0.45,35.00
AP359,K7UHP West Point                  UT US,Mon Jul 26 15:03:04 PDT 2004,0.89,162.00
AP365,KD4MWO Holly Ford                 FL US,Mon Jul 26 15:02:21 PDT 2004,0.00,0.00
AP374,KG4JAC-2 Palm Shores              FL US,Mon Jul 26 15:05:13 PDT 2004,0.00,0.00
AP377,W9QL Druce Lake                   IL US,Mon Jul 26 15:04:09 PDT 2004,0.00,90.00
AP380,WO4U-10 Crossville                TN US,Mon Jul 26 15:04:31 PDT 2004,0.00,2.00
AP388,W4EPI-4 Snellville                GA US,Mon Jul 26 15:00:32 PDT 2004,1.34,164.00
AP394,KN4YZ Peachtree City              GA US,Mon Jul 26 15:05:02 PDT 2004,0.00,125.00
AP395,AB4KN Peachtree City              GA US,Mon Jul 26 15:01:17 PDT 2004,0.00,142.00
AP400,WA9YVE Ixonia                     WI US,Mon Jul 26 15:05:20 PDT 2004,0.89,200.00
AP401,N9OIG Union Grove                 WI US,Mon Jul 26 15:04:14 PDT 2004,0.00,176.00
AP403,KF4CHG Ft.White                   FL US,Mon Jul 26 15:05:10 PDT 2004,0.45,68.00
AP408,W0GJB Conifer                     CO US,Mon Jul 26 15:05:21 PDT 2004,0.45,204.00
AP410,N4XI-5 Evansville                 IN US,Mon Jul 26 15:05:12 PDT 2004,1.34,265.00
AP423,WA6OFT-4 Poston                   AZ US,Mon Jul 26 15:04:39 PDT 2004,4.02,225.00
AP426,N0SLJ Harrisonville               MO US,Mon Jul 26 15:01:56 PDT 2004,0.00,295.00
AP427,KB0VZP Warrensburg                MO US,Mon Jul 26 15:04:46 PDT 2004,0.00,49.00
AP429,KC0CZI Jefferson City             MO US,Mon Jul 26 15:04:44 PDT 2004,0.00,0.00
AP431,K0STL-15 Manchester               MO US,Mon Jul 26 15:00:04 PDT 2004,0.45,320.00
AP449,WB9BJQ Onalaska                   WI US,Mon Jul 26 15:04:00 PDT 2004,0.89,304.00
AP455,W0NSA Omaha                       NE US,Mon Jul 26 15:05:00 PDT 2004,3.13,186.00
AP458,N5RIG Fremont                     NE US,Mon Jul 26 15:04:05 PDT 2004,2.24,242.00
AP460,KB0VMZ Belmont                    NE US,Mon Jul 26 15:04:24 PDT 2004,0.89,225.00
AP463,K4RVH Madison                     AL US,Mon Jul 26 15:01:53 PDT 2004,0.45,342.00
AP464,KU4ME Andersonville               TN US,Mon Jul 26 15:03:34 PDT 2004,0.00,285.00
AP472,W7EPP Lynden                      WA US,Mon Jul 26 15:01:27 PDT 2004,3.13,206.00
AP477,KC7ZPO Milwaukie                  OR US,Mon Jul 26 15:05:21 PDT 2004,0.89,334.00
AP479,KC7AM-10 Tollgate                 OR US,Mon Jul 26 15:03:33 PDT 2004,1.34,3.00
AP483,N9OSQ-7 Pensacola                 FL US,Mon Jul 26 15:00:36 PDT 2004,0.00,200.00
AP487,WX6X Springfield                  MO US,Mon Jul 26 15:02:51 PDT 2004,0.00,312.00
AP492,WA6OFT-5 Quartzsite               AZ US,Mon Jul 26 15:04:16 PDT 2004,0.00,193.00
AP499,KD4YJJ-2 Pensacola                FL US,Mon Jul 26 15:01:22 PDT 2004,0.00,219.00
AP500,N1SKZ Hillsboro                   NH US,Mon Jul 26 15:00:35 PDT 2004,0.00,68.00
AP504,N4BHM Roanoke                     VA US,Mon Jul 26 15:01:45 PDT 2004,0.00,41.00
AP505,WK1F-2 Yulee                      FL US,Mon Jul 26 15:00:52 PDT 2004,0.00,12.00
AP513,WB4QEV-4 Hollingers Is.           AL US,Mon Jul 26 15:04:33 PDT 2004,5.36,177.00
AP519,W2KB Lebanon Twp.                 NJ US,Mon Jul 26 15:03:46 PDT 2004,0.00,135.00
AP520,WA4LZC Orlando                    FL US,Mon Jul 26 15:01:28 PDT 2004,0.00,41.00
AP521,KD4K Cumming                      GA US,Mon Jul 26 15:04:24 PDT 2004,0.00,299.00
AP522,K3CHZ Dayton                      MD US,Mon Jul 26 15:05:12 PDT 2004,0.00,185.00
AP525,N6RZR-2 Anderson                  CA US,Mon Jul 26 15:01:03 PDT 2004,1.79,181.00
AP526,KG4CVZ Tallulah Falls             GA US,Mon Jul 26 15:00:08 PDT 2004,0.00,359.00
AP528,W7IUC-4 Marathon                  FL US,Mon Jul 26 15:00:38 PDT 2004,0.00,149.00
AP530,W7IUC-3 Big Pine Key              FL US,Mon Jul 26 15:03:56 PDT 2004,0.00,84.00
AP534,W2MJD Hempstead                   NY US,Mon Jul 26 15:03:35 PDT 2004,0.89,182.00
AP535,N1LTP Norton                      MA US,Mon Jul 26 15:03:23 PDT 2004,1.79,31.00
AP537,KC6TYC Port St. John              FL US,Mon Jul 26 15:04:19 PDT 2004,0.45,31.00
AP538,WA3YML Thornhurst                 PA US,Mon Jul 26 15:00:37 PDT 2004,0.00,215.00
AP540,LU2VA-8 Neuquen                      AR,Mon Jul 26 15:00:13 PDT 2004,4.02,135.00
AP541,AD6NH Placentia                   CA US,Mon Jul 26 15:03:57 PDT 2004,0.45,231.00
AP542,WM0F Berthoud                     CO US,Mon Jul 26 15:00:14 PDT 2004,3.13,180.00
AP551,KB0WJQ-1 Rock Rapids              IA US,Mon Jul 26 15:00:52 PDT 2004,4.47,162.00
AP559,N9LYA-3 Mitchell                  IN US,Mon Jul 26 15:00:36 PDT 2004,0.00,351.00
AP560,KB9LHX-6 Jasper                   IN US,Mon Jul 26 15:00:59 PDT 2004,0.45,0.00
AP561,AI9H-6 Mount Carmel               IL US,Mon Jul 26 15:02:24 PDT 2004,2.24,97.00
AP564,N1OTX Woburn                      MA US,Mon Jul 26 15:03:09 PDT 2004,2.24,128.00
AP565,KQ4YD White City                  FL US,Mon Jul 26 15:00:48 PDT 2004,0.00,328.00
AP566,KQ4KX Lakeland                    FL US,Mon Jul 26 15:00:42 PDT 2004,1.34,134.00
AP570,KF3BH Catawissa                   PA US,Mon Jul 26 15:03:13 PDT 2004,0.00,336.00
AP574,K0JJV Hays                        KS US,Mon Jul 26 15:01:14 PDT 2004,2.68,135.00
AP575,KB5WIO Amarillo                   TX US,Mon Jul 26 15:03:22 PDT 2004,1.79,177.00
AP577,K4MG Ocala                        FL US,Mon Jul 26 15:03:27 PDT 2004,0.00,114.00
AP578,W1ZCJ Chelsea                     VT US,Mon Jul 26 15:00:34 PDT 2004,0.00,203.00
AP580,WA9IN-2 Washington                IN US,Mon Jul 26 15:03:28 PDT 2004,0.00,230.00
AP583,W9HOI Kickapoo                    IL US,Mon Jul 26 15:01:48 PDT 2004,1.34,17.00
AP584,KC9BWF-1 Green Bay                WI US,Mon Jul 26 15:04:54 PDT 2004,0.00,0.00
AP585,KC9BWF-3 Green Bay                WI US,Mon Jul 26 15:02:15 PDT 2004,4.47,117.00
AP586,N1EPX Jamaica Plain               MA US,Mon Jul 26 15:03:46 PDT 2004,1.34,79.00
AP588,WD4CD Pickens                     SC US,Mon Jul 26 15:00:15 PDT 2004,0.00,129.00
AP590,KD5RXP Ft.Worth                   TX US,Mon Jul 26 15:04:51 PDT 2004,0.00,0.00
AP593,KC5JIF Amarillo                   TX US,Mon Jul 26 15:00:29 PDT 2004,1.34,357.00
AP594,KC5JZG-2 Bryan                    TX US,Mon Jul 26 15:04:25 PDT 2004,2.68,318.00
AP599,N1HQ Panama City                  FL US,Mon Jul 26 15:04:48 PDT 2004,0.89,147.00
AP602,KG5RG Dickinson                   TX US,Mon Jul 26 15:02:06 PDT 2004,1.34,13.00
AP610,WB9HLA-2 Hartford City            IN US,Mon Jul 26 15:05:25 PDT 2004,1.34,43.00
AP613,PA0OKE Neptunuslaan                  NL,Mon Jul 26 15:02:48 PDT 2004,0.00,50.00
AP616,PA1PV Haarlen                        NL,Mon Jul 26 15:00:10 PDT 2004,0.00,93.00
AP624,M0ADS Sheffield                      UK,Mon Jul 26 15:00:02 PDT 2004,0.00,0.00
AP626,G1YXH Kent                           UK,Mon Jul 26 15:00:28 PDT 2004,0.89,236.00
AP627,VE4UB Selkirk                     MB CA,Mon Jul 26 15:02:05 PDT 2004,3.13,231.00
AP634,VK7HDM-5 Gagebrook               Tas AU,Mon Jul 26 15:05:16 PDT 2004,3.13,258.00
AP641,KB0WBM-2 Arnold                   ND US,Mon Jul 26 15:02:23 PDT 2004,7.15,159.00
AP650,N5CWM Montgomery                  TX US,Mon Jul 26 15:05:00 PDT 2004,1.34,298.00
AP654,N5YXO Granbury                    TX US,Mon Jul 26 15:01:18 PDT 2004,0.45,246.00
AP656,KC5TIL Rendon                     TX US,Mon Jul 26 15:00:15 PDT 2004,0.45,25.00
AP657,KC4WTI Carrolton                  TX US,Mon Jul 26 15:02:43 PDT 2004,4.47,123.00
AP661,WA5KXX Plano                      TX US,Mon Jul 26 15:02:02 PDT 2004,0.00,25.00
AP669,PA0OKE Amsterdam                     NL,Mon Jul 26 15:02:48 PDT 2004,0.00,50.00
AP671,KD5FGW NW Oranjestad                 AW,Mon Jul 26 15:01:05 PDT 2004,5.36,304.00
AP677,NR0A-4 Norfolk                    NE US,Mon Jul 26 15:03:46 PDT 2004,0.00,79.00
AP679,ON5CT St-Niklaas                     BE,Mon Jul 26 15:00:41 PDT 2004,0.00,14.00
AP680,KA1GOZ Nashua                     NH US,Mon Jul 26 15:00:53 PDT 2004,0.00,54.00
AP682,W7KKE-3 Road's End                OR US,Mon Jul 26 15:03:10 PDT 2004,6.26,318.00
AP685,KD7CTY Vancouver                  WA US,Mon Jul 26 15:01:13 PDT 2004,0.45,141.00
AP689,KF4TTB-2 Huntsville               AL US,Mon Jul 26 15:03:04 PDT 2004,4.92,302.00
AP690,KF4TTB-1 Huntsville               AL US,Mon Jul 26 15:04:43 PDT 2004,0.89,325.00
AP691,KE4ROC-9 Flemington Hts.          AL US,Mon Jul 26 15:04:15 PDT 2004,0.00,248.00
AP696,N4ARI Williamsburg                VA US,Mon Jul 26 15:04:10 PDT 2004,3.13,11.00
AP698,K3BAY Pasadena                    MD US,Mon Jul 26 15:02:55 PDT 2004,0.00,130.00
AP701,EA3ABN Barcelona                     ES,Mon Jul 26 15:00:40 PDT 2004,1.34,312.00
AP705,K4VVN Kingsport                   TN US,Mon Jul 26 15:05:07 PDT 2004,0.00,44.00
AP706,N0PJH Grand Island                NE US,Mon Jul 26 15:05:09 PDT 2004,2.68,229.00
AP712,KA1HEU Hudson                     NH US,Mon Jul 26 15:01:46 PDT 2004,0.00,241.00
AP725,KD4BNP Palm Bay                   FL US,Mon Jul 26 15:05:10 PDT 2004,0.45,145.00
AP733,K0YCN East Tawakoni               TX US,Mon Jul 26 15:01:29 PDT 2004,0.45,86.00
AP736,VK5RR Adelaide                       AU,Mon Jul 26 15:00:14 PDT 2004,0.00,299.00
AP738,KB0VBZ Aurora                     CO US,Mon Jul 26 15:02:23 PDT 2004,0.00,105.00
AP739,WB0TWE Encinitas                  CA US,Mon Jul 26 15:03:53 PDT 2004,1.34,107.00
AP745,K4GPS-1 Jupiter Farms             FL US,Mon Jul 26 15:00:55 PDT 2004,0.00,155.00
AP749,N3FJA Mountain Top                PA US,Mon Jul 26 15:02:42 PDT 2004,0.00,66.00
AP750,W1OEM Flanders                    CT US,Mon Jul 26 15:04:56 PDT 2004,0.89,158.00
AP751,KC2KY Centereach                  NY US,Mon Jul 26 15:03:49 PDT 2004,0.89,27.00
AP752,WB2FTX Butler                     NJ US,Mon Jul 26 15:01:58 PDT 2004,0.00,101.00
AP760,WB0BLV Security/Widefield         CO US,Mon Jul 26 15:00:55 PDT 2004,2.68,134.00
AP763,OX3HI Kangerlussuaq                  GL,Mon Jul 26 15:00:13 PDT 2004,0.89,86.00
AP767,N2XP Flanders                     NJ US,Mon Jul 26 15:05:02 PDT 2004,0.00,45.00
AP769,WC4PEM-10 Bartow                  FL US,Mon Jul 26 15:03:19 PDT 2004,0.00,180.00
AP771,WD9HDQ-2 Northfield               MN US,Mon Jul 26 15:05:23 PDT 2004,0.00,172.00
AP772,K4KAL Marietta                    GA US,Mon Jul 26 15:05:30 PDT 2004,0.00,128.00
AP773,KB4TOH-11 Columbia                NC US,Mon Jul 26 15:05:19 PDT 2004,4.47,187.00
AP774,N8OVD Wendell                     NC US,Mon Jul 26 15:05:07 PDT 2004,0.00,180.00
AP780,W5VBQ Santa Fe                    NM US,Mon Jul 26 15:03:30 PDT 2004,2.24,298.00
AP782,WB5NZV-8 N.Denton                 TX US,Mon Jul 26 15:02:19 PDT 2004,0.00,141.00
AP783,KC5DPC-3 Slidell                  TX US,Mon Jul 26 15:02:37 PDT 2004,4.92,257.00
AP786,K5EBQ Houston                     TX US,Mon Jul 26 15:04:19 PDT 2004,0.00,20.00
AP787,KC5LPN Houston                    TX US,Mon Jul 26 15:02:47 PDT 2004,2.24,351.00
AP789,W0HVA Minot                       ND US,Mon Jul 26 15:00:23 PDT 2004,2.24,180.00
AP799,AE0S-3 Columbia                   MO US,Mon Jul 26 15:01:17 PDT 2004,1.34,358.00
AP802,W4OZK-7 Mentone                   AL US,Mon Jul 26 15:05:30 PDT 2004,0.00,229.00
AP803,KE6AFE Santa Cruz                 CA US,Mon Jul 26 15:05:08 PDT 2004,2.24,188.00
AP808,KG4YZY New Port Richey            FL US,Mon Jul 26 15:05:29 PDT 2004,0.00,144.00
AP809,K4NUT Port Richey                 FL US,Mon Jul 26 15:04:05 PDT 2004,1.79,133.00
AP811,KC2IXE Bayside Hills              NY US,Mon Jul 26 15:02:00 PDT 2004,1.34,195.00
AP815,VA3HST Guelph                    ONT CA,Mon Jul 26 15:03:31 PDT 2004,2.24,78.00
AP817,VA3AT Renfrew                    ONT CA,Mon Jul 26 15:04:32 PDT 2004,0.00,5.00
AP818,VA3MWK Ashton                    ONT CA,Mon Jul 26 15:04:39 PDT 2004,1.34,129.00
AP819,VE3TEN Ottawa                    ONT CA,Mon Jul 26 15:01:14 PDT 2004,0.00,204.00
AP820,VE6BMR Sherwood Park             ALT CA,Mon Jul 26 15:02:22 PDT 2004,8.94,280.00
AP824,K5WPN-10 Duncan                   OK US,Mon Jul 26 15:04:11 PDT 2004,2.24,76.00
AP830,KA2FNK Merriam                    KS US,Mon Jul 26 15:03:43 PDT 2004,0.45,249.00
AP831,N9NJK Warsaw                      IN US,Mon Jul 26 15:03:54 PDT 2004,3.13,47.00
AP832,WB9TLH-11 Bloomington             IN US,Mon Jul 26 15:01:52 PDT 2004,0.00,0.00
AP833,KE4CON-3 Woodstock                IL US,Mon Jul 26 15:05:00 PDT 2004,0.00,35.00
AP838,W5MAI San Antonio                 TX US,Mon Jul 26 15:03:41 PDT 2004,1.34,0.00
AP842,VE5VAP Dalmeny                    SK CA,Mon Jul 26 15:03:29 PDT 2004,8.05,322.00
AP850,KC2GLZ Lowville                   NY US,Mon Jul 26 15:01:28 PDT 2004,0.00,133.00
AP852,WG4R Meadows of Dan               VA US,Mon Jul 26 15:05:18 PDT 2004,0.45,267.00
AP855,N4HHP-2 Ft. Lauderdale            FL US,Mon Jul 26 15:02:06 PDT 2004,5.81,141.00
AP858,KD5WEB Port Allen                 LA US,Mon Jul 26 15:00:13 PDT 2004,1.34,322.00
