AP715,K4DNM Clayton                     NC US,Mon Jul 26 15:48:58 PDT 2004,0.00,189.00
AP718,K4YK Greensboro                   GA US,Mon Jul 26 15:47:35 PDT 2004,0.00,318.00
AP720,KD4DLT-3 Lithonia                 GA US,Mon Jul 26 15:39:36 PDT 2004,0.00,122.00
AP722,KF4ORW Dade City                  FL US,Mon Jul 26 15:50:10 PDT 2004,0.00,189.00
AP725,KD4BNP Palm Bay                   FL US,Mon Jul 26 15:50:10 PDT 2004,1.34,150.00
AP738,KB0VBZ Aurora                     CO US,Mon Jul 26 15:42:24 PDT 2004,0.45,247.00
AP739,WB0TWE Encinitas                  CA US,Mon Jul 26 15:48:53 PDT 2004,3.58,181.00
AP742,KC4ELV Honey Creek                GA US,Mon Jul 26 15:49:12 PDT 2004,0.00,239.00
AP745,K4GPS-1 Jupiter Farms             FL US,Mon Jul 26 15:45:56 PDT 2004,0.00,167.00
AP747,KC4ANB Trussville                 AL US,Mon Jul 26 15:48:38 PDT 2004,0.00,40.00
AP749,N3FJA Mountain Top                PA US,Mon Jul 26 15:47:41 PDT 2004,0.00,66.00
AP750,W1OEM Flanders                    CT US,Mon Jul 26 15:44:57 PDT 2004,0.00,180.00
AP751,KC2KY Centereach                  NY US,Mon Jul 26 15:48:46 PDT 2004,0.89,49.00
AP758,KC7BWK Florence                   OR US,Mon Jul 26 15:49:30 PDT 2004,3.58,247.00
AP760,WB0BLV Security/Widefield         CO US,Mon Jul 26 15:49:23 PDT 2004,1.34,120.00
AP763,OX3HI Kangerlussuaq                  GL,Mon Jul 26 15:45:08 PDT 2004,1.34,85.00
AP766,WB2CMF Farmingville               NY US,Mon Jul 26 15:35:41 PDT 2004,0.00,96.00
AP767,N2XP Flanders                     NJ US,Mon Jul 26 15:50:02 PDT 2004,0.00,45.00
AP769,WC4PEM-10 Bartow                  FL US,Mon Jul 26 15:43:20 PDT 2004,0.00,180.00
AP771,WD9HDQ-2 Northfield               MN US,Mon Jul 26 15:50:24 PDT 2004,0.00,192.00
AP772,K4KAL Marietta                    GA US,Mon Jul 26 15:45:36 PDT 2004,0.00,215.00
AP773,KB4TOH-11 Columbia                NC US,Mon Jul 26 15:48:02 PDT 2004,4.47,194.00
AP774,N8OVD Wendell                     NC US,Mon Jul 26 15:50:08 PDT 2004,0.00,180.00
AP779,K4CCC-9 Cheraw                    SC US,Mon Jul 26 15:45:58 PDT 2004,0.89,165.00
AP780,W5VBQ Santa Fe                    NM US,Mon Jul 26 15:43:33 PDT 2004,2.24,234.00
AP782,WB5NZV-8 N.Denton                 TX US,Mon Jul 26 15:42:16 PDT 2004,0.00,142.00
AP783,KC5DPC-3 Slidell                  TX US,Mon Jul 26 15:47:36 PDT 2004,4.92,257.00
AP786,K5EBQ Houston                     TX US,Mon Jul 26 15:49:19 PDT 2004,0.45,335.00
AP787,KC5LPN Houston                    TX US,Mon Jul 26 15:42:47 PDT 2004,1.34,31.00
AP789,W0HVA Minot                       ND US,Mon Jul 26 15:50:22 PDT 2004,2.24,202.00
AP799,AE0S-3 Columbia                   MO US,Mon Jul 26 15:46:18 PDT 2004,0.00,194.00
AP802,W4OZK-7 Mentone                   AL US,Mon Jul 26 15:47:30 PDT 2004,0.00,217.00
AP803,KE6AFE Santa Cruz                 CA US,Mon Jul 26 15:50:09 PDT 2004,4.02,196.00
AP806,N3EG Longview                     WA US,Mon Jul 26 15:41:01 PDT 2004,0.89,250.00
AP808,KG4YZY New Port Richey            FL US,Mon Jul 26 15:49:26 PDT 2004,0.00,161.00
AP809,K4NUT Port Richey                 FL US,Mon Jul 26 15:49:40 PDT 2004,1.34,176.00
AP811,KC2IXE Bayside Hills              NY US,Mon Jul 26 15:47:09 PDT 2004,0.89,213.00
AP814,VA3GY Erin                       ONT CA,Mon Jul 26 15:48:36 PDT 2004,4.02,66.00
AP815,VA3HST Guelph                    ONT CA,Mon Jul 26 15:48:28 PDT 2004,1.34,87.00
AP817,VA3AT Renfrew                    ONT CA,Mon Jul 26 15:49:27 PDT 2004,0.00,60.00
AP818,VA3MWK Ashton                    ONT CA,Mon Jul 26 15:47:36 PDT 2004,2.24,135.00
AP819,VE3TEN Ottawa                    ONT CA,Mon Jul 26 15:41:15 PDT 2004,0.00,179.00
AP820,VE6BMR Sherwood Park             ALT CA,Mon Jul 26 15:46:21 PDT 2004,6.26,259.00
AP824,K5WPN-10 Duncan                   OK US,Mon Jul 26 15:50:12 PDT 2004,2.24,0.00
AP826,KC9CI Germantown                  WI US,Mon Jul 26 15:37:17 PDT 2004,0.00,67.00
AP830,KA2FNK Merriam                    KS US,Mon Jul 26 15:46:48 PDT 2004,0.45,119.00
AP831,N9NJK Warsaw                      IN US,Mon Jul 26 15:48:53 PDT 2004,1.34,8.00
AP832,WB9TLH-11 Bloomington             IN US,Mon Jul 26 15:47:06 PDT 2004,0.89,143.00
AP833,KE4CON-3 Woodstock                IL US,Mon Jul 26 15:41:16 PDT 2004,0.00,352.00
AP838,W5MAI San Antonio                 TX US,Mon Jul 26 15:43:24 PDT 2004,0.89,38.00
AP841,WE1A USAF Academy                 CO US,Mon Jul 26 15:44:26 PDT 2004,0.89,135.00
AP842,VE5VAP Dalmeny                    SK CA,Mon Jul 26 15:43:19 PDT 2004,7.15,301.00
AP846,WN5PFI N.Dallas                   TX US,Mon Jul 26 15:49:37 PDT 2004,0.00,66.00
AP850,KC2GLZ Lowville                   NY US,Mon Jul 26 15:46:29 PDT 2004,0.00,289.00
AP852,WG4R Meadows of Dan               VA US,Mon Jul 26 15:50:18 PDT 2004,0.45,289.00
AP854,N4HHP-1 Plantation                FL US,Mon Jul 26 15:39:34 PDT 2004,3.58,165.00
AP855,N4HHP-2 Ft. Lauderdale            FL US,Mon Jul 26 15:47:06 PDT 2004,0.00,148.00
AP856,N4HHP-3 Hallandale Beach          FL US,Mon Jul 26 15:48:13 PDT 2004,0.00,107.00
AP858,KD5WEB Port Allen                 LA US,Mon Jul 26 15:43:24 PDT 2004,1.79,307.00
AP859,KF4LQQ Sarasota                   FL US,Mon Jul 26 15:49:43 PDT 2004,0.00,345.00
AP860,AA5ED-10 Brandon                  MS US,Mon Jul 26 15:47:22 PDT 2004,0.45,351.00
AP862,KC0KOQ-1 Goodland                 KS US,Mon Jul 26 15:46:16 PDT 2004,9.39,158.00
AP864,AB0XM-1 Great Bend                KS US,Mon Jul 26 15:44:04 PDT 2004,3.13,134.00
AP866,KA0HJZ Van Meter                  IA US,Mon Jul 26 15:47:05 PDT 2004,0.89,67.00
AP867,N0VPR Johnston                    IA US,Mon Jul 26 15:49:36 PDT 2004,0.00,48.00
AP870,KC0LBV Farmington                 MN US,Mon Jul 26 15:41:17 PDT 2004,2.68,168.00
AP871,N0PFY Northfield                  MN US,Mon Jul 26 15:48:23 PDT 2004,0.89,185.00
AP872,N0EST Rochester                   MN US,Mon Jul 26 15:49:31 PDT 2004,0.00,37.00
AP874,VK2AAK Forster                       AU,Mon Jul 26 15:49:11 PDT 2004,2.68,160.00
AP877,KA8OAD-1 Fairlawn                 OH US,Mon Jul 26 15:47:13 PDT 2004,0.00,2.00
AP878,AB9FX Chicago                     IL US,Mon Jul 26 15:49:18 PDT 2004,0.00,89.00
AP879,N9VPV Galesburg                   IL US,Mon Jul 26 15:48:25 PDT 2004,0.45,0.00
AP881,KJ4W Murray                       KY US,Mon Jul 26 15:38:22 PDT 2004,0.45,27.00
AP888,N7QXO-2 Vancouver                 WA US,Mon Jul 26 15:42:07 PDT 2004,0.00,147.00
AP890,KB7DZR Tigard                     OR US,Mon Jul 26 15:45:58 PDT 2004,4.47,291.00
AP892,KG6QHD Prineville                 OR US,Mon Jul 26 15:39:00 PDT 2004,1.79,353.00
AP893,KE6KYI Groveland                  CA US,Mon Jul 26 15:43:58 PDT 2004,0.00,144.00
AP896,WA6YLB Exeter                     CA US,Mon Jul 26 15:45:47 PDT 2004,2.24,265.00
AP897,WA6YLB-4 Govt.Peak                CA US,Mon Jul 26 15:43:49 PDT 2004,13.86,229.00
AP898,WA6YLB-6 Visalia                  CA US,Mon Jul 26 15:50:01 PDT 2004,0.00,0.00
AP900,KE6ZPS-1 Miranda Canyon           CA US,Mon Jul 26 15:49:34 PDT 2004,8.49,218.00
AP901,KB6OQJ Santa Ynez                 CA US,Mon Jul 26 15:46:49 PDT 2004,2.24,269.00
AP902,N6HGA-1 Palmdale                  CA US,Mon Jul 26 15:48:02 PDT 2004,8.49,220.00
AP904,W6MAF Hesperia                    CA US,Mon Jul 26 15:46:39 PDT 2004,4.92,203.00
AP907,W9IF-4 Torry Pines                CA US,Mon Jul 26 15:48:56 PDT 2004,4.02,229.00
AP911,K4GIG-7 Brindley Mtn.             AL US,Mon Jul 26 15:47:29 PDT 2004,0.00,342.00
AP912,WB2JSH Eaton                      CO US,Mon Jul 26 15:50:17 PDT 2004,3.13,353.00
AP913,WB5SLA Ball Ground                GA US,Mon Jul 26 15:47:02 PDT 2004,0.00,152.00
AP916,KE4YGK Fort Payne                 AL US,Mon Jul 26 15:50:08 PDT 2004,0.45,263.00
AP917,W7NWS Billings                    MT US,Mon Jul 26 15:50:03 PDT 2004,0.45,113.00
AP918,KB0YUP Maryland Hts.              MO US,Mon Jul 26 15:44:19 PDT 2004,0.00,227.00
AP919,LB9ME Trondheim                      NO,Mon Jul 26 15:49:17 PDT 2004,1.34,230.00
AP921,OZ6GX-5 Roervig                      DK,Mon Jul 26 15:43:05 PDT 2004,0.00,271.00
AP922,OZ1IEP-5 Jaegerspris                 DK,Mon Jul 26 15:43:48 PDT 2004,2.68,304.00
AP924,OH6GGL-3 Lppalahti                   FI,Mon Jul 26 15:40:53 PDT 2004,0.00,0.00
AP932,MB7UHR Luton                         UK,Mon Jul 26 15:46:39 PDT 2004,0.00,318.00
AP937,MB7UEK Herne Bay                     UK,Mon Jul 26 15:49:22 PDT 2004,0.00,118.00
AP938,G3OJZ-6 Kent                         UK,Mon Jul 26 15:38:40 PDT 2004,0.45,167.00
AP941,LU5ABT-15 BuenosAries                AR,Mon Jul 26 15:40:57 PDT 2004,2.68,73.00
AP943,MTHEBO Mt. Hebo                   OR US,Mon Jul 26 15:48:29 PDT 2004,0.00,0.00
AP944,F4BNZ Drouais                        FR,Mon Jul 26 15:35:57 PDT 2004,0.00,303.00
AP946,F1HCI-12 Versailles                  FR,Mon Jul 26 15:43:17 PDT 2004,0.00,316.00
AP949,F4CEP-12 Rubelles                    FR,Mon Jul 26 15:45:07 PDT 2004,1.34,300.00
AP952,N1NSI Contoocook                  NH US,Mon Jul 26 15:45:19 PDT 2004,0.00,78.00
AP956,K4TEM Tallahassee                 FL US,Mon Jul 26 15:49:00 PDT 2004,0.45,318.00
AP957,KA4EOC Tallahassee                FL US,Mon Jul 26 15:49:09 PDT 2004,3.13,315.00
AP959,K7NPS Snowden                     WA US,Mon Jul 26 15:45:36 PDT 2004,2.68,90.00
AP960,HB9TJM-8 Vallorbe                    CH,Mon Jul 26 15:48:35 PDT 2004,0.00,292.00
AP962,EB2FGI-15 Irun                       ES,Mon Jul 26 15:36:24 PDT 2004,0.00,359.00
AP965,EB5ESX Sta Pola                      ES,Mon Jul 26 15:46:17 PDT 2004,0.89,244.00
AP968,EA3FAJ-1 Girona                      ES,Mon Jul 26 15:48:37 PDT 2004,0.89,334.00
AP976,DO7VLR-5 Zweibruecken                DE,Mon Jul 26 15:46:29 PDT 2004,0.00,38.00
AP979,KC9BWF-3 Sister Bay               MI US,Mon Jul 26 15:47:15 PDT 2004,3.58,110.00
AP981,KG4SEY Niceville                  FL US,Mon Jul 26 15:40:31 PDT 2004,0.00,176.00
AP984,N8QQ Cincinnati                   OH US,Mon Jul 26 15:50:09 PDT 2004,0.00,332.00
AP985,KB9QJM-11 Cloverdale              IN US,Mon Jul 26 15:46:15 PDT 2004,1.79,19.00
AP986,KB9QJM-12 Atlanta                 IN US,Mon Jul 26 15:47:02 PDT 2004,0.00,64.00
AP987,KC5CPO Keene                      TX US,Mon Jul 26 15:50:19 PDT 2004,0.89,337.00
AP989,KC9JWM Clam Lake                  WI US,Mon Jul 26 15:44:42 PDT 2004,0.00,280.00
AP990,KG6MOZ Sunnyvale                  CA US,Mon Jul 26 15:48:25 PDT 2004,1.34,318.00
AP991,W0BIS-3 Killdeer                  ND US,Mon Jul 26 15:49:03 PDT 2004,4.47,159.00
AP993,F6CNB Frelsburg                   TX US,Mon Jul 26 15:44:28 PDT 2004,0.00,20.00
AP994,DL2YED-6 Recklinghausen              DE,Mon Jul 26 15:36:10 PDT 2004,0.00,299.00
AP995,KI4BUM Burlington                 KY US,Mon Jul 26 15:50:01 PDT 2004,0.00,329.00
AP996,KC5YVU Lampasas                   TX US,Mon Jul 26 15:46:57 PDT 2004,3.58,16.00
AP998,DK1PR-6 Altenahr                     DE,Mon Jul 26 15:49:27 PDT 2004,1.34,193.00
AP999,DB5OY-15 Celle                       DE,Mon Jul 26 15:43:50 PDT 2004,0.00,360.00
AR003,DL9GJ-6 Burgrieden                   DE,Mon Jul 26 15:47:22 PDT 2004,0.00,203.00
AR005,HB9BA-8 Solothurn                    CH,Mon Jul 26 15:50:23 PDT 2004,0.00,0.00
AR006,HB9MZI Giubiasco                     CH,Mon Jul 26 15:48:33 PDT 2004,4.92,231.00
AR009,SR3TK-1 Gontyniec                    PL,Mon Jul 26 15:49:20 PDT 2004,0.00,243.00
AR011,IK1ZQJ Torino                        IT,Mon Jul 26 15:44:06 PDT 2004,0.00,312.00
AR013,IK1ZYQ Dusino                        IT,Mon Jul 26 15:47:03 PDT 2004,0.00,146.00
AR014,IK1RDC Scurzolengo                   IT,Mon Jul 26 15:37:45 PDT 2004,1.79,351.00
AR016,IW4APJ-3 Soliera                     IT,Mon Jul 26 15:44:07 PDT 2004,0.00,139.00
AR017,IK4UPW S.Giovanni                    IT,Mon Jul 26 15:44:57 PDT 2004,0.00,142.00
AR020,IK3SVW-3 Treviso                     IT,Mon Jul 26 15:42:01 PDT 2004,4.02,9.00
AR021,I3OVD Scaltenigo                     IT,Mon Jul 26 15:40:36 PDT 2004,4.02,11.00
AR022,IW5BFZ Lucca                         IT,Mon Jul 26 15:46:00 PDT 2004,0.00,331.00
AR025,IT9IPQ-2 Messina                     IT,Mon Jul 26 15:48:28 PDT 2004,3.13,21.00
AR027,IZ8GMP-2 Reggio Calabria             IT,Mon Jul 26 15:45:49 PDT 2004,6.71,26.00
AR028,IW8PCP-2 Gambarie d'Aspromonte       IT,Mon Jul 26 15:48:11 PDT 2004,0.00,73.00
AR029,KG4QXL-2 Fort Valley              VA US,Mon Jul 26 15:50:23 PDT 2004,0.00,337.00
AR030,N4HHP-4 Pompano Beach             FL US,Mon Jul 26 15:48:27 PDT 2004,2.24,139.00
AR031,SV2BNL-2 Thessaloniki                GR,Mon Jul 26 15:43:47 PDT 2004,3.58,314.00
AR033,SV4BHA-2 Larisa                      GR,Mon Jul 26 15:44:23 PDT 2004,0.00,313.00
AR034,SV1CIF-2 Aitoloakarnania             GR,Mon Jul 26 15:49:46 PDT 2004,2.68,117.00
AR035,SV3AQN-2 Patra                       GR,Mon Jul 26 15:41:57 PDT 2004,0.00,271.00
AR036,SV3BEF-2 Tripolis                    GR,Mon Jul 26 15:45:12 PDT 2004,0.00,222.00
AR039,VK4TMK Arana Hills                   AU,Mon Jul 26 15:43:28 PDT 2004,3.13,262.00
AR040,N3BSQ Bethel Park                 PA US,Mon Jul 26 15:50:04 PDT 2004,0.00,300.00
AR042,VK1AC Bywong                     NSW AU,Mon Jul 26 15:50:06 PDT 2004,0.00,296.00
AR043,K4ZZR Port St. Lucie              FL US,Mon Jul 26 15:48:21 PDT 2004,2.24,95.00
AR044,N0QXY Ft.Lupton                   CO US,Mon Jul 26 15:45:34 PDT 2004,1.34,188.00
AR045,IW9ETI-2 Taormina                    IT,Mon Jul 26 15:50:21 PDT 2004,3.13,331.00
AR051,KE7TR-8 Mesa                      AZ US,Mon Jul 26 15:50:28 PDT 2004,2.68,49.00
AR052,KG4QXL Fort Valley                VA US,Mon Jul 26 15:49:45 PDT 2004,0.00,180.00
AR053,VK3AWA Paradise Beach                AU,Mon Jul 26 15:40:57 PDT 2004,0.45,317.00
AR054,VK3HV Morwell                        AU,Mon Jul 26 15:40:05 PDT 2004,3.13,297.00
AR057,VK3XJB Shepparton                    AU,Mon Jul 26 15:36:45 PDT 2004,0.00,0.00
AR058,VK3YWY-1 Kyneton                     AU,Mon Jul 26 15:36:17 PDT 2004,0.00,117.00
AR060,VK3JTM-3 Ararat                      AU,Mon Jul 26 15:46:19 PDT 2004,1.34,315.00
AR061,VK3YLV Horsham                       AU,Mon Jul 26 15:37:49 PDT 2004,0.00,305.00
AR062,VK5EX-1 Adelaide                     AU,Mon Jul 26 15:47:49 PDT 2004,0.00,127.00
AR066,KC0IVW Colorado Springs           CO US,Mon Jul 26 15:45:20 PDT 2004,0.00,0.00
AR068,WA2MAK Bolton                     MA US,Mon Jul 26 15:49:50 PDT 2004,0.00,42.00
AR069,KF7KN-7 Red Lodge                 MT US,Mon Jul 26 15:44:38 PDT 2004,0.00,79.00
AR070,KI0BJ-2 Fort Smith                MT US,Mon Jul 26 15:45:45 PDT 2004,0.45,35.00
AR071,KD4BJW Albertville                AL US,Mon Jul 26 15:45:58 PDT 2004,0.00,184.00
AR072,KB2KMM N. Babylon                 NY US,Mon Jul 26 15:50:11 PDT 2004,1.34,98.00
AR079,WX4BUY Elon                       NC US,Mon Jul 26 15:47:47 PDT 2004,0.00,204.00
AR084,W4ERC-10 Avon Park                FL US,Mon Jul 26 15:46:44 PDT 2004,0.00,72.00
AR085,N4HHP-5 Deerfield Beach           FL US,Mon Jul 26 15:44:32 PDT 2004,4.47,131.00
AR087,F8KDX Melun                          FR,Mon Jul 26 15:38:51 PDT 2004,0.00,357.00
AR091,DB0SAC-6 Bad Sackingen               DE,Mon Jul 26 15:47:59 PDT 2004,2.68,320.00
AR095,DO2UMM Gorlitz                       DE,Mon Jul 26 15:41:30 PDT 2004,0.00,68.00
AR097,EA3AGQ Lleida                        ES,Mon Jul 26 15:45:51 PDT 2004,5.81,220.00
AR098,EA3AGQ-1 Montsec d'Ares              ES,Mon Jul 26 15:42:15 PDT 2004,3.13,43.00
AR100,N1FWV Peabody                     MA US,Mon Jul 26 15:50:04 PDT 2004,0.00,112.00
AR103,W4SBO-7 Section                   AL US,Mon Jul 26 15:48:56 PDT 2004,0.00,311.00
AR106,N6FKW Auberry                     CA US,Mon Jul 26 15:48:35 PDT 2004,0.45,210.00
AR107,EA3AKS-15 SantPere de Ribes          ES,Mon Jul 26 15:49:57 PDT 2004,0.00,9.00
AR108,EA3BB Santpedor                      ES,Mon Jul 26 15:49:56 PDT 2004,0.45,214.00
AR109,EA3BSJ-1 Pinos                       ES,Mon Jul 26 15:50:15 PDT 2004,1.79,272.00
AR110,EA3CNO-1 Barcelona                   ES,Mon Jul 26 15:46:01 PDT 2004,0.89,242.00
AR112,EB3DMC-1 Belvis                      ES,Mon Jul 26 15:50:03 PDT 2004,2.24,250.00
AR115,EUGENE Eugene                     OR US,Mon Jul 26 15:47:24 PDT 2004,4.47,312.00
AR118,F6DEV-5 Rimont                       FR,Mon Jul 26 15:42:07 PDT 2004,2.24,300.00
AR122,N4HHP-6 Cooper City               FL US,Mon Jul 26 15:43:27 PDT 2004,3.13,236.00
AR127,ZL1RED Tauranga Bay                  NZ,Mon Jul 26 15:40:41 PDT 2004,0.45,188.00
AR132,IZ1DBU-2 Favria                      IT,Mon Jul 26 15:43:26 PDT 2004,1.34,345.00
AR137,K6NE Ventura                      CA US,Mon Jul 26 15:48:38 PDT 2004,1.34,356.00
AR138,K7LHC-1 Lake Havasu               AZ US,Mon Jul 26 15:49:38 PDT 2004,2.68,125.00
AR140,KB0VYO-12 Winona                  MN US,Mon Jul 26 15:43:47 PDT 2004,0.00,0.00
AR141,KB5NMB-5 Fulton                   MS US,Mon Jul 26 15:42:08 PDT 2004,3.13,327.00
AR144,KB6CYS Cypress                    CA US,Mon Jul 26 15:45:55 PDT 2004,3.13,270.00
AR147,W0NWS-4 Colon                     NE US,Mon Jul 26 15:48:29 PDT 2004,3.58,180.00
AR148,K6DYC Meeker                      CO US,Mon Jul 26 15:46:29 PDT 2004,5.36,272.00
AR150,KC4WPS Hendersonville             TN US,Mon Jul 26 15:47:57 PDT 2004,0.00,337.00
AR159,KD6VLN-14 Tucson                  AZ US,Mon Jul 26 15:48:24 PDT 2004,1.34,2.00
AR160,NEWPRT Cape Foulweather           OR US,Mon Jul 26 15:49:45 PDT 2004,6.71,326.00
AR161,KD7DR-3 Tempe                     AZ US,Mon Jul 26 15:41:53 PDT 2004,0.00,0.00
AR162,KF4VTT Mebane                     NC US,Mon Jul 26 15:49:39 PDT 2004,0.00,107.00
AR163,KF6JSV San Bernardino             CA US,Mon Jul 26 15:47:00 PDT 2004,0.89,230.00
AR164,KF6NY Mt. Ranch                   CA US,Mon Jul 26 15:50:26 PDT 2004,0.00,229.00
AR166,KG4LXH-2 Miami                    FL US,Mon Jul 26 15:48:33 PDT 2004,0.00,278.00
AR167,KI0IO-2 Berthoud                  CO US,Mon Jul 26 15:45:55 PDT 2004,3.13,186.00
AR169,KK6RW Gig Harbor                  WA US,Mon Jul 26 15:38:54 PDT 2004,1.34,150.00
AR170,KO5Z Denton                       TX US,Mon Jul 26 15:37:17 PDT 2004,2.24,90.00
AR173,LA2YEA Hauglandshella                NO,Mon Jul 26 15:45:22 PDT 2004,0.00,0.00
AR177,K7UGT Cary                        NC US,Mon Jul 26 15:50:00 PDT 2004,0.00,155.00
AR178,KJ3L Erie                         PA US,Mon Jul 26 15:50:13 PDT 2004,0.45,42.00
AR179,KC9AAG Fond Du Lac                WI US,Mon Jul 26 15:46:32 PDT 2004,0.00,99.00
AR180,WB6YPF Altadena                   CA US,Mon Jul 26 15:48:22 PDT 2004,2.24,177.00
AR181,KE6ONT Duarte                     CA US,Mon Jul 26 15:48:00 PDT 2004,2.68,235.00
AR182,GW4TJC Caerphilly                    UK,Mon Jul 26 15:50:10 PDT 2004,0.45,252.00
AR183,N7LUF Hansville                   WA US,Mon Jul 26 15:48:33 PDT 2004,0.89,328.00
AR184,W7PG-10 Forsyth                   MT US,Mon Jul 26 15:36:40 PDT 2004,4.47,271.00
AR185,N1XH-15 Spencer                   MA US,Mon Jul 26 15:47:30 PDT 2004,0.00,13.00
AR186,N2LBT-7 Albany                    NY US,Mon Jul 26 15:42:48 PDT 2004,0.00,319.00
AR190,N6GIW Joshua Tree                 CA US,Mon Jul 26 15:44:59 PDT 2004,4.02,233.00
AR191,WA4BPS Huntsville                 AL US,Mon Jul 26 15:48:21 PDT 2004,0.89,304.00
AR195,N7BIV Glendale                    AZ US,Mon Jul 26 15:48:59 PDT 2004,1.34,45.00
AR196,N7CK San Manuel                   AZ US,Mon Jul 26 15:38:43 PDT 2004,2.24,196.00
AR197,N7FZA-15 Boise                    ID US,Mon Jul 26 15:42:25 PDT 2004,2.24,214.00
AR199,N7TCF Phoenix                     AZ US,Mon Jul 26 15:42:32 PDT 2004,1.34,270.00
AR200,N7TQZ Tacoma                      WA US,Mon Jul 26 15:43:50 PDT 2004,1.34,265.00
AR201,N8NQF-1 Middletown                OH US,Mon Jul 26 15:48:02 PDT 2004,0.00,288.00
AR202,N8VIM Pepperell                   MA US,Mon Jul 26 15:44:28 PDT 2004,0.00,0.00
AR203,N9UDO-2 Baraboo                   WI US,Mon Jul 26 15:45:47 PDT 2004,0.00,169.00
AR204,N9YWZ Kimberly                    WI US,Mon Jul 26 15:42:23 PDT 2004,0.45,188.00
AR205,OE9FWV Feldkirch                     AT,Mon Jul 26 15:43:20 PDT 2004,0.00,93.00
AR206,OK1MX-7 Praha                        CZ,Mon Jul 26 15:42:21 PDT 2004,0.00,2.00
AR208,KD7WIS Miles City                 MT US,Mon Jul 26 15:43:32 PDT 2004,3.58,238.00
AR209,K0OQ Northfield                   MN US,Mon Jul 26 15:50:01 PDT 2004,0.00,191.00
AR210,N4IDX-7 Youngtown                 AL US,Mon Jul 26 15:44:57 PDT 2004,0.00,316.00
AR212,WX4MAP Phenix City                AL US,Mon Jul 26 15:50:03 PDT 2004,0.00,145.00
AR213,W4HSV Huntsville                  AL US,Mon Jul 26 15:48:10 PDT 2004,2.68,21.00
AR216,W7PG-12 Home Creek                MT US,Mon Jul 26 15:46:36 PDT 2004,0.00,0.00
AR220,KB6KJX Ellensburg                 WA US,Mon Jul 26 15:41:16 PDT 2004,3.13,312.00
AR221,K6TVI-1 Onyx Peak                 CA US,Mon Jul 26 15:43:52 PDT 2004,0.00,338.00
AR222,W7IUC-2 Big Coppitt Key           FL US,Mon Jul 26 15:48:51 PDT 2004,3.58,103.00
AR223,W7IUC-5 Grassy Key                FL US,Mon Jul 26 15:46:37 PDT 2004,0.00,177.00
AR225,KG6QHS Shingletown                CA US,Mon Jul 26 15:44:47 PDT 2004,3.13,226.00
AR226,W4RL-1 Pensacola                  FL US,Mon Jul 26 15:46:08 PDT 2004,0.00,58.00
AR228,N0ERG Littleton                   CO US,Mon Jul 26 15:45:05 PDT 2004,2.24,247.00
AR230,K4DIG-7 Sardis Springs            AL US,Mon Jul 26 15:49:09 PDT 2004,1.79,30.00
AR231,KB5GAS-1 Balloon Fiesta           NM US,Mon Jul 26 15:49:14 PDT 2004,0.89,120.00
AR232,KC7RJK Eugene                     OR US,Mon Jul 26 15:47:29 PDT 2004,1.79,8.00
AR234,NK7W Reno                         NV US,Mon Jul 26 15:45:58 PDT 2004,0.45,260.00
AR238,N5YXO Granbury                    TX US,Mon Jul 26 15:45:58 PDT 2004,0.00,210.00
AR239,OZ9WC-5 Lejre                        DK,Mon Jul 26 15:43:20 PDT 2004,0.45,268.00
AR243,K4TPD-5 Tallahassee               FL US,Mon Jul 26 15:48:29 PDT 2004,1.79,272.00
AR245,K7HRT Greenacres                  WA US,Mon Jul 26 15:49:28 PDT 2004,28.16,246.00
AR248,K7VIP Tucson                      AZ US,Mon Jul 26 15:47:43 PDT 2004,2.24,112.00
AR249,KA5WRG Oklahoma City              OK US,Mon Jul 26 15:48:56 PDT 2004,0.00,135.00
AR250,KA8SCP Westford                   MA US,Mon Jul 26 15:46:33 PDT 2004,0.00,320.00
AR252,KB7IPU-2 Payson                   AZ US,Mon Jul 26 15:47:36 PDT 2004,3.13,38.00
AR253,KB8WFH Springfield                OH US,Mon Jul 26 15:49:21 PDT 2004,0.00,100.00
AR254,KB9TPG Viroqua                    WI US,Mon Jul 26 15:50:23 PDT 2004,0.00,112.00
AR255,KC4YLE Efland                     NC US,Mon Jul 26 15:40:30 PDT 2004,0.00,191.00
AR256,W5HKR Schertz                     TX US,Mon Jul 26 15:49:11 PDT 2004,0.00,64.00
AR257,N1ETY New Britain                 CT US,Mon Jul 26 15:50:30 PDT 2004,0.00,337.00
AR258,KC8HJN Ludington                  MI US,Mon Jul 26 15:39:19 PDT 2004,0.45,318.00
AR259,KD5CUW-1 Copperas Cove            TX US,Mon Jul 26 15:45:33 PDT 2004,0.45,359.00
AR260,KD5FDE Runaway Bay                TX US,Mon Jul 26 15:45:15 PDT 2004,1.79,88.00
AR261,KD6RXY Calimesa                   CA US,Mon Jul 26 15:38:21 PDT 2004,5.36,269.00
AR264,K0JDN Phoenix                     AZ US,Mon Jul 26 15:47:41 PDT 2004,0.00,201.00
AR266,KJ7XE Port Angeles                WA US,Mon Jul 26 15:49:56 PDT 2004,0.89,338.00
AR267,N3WNZ Brandon                        UK,Mon Jul 26 15:44:13 PDT 2004,0.00,158.00
AR269,KC7PHC Orofino                    ID US,Mon Jul 26 15:45:08 PDT 2004,0.00,338.00
AR271,AA0MM-2 Holton                    KS US,Mon Jul 26 15:49:59 PDT 2004,1.79,149.00
AR272,KG4JPL Hudson                     FL US,Mon Jul 26 15:45:38 PDT 2004,0.00,161.00
AR273,N1JJX Southington                 CT US,Mon Jul 26 15:49:22 PDT 2004,0.00,134.00
AR274,W4RP Palm Bay                     FL US,Mon Jul 26 15:47:19 PDT 2004,0.45,144.00
AR277,VE2GAT-2 St.Hyacinthe             QB CA,Mon Jul 26 15:48:37 PDT 2004,1.34,154.00
AR279,VE3COE Kincardine                ONT CA,Mon Jul 26 15:47:40 PDT 2004,0.89,51.00
AR280,VE3JON Kincardine                ONT CA,Mon Jul 26 15:46:14 PDT 2004,0.45,57.00
AR282,VE7IMD-2 Delta                    BC CA,Mon Jul 26 15:48:39 PDT 2004,0.45,359.00
AR284,VE7MMG-1 Crystal Mt.              BC CA,Mon Jul 26 15:48:47 PDT 2004,3.58,243.00
AR286,K0NSA Omaha                       NE US,Mon Jul 26 15:40:57 PDT 2004,3.58,198.00
AR290,AB4KN Peachtree City              GA US,Mon Jul 26 15:47:00 PDT 2004,0.00,233.00
AR299,KB5NMB-15 Belmont                 MS US,Mon Jul 26 15:48:40 PDT 2004,0.00,92.00
AR300,KB8GQ Galloway                    OH US,Mon Jul 26 15:47:48 PDT 2004,1.79,0.00
AR301,N5KUK Norman                      OK US,Mon Jul 26 15:47:11 PDT 2004,1.34,90.00
AR302,N4NW Stafford                     VA US,Mon Jul 26 15:49:21 PDT 2004,0.00,289.00
AR303,DL1BLU Schortens                     DE,Mon Jul 26 15:45:19 PDT 2004,0.00,268.00
AR306,KQ6DI-15 Livermore                CA US,Mon Jul 26 15:48:01 PDT 2004,4.02,260.00
AR307,W6KL Burbank                      CA US,Mon Jul 26 15:39:53 PDT 2004,2.68,198.00
AR308,W8EHH Winter Garden               FL US,Mon Jul 26 15:46:46 PDT 2004,3.13,107.00
AR309,WB6ABE-4 Benicia                  CA US,Mon Jul 26 15:47:00 PDT 2004,6.71,277.00
AR310,K4ROK-10 Fountain                 NC US,Mon Jul 26 15:46:31 PDT 2004,0.00,35.00
AR311,KD4DLT-3 Lithonia                 GA US,Mon Jul 26 15:39:36 PDT 2004,0.00,122.00
AR312,WA6BAY-1 Soquel                   CA US,Mon Jul 26 15:46:31 PDT 2004,2.68,231.00
AR313,WB6AHC-1 San Jose                 CA US,Mon Jul 26 15:50:25 PDT 2004,3.58,307.00
AR314,N7NAT Yakima                      WA US,Mon Jul 26 15:44:26 PDT 2004,0.00,118.00
AR315,OH6GPB Pietarsaari                   FI,Mon Jul 26 15:40:39 PDT 2004,0.00,4.00
AR318,ND1Q Concord                      NH US,Mon Jul 26 15:39:47 PDT 2004,0.45,178.00
AR319,VK7HDM-5 Hobart                  TAS AU,Mon Jul 26 15:49:17 PDT 2004,4.47,268.00
