AP888,N7QXO-2 Vancouver                 WA US,Tue Jul 27 15:32:07 PDT 2004,0.89,23.00
AP889,K7EWG Lincoln City                OR US,Tue Jul 27 15:34:40 PDT 2004,5.36,311.00
AP890,KB7DZR Tigard                     OR US,Tue Jul 27 15:35:02 PDT 2004,3.58,346.00
AP892,KG6QHD Prineville                 OR US,Tue Jul 27 15:24:08 PDT 2004,2.24,316.00
AP893,KE6KYI Groveland                  CA US,Tue Jul 27 15:33:46 PDT 2004,0.00,323.00
AP894,K6IMN Atwater                     CA US,Tue Jul 27 15:30:03 PDT 2004,1.79,328.00
AP896,WA6YLB Exeter                     CA US,Tue Jul 27 15:28:55 PDT 2004,0.89,275.00
AP897,WA6YLB-4 Govt.Peak                CA US,Tue Jul 27 15:34:48 PDT 2004,9.83,314.00
AP898,WA6YLB-6 Visalia                  CA US,Tue Jul 27 15:34:57 PDT 2004,0.00,0.00
AP900,KE6ZPS-1 Miranda Canyon           CA US,Tue Jul 27 15:34:59 PDT 2004,9.83,232.00
AP901,KB6OQJ Santa Ynez                 CA US,Tue Jul 27 15:34:03 PDT 2004,0.89,250.00
AP902,N6HGA-1 Palmdale                  CA US,Tue Jul 27 15:31:34 PDT 2004,7.60,239.00
AP904,W6MAF Hesperia                    CA US,Tue Jul 27 15:33:08 PDT 2004,4.92,172.00
AP907,W9IF-4 Torry Pines                CA US,Tue Jul 27 15:34:58 PDT 2004,4.02,278.00
AP911,K4GIG-7 Brindley Mtn.             AL US,Tue Jul 27 15:32:31 PDT 2004,0.00,359.00
AP912,WB2JSH Eaton                      CO US,Tue Jul 27 15:30:22 PDT 2004,1.34,287.00
AP913,WB5SLA Ball Ground                GA US,Tue Jul 27 15:32:07 PDT 2004,0.00,155.00
AP917,W7NWS Billings                    MT US,Tue Jul 27 15:30:17 PDT 2004,3.58,89.00
AP919,LB9ME Trondheim                      NO,Tue Jul 27 15:29:17 PDT 2004,1.34,220.00
AP921,OZ6GX-5 Roervig                      DK,Tue Jul 27 15:32:56 PDT 2004,0.00,329.00
AP922,OZ1IEP-5 Jaegerspris                 DK,Tue Jul 27 15:34:19 PDT 2004,2.68,349.00
AP924,OH6GGL-3 Lppalahti                   FI,Tue Jul 27 15:30:48 PDT 2004,0.00,0.00
AP932,MB7UHR Luton                         UK,Tue Jul 27 15:31:16 PDT 2004,0.00,34.00
AP937,MB7UEK Herne Bay                     UK,Tue Jul 27 15:30:30 PDT 2004,0.00,123.00
AP941,LU5ABT-15 BuenosAries                AR,Tue Jul 27 15:30:16 PDT 2004,4.92,72.00
AP943,MTHEBO Mt. Hebo                   OR US,Tue Jul 27 15:28:28 PDT 2004,0.00,0.00
AP946,F1HCI-12 Versailles                  FR,Tue Jul 27 15:32:15 PDT 2004,0.00,318.00
AP949,F4CEP-12 Rubelles                    FR,Tue Jul 27 15:35:02 PDT 2004,2.24,50.00
AP953,ZF1EJ Savannah                       KY,Tue Jul 27 15:29:39 PDT 2004,0.00,97.00
AP956,K4TEM Tallahassee                 FL US,Tue Jul 27 15:34:02 PDT 2004,0.00,311.00
AP957,KA4EOC Tallahassee                FL US,Tue Jul 27 15:22:08 PDT 2004,0.00,279.00
AP962,EB2FGI-15 Irun                       ES,Tue Jul 27 15:21:23 PDT 2004,0.89,195.00
AP965,EB5ESX Sta Pola                      ES,Tue Jul 27 15:31:01 PDT 2004,0.00,112.00
AP968,EA3FAJ-1 Girona                      ES,Tue Jul 27 15:33:55 PDT 2004,0.00,263.00
AP969,EA3RCK-1 Lleida                      ES,Tue Jul 27 15:34:27 PDT 2004,0.00,351.00
AP971,EB3GGU Balaguer                      ES,Tue Jul 27 15:35:00 PDT 2004,2.68,25.00
AP976,DO7VLR-5 Zweibruecken                DE,Tue Jul 27 15:26:39 PDT 2004,1.34,133.00
AP979,KC9BWF-3 Sister Bay               MI US,Tue Jul 27 15:34:35 PDT 2004,3.58,93.00
AP981,KG4SEY Niceville                  FL US,Tue Jul 27 15:22:28 PDT 2004,0.00,134.00
AP984,N8QQ Cincinnati                   OH US,Tue Jul 27 15:35:03 PDT 2004,0.00,324.00
AP985,KB9QJM-11 Cloverdale              IN US,Tue Jul 27 15:31:16 PDT 2004,1.34,324.00
AP986,KB9QJM-12 Atlanta                 IN US,Tue Jul 27 15:27:02 PDT 2004,1.34,325.00
AP989,KC9JWM Clam Lake                  WI US,Tue Jul 27 15:32:41 PDT 2004,1.79,281.00
AP990,KG6MOZ Sunnyvale                  CA US,Tue Jul 27 15:33:16 PDT 2004,0.89,267.00
AP991,W0BIS-3 Killdeer                  ND US,Tue Jul 27 15:34:06 PDT 2004,8.05,349.00
AP993,F6CNB Frelsburg                   TX US,Tue Jul 27 15:29:37 PDT 2004,0.00,23.00
AP994,DL2YED-6 Recklinghausen              DE,Tue Jul 27 15:29:57 PDT 2004,0.00,310.00
AP995,KI4BUM Burlington                 KY US,Tue Jul 27 15:35:02 PDT 2004,1.34,22.00
AP996,KC5YVU Lampasas                   TX US,Tue Jul 27 15:30:42 PDT 2004,3.13,129.00
AP998,DK1PR-6 Altenahr                     DE,Tue Jul 27 15:31:30 PDT 2004,1.34,202.00
AP999,DB5OY-15 Celle                       DE,Tue Jul 27 15:28:55 PDT 2004,0.00,360.00
AR004,DK1MAW Bad Reichenhall               DE,Tue Jul 27 15:26:11 PDT 2004,0.89,180.00
AR005,HB9BA-8 Solothurn                    CH,Tue Jul 27 15:32:19 PDT 2004,0.00,0.00
AR009,SR3TK-1 Gontyniec                    PL,Tue Jul 27 15:35:17 PDT 2004,5.81,335.00
AR011,IK1ZQJ Torino                        IT,Tue Jul 27 15:34:05 PDT 2004,0.00,52.00
AR013,IK1ZYQ Dusino                        IT,Tue Jul 27 15:31:54 PDT 2004,0.00,305.00
AR014,IK1RDC Scurzolengo                   IT,Tue Jul 27 15:33:48 PDT 2004,3.58,351.00
AR016,IW4APJ-3 Soliera                     IT,Tue Jul 27 15:34:06 PDT 2004,1.79,118.00
AR017,IK4UPW S.Giovanni                    IT,Tue Jul 27 15:29:48 PDT 2004,1.34,124.00
AR021,I3OVD Scaltenigo                     IT,Tue Jul 27 15:30:39 PDT 2004,0.00,212.00
AR022,IW5BFZ Lucca                         IT,Tue Jul 27 15:31:25 PDT 2004,0.00,16.00
AR023,I4GOS-3 Rimini                       IT,Tue Jul 27 15:35:05 PDT 2004,0.00,299.00
AR027,IZ8GMP-2 Reggio Calabria             IT,Tue Jul 27 15:30:45 PDT 2004,4.02,25.00
AR028,IW8PCP-2 Gambarie d'Aspromonte       IT,Tue Jul 27 15:33:12 PDT 2004,0.00,85.00
AR029,KG4QXL-2 Fort Valley              VA US,Tue Jul 27 15:32:22 PDT 2004,0.00,337.00
AR030,N4HHP-4 Pompano Beach             FL US,Tue Jul 27 15:28:30 PDT 2004,2.24,139.00
AR031,SV2BNL-2 Thessaloniki                GR,Tue Jul 27 15:30:51 PDT 2004,3.13,348.00
AR033,SV4BHA-2 Larisa                      GR,Tue Jul 27 15:34:04 PDT 2004,1.34,129.00
AR034,SV1CIF-2 Aitoloakarnania             GR,Tue Jul 27 15:30:44 PDT 2004,0.00,323.00
AR035,SV3AQN-2 Patra                       GR,Tue Jul 27 15:32:00 PDT 2004,1.79,140.00
AR036,SV3BEF-2 Tripolis                    GR,Tue Jul 27 15:31:19 PDT 2004,0.00,246.00
AR038,VK4AGS-3 Calliope                    AU,Tue Jul 27 15:31:11 PDT 2004,0.89,286.00
AR039,VK4TMK Arana Hills                   AU,Tue Jul 27 15:34:45 PDT 2004,1.79,216.00
AR040,N3BSQ Bethel Park                 PA US,Tue Jul 27 15:35:08 PDT 2004,0.45,307.00
AR042,VK1AC Bywong                     NSW AU,Tue Jul 27 15:32:42 PDT 2004,1.79,250.00
AR043,K4ZZR Port St. Lucie              FL US,Tue Jul 27 15:30:23 PDT 2004,3.13,124.00
AR044,N0QXY Ft.Lupton                   CO US,Tue Jul 27 15:27:16 PDT 2004,1.79,99.00
AR045,IW9ETI-2 Taormina                    IT,Tue Jul 27 15:28:21 PDT 2004,1.34,351.00
AR051,KE7TR-8 Mesa                      AZ US,Tue Jul 27 15:34:34 PDT 2004,0.00,351.00
AR052,KG4QXL Fort Valley                VA US,Tue Jul 27 15:32:01 PDT 2004,0.00,154.00
AR053,VK3AWA Paradise Beach                AU,Tue Jul 27 15:23:37 PDT 2004,0.00,156.00
AR057,VK3XJB Shepparton                    AU,Tue Jul 27 15:26:17 PDT 2004,0.89,357.00
AR058,VK3YWY-1 Kyneton                     AU,Tue Jul 27 15:32:47 PDT 2004,1.34,292.00
AR060,VK3JTM-3 Ararat                      AU,Tue Jul 27 15:34:01 PDT 2004,3.13,336.00
AR061,VK3YLV Horsham                       AU,Tue Jul 27 15:22:37 PDT 2004,0.89,303.00
AR062,VK5EX-1 Adelaide                     AU,Tue Jul 27 15:33:45 PDT 2004,1.34,328.00
AR066,KC0IVW Colorado Springs           CO US,Tue Jul 27 15:30:29 PDT 2004,0.00,0.00
AR068,WA2MAK Bolton                     MA US,Tue Jul 27 15:34:56 PDT 2004,0.00,65.00
AR069,KF7KN-7 Red Lodge                 MT US,Tue Jul 27 15:34:45 PDT 2004,1.79,105.00
AR070,KI0BJ-2 Fort Smith                MT US,Tue Jul 27 15:27:07 PDT 2004,1.34,264.00
AR071,KD4BJW Albertville                AL US,Tue Jul 27 15:32:24 PDT 2004,0.00,323.00
AR072,KB2KMM N. Babylon                 NY US,Tue Jul 27 15:35:10 PDT 2004,0.00,91.00
AR075,W3UGI Ambler                      PA US,Tue Jul 27 15:27:29 PDT 2004,0.00,354.00
AR078,N9NYF-6 Evansville                IN US,Tue Jul 27 15:24:21 PDT 2004,2.24,20.00
AR079,WX4BUY Elon                       NC US,Tue Jul 27 15:34:44 PDT 2004,0.00,65.00
AR084,W4ERC-10 Avon Park                FL US,Tue Jul 27 15:26:45 PDT 2004,0.00,101.00
AR085,N4HHP-5 Deerfield Beach           FL US,Tue Jul 27 15:34:33 PDT 2004,5.36,131.00
AR087,F8KDX Melun                          FR,Tue Jul 27 15:24:36 PDT 2004,1.79,52.00
AR090,DB0BGD-3 Berchtesgaden               DE,Tue Jul 27 15:30:35 PDT 2004,3.13,205.00
AR091,DB0SAC-6 Bad Sackingen               DE,Tue Jul 27 15:21:58 PDT 2004,4.92,57.00
AR095,DO2UMM Gorlitz                       DE,Tue Jul 27 15:31:18 PDT 2004,0.00,270.00
AR097,EA3AGQ Lleida                        ES,Tue Jul 27 15:34:28 PDT 2004,5.36,62.00
AR098,EA3AGQ-1 Montsec d'Ares              ES,Tue Jul 27 15:29:38 PDT 2004,3.13,237.00
AR100,N1FWV Peabody                     MA US,Tue Jul 27 15:32:56 PDT 2004,0.00,110.00
AR103,W4SBO-7 Section                   AL US,Tue Jul 27 15:34:09 PDT 2004,2.24,319.00
AR108,EA3BB Santpedor                      ES,Tue Jul 27 15:34:09 PDT 2004,0.89,242.00
AR109,EA3BSJ-1 Pinos                       ES,Tue Jul 27 15:29:08 PDT 2004,3.13,152.00
AR110,EA3CNO-1 Barcelona                   ES,Tue Jul 27 15:26:38 PDT 2004,0.89,298.00
AR112,EB3DMC-1 Belvis                      ES,Tue Jul 27 15:30:08 PDT 2004,1.79,79.00
AR115,EUGENE Eugene                     OR US,Tue Jul 27 15:34:29 PDT 2004,2.24,21.00
AR116,F1JXB-5 Villate                      FR,Tue Jul 27 15:33:09 PDT 2004,0.00,343.00
AR118,F6DEV-5 Rimont                       FR,Tue Jul 27 15:34:45 PDT 2004,1.34,201.00
AR127,ZL1RED Tauranga Bay                  NZ,Tue Jul 27 15:27:27 PDT 2004,0.00,151.00
AR132,IZ1DBU-2 Favria                      IT,Tue Jul 27 15:29:14 PDT 2004,0.89,18.00
AR133,K0MXU-4 Hoxie                     KS US,Tue Jul 27 15:32:28 PDT 2004,4.92,113.00
AR134,K4JRG Miami                       FL US,Tue Jul 27 15:28:37 PDT 2004,1.79,151.00
AR137,K6NE Ventura                      CA US,Tue Jul 27 15:29:44 PDT 2004,1.34,295.00
AR138,K7LHC-1 Lake Havasu               AZ US,Tue Jul 27 15:34:23 PDT 2004,3.58,298.00
AR140,KB0VYO-12 Winona                  MN US,Tue Jul 27 15:29:36 PDT 2004,2.68,0.00
AR141,KB5NMB-5 Fulton                   MS US,Tue Jul 27 15:31:05 PDT 2004,1.79,28.00
AR144,KB6CYS Cypress                    CA US,Tue Jul 27 15:31:05 PDT 2004,4.02,157.00
AR145,KB9KTD-1 Onalaska                 WI US,Tue Jul 27 15:30:10 PDT 2004,1.79,76.00
AR147,W0NWS-4 Colon                     NE US,Tue Jul 27 15:34:18 PDT 2004,4.02,186.00
AR148,K6DYC Meeker                      CO US,Tue Jul 27 15:31:29 PDT 2004,6.71,193.00
AR150,KC4WPS Hendersonville             TN US,Tue Jul 27 15:32:56 PDT 2004,0.89,350.00
AR152,KC5LIO West Point                 MS US,Tue Jul 27 15:30:19 PDT 2004,0.00,22.00
AR156,KD4DLT-6 Lithonia                 GA US,Tue Jul 27 15:28:59 PDT 2004,0.00,0.00
AR159,KD6VLN-14 Tucson                  AZ US,Tue Jul 27 15:33:22 PDT 2004,4.02,229.00
AR160,NEWPRT Cape Foulweather           OR US,Tue Jul 27 15:30:42 PDT 2004,7.15,307.00
AR161,KD7DR-3 Tempe                     AZ US,Tue Jul 27 15:31:54 PDT 2004,0.89,300.00
AR166,KG4LXH-2 Miami                    FL US,Tue Jul 27 15:33:25 PDT 2004,1.79,83.00
AR167,KI0IO-2 Berthoud                  CO US,Tue Jul 27 15:31:30 PDT 2004,0.89,212.00
AR169,KK6RW Gig Harbor                  WA US,Tue Jul 27 15:28:59 PDT 2004,0.45,161.00
AR172,W6TQP Soquel                      CA US,Tue Jul 27 15:31:04 PDT 2004,0.00,128.00
AR173,LA2YEA Hauglandshella                NO,Tue Jul 27 15:25:33 PDT 2004,0.00,158.00
AR174,K4AG-6 Miami                      FL US,Tue Jul 27 15:34:12 PDT 2004,0.00,72.00
AR177,K7UGT Cary                        NC US,Tue Jul 27 15:35:00 PDT 2004,0.00,217.00
AR178,KJ3L Erie                         PA US,Tue Jul 27 15:35:06 PDT 2004,3.13,262.00
AR179,KC9AAG Fond Du Lac                WI US,Tue Jul 27 15:35:21 PDT 2004,0.00,88.00
AR180,WB6YPF Altadena                   CA US,Tue Jul 27 15:31:18 PDT 2004,2.24,185.00
AR181,KE6ONT Duarte                     CA US,Tue Jul 27 15:26:07 PDT 2004,2.68,238.00
AR182,GW4TJC Caerphilly                    UK,Tue Jul 27 15:35:16 PDT 2004,0.89,244.00
AR183,N7LUF Hansville                   WA US,Tue Jul 27 15:33:24 PDT 2004,0.89,3.00
AR184,W7PG-10 Forsyth                   MT US,Tue Jul 27 15:26:40 PDT 2004,3.58,21.00
AR185,N1XH-15 Spencer                   MA US,Tue Jul 27 15:35:19 PDT 2004,0.00,13.00
AR186,N2LBT-7 Albany                    NY US,Tue Jul 27 15:30:51 PDT 2004,0.00,7.00
AR189,N5JEI-8 Spicewood                 TX US,Tue Jul 27 15:31:13 PDT 2004,0.00,2.00
AR190,N6GIW Joshua Tree                 CA US,Tue Jul 27 15:28:17 PDT 2004,6.71,240.00
AR191,WA4BPS Huntsville                 AL US,Tue Jul 27 15:33:29 PDT 2004,1.34,18.00
AR195,N7BIV Glendale                    AZ US,Tue Jul 27 15:29:08 PDT 2004,1.79,45.00
AR196,N7CK San Manuel                   AZ US,Tue Jul 27 15:25:18 PDT 2004,4.02,343.00
AR197,N7FZA-15 Boise                    ID US,Tue Jul 27 15:27:28 PDT 2004,3.58,326.00
AR198,N7GLR Grand Isle                  ME US,Tue Jul 27 15:32:15 PDT 2004,0.00,172.00
AR199,N7TCF Phoenix                     AZ US,Tue Jul 27 15:24:01 PDT 2004,1.79,265.00
AR200,N7TQZ Tacoma                      WA US,Tue Jul 27 15:28:25 PDT 2004,0.00,65.00
AR201,N8NQF-1 Middletown                OH US,Tue Jul 27 15:35:02 PDT 2004,0.00,303.00
AR202,N8VIM Pepperell                   MA US,Tue Jul 27 15:34:33 PDT 2004,0.00,0.00
AR203,N9UDO-2 Baraboo                   WI US,Tue Jul 27 15:33:51 PDT 2004,1.34,226.00
AR204,N9YWZ Kimberly                    WI US,Tue Jul 27 15:32:16 PDT 2004,1.34,202.00
AR205,OE9FWV Feldkirch                     AT,Tue Jul 27 15:33:54 PDT 2004,0.00,143.00
AR206,OK1MX-7 Praha                        CZ,Tue Jul 27 15:32:23 PDT 2004,0.00,79.00
AR208,KD7WIS Miles City                 MT US,Tue Jul 27 15:23:57 PDT 2004,0.00,42.00
AR209,K0OQ Northfield                   MN US,Tue Jul 27 15:30:56 PDT 2004,0.45,178.00
AR212,WX4MAP Phenix City                AL US,Tue Jul 27 15:29:46 PDT 2004,0.89,176.00
AR213,W4HSV Huntsville                  AL US,Tue Jul 27 15:22:01 PDT 2004,0.89,7.00
AR220,KB6KJX Ellensburg                 WA US,Tue Jul 27 15:31:27 PDT 2004,0.89,1.00
AR221,K6TVI-1 Onyx Peak                 CA US,Tue Jul 27 15:33:49 PDT 2004,2.68,260.00
AR223,W7IUC-5 Grassy Key                FL US,Tue Jul 27 15:32:30 PDT 2004,0.00,177.00
AR224,W7IUC-6 Plantation Key            FL US,Tue Jul 27 15:32:29 PDT 2004,0.00,132.00
AR225,KG6QHS Shingletown                CA US,Tue Jul 27 15:33:53 PDT 2004,5.36,158.00
AR226,W4RL-1 Pensacola                  FL US,Tue Jul 27 15:31:10 PDT 2004,0.00,243.00
AR228,N0ERG Littleton                   CO US,Tue Jul 27 15:30:05 PDT 2004,0.00,145.00
AR230,K4DIG-7 Sardis Springs            AL US,Tue Jul 27 15:34:26 PDT 2004,0.00,315.00
AR231,KB5GAS-1 Balloon Fiesta           NM US,Tue Jul 27 15:34:04 PDT 2004,2.24,78.00
AR232,KC7RJK Eugene                     OR US,Tue Jul 27 15:31:21 PDT 2004,2.24,1.00
AR234,NK7W Reno                         NV US,Tue Jul 27 15:34:42 PDT 2004,3.13,343.00
AR235,K6SUD Hesperia                    CA US,Tue Jul 27 15:33:57 PDT 2004,4.02,152.00
AR238,N5YXO Granbury                    TX US,Tue Jul 27 15:31:10 PDT 2004,1.34,51.00
AR242,K2LGJ Buffalo                     NY US,Tue Jul 27 15:24:50 PDT 2004,0.00,50.00
AR243,K4TPD-5 Tallahassee               FL US,Tue Jul 27 15:33:31 PDT 2004,0.00,188.00
AR245,K7HRT Greenacres                  WA US,Tue Jul 27 15:29:24 PDT 2004,0.00,302.00
AR248,K7VIP Tucson                      AZ US,Tue Jul 27 15:32:02 PDT 2004,4.47,202.00
AR249,KA5WRG Oklahoma City              OK US,Tue Jul 27 15:34:55 PDT 2004,3.13,158.00
AR250,KA8SCP Westford                   MA US,Tue Jul 27 15:31:52 PDT 2004,0.00,137.00
AR252,KB7IPU-2 Payson                   AZ US,Tue Jul 27 15:32:24 PDT 2004,3.58,271.00
AR254,KB9TPG Viroqua                    WI US,Tue Jul 27 15:30:22 PDT 2004,0.45,248.00
AR255,KC4YLE Efland                     NC US,Tue Jul 27 15:30:38 PDT 2004,0.00,267.00
AR256,W5HKR Schertz                     TX US,Tue Jul 27 15:30:58 PDT 2004,0.00,140.00
AR257,N1ETY New Britain                 CT US,Tue Jul 27 15:30:31 PDT 2004,0.00,337.00
AR258,KC8HJN Ludington                  MI US,Tue Jul 27 15:33:49 PDT 2004,0.89,277.00
AR259,KD5CUW-1 Copperas Cove            TX US,Tue Jul 27 15:35:22 PDT 2004,0.00,141.00
AR260,KD5FDE Runaway Bay                TX US,Tue Jul 27 15:29:57 PDT 2004,1.34,65.00
AR261,KD6RXY Calimesa                   CA US,Tue Jul 27 15:24:03 PDT 2004,4.47,321.00
AR264,K0JDN Phoenix                     AZ US,Tue Jul 27 15:32:51 PDT 2004,3.58,221.00
AR266,KJ7XE Port Angeles                WA US,Tue Jul 27 15:34:54 PDT 2004,2.68,292.00
AR269,KC7PHC Orofino                    ID US,Tue Jul 27 15:30:07 PDT 2004,0.00,225.00
AR271,AA0MM-2 Holton                    KS US,Tue Jul 27 15:35:03 PDT 2004,4.02,173.00
AR272,KG4JPL Hudson                     FL US,Tue Jul 27 15:30:28 PDT 2004,0.89,73.00
AR273,N1JJX Southington                 CT US,Tue Jul 27 15:31:20 PDT 2004,0.00,55.00
AR274,W4RP Palm Bay                     FL US,Tue Jul 27 15:32:31 PDT 2004,0.89,68.00
AR275,W1CWS-1 Cos Cob                   CT US,Tue Jul 27 15:30:26 PDT 2004,0.00,67.00
AR277,VE2GAT-2 St.Hyacinthe             QB CA,Tue Jul 27 15:32:19 PDT 2004,1.34,136.00
AR279,VE3COE Kincardine                ONT CA,Tue Jul 27 15:25:45 PDT 2004,0.45,56.00
AR280,VE3JON Kincardine                ONT CA,Tue Jul 27 15:24:04 PDT 2004,0.00,57.00
AR282,VE7IMD-2 Delta                    BC CA,Tue Jul 27 15:33:50 PDT 2004,0.00,148.00
AR283,VE7MKF-3 Surry                    BC CA,Tue Jul 27 15:30:42 PDT 2004,1.79,217.00
AR284,VE7MMG-1 Crystal Mt.              BC CA,Tue Jul 27 15:22:18 PDT 2004,2.68,108.00
AR286,K0NSA Omaha                       NE US,Tue Jul 27 15:30:42 PDT 2004,5.36,194.00
AR290,AB4KN Peachtree City              GA US,Tue Jul 27 15:35:20 PDT 2004,0.00,177.00
AR299,KB5NMB-15 Belmont                 MS US,Tue Jul 27 15:30:32 PDT 2004,0.00,91.00
AR300,KB8GQ Galloway                    OH US,Tue Jul 27 15:31:19 PDT 2004,1.79,22.00
AR301,N5KUK Norman                      OK US,Tue Jul 27 15:30:41 PDT 2004,1.34,170.00
AR302,N4NW Stafford                     VA US,Tue Jul 27 15:34:19 PDT 2004,0.00,193.00
AR303,DL1BLU Schortens                     DE,Tue Jul 27 15:30:18 PDT 2004,0.00,324.00
AR304,AA6HF-5 Cathedral City            CA US,Tue Jul 27 15:27:04 PDT 2004,0.00,32.00
AR305,KF6ZGH Fremont                    CA US,Tue Jul 27 15:30:28 PDT 2004,3.58,271.00
AR306,KQ6DI-15 Livermore                CA US,Tue Jul 27 15:31:35 PDT 2004,4.47,240.00
AR308,W8EHH Winter Garden               FL US,Tue Jul 27 15:33:16 PDT 2004,2.24,97.00
AR310,K4ROK-10 Fountain                 NC US,Tue Jul 27 15:26:28 PDT 2004,2.24,110.00
AR312,WA6BAY-1 Soquel                   CA US,Tue Jul 27 15:26:27 PDT 2004,2.68,156.00
AR313,WB6AHC-1 San Jose                 CA US,Tue Jul 27 15:25:23 PDT 2004,2.24,300.00
AR314,N7NAT Yakima                      WA US,Tue Jul 27 15:34:20 PDT 2004,0.00,329.00
AR315,OH6GPB Pietarsaari                   FI,Tue Jul 27 15:30:49 PDT 2004,0.45,45.00
AR319,VK7HDM-5 Hobart                  TAS AU,Tue Jul 27 15:34:31 PDT 2004,1.79,325.00
AR320,K6TZ Diablo Peak                  CA US,Tue Jul 27 15:31:29 PDT 2004,0.00,280.00
AR321,K6DJR W.Menlo Park                CA US,Tue Jul 27 15:32:10 PDT 2004,0.00,19.00
AR323,KF6YUA Sebastopol                 CA US,Tue Jul 27 15:31:05 PDT 2004,3.13,236.00
AR327,WB1FYE Weirs Beach                NH US,Tue Jul 27 15:35:05 PDT 2004,0.00,90.00
AR328,N1EO Center Harbor                NH US,Tue Jul 27 15:32:05 PDT 2004,0.00,295.00
AR329,KA1RVR Epping                     NH US,Tue Jul 27 15:30:20 PDT 2004,0.00,106.00
AR330,KC1EO Hollis                      NH US,Tue Jul 27 15:30:30 PDT 2004,0.00,35.00
AR332,KD2KB Coudersport                 PA US,Tue Jul 27 15:35:12 PDT 2004,0.00,151.00
AR333,WO4U-10 Crossville                TN US,Tue Jul 27 15:30:32 PDT 2004,0.00,8.00
AR334,W4OZK-8 Collinsville              AL US,Tue Jul 27 15:31:29 PDT 2004,0.00,55.00
AR335,KB0RF San Jose                    CA US,Tue Jul 27 15:33:37 PDT 2004,2.24,357.00
AR338,N3WKE Baltimore                   MD US,Tue Jul 27 15:33:18 PDT 2004,2.24,176.00
AR339,AB0YW Blair                       NE US,Tue Jul 27 15:34:38 PDT 2004,3.13,184.00
AR340,AB8CY Scottville                  MI US,Tue Jul 27 15:35:00 PDT 2004,0.00,68.00
AR342,N2NZD Copake                      NY US,Tue Jul 27 15:34:56 PDT 2004,0.00,351.00
AR343,WA1OUI West Simsbury              CT US,Tue Jul 27 15:32:27 PDT 2004,0.00,15.00
AR345,KD5ZLP Rowlett                    TX US,Tue Jul 27 15:35:10 PDT 2004,0.00,12.00
AR346,TG9RB Guatemala City                 GT,Tue Jul 27 15:33:27 PDT 2004,0.45,0.00
AR347,KC5ZJO-1 Madison                  AL US,Tue Jul 27 15:33:10 PDT 2004,0.00,27.00
AR348,KG4VVU Helena                     AL US,Tue Jul 27 15:31:22 PDT 2004,0.45,89.00
AR351,ON7EQ-1 Brugge                       BE,Tue Jul 27 15:28:55 PDT 2004,0.00,32.00
AR354,W7PAQ Missoula                    MT US,Tue Jul 27 15:30:37 PDT 2004,0.00,268.00
AR356,AG1C Westborough                  MA US,Tue Jul 27 15:30:55 PDT 2004,0.00,84.00
AR357,WB1ETW Plainville                 MA US,Tue Jul 27 15:31:08 PDT 2004,0.00,342.00
AR358,N1MZX Peterborough                NH US,Tue Jul 27 15:30:19 PDT 2004,1.79,114.00
AR363,KC0MKS-10 Knife River             MN US,Tue Jul 27 15:33:06 PDT 2004,2.68,300.00
AR365,KM6GE Allenspark                  CO US,Tue Jul 27 15:33:49 PDT 2004,0.45,304.00
AR366,KB9VSQ Reedsburg                  WI US,Tue Jul 27 15:34:49 PDT 2004,1.34,250.00
AR368,WA0VSL Monument                   CO US,Tue Jul 27 15:30:18 PDT 2004,0.00,196.00
AR369,VA4GD Pinawa                     MAN CA,Tue Jul 27 15:35:16 PDT 2004,0.89,237.00
AR370,K7RKT Lake Oswego                 OR US,Tue Jul 27 15:33:18 PDT 2004,0.00,0.00
AR376,N9QIP Arlington                   WI US,Tue Jul 27 15:33:44 PDT 2004,2.68,268.00
AR377,N9WWR Racine                      WI US,Tue Jul 27 15:26:21 PDT 2004,0.00,164.00
AR378,WD8JVQ Petoskey                   MI US,Tue Jul 27 15:34:21 PDT 2004,2.24,331.00
AR380,KC8YHQ Sanford                    MI US,Tue Jul 27 15:34:06 PDT 2004,0.00,311.00
AR382,K8SWR Battle Creek                MI US,Tue Jul 27 15:22:05 PDT 2004,0.00,292.00
AR383,K5WPN-10 Duncan                   OK US,Tue Jul 27 15:34:32 PDT 2004,5.36,158.00
AR384,KB5AWM Cedar Park                 TX US,Tue Jul 27 15:35:03 PDT 2004,0.89,130.00
AR385,N1NAZ-1 Derry                     NH US,Tue Jul 27 15:33:14 PDT 2004,0.00,97.00
AR387,KF4OTN-6 Plymouth                 NC US,Tue Jul 27 15:34:59 PDT 2004,3.13,222.00
AR388,KB8UNF Twin Lake                  MI US,Tue Jul 27 15:30:40 PDT 2004,0.45,192.00
AR390,KE6JDC Long Beach                 CA US,Tue Jul 27 15:30:26 PDT 2004,2.24,193.00
AR392,K0NY-2 Winona                     MN US,Tue Jul 27 15:34:40 PDT 2004,2.24,0.00
AR394,N9ZWY-2 Prairie Du Chien          WI US,Tue Jul 27 15:33:51 PDT 2004,0.00,219.00
AR397,K0MCA-4 California                MO US,Tue Jul 27 15:33:46 PDT 2004,0.00,33.00
AR398,W0RED Ballwin                     MO US,Tue Jul 27 15:31:43 PDT 2004,0.00,19.00
AR400,KM5HG Claremore                   OK US,Tue Jul 27 15:33:34 PDT 2004,2.24,71.00
AR403,KB7TBT Phoenix                    AZ US,Tue Jul 27 15:24:54 PDT 2004,2.24,225.00
AR404,KI4AOA Gladys                     VA US,Tue Jul 27 15:32:50 PDT 2004,0.89,302.00
AR409,KQ3F Harrisburg                   PA US,Tue Jul 27 15:33:56 PDT 2004,0.00,283.00
AR410,WB3W Schnecksville                PA US,Tue Jul 27 15:30:40 PDT 2004,0.00,1.00
AR412,KL1SF-7 Healy                     AK US,Tue Jul 27 15:31:21 PDT 2004,3.13,133.00
AR413,W5JWW Sumner                      MS US,Tue Jul 27 15:32:40 PDT 2004,0.45,54.00
AR417,K4EKG Hamilton                    AL US,Tue Jul 27 15:33:34 PDT 2004,0.00,25.00
AR418,NK7I Las Vegas                    NV US,Tue Jul 27 15:33:22 PDT 2004,3.58,241.00
AR421,DB9AZ-5 Hamburg                      DE,Tue Jul 27 15:24:02 PDT 2004,2.68,326.00
AR422,DF0BLM Gosen                         DE,Tue Jul 27 15:27:23 PDT 2004,0.00,257.00
AR423,DG2KB Wilhelmshaven                  DE,Tue Jul 27 15:30:13 PDT 2004,0.00,333.00
AR426,K4BS Dahlonega                    GA US,Tue Jul 27 15:30:32 PDT 2004,0.00,204.00
AR427,AH6GR Maui                        HI US,Tue Jul 27 15:32:01 PDT 2004,4.02,311.00
AR428,KF4YYH Largo                      FL US,Tue Jul 27 15:30:55 PDT 2004,0.89,254.00
AR429,KD5NFW Midlothian                 TX US,Tue Jul 27 15:34:29 PDT 2004,1.34,69.00
AR431,KB9RQD Hawthorne                  WI US,Tue Jul 27 15:30:22 PDT 2004,2.24,131.00
AR433,KC8YFO Strongsville               OH US,Tue Jul 27 15:30:53 PDT 2004,0.45,270.00
AR434,KD5RWX Glenwood                   NM US,Tue Jul 27 15:30:13 PDT 2004,0.00,68.00
AR435,KB8UBG Saint Bernard              OH US,Tue Jul 27 15:31:58 PDT 2004,1.34,23.00
AR436,N0KTA-2 Mulvane                   KS US,Tue Jul 27 15:34:54 PDT 2004,0.89,158.00
AR437,N0OHO-1 Sioux Center              IA US,Tue Jul 27 15:33:33 PDT 2004,3.13,167.00
AR438,N0RGA-2 Tea                       SD US,Tue Jul 27 15:32:20 PDT 2004,0.00,359.00
AR439,N0VHU Howells                     NE US,Tue Jul 27 15:32:43 PDT 2004,6.26,177.00
AR441,N1CNV Newington                   CT US,Tue Jul 27 15:33:28 PDT 2004,0.45,56.00
AR443,N4BCB-2 Roanoke                   AL US,Tue Jul 27 15:33:04 PDT 2004,2.24,283.00
AR444,KC2KWK Somerville                 NJ US,Tue Jul 27 15:34:05 PDT 2004,1.34,122.00
AR445,N4XI-9 Owensboro                  KY US,Tue Jul 27 15:32:01 PDT 2004,2.68,232.00
AR446,N4XI-3 Evansville                 IN US,Tue Jul 27 15:33:05 PDT 2004,0.89,350.00
AR447,N4XI-5 Evansville                 IN US,Tue Jul 27 15:25:58 PDT 2004,1.79,303.00
