AP780,W5VBQ Santa Fe                    NM US,Mon Jul 26 15:13:37 PDT 2004,2.24,281.00
AP782,WB5NZV-8 N.Denton                 TX US,Mon Jul 26 15:12:16 PDT 2004,0.00,141.00
AP783,KC5DPC-3 Slidell                  TX US,Mon Jul 26 15:17:37 PDT 2004,4.92,257.00
AP786,K5EBQ Houston                     TX US,Mon Jul 26 15:19:19 PDT 2004,0.00,14.00
AP787,KC5LPN Houston                    TX US,Mon Jul 26 15:12:46 PDT 2004,1.34,48.00
AP789,W0HVA Minot                       ND US,Mon Jul 26 15:20:21 PDT 2004,3.13,202.00
AP799,AE0S-3 Columbia                   MO US,Mon Jul 26 15:06:17 PDT 2004,0.00,35.00
AP802,W4OZK-7 Mentone                   AL US,Mon Jul 26 15:20:28 PDT 2004,0.00,217.00
AP803,KE6AFE Santa Cruz                 CA US,Mon Jul 26 15:20:09 PDT 2004,3.58,216.00
AP806,N3EG Longview                     WA US,Mon Jul 26 15:10:59 PDT 2004,1.79,300.00
AP808,KG4YZY New Port Richey            FL US,Mon Jul 26 15:19:27 PDT 2004,0.45,222.00
AP809,K4NUT Port Richey                 FL US,Mon Jul 26 15:19:40 PDT 2004,1.34,169.00
AP811,KC2IXE Bayside Hills              NY US,Mon Jul 26 15:17:06 PDT 2004,2.24,239.00
AP815,VA3HST Guelph                    ONT CA,Mon Jul 26 15:12:25 PDT 2004,2.24,79.00
AP817,VA3AT Renfrew                    ONT CA,Mon Jul 26 15:19:25 PDT 2004,0.00,60.00
AP818,VA3MWK Ashton                    ONT CA,Mon Jul 26 15:20:01 PDT 2004,1.79,172.00
AP819,VE3TEN Ottawa                    ONT CA,Mon Jul 26 15:16:14 PDT 2004,0.00,181.00
AP820,VE6BMR Sherwood Park             ALT CA,Mon Jul 26 15:13:22 PDT 2004,4.92,280.00
AP823,AD4BL Fairbanks                   AK US,Mon Jul 26 15:12:25 PDT 2004,0.45,70.00
AP824,K5WPN-10 Duncan                   OK US,Mon Jul 26 15:20:11 PDT 2004,5.36,120.00
AP825,N4WFF Elba                        AL US,Mon Jul 26 15:09:34 PDT 2004,0.00,270.00
AP826,KC9CI Germantown                  WI US,Mon Jul 26 15:13:23 PDT 2004,0.00,67.00
AP830,KA2FNK Merriam                    KS US,Mon Jul 26 15:19:23 PDT 2004,0.45,71.00
AP831,N9NJK Warsaw                      IN US,Mon Jul 26 15:18:41 PDT 2004,2.68,27.00
AP832,WB9TLH-11 Bloomington             IN US,Mon Jul 26 15:11:12 PDT 2004,0.00,0.00
AP833,KE4CON-3 Woodstock                IL US,Mon Jul 26 15:14:59 PDT 2004,2.68,11.00
AP838,W5MAI San Antonio                 TX US,Mon Jul 26 15:13:25 PDT 2004,1.34,0.00
AP841,WE1A USAF Academy                 CO US,Mon Jul 26 15:14:26 PDT 2004,1.34,113.00
AP842,VE5VAP Dalmeny                    SK CA,Mon Jul 26 15:13:21 PDT 2004,8.94,315.00
AP846,WN5PFI N.Dallas                   TX US,Mon Jul 26 15:14:34 PDT 2004,0.00,25.00
AP850,KC2GLZ Lowville                   NY US,Mon Jul 26 15:16:27 PDT 2004,0.00,107.00
AP852,WG4R Meadows of Dan               VA US,Mon Jul 26 15:20:18 PDT 2004,0.00,88.00
AP854,N4HHP-1 Plantation                FL US,Mon Jul 26 15:19:34 PDT 2004,4.02,159.00
AP855,N4HHP-2 Ft. Lauderdale            FL US,Mon Jul 26 15:17:06 PDT 2004,0.00,148.00
AP856,N4HHP-3 Hallandale Beach          FL US,Mon Jul 26 15:13:13 PDT 2004,2.24,96.00
AP858,KD5WEB Port Allen                 LA US,Mon Jul 26 15:14:35 PDT 2004,2.24,317.00
AP860,AA5ED-10 Brandon                  MS US,Mon Jul 26 15:17:22 PDT 2004,1.34,332.00
AP862,KC0KOQ-1 Goodland                 KS US,Mon Jul 26 15:16:17 PDT 2004,6.26,135.00
AP864,AB0XM-1 Great Bend                KS US,Mon Jul 26 15:19:02 PDT 2004,4.02,179.00
AP866,KA0HJZ Van Meter                  IA US,Mon Jul 26 15:17:05 PDT 2004,0.00,67.00
AP867,N0VPR Johnston                    IA US,Mon Jul 26 15:19:34 PDT 2004,0.00,327.00
AP870,KC0LBV Farmington                 MN US,Mon Jul 26 15:11:22 PDT 2004,3.58,189.00
AP871,N0PFY Northfield                  MN US,Mon Jul 26 15:18:41 PDT 2004,1.79,174.00
AP872,N0EST Rochester                   MN US,Mon Jul 26 15:19:47 PDT 2004,0.00,37.00
AP874,VK2AAK Forster                       AU,Mon Jul 26 15:18:11 PDT 2004,3.13,157.00
AP877,KA8OAD-1 Fairlawn                 OH US,Mon Jul 26 15:15:16 PDT 2004,0.00,4.00
AP878,AB9FX Chicago                     IL US,Mon Jul 26 15:15:33 PDT 2004,0.00,89.00
AP879,N9VPV Galesburg                   IL US,Mon Jul 26 15:18:33 PDT 2004,0.89,25.00
AP881,KJ4W Murray                       KY US,Mon Jul 26 15:08:29 PDT 2004,0.45,1.00
AP890,KB7DZR Tigard                     OR US,Mon Jul 26 15:20:03 PDT 2004,3.58,341.00
AP892,KG6QHD Prineville                 OR US,Mon Jul 26 15:09:02 PDT 2004,0.00,38.00
AP893,KE6KYI Groveland                  CA US,Mon Jul 26 15:14:59 PDT 2004,1.79,299.00
AP896,WA6YLB Exeter                     CA US,Mon Jul 26 15:19:17 PDT 2004,1.34,225.00
AP897,WA6YLB-4 Govt.Peak                CA US,Mon Jul 26 15:18:52 PDT 2004,12.96,205.00
AP898,WA6YLB-6 Visalia                  CA US,Mon Jul 26 15:20:25 PDT 2004,0.00,0.00
AP900,KE6ZPS-1 Miranda Canyon           CA US,Mon Jul 26 15:19:40 PDT 2004,7.15,218.00
AP901,KB6OQJ Santa Ynez                 CA US,Mon Jul 26 15:14:05 PDT 2004,0.45,294.00
AP902,N6HGA-1 Palmdale                  CA US,Mon Jul 26 15:17:46 PDT 2004,6.71,238.00
AP904,W6MAF Hesperia                    CA US,Mon Jul 26 15:16:10 PDT 2004,8.49,198.00
AP907,W9IF-4 Torry Pines                CA US,Mon Jul 26 15:19:01 PDT 2004,4.47,253.00
AP911,K4GIG-7 Brindley Mtn.             AL US,Mon Jul 26 15:20:28 PDT 2004,0.00,287.00
AP912,WB2JSH Eaton                      CO US,Mon Jul 26 15:15:30 PDT 2004,2.68,234.00
AP913,WB5SLA Ball Ground                GA US,Mon Jul 26 15:17:01 PDT 2004,0.00,152.00
AP916,KE4YGK Fort Payne                 AL US,Mon Jul 26 15:20:08 PDT 2004,0.00,208.00
AP917,W7NWS Billings                    MT US,Mon Jul 26 15:20:06 PDT 2004,1.34,279.00
AP918,KB0YUP Maryland Hts.              MO US,Mon Jul 26 15:17:00 PDT 2004,1.34,263.00
AP919,LB9ME Trondheim                      NO,Mon Jul 26 15:09:16 PDT 2004,0.00,211.00
AP921,OZ6GX-5 Roervig                      DK,Mon Jul 26 15:13:05 PDT 2004,0.00,359.00
AP922,OZ1IEP-5 Jaegerspris                 DK,Mon Jul 26 15:05:51 PDT 2004,1.34,315.00
AP924,OH6GGL-3 Lppalahti                   FI,Mon Jul 26 15:10:43 PDT 2004,0.00,0.00
AP932,MB7UHR Luton                         UK,Mon Jul 26 15:16:33 PDT 2004,0.00,318.00
AP936,G3RJI Essex                          UK,Mon Jul 26 15:05:55 PDT 2004,0.00,0.00
AP937,MB7UEK Herne Bay                     UK,Mon Jul 26 15:19:23 PDT 2004,0.00,95.00
AP938,G3OJZ-6 Kent                         UK,Mon Jul 26 15:10:40 PDT 2004,0.00,0.00
AP941,LU5ABT-15 BuenosAries                AR,Mon Jul 26 15:08:15 PDT 2004,2.68,77.00
AP943,MTHEBO Mt. Hebo                   OR US,Mon Jul 26 15:18:30 PDT 2004,0.00,0.00
AP944,F4BNZ Drouais                        FR,Mon Jul 26 15:16:10 PDT 2004,0.00,303.00
AP946,F1HCI-12 Versailles                  FR,Mon Jul 26 15:12:16 PDT 2004,0.00,316.00
AP949,F4CEP-12 Rubelles                    FR,Mon Jul 26 15:15:02 PDT 2004,2.68,300.00
AP956,K4TEM Tallahassee                 FL US,Mon Jul 26 15:19:00 PDT 2004,1.34,17.00
AP957,KA4EOC Tallahassee                FL US,Mon Jul 26 15:19:08 PDT 2004,1.34,220.00
AP960,HB9TJM-8 Vallorbe                    CH,Mon Jul 26 15:18:35 PDT 2004,0.00,315.00
AP962,EB2FGI-15 Irun                       ES,Mon Jul 26 15:06:24 PDT 2004,0.00,359.00
AP965,EB5ESX Sta Pola                      ES,Mon Jul 26 15:16:11 PDT 2004,0.89,212.00
AP968,EA3FAJ-1 Girona                      ES,Mon Jul 26 15:13:41 PDT 2004,0.00,325.00
AP976,DO7VLR-5 Zweibruecken                DE,Mon Jul 26 15:16:28 PDT 2004,0.00,38.00
AP979,KC9BWF-3 Sister Bay               MI US,Mon Jul 26 15:17:16 PDT 2004,4.02,98.00
AP981,KG4SEY Niceville                  FL US,Mon Jul 26 15:08:50 PDT 2004,0.00,8.00
AP984,N8QQ Cincinnati                   OH US,Mon Jul 26 15:20:04 PDT 2004,0.00,145.00
AP985,KB9QJM-11 Cloverdale              IN US,Mon Jul 26 15:16:16 PDT 2004,1.34,8.00
AP986,KB9QJM-12 Atlanta                 IN US,Mon Jul 26 15:17:02 PDT 2004,0.89,64.00
AP987,KC5CPO Keene                      TX US,Mon Jul 26 15:14:39 PDT 2004,1.79,313.00
AP989,KC9JWM Clam Lake                  WI US,Mon Jul 26 15:08:40 PDT 2004,0.45,284.00
AP990,KG6MOZ Sunnyvale                  CA US,Mon Jul 26 15:18:12 PDT 2004,1.34,304.00
AP991,W0BIS-3 Killdeer                  ND US,Mon Jul 26 15:19:03 PDT 2004,4.47,172.00
AP993,F6CNB Frelsburg                   TX US,Mon Jul 26 15:14:07 PDT 2004,0.00,5.00
AP994,DL2YED-6 Recklinghausen              DE,Mon Jul 26 15:06:07 PDT 2004,0.00,299.00
AP995,KI4BUM Burlington                 KY US,Mon Jul 26 15:20:01 PDT 2004,0.00,13.00
AP996,KC5YVU Lampasas                   TX US,Mon Jul 26 15:16:31 PDT 2004,3.58,24.00
AP998,DK1PR-6 Altenahr                     DE,Mon Jul 26 15:19:27 PDT 2004,0.00,204.00
AP999,DB5OY-15 Celle                       DE,Mon Jul 26 15:13:49 PDT 2004,0.00,360.00
AR003,DL9GJ-6 Burgrieden                   DE,Mon Jul 26 15:15:24 PDT 2004,0.00,203.00
AR005,HB9BA-8 Solothurn                    CH,Mon Jul 26 15:19:15 PDT 2004,0.00,0.00
AR006,HB9MZI Giubiasco                     CH,Mon Jul 26 15:07:57 PDT 2004,4.02,180.00
AR009,SR3TK-1 Gontyniec                    PL,Mon Jul 26 15:19:24 PDT 2004,0.00,243.00
AR011,IK1ZQJ Torino                        IT,Mon Jul 26 15:19:10 PDT 2004,0.00,332.00
AR014,IK1RDC Scurzolengo                   IT,Mon Jul 26 15:13:47 PDT 2004,1.79,351.00
AR016,IW4APJ-3 Soliera                     IT,Mon Jul 26 15:14:15 PDT 2004,0.00,142.00
AR017,IK4UPW S.Giovanni                    IT,Mon Jul 26 15:14:47 PDT 2004,0.00,123.00
AR020,IK3SVW-3 Treviso                     IT,Mon Jul 26 15:15:03 PDT 2004,3.13,32.00
AR021,I3OVD Scaltenigo                     IT,Mon Jul 26 15:10:38 PDT 2004,0.00,356.00
AR022,IW5BFZ Lucca                         IT,Mon Jul 26 15:15:37 PDT 2004,0.00,272.00
AR025,IT9IPQ-2 Messina                     IT,Mon Jul 26 15:18:28 PDT 2004,4.02,260.00
AR027,IZ8GMP-2 Reggio Calabria             IT,Mon Jul 26 15:15:45 PDT 2004,5.36,6.00
AR028,IW8PCP-2 Gambarie d'Aspromonte       IT,Mon Jul 26 15:18:11 PDT 2004,0.00,266.00
AR029,KG4QXL-2 Fort Valley              VA US,Mon Jul 26 15:20:15 PDT 2004,0.00,337.00
AR030,N4HHP-4 Pompano Beach             FL US,Mon Jul 26 15:08:24 PDT 2004,2.24,139.00
AR031,SV2BNL-2 Thessaloniki                GR,Mon Jul 26 15:13:27 PDT 2004,2.68,336.00
AR033,SV4BHA-2 Larisa                      GR,Mon Jul 26 15:14:04 PDT 2004,0.00,313.00
AR034,SV1CIF-2 Aitoloakarnania             GR,Mon Jul 26 15:19:46 PDT 2004,3.58,126.00
AR035,SV3AQN-2 Patra                       GR,Mon Jul 26 15:16:55 PDT 2004,0.00,271.00
AR036,SV3BEF-2 Tripolis                    GR,Mon Jul 26 15:06:18 PDT 2004,0.00,208.00
AR039,VK4TMK Arana Hills                   AU,Mon Jul 26 15:13:25 PDT 2004,1.79,243.00
AR040,N3BSQ Bethel Park                 PA US,Mon Jul 26 15:20:02 PDT 2004,0.00,300.00
AR042,VK1AC Bywong                     NSW AU,Mon Jul 26 15:20:07 PDT 2004,0.00,15.00
AR043,K4ZZR Port St. Lucie              FL US,Mon Jul 26 15:18:20 PDT 2004,0.89,93.00
AR044,N0QXY Ft.Lupton                   CO US,Mon Jul 26 15:15:35 PDT 2004,0.00,250.00
AR045,IW9ETI-2 Taormina                    IT,Mon Jul 26 15:20:20 PDT 2004,3.58,292.00
AR051,KE7TR-8 Mesa                      AZ US,Mon Jul 26 15:20:31 PDT 2004,0.00,44.00
AR052,KG4QXL Fort Valley                VA US,Mon Jul 26 15:19:30 PDT 2004,0.00,266.00
AR053,VK3AWA Paradise Beach                AU,Mon Jul 26 15:10:33 PDT 2004,0.45,320.00
AR057,VK3XJB Shepparton                    AU,Mon Jul 26 15:08:52 PDT 2004,0.00,0.00
AR060,VK3JTM-3 Ararat                      AU,Mon Jul 26 15:16:19 PDT 2004,0.89,351.00
AR062,VK5EX-1 Adelaide                     AU,Mon Jul 26 15:17:44 PDT 2004,0.00,127.00
AR066,KC0IVW Colorado Springs           CO US,Mon Jul 26 15:15:19 PDT 2004,0.00,0.00
AR068,WA2MAK Bolton                     MA US,Mon Jul 26 15:19:50 PDT 2004,0.00,40.00
AR069,KF7KN-7 Red Lodge                 MT US,Mon Jul 26 15:14:42 PDT 2004,0.00,129.00
AR070,KI0BJ-2 Fort Smith                MT US,Mon Jul 26 15:15:57 PDT 2004,1.34,172.00
AR071,KD4BJW Albertville                AL US,Mon Jul 26 15:10:51 PDT 2004,0.45,161.00
AR072,KB2KMM N. Babylon                 NY US,Mon Jul 26 15:20:12 PDT 2004,0.00,262.00
AR078,N9NYF-6 Evansville                IN US,Mon Jul 26 15:13:19 PDT 2004,0.89,30.00
AR079,WX4BUY Elon                       NC US,Mon Jul 26 15:19:06 PDT 2004,0.00,65.00
AR084,W4ERC-10 Avon Park                FL US,Mon Jul 26 15:16:43 PDT 2004,0.00,59.00
AR085,N4HHP-5 Deerfield Beach           FL US,Mon Jul 26 15:14:33 PDT 2004,4.92,135.00
AR087,F8KDX Melun                          FR,Mon Jul 26 15:08:53 PDT 2004,0.00,354.00
AR091,DB0SAC-6 Bad Sackingen               DE,Mon Jul 26 15:19:59 PDT 2004,1.79,347.00
AR097,EA3AGQ Lleida                        ES,Mon Jul 26 15:11:21 PDT 2004,5.81,237.00
AR098,EA3AGQ-1 Montsec d'Ares              ES,Mon Jul 26 15:17:13 PDT 2004,5.81,45.00
AR100,N1FWV Peabody                     MA US,Mon Jul 26 15:20:04 PDT 2004,0.00,130.00
AR103,W4SBO-7 Section                   AL US,Mon Jul 26 15:18:53 PDT 2004,0.00,235.00
AR106,N6FKW Auberry                     CA US,Mon Jul 26 15:18:31 PDT 2004,0.00,193.00
AR107,EA3AKS-15 SantPere de Ribes          ES,Mon Jul 26 15:19:57 PDT 2004,1.34,0.00
AR108,EA3BB Santpedor                      ES,Mon Jul 26 15:20:01 PDT 2004,0.00,0.00
AR109,EA3BSJ-1 Pinos                       ES,Mon Jul 26 15:19:09 PDT 2004,0.00,180.00
AR110,EA3CNO-1 Barcelona                   ES,Mon Jul 26 15:15:59 PDT 2004,1.34,278.00
AR111,EA3URE Figueres                      ES,Mon Jul 26 15:17:03 PDT 2004,7.60,356.00
AR112,EB3DMC-1 Belvis                      ES,Mon Jul 26 15:20:07 PDT 2004,3.58,253.00
AR115,EUGENE Eugene                     OR US,Mon Jul 26 15:17:23 PDT 2004,5.36,268.00
AR118,F6DEV-5 Rimont                       FR,Mon Jul 26 15:19:25 PDT 2004,2.68,299.00
AR122,N4HHP-6 Cooper City               FL US,Mon Jul 26 15:18:27 PDT 2004,0.00,190.00
AR132,IZ1DBU-2 Favria                      IT,Mon Jul 26 15:13:25 PDT 2004,0.00,8.00
AR133,K0MXU-4 Hoxie                     KS US,Mon Jul 26 15:13:05 PDT 2004,2.24,135.00
AR134,K4JRG Miami                       FL US,Mon Jul 26 15:12:45 PDT 2004,1.34,277.00
AR137,K6NE Ventura                      CA US,Mon Jul 26 15:08:40 PDT 2004,0.00,269.00
AR138,K7LHC-1 Lake Havasu               AZ US,Mon Jul 26 15:19:10 PDT 2004,2.24,132.00
AR140,KB0VYO-12 Winona                  MN US,Mon Jul 26 15:19:22 PDT 2004,0.00,0.00
AR144,KB6CYS Cypress                    CA US,Mon Jul 26 15:15:53 PDT 2004,0.89,180.00
AR145,KB9KTD-1 Onalaska                 WI US,Mon Jul 26 15:15:09 PDT 2004,0.89,3.00
AR147,W0NWS-4 Colon                     NE US,Mon Jul 26 15:19:24 PDT 2004,3.58,200.00
AR148,K6DYC Meeker                      CO US,Mon Jul 26 15:16:29 PDT 2004,4.47,233.00
AR150,KC4WPS Hendersonville             TN US,Mon Jul 26 15:17:57 PDT 2004,0.00,337.00
AR156,KD4DLT-6 Lithonia                 GA US,Mon Jul 26 15:18:59 PDT 2004,0.00,0.00
AR159,KD6VLN-14 Tucson                  AZ US,Mon Jul 26 15:18:24 PDT 2004,1.79,29.00
AR161,KD7DR-3 Tempe                     AZ US,Mon Jul 26 15:11:53 PDT 2004,0.00,0.00
AR162,KF4VTT Mebane                     NC US,Mon Jul 26 15:17:54 PDT 2004,0.00,107.00
AR163,KF6JSV San Bernardino             CA US,Mon Jul 26 15:15:45 PDT 2004,2.24,208.00
AR164,KF6NY Mt. Ranch                   CA US,Mon Jul 26 15:20:05 PDT 2004,0.00,265.00
AR166,KG4LXH-2 Miami                    FL US,Mon Jul 26 15:08:28 PDT 2004,1.34,253.00
AR167,KI0IO-2 Berthoud                  CO US,Mon Jul 26 15:10:56 PDT 2004,0.00,222.00
AR169,KK6RW Gig Harbor                  WA US,Mon Jul 26 15:18:52 PDT 2004,1.34,141.00
AR170,KO5Z Denton                       TX US,Mon Jul 26 15:17:17 PDT 2004,0.45,270.00
AR173,LA2YEA Hauglandshella                NO,Mon Jul 26 15:15:22 PDT 2004,0.00,0.00
AR176,M3NIC Stowmarket                     UK,Mon Jul 26 15:05:52 PDT 2004,0.00,136.00
AR177,K7UGT Cary                        NC US,Mon Jul 26 15:20:00 PDT 2004,0.00,155.00
AR178,KJ3L Erie                         PA US,Mon Jul 26 15:20:13 PDT 2004,0.45,20.00
AR179,KC9AAG Fond Du Lac                WI US,Mon Jul 26 15:15:53 PDT 2004,0.00,64.00
AR180,WB6YPF Altadena                   CA US,Mon Jul 26 15:18:09 PDT 2004,2.24,193.00
AR181,KE6ONT Duarte                     CA US,Mon Jul 26 15:17:45 PDT 2004,3.13,230.00
AR182,GW4TJC Caerphilly                    UK,Mon Jul 26 15:20:10 PDT 2004,0.00,245.00
AR183,N7LUF Hansville                   WA US,Mon Jul 26 15:18:23 PDT 2004,0.89,354.00
AR184,W7PG-10 Forsyth                   MT US,Mon Jul 26 15:16:38 PDT 2004,1.79,322.00
AR185,N1XH-15 Spencer                   MA US,Mon Jul 26 15:17:21 PDT 2004,0.00,13.00
AR186,N2LBT-7 Albany                    NY US,Mon Jul 26 15:13:00 PDT 2004,0.00,355.00
AR190,N6GIW Joshua Tree                 CA US,Mon Jul 26 15:18:09 PDT 2004,4.47,266.00
AR191,WA4BPS Huntsville                 AL US,Mon Jul 26 15:18:26 PDT 2004,3.58,275.00
AR195,N7BIV Glendale                    AZ US,Mon Jul 26 15:18:58 PDT 2004,0.45,45.00
AR196,N7CK San Manuel                   AZ US,Mon Jul 26 15:08:42 PDT 2004,3.58,171.00
AR197,N7FZA-15 Boise                    ID US,Mon Jul 26 15:12:25 PDT 2004,2.24,154.00
AR199,N7TCF Phoenix                     AZ US,Mon Jul 26 15:12:50 PDT 2004,0.89,304.00
AR200,N7TQZ Tacoma                      WA US,Mon Jul 26 15:13:52 PDT 2004,1.79,6.00
AR201,N8NQF-1 Middletown                OH US,Mon Jul 26 15:18:59 PDT 2004,0.00,299.00
AR202,N8VIM Pepperell                   MA US,Mon Jul 26 15:14:28 PDT 2004,0.00,0.00
AR203,N9UDO-2 Baraboo                   WI US,Mon Jul 26 15:15:45 PDT 2004,1.79,162.00
AR204,N9YWZ Kimberly                    WI US,Mon Jul 26 15:12:28 PDT 2004,0.45,95.00
AR205,OE9FWV Feldkirch                     AT,Mon Jul 26 15:13:03 PDT 2004,0.00,93.00
AR206,OK1MX-7 Praha                        CZ,Mon Jul 26 15:12:22 PDT 2004,0.00,61.00
AR208,KD7WIS Miles City                 MT US,Mon Jul 26 15:13:42 PDT 2004,2.24,215.00
AR209,K0OQ Northfield                   MN US,Mon Jul 26 15:20:02 PDT 2004,0.00,193.00
AR210,N4IDX-7 Youngtown                 AL US,Mon Jul 26 15:17:59 PDT 2004,0.00,316.00
AR212,WX4MAP Phenix City                AL US,Mon Jul 26 15:19:58 PDT 2004,0.00,145.00
AR213,W4HSV Huntsville                  AL US,Mon Jul 26 15:18:13 PDT 2004,3.13,294.00
AR216,W7PG-12 Home Creek                MT US,Mon Jul 26 15:06:37 PDT 2004,0.00,0.00
AR220,KB6KJX Ellensburg                 WA US,Mon Jul 26 15:11:16 PDT 2004,2.24,314.00
AR221,K6TVI-1 Onyx Peak                 CA US,Mon Jul 26 15:13:51 PDT 2004,0.89,319.00
AR222,W7IUC-2 Big Coppitt Key           FL US,Mon Jul 26 15:18:51 PDT 2004,3.13,63.00
AR223,W7IUC-5 Grassy Key                FL US,Mon Jul 26 15:16:37 PDT 2004,0.00,177.00
AR225,KG6QHS Shingletown                CA US,Mon Jul 26 15:20:08 PDT 2004,0.00,240.00
AR226,W4RL-1 Pensacola                  FL US,Mon Jul 26 15:16:08 PDT 2004,0.00,107.00
AR228,N0ERG Littleton                   CO US,Mon Jul 26 15:15:05 PDT 2004,3.58,250.00
AR230,K4DIG-7 Sardis Springs            AL US,Mon Jul 26 15:19:08 PDT 2004,0.00,343.00
AR231,KB5GAS-1 Balloon Fiesta           NM US,Mon Jul 26 15:19:13 PDT 2004,1.79,209.00
AR232,KC7RJK Eugene                     OR US,Mon Jul 26 15:17:04 PDT 2004,1.79,349.00
AR234,NK7W Reno                         NV US,Mon Jul 26 15:15:59 PDT 2004,1.79,246.00
AR235,K6SUD Hesperia                    CA US,Mon Jul 26 15:14:15 PDT 2004,0.00,144.00
AR238,N5YXO Granbury                    TX US,Mon Jul 26 15:15:58 PDT 2004,0.45,270.00
AR243,K4TPD-5 Tallahassee               FL US,Mon Jul 26 15:18:42 PDT 2004,1.79,241.00
AR245,K7HRT Greenacres                  WA US,Mon Jul 26 15:19:25 PDT 2004,0.00,0.00
AR248,K7VIP Tucson                      AZ US,Mon Jul 26 15:19:29 PDT 2004,0.89,338.00
AR249,KA5WRG Oklahoma City              OK US,Mon Jul 26 15:18:57 PDT 2004,0.45,45.00
AR250,KA8SCP Westford                   MA US,Mon Jul 26 15:16:33 PDT 2004,0.00,320.00
AR252,KB7IPU-2 Payson                   AZ US,Mon Jul 26 15:17:37 PDT 2004,4.02,0.00
AR253,KB8WFH Springfield                OH US,Mon Jul 26 15:19:21 PDT 2004,0.00,94.00
AR254,KB9TPG Viroqua                    WI US,Mon Jul 26 15:20:23 PDT 2004,0.45,265.00
AR255,KC4YLE Efland                     NC US,Mon Jul 26 15:10:33 PDT 2004,0.00,220.00
AR256,W5HKR Schertz                     TX US,Mon Jul 26 15:19:11 PDT 2004,0.00,22.00
AR257,N1ETY New Britain                 CT US,Mon Jul 26 15:20:15 PDT 2004,0.00,337.00
AR258,KC8HJN Ludington                  MI US,Mon Jul 26 15:13:50 PDT 2004,2.24,313.00
AR259,KD5CUW-1 Copperas Cove            TX US,Mon Jul 26 15:15:26 PDT 2004,1.79,31.00
AR260,KD5FDE Runaway Bay                TX US,Mon Jul 26 15:15:19 PDT 2004,1.79,51.00
AR261,KD6RXY Calimesa                   CA US,Mon Jul 26 15:10:37 PDT 2004,4.92,259.00
AR264,K0JDN Phoenix                     AZ US,Mon Jul 26 15:17:41 PDT 2004,0.00,186.00
AR266,KJ7XE Port Angeles                WA US,Mon Jul 26 15:19:55 PDT 2004,0.00,0.00
AR267,N3WNZ Brandon                        UK,Mon Jul 26 15:15:50 PDT 2004,0.45,121.00
AR269,KC7PHC Orofino                    ID US,Mon Jul 26 15:15:06 PDT 2004,0.00,270.00
AR271,AA0MM-2 Holton                    KS US,Mon Jul 26 15:19:59 PDT 2004,1.34,174.00
AR272,KG4JPL Hudson                     FL US,Mon Jul 26 15:15:42 PDT 2004,0.00,161.00
AR273,N1JJX Southington                 CT US,Mon Jul 26 15:19:26 PDT 2004,0.00,134.00
AR274,W4RP Palm Bay                     FL US,Mon Jul 26 15:17:18 PDT 2004,1.34,104.00
AR276,W2RZS Hawthorn                    NY US,Mon Jul 26 15:08:02 PDT 2004,0.89,65.00
AR277,VE2GAT-2 St.Hyacinthe             QB CA,Mon Jul 26 15:18:29 PDT 2004,2.24,171.00
AR279,VE3COE Kincardine                ONT CA,Mon Jul 26 15:17:30 PDT 2004,0.89,52.00
AR280,VE3JON Kincardine                ONT CA,Mon Jul 26 15:16:02 PDT 2004,1.34,52.00
AR282,VE7IMD-2 Delta                    BC CA,Mon Jul 26 15:18:49 PDT 2004,0.00,214.00
AR286,K0NSA Omaha                       NE US,Mon Jul 26 15:10:51 PDT 2004,4.02,156.00
AR290,AB4KN Peachtree City              GA US,Mon Jul 26 15:17:01 PDT 2004,0.00,187.00
AR299,KB5NMB-15 Belmont                 MS US,Mon Jul 26 15:18:43 PDT 2004,0.00,120.00
AR300,KB8GQ Galloway                    OH US,Mon Jul 26 15:17:50 PDT 2004,4.02,315.00
AR301,N5KUK Norman                      OK US,Mon Jul 26 15:17:10 PDT 2004,1.34,38.00
AR302,N4NW Stafford                     VA US,Mon Jul 26 15:19:21 PDT 2004,0.00,200.00
AR303,DL1BLU Schortens                     DE,Mon Jul 26 15:15:18 PDT 2004,0.00,268.00
AR305,KF6ZGH Fremont                    CA US,Mon Jul 26 15:20:30 PDT 2004,4.02,250.00
AR306,KQ6DI-15 Livermore                CA US,Mon Jul 26 15:17:35 PDT 2004,3.13,305.00
AR308,W8EHH Winter Garden               FL US,Mon Jul 26 15:19:46 PDT 2004,2.24,174.00
AR309,WB6ABE-4 Benicia                  CA US,Mon Jul 26 15:16:54 PDT 2004,7.15,301.00
AR312,WA6BAY-1 Soquel                   CA US,Mon Jul 26 15:17:29 PDT 2004,0.00,152.00
AR313,WB6AHC-1 San Jose                 CA US,Mon Jul 26 15:20:24 PDT 2004,2.68,319.00
AR314,N7NAT Yakima                      WA US,Mon Jul 26 15:14:26 PDT 2004,1.34,160.00
AR315,OH6GPB Pietarsaari                   FI,Mon Jul 26 15:10:40 PDT 2004,0.00,355.00
AR318,ND1Q Concord                      NH US,Mon Jul 26 15:09:48 PDT 2004,0.89,137.00
AR319,VK7HDM-5 Hobart                  TAS AU,Mon Jul 26 15:19:18 PDT 2004,2.68,250.00
AR320,K6TZ Diablo Peak                  CA US,Mon Jul 26 15:20:33 PDT 2004,0.00,166.00
AR323,KF6YUA Sebastopol                 CA US,Mon Jul 26 15:16:57 PDT 2004,1.79,265.00
AR327,WB1FYE Weirs Beach                NH US,Mon Jul 26 15:20:07 PDT 2004,0.00,90.00
AR328,N1EO Center Harbor                NH US,Mon Jul 26 15:17:00 PDT 2004,0.00,251.00
AR329,KA1RVR Epping                     NH US,Mon Jul 26 15:20:17 PDT 2004,0.00,205.00
AR332,KD2KB Coudersport                 PA US,Mon Jul 26 15:20:16 PDT 2004,0.89,108.00
AR333,WO4U-10 Crossville                TN US,Mon Jul 26 15:19:31 PDT 2004,0.00,248.00
AR334,W4OZK-8 Collinsville              AL US,Mon Jul 26 15:08:45 PDT 2004,0.00,179.00
AR335,KB0RF San Jose                    CA US,Mon Jul 26 15:18:32 PDT 2004,2.24,295.00
AR338,N3WKE Baltimore                   MD US,Mon Jul 26 15:18:17 PDT 2004,0.89,154.00
AR339,AB0YW Blair                       NE US,Mon Jul 26 15:17:01 PDT 2004,2.24,171.00
AR340,AB8CY Scottville                  MI US,Mon Jul 26 15:16:17 PDT 2004,0.00,319.00
AR342,N2NZD Copake                      NY US,Mon Jul 26 15:17:24 PDT 2004,0.00,341.00
AR343,WA1OUI West Simsbury              CT US,Mon Jul 26 15:17:17 PDT 2004,0.00,76.00
AR345,KD5ZLP Rowlett                    TX US,Mon Jul 26 15:20:10 PDT 2004,0.45,40.00
AR346,TG9RB Guatemala City                 GT,Mon Jul 26 15:18:21 PDT 2004,0.00,340.00
AR347,KC5ZJO-1 Madison                  AL US,Mon Jul 26 15:18:14 PDT 2004,2.68,311.00
AR348,KG4VVU Helena                     AL US,Mon Jul 26 15:11:10 PDT 2004,0.00,130.00
AR350,W6MAR Galt                        CA US,Mon Jul 26 15:06:01 PDT 2004,0.00,236.00
AR351,ON7EQ-1 Brugge                       BE,Mon Jul 26 15:17:03 PDT 2004,0.00,50.00
AR354,W7PAQ Missoula                    MT US,Mon Jul 26 15:17:43 PDT 2004,0.00,115.00
AR356,AG1C Westborough                  MA US,Mon Jul 26 15:19:47 PDT 2004,0.00,40.00
AR357,WB1ETW Plainville                 MA US,Mon Jul 26 15:19:18 PDT 2004,0.00,65.00
AR358,N1MZX Peterborough                NH US,Mon Jul 26 15:20:16 PDT 2004,0.89,112.00
AR363,KC0MKS-10 Knife River             MN US,Mon Jul 26 15:12:56 PDT 2004,3.58,260.00
AR365,KM6GE Allenspark                  CO US,Mon Jul 26 15:18:47 PDT 2004,0.45,179.00
AR366,KB9VSQ Reedsburg                  WI US,Mon Jul 26 15:18:09 PDT 2004,0.00,332.00
AR367,KB0KQA Duluth                     MN US,Mon Jul 26 15:15:44 PDT 2004,0.00,358.00
AR368,WA0VSL Monument                   CO US,Mon Jul 26 15:15:21 PDT 2004,0.45,183.00
AR369,VA4GD Pinawa                     MAN CA,Mon Jul 26 15:20:20 PDT 2004,1.34,198.00
