AP449,WB9BJQ Onalaska                   WI US,Wed Aug 04 15:46:20 PDT 2004,0.00,35.00
AP458,N5RIG Fremont                     NE US,Wed Aug 04 15:43:31 PDT 2004,0.89,304.00
AP463,K4RVH Madison                     AL US,Wed Aug 04 15:46:40 PDT 2004,0.00,205.00
AP464,KU4ME Andersonville               TN US,Wed Aug 04 15:43:24 PDT 2004,0.00,296.00
AP469,WA7QFR Bothell                    WA US,Wed Aug 04 15:39:56 PDT 2004,0.00,7.00
AP472,W7EPP Lynden                      WA US,Wed Aug 04 15:40:16 PDT 2004,4.02,235.00
AP475,KB7OHO Tukwila                    WA US,Wed Aug 04 15:43:18 PDT 2004,0.89,348.00
AP477,KC7ZPO Milwaukie                  OR US,Wed Aug 04 15:49:52 PDT 2004,2.68,268.00
AP478,WA7RVV Medical Lake               WA US,Wed Aug 04 15:45:46 PDT 2004,0.00,1.00
AP479,KC7AM-10 Tollgate                 OR US,Wed Aug 04 15:48:31 PDT 2004,2.24,127.00
AP483,N9OSQ-7 Pensacola                 FL US,Wed Aug 04 15:50:07 PDT 2004,1.34,192.00
AP487,WX6X Springfield                  MO US,Wed Aug 04 15:44:05 PDT 2004,0.00,232.00
AP492,WA6OFT-5 Quartzsite               AZ US,Wed Aug 04 15:48:54 PDT 2004,4.92,195.00
AP500,N1SKZ Hillsboro                   NH US,Wed Aug 04 15:45:22 PDT 2004,0.00,250.00
AP505,WK1F-2 Yulee                      FL US,Wed Aug 04 15:40:50 PDT 2004,1.79,202.00
AP510,KK6RW Gig Harbor                  WA US,Wed Aug 04 15:47:37 PDT 2004,0.00,155.00
AP513,WB4QEV-4 Hollingers Is.           AL US,Wed Aug 04 15:48:39 PDT 2004,3.13,262.00
AP514,WB4QEV-9 Sidney                   AL US,Wed Aug 04 15:48:19 PDT 2004,0.00,285.00
AP517,WW7RA Gold Mountain               WA US,Wed Aug 04 15:40:56 PDT 2004,0.00,225.00
AP519,W2KB Lebanon Twp.                 NJ US,Wed Aug 04 15:50:05 PDT 2004,0.00,0.00
AP520,WA4LZC Orlando                    FL US,Wed Aug 04 15:47:22 PDT 2004,0.00,249.00
AP521,KD4K Cumming                      GA US,Wed Aug 04 15:49:05 PDT 2004,0.00,296.00
AP522,K3CHZ Dayton                      MD US,Wed Aug 04 15:48:33 PDT 2004,0.00,250.00
AP523,WA9UKW Boise                      ID US,Wed Aug 04 15:44:50 PDT 2004,1.79,344.00
AP525,N6RZR-2 Anderson                  CA US,Wed Aug 04 15:45:54 PDT 2004,0.00,0.00
AP526,KG4CVZ Tallulah Falls             GA US,Wed Aug 04 15:49:50 PDT 2004,0.45,213.00
AP527,WB0TAX Elm Grove                  LA US,Wed Aug 04 15:44:31 PDT 2004,1.34,113.00
AP534,W2MJD Hempstead                   NY US,Wed Aug 04 15:49:00 PDT 2004,0.00,136.00
AP535,N1LTP Norton                      MA US,Wed Aug 04 15:47:13 PDT 2004,0.00,130.00
AP537,KC6TYC Port St. John              FL US,Wed Aug 04 15:48:30 PDT 2004,0.00,283.00
AP538,WA3YML Thornhurst                 PA US,Wed Aug 04 15:46:11 PDT 2004,0.00,23.00
AP541,AD6NH Placentia                   CA US,Wed Aug 04 15:45:53 PDT 2004,0.45,234.00
AP542,WM0F Berthoud                     CO US,Wed Aug 04 15:45:06 PDT 2004,0.45,355.00
AP544,VP1PRK Perkasie                   PA US,Wed Aug 04 15:46:34 PDT 2004,0.00,309.00
AP550,N9LBG Edwardsville                IL US,Wed Aug 04 15:36:03 PDT 2004,0.00,270.00
AP554,N2XW Manahawkin                   NJ US,Wed Aug 04 15:46:11 PDT 2004,1.34,174.00
AP555,WA1LOU-15 Wolcott                 CT US,Wed Aug 04 15:47:57 PDT 2004,0.00,0.00
AP556,VE3PEW Mississauga               ONT CA,Wed Aug 04 15:46:13 PDT 2004,0.00,3.00
AP558,N9GTL Marion                      IN US,Wed Aug 04 15:49:47 PDT 2004,0.45,1.00
AP561,AI9H-6 Mount Carmel               IL US,Wed Aug 04 15:46:54 PDT 2004,0.89,296.00
AP564,N1OTX Woburn                      MA US,Wed Aug 04 15:49:15 PDT 2004,0.00,104.00
AP565,KQ4YD White City                  FL US,Wed Aug 04 15:45:48 PDT 2004,0.89,285.00
AP566,KQ4KX Lakeland                    FL US,Wed Aug 04 15:46:25 PDT 2004,1.34,172.00
AP570,KF3BH Catawissa                   PA US,Wed Aug 04 15:47:36 PDT 2004,0.00,341.00
AP574,K0JJV Hays                        KS US,Wed Aug 04 15:50:11 PDT 2004,3.58,5.00
AP575,KB5WIO Amarillo                   TX US,Wed Aug 04 15:47:06 PDT 2004,2.24,153.00
AP577,K4MG Ocala                        FL US,Wed Aug 04 15:48:46 PDT 2004,0.89,296.00
AP580,WA9IN-2 Washington                IN US,Wed Aug 04 15:47:53 PDT 2004,0.45,274.00
AP584,KC9BWF-1 Green Bay                WI US,Wed Aug 04 15:49:36 PDT 2004,12.52,45.00
AP585,KC9BWF-3 Green Bay                WI US,Wed Aug 04 15:49:00 PDT 2004,8.05,319.00
AP586,N1EPX Jamaica Plain               MA US,Wed Aug 04 15:46:38 PDT 2004,0.45,82.00
AP588,WD4CD Pickens                     SC US,Wed Aug 04 15:48:27 PDT 2004,0.00,143.00
AP590,KD5RXP Ft.Worth                   TX US,Wed Aug 04 15:47:04 PDT 2004,0.00,0.00
AP593,KC5JIF Amarillo                   TX US,Wed Aug 04 15:48:09 PDT 2004,3.13,259.00
AP594,KC5JZG-2 Bryan                    TX US,Wed Aug 04 15:49:14 PDT 2004,0.89,75.00
AP599,N1HQ Panama City                  FL US,Wed Aug 04 15:47:20 PDT 2004,1.34,161.00
AP602,KG5RG Dickinson                   TX US,Wed Aug 04 15:47:50 PDT 2004,1.79,172.00
AP606,VE2SIL-2 Pierrefonds             QUE CA,Wed Aug 04 15:49:36 PDT 2004,0.00,0.00
AP609,KB8PVI Plain City                 OH US,Wed Aug 04 15:50:07 PDT 2004,0.00,292.00
AP610,WB9HLA-2 Hartford City            IN US,Wed Aug 04 15:50:11 PDT 2004,2.24,39.00
AP611,KJ7NO-2 Farmington                UT US,Wed Aug 04 15:36:31 PDT 2004,0.00,180.00
AP613,PA0OKE Neptunuslaan                  NL,Wed Aug 04 15:50:05 PDT 2004,1.79,34.00
AP614,ON4BDW Vaartdijk                     BE,Wed Aug 04 15:41:27 PDT 2004,0.00,8.00
AP619,IZ6ADZ Scalo                         IT,Wed Aug 04 15:46:46 PDT 2004,0.00,332.00
AP620,IW0RQH Foligno                       IT,Wed Aug 04 15:47:44 PDT 2004,1.79,94.00
AP624,M0ADS Sheffield                      UK,Wed Aug 04 15:49:00 PDT 2004,0.45,15.00
AP626,G1YXH Kent                           UK,Wed Aug 04 15:48:33 PDT 2004,0.00,127.00
AP627,VE4UB Selkirk                     MB CA,Wed Aug 04 15:46:15 PDT 2004,1.79,18.00
AP629,VK3CSJ Dandenong                     AU,Wed Aug 04 15:48:40 PDT 2004,2.24,330.00
AP630,VK3MY Knox City                      AU,Wed Aug 04 15:47:12 PDT 2004,0.00,71.00
AP635,VK5BRC-7 Angaston                    AU,Wed Aug 04 15:45:18 PDT 2004,9.39,270.00
AP640,KC7MRW Lincoln                    ND US,Wed Aug 04 15:45:54 PDT 2004,5.36,84.00
AP641,KB0WBM-2 Arnold                   ND US,Wed Aug 04 15:48:39 PDT 2004,0.45,89.00
AP642,W0NWS-2 Mead                      NE US,Wed Aug 04 15:44:30 PDT 2004,7.60,359.00
AP643,W0HII-3 Cedar Creek               NE US,Wed Aug 04 15:49:40 PDT 2004,3.58,56.00
AP645,VP5DB-2 Carmen                       TC,Wed Aug 04 15:43:38 PDT 2004,3.58,96.00
AP647,K5ZZT-5 San Antonio               TX US,Wed Aug 04 15:46:02 PDT 2004,1.34,96.00
AP648,KS5V Bulverde                     TX US,Wed Aug 04 15:47:30 PDT 2004,3.13,125.00
AP650,N5CWM Montgomery                  TX US,Wed Aug 04 15:36:01 PDT 2004,0.00,321.00
AP652,KK5AV-4 Brownwood                 TX US,Wed Aug 04 15:39:06 PDT 2004,0.00,264.00
AP653,AC5CP Granbury                    TX US,Wed Aug 04 15:46:44 PDT 2004,1.79,139.00
AP654,N5YXO Granbury                    TX US,Wed Aug 04 15:47:05 PDT 2004,2.24,123.00
AP656,KC5TIL Rendon                     TX US,Wed Aug 04 15:42:50 PDT 2004,0.45,118.00
AP657,KC4WTI Carrolton                  TX US,Wed Aug 04 15:46:51 PDT 2004,4.02,140.00
AP661,WA5KXX Plano                      TX US,Wed Aug 04 15:47:50 PDT 2004,0.00,190.00
AP669,PA0OKE Amsterdam                     NL,Wed Aug 04 15:50:05 PDT 2004,1.79,34.00
AP671,KD5FGW NW Oranjestad                 AW,Wed Aug 04 15:40:21 PDT 2004,6.26,141.00
AP672,P43M Noord                           AW,Wed Aug 04 15:44:06 PDT 2004,0.00,0.00
AP677,NR0A-4 Norfolk                    NE US,Wed Aug 04 15:48:33 PDT 2004,0.89,77.00
AP679,ON5CT St-Niklaas                     BE,Wed Aug 04 15:40:38 PDT 2004,0.89,68.00
AP680,KA1GOZ Nashua                     NH US,Wed Aug 04 15:45:36 PDT 2004,0.00,79.00
AP681,N7RIG-6 Mt Vernon                 WA US,Wed Aug 04 15:46:06 PDT 2004,0.00,0.00
AP682,W7KKE-3 Road's End                OR US,Wed Aug 04 15:48:04 PDT 2004,4.47,311.00
AP685,KD7CTY Vancouver                  WA US,Wed Aug 04 15:47:46 PDT 2004,1.34,302.00
AP689,KF4TTB-2 Huntsville               AL US,Wed Aug 04 15:47:24 PDT 2004,4.92,241.00
AP692,ZL1WPK Hamilton                      NZ,Wed Aug 04 15:43:19 PDT 2004,2.24,3.00
AP693,ZL1RED Tauranga                      NZ,Wed Aug 04 15:43:14 PDT 2004,0.00,118.00
AP694,ZL1KRH Tauranga                      NZ,Wed Aug 04 15:38:57 PDT 2004,0.45,203.00
AP697,N1NLX Madison                     NH US,Wed Aug 04 15:43:35 PDT 2004,0.00,332.00
AP698,K3BAY Pasadena                    MD US,Wed Aug 04 15:49:37 PDT 2004,1.34,191.00
AP704,KA1UDX Collegeville               PA US,Wed Aug 04 15:35:48 PDT 2004,0.00,217.00
AP705,K4VVN Kingsport                   TN US,Wed Aug 04 15:47:10 PDT 2004,0.89,227.00
AP706,N0PJH Grand Island                NE US,Wed Aug 04 15:47:19 PDT 2004,3.13,8.00
AP710,N7XRD Renton                      WA US,Wed Aug 04 15:45:39 PDT 2004,2.24,168.00
AP711,W0DVM Divide                      CO US,Wed Aug 04 15:38:38 PDT 2004,2.68,197.00
AP712,KA1HEU Hudson                     NH US,Wed Aug 04 15:50:10 PDT 2004,0.00,79.00
AP715,K4DNM Clayton                     NC US,Wed Aug 04 15:49:09 PDT 2004,0.00,340.00
AP718,K4YK Greensboro                   GA US,Wed Aug 04 15:46:31 PDT 2004,0.00,244.00
AP722,KF4ORW Dade City                  FL US,Wed Aug 04 15:45:24 PDT 2004,0.00,177.00
AP723,KB2RC Orlando                     FL US,Wed Aug 04 15:47:16 PDT 2004,0.00,136.00
AP725,KD4BNP Palm Bay                   FL US,Wed Aug 04 15:50:10 PDT 2004,0.45,193.00
AP732,KC9AVZ Jackson                    WI US,Wed Aug 04 15:35:50 PDT 2004,4.47,337.00
AP733,K0YCN East Tawakoni               TX US,Wed Aug 04 15:48:46 PDT 2004,0.45,133.00
AP738,KB0VBZ Aurora                     CO US,Wed Aug 04 15:45:40 PDT 2004,0.45,249.00
AP739,WB0TWE Encinitas                  CA US,Wed Aug 04 15:45:53 PDT 2004,2.24,205.00
AP741,KB9WVG Golden                     CO US,Wed Aug 04 15:45:44 PDT 2004,0.00,67.00
AP742,KC4ELV Honey Creek                GA US,Wed Aug 04 15:49:57 PDT 2004,0.00,306.00
AP745,K4GPS-1 Jupiter Farms             FL US,Wed Aug 04 15:47:17 PDT 2004,0.00,273.00
AP746,AA3H Avon                         OH US,Wed Aug 04 15:49:19 PDT 2004,0.45,98.00
AP747,KC4ANB Trussville                 AL US,Wed Aug 04 15:49:46 PDT 2004,2.24,356.00
AP749,N3FJA Mountain Top                PA US,Wed Aug 04 15:44:36 PDT 2004,0.00,182.00
AP750,W1OEM Flanders                    CT US,Wed Aug 04 15:48:24 PDT 2004,0.00,248.00
AP752,WB2FTX Butler                     NJ US,Wed Aug 04 15:40:38 PDT 2004,0.00,221.00
AP758,KC7BWK Florence                   OR US,Wed Aug 04 15:49:48 PDT 2004,1.79,183.00
AP760,WB0BLV Security/Widefield         CO US,Wed Aug 04 15:48:00 PDT 2004,4.02,58.00
AP763,OX3HI Kangerlussuaq                  GL,Wed Aug 04 15:45:09 PDT 2004,2.24,83.00
AP765,N3EYQ Kingston                    NY US,Wed Aug 04 15:42:40 PDT 2004,0.89,11.00
AP766,WB2CMF Farmingville               NY US,Wed Aug 04 15:36:03 PDT 2004,0.00,199.00
AP767,N2XP Flanders                     NJ US,Wed Aug 04 15:48:23 PDT 2004,0.00,0.00
AP769,WC4PEM-10 Bartow                  FL US,Wed Aug 04 15:42:41 PDT 2004,0.00,180.00
AP771,WD9HDQ-2 Northfield               MN US,Wed Aug 04 15:38:24 PDT 2004,2.68,358.00
AP772,K4KAL Marietta                    GA US,Wed Aug 04 15:45:29 PDT 2004,0.00,263.00
AP773,KB4TOH-11 Columbia                NC US,Wed Aug 04 15:47:21 PDT 2004,1.79,239.00
AP774,N8OVD Wendell                     NC US,Wed Aug 04 15:49:30 PDT 2004,0.00,358.00
AP779,K4CCC-9 Cheraw                    SC US,Wed Aug 04 15:45:29 PDT 2004,0.00,124.00
AP780,W5VBQ Santa Fe                    NM US,Wed Aug 04 15:43:32 PDT 2004,7.60,97.00
AP782,WB5NZV-8 N.Denton                 TX US,Wed Aug 04 15:42:28 PDT 2004,0.00,182.00
AP783,KC5DPC-3 Slidell                  TX US,Wed Aug 04 15:47:20 PDT 2004,4.92,257.00
AP786,K5EBQ Houston                     TX US,Wed Aug 04 15:50:11 PDT 2004,0.00,244.00
AP787,KC5LPN Houston                    TX US,Wed Aug 04 15:48:49 PDT 2004,1.34,198.00
AP789,W0HVA Minot                       ND US,Wed Aug 04 15:42:40 PDT 2004,1.34,202.00
AP792,KB0TVJ-4 MeadowLake Airport       CO US,Wed Aug 04 15:48:40 PDT 2004,5.36,120.00
AP795,KD7TTL Greenbank                  WA US,Wed Aug 04 15:48:21 PDT 2004,0.00,263.00
AP799,AE0S-3 Columbia                   MO US,Wed Aug 04 15:47:43 PDT 2004,0.00,4.00
AP802,W4OZK-7 Mentone                   AL US,Wed Aug 04 15:47:28 PDT 2004,0.00,267.00
AP803,KE6AFE Santa Cruz                 CA US,Wed Aug 04 15:50:17 PDT 2004,2.24,139.00
AP806,N3EG Longview                     WA US,Wed Aug 04 15:47:03 PDT 2004,0.89,20.00
AP808,KG4YZY New Port Richey            FL US,Wed Aug 04 15:49:20 PDT 2004,0.45,202.00
AP809,K4NUT Port Richey                 FL US,Wed Aug 04 15:50:09 PDT 2004,2.24,212.00
AP811,KC2IXE Bayside Hills              NY US,Wed Aug 04 15:46:44 PDT 2004,0.89,252.00
AP812,VE3XF Stayner                    ONT CA,Wed Aug 04 15:49:45 PDT 2004,3.58,332.00
AP813,VE3PWZ Dundalk                   ONT CA,Wed Aug 04 15:40:54 PDT 2004,5.36,5.00
AP814,VA3GY Erin                       ONT CA,Wed Aug 04 15:48:55 PDT 2004,2.68,29.00
AP815,VA3HST Guelph                    ONT CA,Wed Aug 04 15:47:46 PDT 2004,0.45,308.00
AP818,VA3MWK Ashton                    ONT CA,Wed Aug 04 15:48:12 PDT 2004,2.24,311.00
AP819,VE3TEN Ottawa                    ONT CA,Wed Aug 04 15:46:25 PDT 2004,0.00,277.00
AP820,VE6BMR Sherwood Park             ALT CA,Wed Aug 04 15:46:35 PDT 2004,3.13,138.00
AP823,AD4BL Fairbanks                   AK US,Wed Aug 04 15:42:19 PDT 2004,0.00,329.00
AP830,KA2FNK Merriam                    KS US,Wed Aug 04 15:46:30 PDT 2004,0.45,331.00
AP831,N9NJK Warsaw                      IN US,Wed Aug 04 15:48:44 PDT 2004,4.02,55.00
AP832,WB9TLH-11 Bloomington             IN US,Wed Aug 04 15:46:11 PDT 2004,0.00,0.00
AP833,KE4CON-3 Woodstock                IL US,Wed Aug 04 15:44:16 PDT 2004,2.68,358.00
AP838,W5MAI San Antonio                 TX US,Wed Aug 04 15:43:32 PDT 2004,0.45,106.00
AP840,KC0OGY-5 Bailey                   CO US,Wed Aug 04 15:39:28 PDT 2004,0.00,1.00
AP841,WE1A USAF Academy                 CO US,Wed Aug 04 15:45:04 PDT 2004,2.24,180.00
AP842,VE5VAP Dalmeny                    SK CA,Wed Aug 04 15:43:37 PDT 2004,5.36,171.00
AP850,KC2GLZ Lowville                   NY US,Wed Aug 04 15:49:45 PDT 2004,0.00,357.00
AP852,WG4R Meadows of Dan               VA US,Wed Aug 04 15:50:19 PDT 2004,0.89,248.00
AP854,N4HHP-1 Plantation                FL US,Wed Aug 04 15:50:02 PDT 2004,0.00,349.00
AP855,N4HHP-2 Ft. Lauderdale            FL US,Wed Aug 04 15:47:25 PDT 2004,3.58,13.00
AP856,N4HHP-3 Hallandale Beach          FL US,Wed Aug 04 15:43:32 PDT 2004,2.68,1.00
AP860,AA5ED-10 Brandon                  MS US,Wed Aug 04 15:48:32 PDT 2004,0.00,299.00
AP861,N1IV Plainville                   MA US,Wed Aug 04 15:42:34 PDT 2004,0.00,169.00
AP862,KC0KOQ-1 Goodland                 KS US,Wed Aug 04 15:46:34 PDT 2004,1.79,45.00
AP864,AB0XM-1 Great Bend                KS US,Wed Aug 04 15:48:36 PDT 2004,5.36,24.00
AP866,KA0HJZ Van Meter                  IA US,Wed Aug 04 15:46:18 PDT 2004,2.24,13.00
AP867,N0VPR Johnston                    IA US,Wed Aug 04 15:48:32 PDT 2004,2.68,25.00
AP870,KC0LBV Farmington                 MN US,Wed Aug 04 15:41:10 PDT 2004,3.58,352.00
AP871,N0PFY Northfield                  MN US,Wed Aug 04 15:48:32 PDT 2004,2.24,41.00
AP872,N0EST Rochester                   MN US,Wed Aug 04 15:35:24 PDT 2004,0.00,104.00
AP874,VK2AAK Forster                       AU,Wed Aug 04 15:48:56 PDT 2004,1.34,305.00
AP878,AB9FX Chicago                     IL US,Wed Aug 04 15:46:12 PDT 2004,4.92,87.00
AP879,N9VPV Galesburg                   IL US,Wed Aug 04 15:48:57 PDT 2004,1.34,34.00
AP881,KJ4W Murray                       KY US,Wed Aug 04 15:38:22 PDT 2004,0.89,248.00
AP890,KB7DZR Tigard                     OR US,Wed Aug 04 15:50:02 PDT 2004,3.13,351.00
AP892,KG6QHD Prineville                 OR US,Wed Aug 04 15:50:10 PDT 2004,1.34,317.00
AP893,KE6KYI Groveland                  CA US,Wed Aug 04 15:46:17 PDT 2004,0.00,136.00
AP896,WA6YLB Exeter                     CA US,Wed Aug 04 15:43:38 PDT 2004,0.00,344.00
AP897,WA6YLB-4 Govt.Peak                CA US,Wed Aug 04 15:46:39 PDT 2004,6.26,290.00
AP898,WA6YLB-6 Visalia                  CA US,Wed Aug 04 15:46:34 PDT 2004,0.00,0.00
AP900,KE6ZPS-1 Miranda Canyon           CA US,Wed Aug 04 15:49:43 PDT 2004,5.81,203.00
AP901,KB6OQJ Santa Ynez                 CA US,Wed Aug 04 15:42:21 PDT 2004,2.24,234.00
AP902,N6HGA-1 Palmdale                  CA US,Wed Aug 04 15:46:56 PDT 2004,7.15,240.00
AP904,W6MAF Hesperia                    CA US,Wed Aug 04 15:48:46 PDT 2004,4.92,228.00
AP907,W9IF-4 Torry Pines                CA US,Wed Aug 04 15:48:11 PDT 2004,3.13,281.00
AP911,K4GIG-7 Brindley Mtn.             AL US,Wed Aug 04 15:48:37 PDT 2004,0.00,248.00
AP912,WB2JSH Eaton                      CO US,Wed Aug 04 15:50:10 PDT 2004,4.47,178.00
AP913,WB5SLA Ball Ground                GA US,Wed Aug 04 15:49:20 PDT 2004,0.00,348.00
AP917,W7NWS Billings                    MT US,Wed Aug 04 15:41:02 PDT 2004,3.13,81.00
AP918,KB0YUP Maryland Hts.              MO US,Wed Aug 04 15:44:49 PDT 2004,0.00,339.00
AP919,LB9ME Trondheim                      NO,Wed Aug 04 15:49:31 PDT 2004,1.34,120.00
AP921,OZ6GX-5 Roervig                      DK,Wed Aug 04 15:47:35 PDT 2004,0.00,128.00
AP922,OZ1IEP-5 Jaegerspris                 DK,Wed Aug 04 15:49:17 PDT 2004,2.68,150.00
AP936,G3RJI Essex                          UK,Wed Aug 04 15:49:26 PDT 2004,0.45,49.00
AP937,MB7UEK Herne Bay                     UK,Wed Aug 04 15:49:37 PDT 2004,0.00,107.00
AP938,G3OJZ-6 Kent                         UK,Wed Aug 04 15:40:10 PDT 2004,0.00,0.00
AP943,MTHEBO Mt. Hebo                   OR US,Wed Aug 04 15:48:34 PDT 2004,0.00,0.00
AP944,F4BNZ Drouais                        FR,Wed Aug 04 15:40:35 PDT 2004,0.45,325.00
AP946,F1HCI-12 Versailles                  FR,Wed Aug 04 15:42:20 PDT 2004,0.00,319.00
AP949,F4CEP-12 Rubelles                    FR,Wed Aug 04 15:45:02 PDT 2004,4.02,340.00
AP952,N1NSI Contoocook                  NH US,Wed Aug 04 15:45:37 PDT 2004,0.00,3.00
AP953,ZF1EJ Savannah                       KY,Wed Aug 04 15:48:48 PDT 2004,2.24,101.00
AP957,KA4EOC Tallahassee                FL US,Wed Aug 04 15:49:07 PDT 2004,0.00,272.00
AP959,K7NPS Snowden                     WA US,Wed Aug 04 15:45:16 PDT 2004,2.68,158.00
AP962,EB2FGI-15 Irun                       ES,Wed Aug 04 15:42:35 PDT 2004,0.89,264.00
AP965,EB5ESX Sta Pola                      ES,Wed Aug 04 15:49:21 PDT 2004,1.79,60.00
AP967,EA3AYP-1 Girona                      ES,Wed Aug 04 15:47:30 PDT 2004,2.68,290.00
AP968,EA3FAJ-1 Girona                      ES,Wed Aug 04 15:40:01 PDT 2004,0.00,183.00
AP969,EA3RCK-1 Lleida                      ES,Wed Aug 04 15:50:07 PDT 2004,0.00,351.00
AP973,PE1NAT-1 Heerhugowaard               NL,Wed Aug 04 15:50:01 PDT 2004,0.00,43.00
AP976,DO7VLR-5 Zweibruecken                DE,Wed Aug 04 15:46:21 PDT 2004,2.68,169.00
AP979,KC9BWF-3 Sister Bay               MI US,Wed Aug 04 15:49:00 PDT 2004,8.05,319.00
AP981,KG4SEY Niceville                  FL US,Wed Aug 04 15:46:15 PDT 2004,0.45,178.00
AP984,N8QQ Cincinnati                   OH US,Wed Aug 04 15:50:04 PDT 2004,0.00,320.00
AP985,KB9QJM-11 Cloverdale              IN US,Wed Aug 04 15:48:07 PDT 2004,2.24,355.00
AP986,KB9QJM-12 Atlanta                 IN US,Wed Aug 04 15:47:01 PDT 2004,4.47,20.00
AP987,KC5CPO Keene                      TX US,Wed Aug 04 15:50:21 PDT 2004,1.34,293.00
AP989,KC9JWM Clam Lake                  WI US,Wed Aug 04 15:40:20 PDT 2004,0.89,240.00
AP990,KG6MOZ Sunnyvale                  CA US,Wed Aug 04 15:48:17 PDT 2004,1.34,264.00
AP991,W0BIS-3 Killdeer                  ND US,Wed Aug 04 15:49:28 PDT 2004,6.26,150.00
AP993,F6CNB Frelsburg                   TX US,Wed Aug 04 15:37:20 PDT 2004,0.00,17.00
AP994,DL2YED-6 Recklinghausen              DE,Wed Aug 04 15:47:13 PDT 2004,0.00,182.00
AP996,KC5YVU Lampasas                   TX US,Wed Aug 04 15:45:15 PDT 2004,2.68,134.00
AP998,DK1PR-6 Altenahr                     DE,Wed Aug 04 15:47:43 PDT 2004,0.00,212.00
AR003,DL9GJ-6 Burgrieden                   DE,Wed Aug 04 15:42:34 PDT 2004,0.00,90.00
AR005,HB9BA-8 Solothurn                    CH,Wed Aug 04 15:43:33 PDT 2004,0.00,0.00
AR006,HB9MZI Giubiasco                     CH,Wed Aug 04 15:49:44 PDT 2004,0.00,113.00
AR013,IK1ZYQ Dusino                        IT,Wed Aug 04 15:46:11 PDT 2004,0.00,113.00
AR014,IK1RDC Scurzolengo                   IT,Wed Aug 04 15:47:07 PDT 2004,1.34,351.00
AR021,I3OVD Scaltenigo                     IT,Wed Aug 04 15:49:50 PDT 2004,0.00,212.00
AR022,IW5BFZ Lucca                         IT,Wed Aug 04 15:45:28 PDT 2004,0.00,301.00
AR025,IT9IPQ-2 Messina                     IT,Wed Aug 04 15:48:33 PDT 2004,0.00,244.00
AR026,IK8ERL-2 Scilla                      IT,Wed Aug 04 15:46:40 PDT 2004,1.34,167.00
AR027,IZ8GMP-2 Reggio Calabria             IT,Wed Aug 04 15:45:49 PDT 2004,2.68,50.00
AR028,IW8PCP-2 Gambarie d'Aspromonte       IT,Wed Aug 04 15:48:21 PDT 2004,0.00,91.00
AR030,N4HHP-4 Pompano Beach             FL US,Wed Aug 04 15:48:51 PDT 2004,2.24,139.00
AR031,SV2BNL-2 Thessaloniki                GR,Wed Aug 04 15:49:49 PDT 2004,3.13,301.00
AR034,SV1CIF-2 Aitoloakarnania             GR,Wed Aug 04 15:44:23 PDT 2004,0.89,70.00
AR035,SV3AQN-2 Patra                       GR,Wed Aug 04 15:47:12 PDT 2004,0.00,171.00
AR036,SV3BEF-2 Tripolis                    GR,Wed Aug 04 15:47:18 PDT 2004,0.00,249.00
AR038,VK4AGS-3 Calliope                    AU,Wed Aug 04 15:44:03 PDT 2004,0.00,294.00
AR039,VK4TMK Arana Hills                   AU,Wed Aug 04 15:42:05 PDT 2004,3.13,286.00
AR040,N3BSQ Bethel Park                 PA US,Wed Aug 04 15:49:57 PDT 2004,0.45,309.00
AR042,VK1AC Bywong                     NSW AU,Wed Aug 04 15:48:07 PDT 2004,1.34,259.00
AR043,K4ZZR Port St. Lucie              FL US,Wed Aug 04 15:45:48 PDT 2004,1.79,232.00
AR044,N0QXY Ft.Lupton                   CO US,Wed Aug 04 15:48:23 PDT 2004,0.89,148.00
AR045,IW9ETI-2 Taormina                    IT,Wed Aug 04 15:48:28 PDT 2004,2.24,337.00
AR051,KE7TR-8 Mesa                      AZ US,Wed Aug 04 15:49:42 PDT 2004,4.02,290.00
AR052,KG4QXL Fort Valley                VA US,Wed Aug 04 15:46:06 PDT 2004,0.89,93.00
AR053,VK3AWA Paradise Beach                AU,Wed Aug 04 15:41:06 PDT 2004,1.79,257.00
AR057,VK3XJB Shepparton                    AU,Wed Aug 04 15:45:32 PDT 2004,0.45,296.00
AR058,VK3YWY-1 Kyneton                     AU,Wed Aug 04 15:37:06 PDT 2004,0.00,212.00
AR060,VK3JTM-3 Ararat                      AU,Wed Aug 04 15:47:26 PDT 2004,3.13,234.00
AR062,VK5EX-1 Adelaide                     AU,Wed Aug 04 15:44:51 PDT 2004,0.89,345.00
AR066,KC0IVW Colorado Springs           CO US,Wed Aug 04 15:45:22 PDT 2004,0.00,0.00
AR068,WA2MAK Bolton                     MA US,Wed Aug 04 15:45:24 PDT 2004,0.00,78.00
AR069,KF7KN-7 Red Lodge                 MT US,Wed Aug 04 15:45:08 PDT 2004,4.02,82.00
AR070,KI0BJ-2 Fort Smith                MT US,Wed Aug 04 15:44:48 PDT 2004,0.45,322.00
AR071,KD4BJW Albertville                AL US,Wed Aug 04 15:50:08 PDT 2004,0.00,157.00
AR072,KB2KMM N. Babylon                 NY US,Wed Aug 04 15:50:11 PDT 2004,0.00,211.00
AR075,W3UGI Ambler                      PA US,Wed Aug 04 15:42:11 PDT 2004,0.00,187.00
AR078,N9NYF-6 Evansville                IN US,Wed Aug 04 15:44:23 PDT 2004,1.79,330.00
AR079,WX4BUY Elon                       NC US,Wed Aug 04 15:47:48 PDT 2004,1.79,155.00
AR082,WA2EIU Marietta                   GA US,Wed Aug 04 15:47:45 PDT 2004,0.00,37.00
AR085,N4HHP-5 Deerfield Beach           FL US,Wed Aug 04 15:44:38 PDT 2004,0.00,51.00
AR091,DB0SAC-6 Bad Sackingen               DE,Wed Aug 04 15:37:59 PDT 2004,1.34,315.00
AR095,DO2UMM Gorlitz                       DE,Wed Aug 04 15:45:51 PDT 2004,0.00,90.00
AR097,EA3AGQ Lleida                        ES,Wed Aug 04 15:48:51 PDT 2004,0.00,186.00
AR098,EA3AGQ-1 Montsec d'Ares              ES,Wed Aug 04 15:47:17 PDT 2004,6.26,25.00
AR100,N1FWV Peabody                     MA US,Wed Aug 04 15:49:20 PDT 2004,0.00,134.00
AR103,W4SBO-7 Section                   AL US,Wed Aug 04 15:48:48 PDT 2004,0.00,170.00
AR107,EA3AKS-15 SantPere de Ribes          ES,Wed Aug 04 15:50:00 PDT 2004,1.79,0.00
AR108,EA3BB Santpedor                      ES,Wed Aug 04 15:46:09 PDT 2004,0.00,37.00
AR109,EA3BSJ-1 Pinos                       ES,Wed Aug 04 15:44:20 PDT 2004,0.00,235.00
AR110,EA3CNO-1 Barcelona                   ES,Wed Aug 04 15:48:58 PDT 2004,0.45,281.00
AR112,EB3DMC-1 Belvis                      ES,Wed Aug 04 15:49:06 PDT 2004,1.34,74.00
AR115,EUGENE Eugene                     OR US,Wed Aug 04 15:48:41 PDT 2004,5.81,290.00
AR122,N4HHP-6 Cooper City               FL US,Wed Aug 04 15:43:30 PDT 2004,0.00,359.00
AR127,ZL1RED Tauranga Bay                  NZ,Wed Aug 04 15:43:14 PDT 2004,0.00,118.00
AR133,K0MXU-4 Hoxie                     KS US,Wed Aug 04 15:37:38 PDT 2004,0.00,23.00
AR134,K4JRG Miami                       FL US,Wed Aug 04 15:44:31 PDT 2004,2.24,265.00
AR135,K5MJE-1 Tijeras                   NM US,Wed Aug 04 15:47:10 PDT 2004,0.00,34.00
AR137,K6NE Ventura                      CA US,Wed Aug 04 15:49:29 PDT 2004,0.89,306.00
AR138,K7LHC-1 Lake Havasu               AZ US,Wed Aug 04 15:49:29 PDT 2004,5.81,181.00
AR141,KB5NMB-5 Fulton                   MS US,Wed Aug 04 15:46:15 PDT 2004,1.79,264.00
AR144,KB6CYS Cypress                    CA US,Wed Aug 04 15:47:08 PDT 2004,1.79,225.00
AR145,KB9KTD-1 Onalaska                 WI US,Wed Aug 04 15:44:07 PDT 2004,0.00,50.00
AR147,W0NWS-4 Colon                     NE US,Wed Aug 04 15:45:54 PDT 2004,3.13,15.00
AR148,K6DYC Meeker                      CO US,Wed Aug 04 15:50:19 PDT 2004,0.89,165.00
AR150,KC4WPS Hendersonville             TN US,Wed Aug 04 15:45:57 PDT 2004,0.00,262.00
