AR434,KD5RWX Glenwood                   NM US,Wed Aug 04 15:15:50 PDT 2004,0.45,225.00
AR435,KB8UBG Saint Bernard              OH US,Wed Aug 04 15:16:24 PDT 2004,1.34,225.00
AR437,N0OHO-1 Sioux Center              IA US,Wed Aug 04 15:18:28 PDT 2004,3.58,48.00
AR439,N0VHU Howells                     NE US,Wed Aug 04 15:17:02 PDT 2004,1.34,8.00
AR441,N1CNV Newington                   CT US,Wed Aug 04 15:18:36 PDT 2004,0.00,45.00
AR444,KC2KWK Somerville                 NJ US,Wed Aug 04 15:17:54 PDT 2004,1.34,226.00
AR445,N4XI-9 Owensboro                  KY US,Wed Aug 04 15:17:42 PDT 2004,3.13,60.00
AR446,N4XI-3 Evansville                 IN US,Wed Aug 04 15:08:12 PDT 2004,0.45,350.00
AR447,N4XI-5 Evansville                 IN US,Wed Aug 04 15:19:02 PDT 2004,3.58,317.00
AR448,KA4NES Littleton                  NC US,Wed Aug 04 15:20:28 PDT 2004,0.00,357.00
AR449,N4ZOI Cheraw                      SC US,Wed Aug 04 15:18:00 PDT 2004,0.00,205.00
AR450,WB0RXX Montevideo                 MN US,Wed Aug 04 15:17:02 PDT 2004,1.34,7.00
AR451,WA4ROX Largo                      FL US,Wed Aug 04 15:16:20 PDT 2004,0.45,206.00
AR452,N5SKU-1 Richardson                TX US,Wed Aug 04 15:12:59 PDT 2004,0.00,202.00
AR454,N7RFA Cornelius                   OR US,Wed Aug 04 15:19:47 PDT 2004,0.89,94.00
AR458,N8XHZ-4 Tiffin                    OH US,Wed Aug 04 15:16:01 PDT 2004,0.00,40.00
AR459,N9SVO-1 East Peoria               IL US,Wed Aug 04 15:13:51 PDT 2004,4.92,62.00
AR460,N9VP Greensboro                   NC US,Wed Aug 04 15:17:18 PDT 2004,0.00,112.00
AR461,KF4ZUX-4 London                   KY US,Wed Aug 04 15:18:31 PDT 2004,0.00,248.00
AR464,EMRWX Goodyear                    AZ US,Wed Aug 04 15:12:14 PDT 2004,4.92,219.00
AR466,AB3BE Hagerstown                  MD US,Wed Aug 04 15:20:39 PDT 2004,0.00,271.00
AR467,VE3WXR Verona                    ONT CA,Wed Aug 04 15:06:15 PDT 2004,0.89,220.00
AR470,K9DC Indianapolis                 IN US,Wed Aug 04 15:14:15 PDT 2004,0.89,342.00
AR471,WA4PHY Martinez                   GA US,Wed Aug 04 15:19:37 PDT 2004,0.00,267.00
AR472,N6MVS Hutchins                    TX US,Wed Aug 04 15:19:46 PDT 2004,0.00,248.00
AR473,KC2EUS Gloversville               NY US,Wed Aug 04 15:15:10 PDT 2004,0.45,290.00
AR474,N3IDX Huntingtown                 MD US,Wed Aug 04 15:16:15 PDT 2004,0.00,93.00
AR475,N1MD-3 Putnam                     CT US,Wed Aug 04 15:17:51 PDT 2004,0.00,0.00
AR476,N5ZPR Arlington                   TX US,Wed Aug 04 15:17:03 PDT 2004,0.00,175.00
AR477,KD5FHA-1 Mansfield                TX US,Wed Aug 04 15:16:05 PDT 2004,1.34,220.00
AR478,KG4VDR Simpsonville               SC US,Wed Aug 04 15:16:22 PDT 2004,0.00,226.00
AR480,KC0OWW Mystic                     IA US,Wed Aug 04 15:06:03 PDT 2004,3.13,299.00
AR481,KA1TOX Braintree                  MA US,Wed Aug 04 15:19:13 PDT 2004,0.00,180.00
C0001,CW0001 Evansville                 IN US,Wed Aug 04 15:20:13 PDT 2004,3.58,348.00
C0004,CW0004 Denver                     CO US,Wed Aug 04 15:15:08 PDT 2004,0.00,135.00
C0005,CW0005 Des Moines                 IA US,Wed Aug 04 15:20:25 PDT 2004,0.89,353.00
C0009,CW0009 Antwerp                       BE,Wed Aug 04 15:15:15 PDT 2004,2.68,60.00
C0013,CW0013 Inverness                  CA US,Wed Aug 04 15:11:36 PDT 2004,3.58,278.00
C0018,CW0018 Smithville                 TX US,Wed Aug 04 15:20:19 PDT 2004,0.89,230.00
C0020,CW0020 Trondheim                     NO,Wed Aug 04 15:20:18 PDT 2004,0.45,45.00
C0028,CW0028 Great Neck                 NY US,Wed Aug 04 15:20:17 PDT 2004,0.00,171.00
C0031,CW0031 Chicago                    IL US,Wed Aug 04 15:15:25 PDT 2004,0.45,359.00
C0041,CW0041 Brunswick                  GA US,Wed Aug 04 15:15:34 PDT 2004,0.45,102.00
C0052,CW0052 Bath                       ME US,Wed Aug 04 15:11:57 PDT 2004,1.34,273.00
C0053,CW0053 Wamic                      OR US,Wed Aug 04 15:15:15 PDT 2004,2.68,288.00
C0061,CW0061 Wellington                    NZ,Wed Aug 04 15:07:46 PDT 2004,1.34,36.00
C0062,CW0062 Decatur                    TX US,Wed Aug 04 15:15:28 PDT 2004,0.00,137.00
C0066,CW0066 Hoffman Estates            IL US,Wed Aug 04 15:15:15 PDT 2004,2.24,36.00
C0069,CW0069 Diamondhead                MS US,Wed Aug 04 15:15:24 PDT 2004,0.00,169.00
C0078,CW0078 Estes Park                 CO US,Wed Aug 04 15:17:29 PDT 2004,0.00,158.00
C0082,CW0082 Albuquerque                NM US,Wed Aug 04 15:20:20 PDT 2004,5.36,77.00
C0099,CW0099 Affton                     MO US,Wed Aug 04 15:05:54 PDT 2004,1.34,9.00
C0101,CW0101 Eau Clair                  WI US,Wed Aug 04 15:17:50 PDT 2004,4.47,12.00
C0104,CW0104 Dedham                     MA US,Wed Aug 04 15:18:25 PDT 2004,0.00,78.00
C0117,CW0117 Thornlie                      AU,Wed Aug 04 15:17:13 PDT 2004,0.00,35.00
C0118,CW0118 Scituate                   MA US,Wed Aug 04 15:17:24 PDT 2004,0.00,159.00
C0121,CW0121 Groton                     SD US,Wed Aug 04 15:20:20 PDT 2004,0.89,306.00
C0136,CW0136 Stockton                   CA US,Wed Aug 04 15:15:09 PDT 2004,2.68,329.00
C0138,CW0138 Brier                      WA US,Wed Aug 04 15:15:11 PDT 2004,0.45,326.00
C0146,CW0146 Ashburn                    VA US,Wed Aug 04 15:20:04 PDT 2004,0.45,179.00
C0149,CW0149 Richmond                   MN US,Wed Aug 04 15:15:33 PDT 2004,0.89,22.00
C0153,CW0153 Floral Park                NY US,Wed Aug 04 15:19:13 PDT 2004,1.34,173.00
C0154,CW0154 Cedar Knolls               NJ US,Wed Aug 04 15:11:45 PDT 2004,0.00,317.00
C0158,CW0158 Richland                   MI US,Wed Aug 04 15:15:32 PDT 2004,0.45,34.00
C0162,CW0162 Kress                      TX US,Wed Aug 04 15:15:19 PDT 2004,8.05,31.00
C0168,CW0168 Florence                   AL US,Wed Aug 04 15:16:40 PDT 2004,0.00,94.00
C0169,CW0169 Beverly                    MA US,Wed Aug 04 15:20:03 PDT 2004,0.00,0.00
C0176,CW0176 Cincinnati                 OH US,Wed Aug 04 15:14:42 PDT 2004,0.00,226.00
C0181,CW0181 Seal Beach                 CA US,Wed Aug 04 15:17:14 PDT 2004,3.58,263.00
C0187,CW0187 Bakersville                NC US,Wed Aug 04 15:15:17 PDT 2004,0.00,226.00
C0189,CW0189 Cirero                     NY US,Wed Aug 04 15:20:14 PDT 2004,1.34,351.00
C0198,CW0198 Littleton                  NC US,Wed Aug 04 15:19:23 PDT 2004,0.89,248.00
C0210,CW0210 Malden                     MA US,Wed Aug 04 15:15:16 PDT 2004,0.00,127.00
C0213,CW0213 Ferndale                   WA US,Wed Aug 04 15:16:27 PDT 2004,2.24,224.00
C0214,CW0214 Abrantes                      PT,Wed Aug 04 15:06:25 PDT 2004,2.68,293.00
C0222,CW0222 Karval                     CO US,Wed Aug 04 15:20:36 PDT 2004,5.36,72.00
C0228,CW0228 Highwood                   MT US,Wed Aug 04 15:15:01 PDT 2004,4.02,124.00
C0230,CW0230 Yeovil                        UK,Wed Aug 04 15:15:57 PDT 2004,0.00,357.00
C0234,CW0234 Canyon Country             CA US,Wed Aug 04 15:17:58 PDT 2004,2.68,240.00
C0237,CW0237 Walpole                    MA US,Wed Aug 04 15:15:19 PDT 2004,0.00,117.00
C0241,CW0241 Kalamazoo                  MI US,Wed Aug 04 15:20:32 PDT 2004,0.89,25.00
C0242,CW0242 Cincinnati                 OH US,Wed Aug 04 15:13:13 PDT 2004,0.45,279.00
C0261,CW0261 Clearwater Beach           FL US,Wed Aug 04 15:20:20 PDT 2004,3.13,254.00
C0262,CW0262 Port St. Lucie             FL US,Wed Aug 04 15:20:31 PDT 2004,2.68,228.00
C0265,CW0265 Williamstown               NJ US,Wed Aug 04 15:20:12 PDT 2004,0.00,304.00
C0267,CW0267 Waseca                     MN US,Wed Aug 04 15:16:21 PDT 2004,1.34,90.00
C0272,CW0272 Rome                          IT,Wed Aug 04 15:15:20 PDT 2004,0.89,198.00
C0275,CW0275 Lelystad                      NL,Wed Aug 04 15:16:22 PDT 2004,0.89,45.00
C0288,CW0288 Gilman                     MN US,Wed Aug 04 15:11:06 PDT 2004,4.02,21.00
C0318,CW0318 Broken Arrow               OK US,Wed Aug 04 15:20:12 PDT 2004,1.79,31.00
C0333,CW0333 Kittery Point              ME US,Wed Aug 04 15:11:04 PDT 2004,0.00,181.00
C0334,CW0334 Penzberg                      DE,Wed Aug 04 15:19:29 PDT 2004,0.00,179.00
C0338,CW0338 Seattle                    WA US,Wed Aug 04 15:17:06 PDT 2004,0.89,309.00
C0342,CW0342 Lincoln City               OR US,Wed Aug 04 15:15:12 PDT 2004,2.68,323.00
C0346,CW0346 Ft. Collins                CO US,Wed Aug 04 15:20:17 PDT 2004,1.79,183.00
C0351,CW0351 Brookeville                MD US,Wed Aug 04 15:20:08 PDT 2004,0.89,253.00
C0352,CW0352 Colby                      KS US,Wed Aug 04 15:18:38 PDT 2004,2.68,0.00
C0354,CW0354 West Islip                 NY US,Wed Aug 04 15:18:05 PDT 2004,2.24,275.00
C0356,CW0356 Seaside                    OR US,Wed Aug 04 15:13:04 PDT 2004,2.24,356.00
C0361,CW0361 Marietta                   GA US,Wed Aug 04 15:18:20 PDT 2004,0.00,22.00
C0364,CW0364 Greenbrier                 AR US,Wed Aug 04 15:19:37 PDT 2004,2.24,270.00
C0375,CW0375 Bartlett                   TN US,Wed Aug 04 15:18:43 PDT 2004,0.89,356.00
C0386,CW0386 Tatum                      NM US,Wed Aug 04 15:13:48 PDT 2004,6.26,129.00
C0405,CW0405 Salisbury                  MA US,Wed Aug 04 15:15:58 PDT 2004,0.00,141.00
C0415,CW0415 Savage                     MD US,Wed Aug 04 15:15:21 PDT 2004,0.00,179.00
C0416,CW0416 Bellevue                   WA US,Wed Aug 04 15:11:55 PDT 2004,0.00,162.00
C0420,CW0420 Beaverton                  OR US,Wed Aug 04 15:20:11 PDT 2004,2.24,226.00
C0425,CW0425 Saratoga                   CA US,Wed Aug 04 15:15:06 PDT 2004,2.24,23.00
C0430,CW0430 Newnan                     GA US,Wed Aug 04 15:16:54 PDT 2004,0.45,314.00
C0433,CW0433 Montgomery Village         MD US,Wed Aug 04 15:16:08 PDT 2004,0.00,183.00
C0443,CW0443 Sacramento                 CA US,Wed Aug 04 15:19:43 PDT 2004,1.34,183.00
C0444,CW0444 Marlborough                CT US,Wed Aug 04 15:20:10 PDT 2004,0.00,224.00
C0447,CW0447 Margate                    FL US,Wed Aug 04 15:09:25 PDT 2004,0.00,172.00
C0451,CW0451 Taunton                    MA US,Wed Aug 04 15:19:48 PDT 2004,0.45,105.00
C0453,CW0453 Gretna                     NE US,Wed Aug 04 15:15:33 PDT 2004,3.13,64.00
C0454,CW0454 Millersville               MD US,Wed Aug 04 15:20:03 PDT 2004,2.24,210.00
C0456,CW0456 Brandon                    MS US,Wed Aug 04 15:15:53 PDT 2004,0.00,250.00
C0458,CW0458 Rancho Cordova             CA US,Wed Aug 04 15:11:51 PDT 2004,3.13,270.00
C0464,CW0464 Tehachapi                  CA US,Wed Aug 04 15:19:13 PDT 2004,3.13,0.00
C0465,CW0465 Sherman                    CT US,Wed Aug 04 15:16:01 PDT 2004,0.00,284.00
C0467,CW0467 Duxbury                    MA US,Wed Aug 04 15:20:16 PDT 2004,0.00,127.00
C0476,CW0476 De Graff                   OH US,Wed Aug 04 15:19:57 PDT 2004,0.89,23.00
C0479,CW0479 E. Brunswick               NJ US,Wed Aug 04 15:19:53 PDT 2004,0.45,208.00
C0498,CW0498 Powder Springs             GA US,Wed Aug 04 15:15:48 PDT 2004,0.00,346.00
C0499,CW0499 Monticello                 MN US,Wed Aug 04 15:19:38 PDT 2004,0.00,61.00
C0506,CW0506 Canton                     CT US,Wed Aug 04 15:19:38 PDT 2004,0.00,328.00
C0508,CW0508 Troy                       NY US,Wed Aug 04 15:19:03 PDT 2004,0.00,244.00
C0512,CW0512 Torino                        IT,Wed Aug 04 15:17:20 PDT 2004,0.00,167.00
C0521,CW0521 Morecambe                     UK,Wed Aug 04 15:16:09 PDT 2004,1.79,63.00
C0527,CW0527 Lexington                  VA US,Wed Aug 04 15:12:58 PDT 2004,1.34,302.00
C0529,CW0529 West Paterson              NJ US,Wed Aug 04 15:14:51 PDT 2004,0.00,18.00
C0531,CW0531 Plainfield                 IL US,Wed Aug 04 15:15:44 PDT 2004,2.24,353.00
C0537,CW0537 Bel Air                    MD US,Wed Aug 04 15:16:41 PDT 2004,1.79,170.00
C0539,CW0539 Dansweiler                    DE,Wed Aug 04 15:19:37 PDT 2004,0.00,225.00
C0541,CW0541 Hornell                    NY US,Wed Aug 04 15:14:37 PDT 2004,0.00,0.00
C0546,CW0546 Lincoln                    NE US,Wed Aug 04 15:17:09 PDT 2004,0.45,8.00
C0547,CW0547 Westfield                  IN US,Wed Aug 04 15:15:54 PDT 2004,2.24,32.00
C0548,CW0548 Frisco                     TX US,Wed Aug 04 15:12:04 PDT 2004,0.00,305.00
C0549,CW0549 Lafayette                  CO US,Wed Aug 04 15:19:18 PDT 2004,2.24,93.00
C0555,CW0555 Omaha                      NE US,Wed Aug 04 15:20:06 PDT 2004,0.89,152.00
C0556,CW0556 Stow                       MA US,Wed Aug 04 15:20:17 PDT 2004,1.34,131.00
C0561,CW0561 Coon Rapids                MN US,Wed Aug 04 15:19:54 PDT 2004,2.68,58.00
C0565,CW0565 Kristiansand                  NO,Wed Aug 04 15:15:40 PDT 2004,0.00,195.00
C0566,CW0566 Mullica Hill               NJ US,Wed Aug 04 15:15:22 PDT 2004,0.45,217.00
C0568,CW0568 Ponca City                 OK US,Wed Aug 04 15:15:39 PDT 2004,3.58,25.00
C0569,CW0569 Jacksonville               FL US,Wed Aug 04 15:16:27 PDT 2004,0.45,213.00
C0570,CW0570 Blue Lake                  CA US,Wed Aug 04 15:20:16 PDT 2004,0.89,112.00
C0571,CW0571 Batavia                    IL US,Wed Aug 04 15:08:35 PDT 2004,3.58,77.00
C0572,CW0572 Orlando                    FL US,Wed Aug 04 15:18:00 PDT 2004,0.00,173.00
C0577,CW0577 Elkridge                   MD US,Wed Aug 04 15:15:42 PDT 2004,1.34,222.00
C0584,CW0584 Northampton                   UK,Wed Aug 04 15:08:01 PDT 2004,1.79,350.00
C0588,CW0588 Parma                         IT,Wed Aug 04 15:14:08 PDT 2004,0.45,143.00
C0597,CW0597 Tehachapi                  CA US,Wed Aug 04 15:15:14 PDT 2004,5.36,333.00
C0599,CW0599 Corrales                   NM US,Wed Aug 04 15:19:44 PDT 2004,0.45,294.00
C0605,CW0605 Pistoia                       IT,Wed Aug 04 15:15:46 PDT 2004,0.00,200.00
C0608,CW0608 Perry Hall                 MD US,Wed Aug 04 15:20:32 PDT 2004,1.34,141.00
C0613,CW0613 Maiden                     NC US,Wed Aug 04 15:17:18 PDT 2004,1.34,253.00
C0615,CW0615 South Portland             ME US,Wed Aug 04 15:11:19 PDT 2004,0.00,171.00
C0617,CW0617 Plover                     WI US,Wed Aug 04 15:17:06 PDT 2004,4.47,51.00
C0630,CW0630 Annandale                  VA US,Wed Aug 04 15:15:19 PDT 2004,0.00,335.00
C0639,CW0639 Jacksonville               FL US,Wed Aug 04 15:06:21 PDT 2004,0.89,148.00
C0641,CW0641 Jerusalem                     IL,Wed Aug 04 15:11:10 PDT 2004,3.58,251.00
C0643,CW0643 Goldvein                   VA US,Wed Aug 04 15:15:17 PDT 2004,0.00,201.00
C0645,CW0645 Whittier                   CA US,Wed Aug 04 15:15:31 PDT 2004,2.24,187.00
C0646,CW0646 Guilderland                NY US,Wed Aug 04 15:15:08 PDT 2004,0.00,61.00
C0653,CW0653 Tracy                      MN US,Wed Aug 04 15:19:30 PDT 2004,1.79,66.00
C0655,CW0655 Salem                      NH US,Wed Aug 04 15:12:01 PDT 2004,0.00,109.00
C0657,CW0657 Madeira Park               BC CA,Wed Aug 04 15:16:19 PDT 2004,1.34,181.00
C0672,CW0672 Sumner                     WA US,Wed Aug 04 15:06:08 PDT 2004,0.00,335.00
C0673,CW0673 Moapa                      NV US,Wed Aug 04 15:16:54 PDT 2004,4.47,189.00
C0675,CW0675 Antwerp                       BE,Wed Aug 04 15:20:36 PDT 2004,0.45,64.00
C0677,CW0677 Santa Rosa                 CA US,Wed Aug 04 15:19:15 PDT 2004,2.24,141.00
C0681,CW0681 Breckenridge               MI US,Wed Aug 04 15:19:16 PDT 2004,4.02,79.00
C0686,CW0686 Mesquite                   NV US,Wed Aug 04 15:12:07 PDT 2004,3.13,213.00
C0692,CW0692 Little Switzerland         NC US,Wed Aug 04 15:20:39 PDT 2004,0.00,289.00
C0693,CW0693 Henderson                  NV US,Wed Aug 04 15:17:25 PDT 2004,2.68,49.00
C0694,CW0694 Alligator Point            FL US,Wed Aug 04 15:20:16 PDT 2004,1.34,252.00
C0698,CW0698 Apple Valley               MN US,Wed Aug 04 15:20:29 PDT 2004,0.00,119.00
C0699,CW0699 Largo                      FL US,Wed Aug 04 15:20:24 PDT 2004,0.00,0.00
C0706,CW0706 Athena                     OR US,Wed Aug 04 15:16:15 PDT 2004,1.34,24.00
C0710,CW0710 Salford                       UK,Wed Aug 04 15:07:49 PDT 2004,0.00,84.00
C0713,CW0713 Auburn                     CA US,Wed Aug 04 15:13:29 PDT 2004,1.79,168.00
C0714,CW0714 Plymouth                   MI US,Wed Aug 04 15:16:08 PDT 2004,0.00,355.00
C0720,CW0720 Bellflower                 CA US,Wed Aug 04 15:16:10 PDT 2004,4.47,197.00
C0725,CW0725 Wimberley                  TX US,Wed Aug 04 15:20:18 PDT 2004,0.45,99.00
C0728,CW0728 Avon                       CT US,Wed Aug 04 15:17:39 PDT 2004,0.00,236.00
C0732,CW0732 Seneca                     OR US,Wed Aug 04 15:14:48 PDT 2004,3.58,232.00
C0734,CW0734 Middleboro                 MA US,Wed Aug 04 15:12:25 PDT 2004,0.00,76.00
C0736,CW0736 Rochester                  NY US,Wed Aug 04 15:18:31 PDT 2004,0.45,333.00
C0752,CW0752 Norman                     OK US,Wed Aug 04 15:06:53 PDT 2004,1.79,296.00
C0755,CW0755 Charlotte                  NC US,Wed Aug 04 15:20:27 PDT 2004,0.00,339.00
C0756,CW0756 Benjamin                   UT US,Wed Aug 04 15:16:49 PDT 2004,4.02,208.00
C0757,CW0757 Columbia                   SC US,Wed Aug 04 15:15:14 PDT 2004,0.00,231.00
C0760,CW0760 Mullica Hill               NJ US,Wed Aug 04 15:15:18 PDT 2004,1.34,234.00
C0762,CW0762 Flower Mound               TX US,Wed Aug 04 15:16:08 PDT 2004,0.45,215.00
C0766,CW0766 Raymond                    NH US,Wed Aug 04 15:18:46 PDT 2004,1.34,0.00
C0779,CW0779 Trabuco Canyon             CA US,Wed Aug 04 15:20:37 PDT 2004,1.34,298.00
C0783,CW0783 Valparaiso                 IN US,Wed Aug 04 15:16:20 PDT 2004,3.58,26.00
C0786,CW0786 Smithtown                  NY US,Wed Aug 04 15:17:57 PDT 2004,0.00,227.00
C0791,CW0791 Belmont                    CA US,Wed Aug 04 15:19:02 PDT 2004,4.02,258.00
C0793,CW0793 Seattle                    WA US,Wed Aug 04 15:18:27 PDT 2004,1.79,275.00
C0796,CW0796 Savage                     MN US,Wed Aug 04 15:20:28 PDT 2004,0.45,1.00
C0801,CW0801 South Portland             ME US,Wed Aug 04 15:19:23 PDT 2004,1.34,282.00
C0803,CW0803 Concord                    NC US,Wed Aug 04 15:19:29 PDT 2004,0.89,325.00
C0804,CW0804 Juneau                     AK US,Wed Aug 04 15:08:06 PDT 2004,2.24,272.00
C0811,CW0811 West Hartford              CT US,Wed Aug 04 15:19:23 PDT 2004,0.45,326.00
C0817,CW0817 Denton                     TX US,Wed Aug 04 15:06:01 PDT 2004,0.00,203.00
C0825,CW0825 Sweet Home                 OR US,Wed Aug 04 15:20:31 PDT 2004,1.34,251.00
C0832,CW0832 Clovis                     CA US,Wed Aug 04 15:17:44 PDT 2004,3.58,301.00
C0834,CW0834 Gackle                     ND US,Wed Aug 04 15:18:53 PDT 2004,0.45,69.00
C0835,CW0835 Dijon                         FR,Wed Aug 04 15:20:01 PDT 2004,1.34,353.00
C0837,CW0837 Hays                       KS US,Wed Aug 04 15:20:06 PDT 2004,2.68,113.00
C0845,CW0845 East Hampton               MA US,Wed Aug 04 15:16:24 PDT 2004,0.00,21.00
C0846,CW0846 Canajoharie                NY US,Wed Aug 04 15:18:19 PDT 2004,0.45,342.00
C0856,CW0856 Kingwood                   TX US,Wed Aug 04 15:18:21 PDT 2004,0.00,315.00
C0857,CW0857 Hancock                    NH US,Wed Aug 04 15:18:17 PDT 2004,0.00,157.00
C0863,CW0863 Mendon                     MA US,Wed Aug 04 15:20:12 PDT 2004,0.00,89.00
C0870,CW0870 Victoria                   BC CA,Wed Aug 04 15:18:53 PDT 2004,0.89,135.00
C0873,CW0873 Chenango Bridge            NY US,Wed Aug 04 15:17:06 PDT 2004,0.00,309.00
C0877,CW0877 Bynum                      NC US,Wed Aug 04 15:18:31 PDT 2004,0.00,6.00
C0900,FSUMET Tallahassee                FL US,Wed Aug 04 15:20:28 PDT 2004,2.68,59.00
C0901,NORLND Miami                      FL US,Wed Aug 04 15:19:18 PDT 2004,2.24,271.00
C0902,STEVNS Carol City                 FL US,Wed Aug 04 15:17:56 PDT 2004,2.68,28.00
C0905,MANN Miami                        FL US,Wed Aug 04 15:16:37 PDT 2004,3.13,158.00
C0908,BRWNVL Miami                      FL US,Wed Aug 04 15:18:03 PDT 2004,2.68,354.00
C0909,DORAL Miami                       FL US,Wed Aug 04 15:19:02 PDT 2004,1.79,175.00
C0911,NTLLS Miami Beach                 FL US,Wed Aug 04 15:19:43 PDT 2004,5.36,93.00
C0913,CITRUS Miami                      FL US,Wed Aug 04 15:19:30 PDT 2004,0.89,267.00
C0927,CW0927 Apopka                     FL US,Wed Aug 04 15:20:09 PDT 2004,2.24,315.00
C0929,CW0929 Arouville les mantes          FR,Wed Aug 04 15:20:11 PDT 2004,2.24,336.00
C0930,CW0930 Highlands                  NC US,Wed Aug 04 15:15:47 PDT 2004,0.45,289.00
C0934,CW0934 Lynn                       MA US,Wed Aug 04 15:19:46 PDT 2004,0.45,145.00
C0947,CW0947 Yorktown                   VA US,Wed Aug 04 15:20:11 PDT 2004,0.89,270.00
C0956,CW0956 Worthington                WV US,Wed Aug 04 15:19:38 PDT 2004,0.00,85.00
C0964,CW0964 Georgetown                 TX US,Wed Aug 04 15:20:09 PDT 2004,1.79,195.00
C0965,CW0965 Hastings                   NE US,Wed Aug 04 15:19:44 PDT 2004,1.79,38.00
C0968,CW0968 Alleman                    IA US,Wed Aug 04 15:15:56 PDT 2004,2.24,6.00
C0973,CW0973 Calgary                   ALB CA,Wed Aug 04 15:19:02 PDT 2004,0.00,356.00
C0979,CW0979 Mobile                     AL US,Wed Aug 04 15:15:53 PDT 2004,0.00,203.00
C1000,CW1000 Porterville                CA US,Wed Aug 04 15:11:27 PDT 2004,0.45,186.00
C1002,CW1002 Tacoma                     WA US,Wed Aug 04 15:07:23 PDT 2004,0.89,203.00
C1004,CW1004 Auburn                     NY US,Wed Aug 04 15:20:07 PDT 2004,0.45,0.00
C1007,CW1007 Chestatee                  GA US,Wed Aug 04 15:20:24 PDT 2004,0.00,349.00
C1012,CW1012 Boxford                    MA US,Wed Aug 04 15:18:10 PDT 2004,0.00,215.00
C1014,CW1014 Crystal Lake               IL US,Wed Aug 04 15:17:32 PDT 2004,4.47,46.00
C1015,CW1015 Aston                      PA US,Wed Aug 04 15:15:42 PDT 2004,1.34,71.00
C1017,CW1017 Arlington                  MA US,Wed Aug 04 15:17:33 PDT 2004,0.00,135.00
C1018,CW1018 Tampa                      FL US,Wed Aug 04 15:20:43 PDT 2004,0.00,292.00
C1020,CW1020 Tehachapi                  CA US,Wed Aug 04 15:18:28 PDT 2004,5.81,354.00
C1021,CW1021 Delfzijl                      NL,Wed Aug 04 15:11:20 PDT 2004,0.00,7.00
C1028,CW1028 Friendswood                TX US,Wed Aug 04 15:16:25 PDT 2004,1.34,162.00
C1032,CW1032 Timonium                   MD US,Wed Aug 04 15:14:53 PDT 2004,0.89,200.00
C1033,CW1033 Lebanon                    TN US,Wed Aug 04 15:19:02 PDT 2004,0.89,267.00
C1035,CW1035 Port Townsend              WA US,Wed Aug 04 15:17:08 PDT 2004,0.00,0.00
C1040,CW1040 Mannheim                      DE,Wed Aug 04 15:14:02 PDT 2004,2.24,350.00
C1043,CW1043 La Pine                    OR US,Wed Aug 04 15:17:49 PDT 2004,1.34,223.00
C1053,CW1053 Monroe Twp                 NJ US,Wed Aug 04 15:20:32 PDT 2004,0.00,291.00
C1055,CW1055 Oxford                     GA US,Wed Aug 04 15:09:25 PDT 2004,0.00,265.00
C1057,CW1057 Racine                     WI US,Wed Aug 04 15:20:14 PDT 2004,7.15,15.00
C1064,CW1064 Newport                    NH US,Wed Aug 04 15:13:21 PDT 2004,0.45,350.00
C1066,CW1066 Blackpool                     UK,Wed Aug 04 15:16:10 PDT 2004,0.89,72.00
C1074,CW1074 Wasilla                    AK US,Wed Aug 04 15:20:10 PDT 2004,0.89,191.00
C1081,CW1081 Charlotte                  NC US,Wed Aug 04 15:07:34 PDT 2004,0.00,344.00
C1084,CW1084 Lusby                      MD US,Wed Aug 04 15:20:35 PDT 2004,0.00,48.00
C1085,CW1085 Mifflinburg                PA US,Wed Aug 04 15:16:00 PDT 2004,0.00,78.00
C1091,CW1091 Toms River                 NJ US,Wed Aug 04 15:19:16 PDT 2004,1.34,163.00
C1096,CW1096 Bay View                   WI US,Wed Aug 04 15:15:58 PDT 2004,3.13,359.00
C1097,CW1097 Billerica                  MA US,Wed Aug 04 15:20:38 PDT 2004,0.00,92.00
C1100,CW1100 Regina                    SAS CA,Wed Aug 04 15:16:35 PDT 2004,4.02,158.00
C1104,CW1104 Ennis                      TX US,Wed Aug 04 15:20:17 PDT 2004,0.45,152.00
C1110,CW1110 Townsville                    AU,Wed Aug 04 15:15:20 PDT 2004,1.34,226.00
C1115,CW1115 Wallington                    UK,Wed Aug 04 15:19:37 PDT 2004,1.34,74.00
C1120,CW1120 Goteborg                      SE,Wed Aug 04 15:11:30 PDT 2004,0.89,102.00
C1121,CW1121 Boras                         SE,Wed Aug 04 15:11:25 PDT 2004,0.00,131.00
C1122,CW1122 Page                       AZ US,Wed Aug 04 15:16:15 PDT 2004,3.58,0.00
C1123,CW1123 Newburgh                   IN US,Wed Aug 04 15:18:33 PDT 2004,3.58,347.00
C1126,CW1126 Earlwood                  NSW AU,Wed Aug 04 15:17:44 PDT 2004,1.79,302.00
C1129,CW1129 Woburn                     MA US,Wed Aug 04 15:20:29 PDT 2004,0.45,110.00
C1130,CW1130 Kanab                      UT US,Wed Aug 04 15:19:27 PDT 2004,2.24,36.00
C1134,CW1134 Pierce                     NE US,Wed Aug 04 15:19:05 PDT 2004,7.15,31.00
C1136,CW1136 Nagu/Nauvo                    FI,Wed Aug 04 15:20:28 PDT 2004,1.34,120.00
C1138,CW1138 Otis Orchards              WA US,Wed Aug 04 15:17:49 PDT 2004,0.00,295.00
C1139,CW1139 Middletown                 NY US,Wed Aug 04 15:19:06 PDT 2004,0.00,34.00
C1141,CW1141 Pensacola                  FL US,Wed Aug 04 15:15:30 PDT 2004,0.00,191.00
C1151,CW1151 Grand Marais               MN US,Wed Aug 04 15:19:46 PDT 2004,2.24,97.00
C1162,CW1162 Ely                        MN US,Wed Aug 04 15:17:22 PDT 2004,1.34,54.00
C1166,CW1166 Saratoga                   CA US,Wed Aug 04 15:18:31 PDT 2004,1.79,19.00
C1169,CW1169 Monument                   CO US,Wed Aug 04 15:17:34 PDT 2004,0.00,196.00
C1172,CW1172 Uddevalla                     SE,Wed Aug 04 15:13:34 PDT 2004,0.00,124.00
C1180,CW1180 Frederick                  MD US,Wed Aug 04 15:20:45 PDT 2004,7.15,0.00
C1188,CW1188 Frisco                     TX US,Wed Aug 04 15:20:00 PDT 2004,0.00,294.00
C1190,CW1190 Lancaster                  CA US,Wed Aug 04 15:18:10 PDT 2004,4.47,249.00
C1192,CW1192 Aransas Pass               TX US,Wed Aug 04 15:20:09 PDT 2004,1.34,92.00
C1195,CW1195 Muncie                     IN US,Wed Aug 04 15:19:30 PDT 2004,1.34,11.00
C1196,CW1196 Moorebank                     AU,Wed Aug 04 15:15:57 PDT 2004,1.79,295.00
C1200,CW1200 Lake Barrington            IL US,Wed Aug 04 15:19:37 PDT 2004,4.47,30.00
C1204,CW1204 Temple                     TX US,Wed Aug 04 15:17:08 PDT 2004,0.45,134.00
C1210,CW1210 Oak Park                   IL US,Wed Aug 04 15:15:19 PDT 2004,2.68,0.00
C1211,CW1211 Motherwell                    UK,Wed Aug 04 15:12:29 PDT 2004,1.79,57.00
C1212,CW1212 Collinsville               IL US,Wed Aug 04 15:15:39 PDT 2004,0.45,312.00
