AP763,OX3HI Kangerlussuaq                  GL,Wed Aug 04 15:30:14 PDT 2004,3.13,88.00
AP765,N3EYQ Kingston                    NY US,Wed Aug 04 15:27:50 PDT 2004,0.89,16.00
AP767,N2XP Flanders                     NJ US,Wed Aug 04 15:33:24 PDT 2004,0.00,0.00
AP769,WC4PEM-10 Bartow                  FL US,Wed Aug 04 15:32:42 PDT 2004,0.00,180.00
AP771,WD9HDQ-2 Northfield               MN US,Wed Aug 04 15:33:25 PDT 2004,0.89,2.00
AP772,K4KAL Marietta                    GA US,Wed Aug 04 15:35:19 PDT 2004,0.00,224.00
AP773,KB4TOH-11 Columbia                NC US,Wed Aug 04 15:32:22 PDT 2004,1.79,228.00
AP774,N8OVD Wendell                     NC US,Wed Aug 04 15:29:31 PDT 2004,0.00,326.00
AP777,KD4CCO Briston                    VA US,Wed Aug 04 15:27:13 PDT 2004,1.34,276.00
AP780,W5VBQ Santa Fe                    NM US,Wed Aug 04 15:33:31 PDT 2004,5.36,133.00
AP782,WB5NZV-8 N.Denton                 TX US,Wed Aug 04 15:22:29 PDT 2004,0.00,182.00
AP783,KC5DPC-3 Slidell                  TX US,Wed Aug 04 15:32:20 PDT 2004,4.92,257.00
AP786,K5EBQ Houston                     TX US,Wed Aug 04 15:35:12 PDT 2004,0.00,182.00
AP787,KC5LPN Houston                    TX US,Wed Aug 04 15:28:53 PDT 2004,0.00,181.00
AP789,W0HVA Minot                       ND US,Wed Aug 04 15:32:40 PDT 2004,0.45,135.00
AP795,KD7TTL Greenbank                  WA US,Wed Aug 04 15:33:15 PDT 2004,0.00,260.00
AP799,AE0S-3 Columbia                   MO US,Wed Aug 04 15:32:43 PDT 2004,0.00,316.00
AP802,W4OZK-7 Mentone                   AL US,Wed Aug 04 15:32:29 PDT 2004,0.00,235.00
AP803,KE6AFE Santa Cruz                 CA US,Wed Aug 04 15:35:07 PDT 2004,2.24,130.00
AP806,N3EG Longview                     WA US,Wed Aug 04 15:27:04 PDT 2004,0.89,340.00
AP808,KG4YZY New Port Richey            FL US,Wed Aug 04 15:34:46 PDT 2004,0.45,219.00
AP809,K4NUT Port Richey                 FL US,Wed Aug 04 15:35:09 PDT 2004,1.34,233.00
AP811,KC2IXE Bayside Hills              NY US,Wed Aug 04 15:31:36 PDT 2004,1.34,247.00
AP812,VE3XF Stayner                    ONT CA,Wed Aug 04 15:34:47 PDT 2004,3.13,321.00
AP813,VE3PWZ Dundalk                   ONT CA,Wed Aug 04 15:34:43 PDT 2004,5.36,358.00
AP814,VA3GY Erin                       ONT CA,Wed Aug 04 15:28:53 PDT 2004,1.79,26.00
AP815,VA3HST Guelph                    ONT CA,Wed Aug 04 15:34:05 PDT 2004,0.89,358.00
AP818,VA3MWK Ashton                    ONT CA,Wed Aug 04 15:32:52 PDT 2004,0.00,329.00
AP819,VE3TEN Ottawa                    ONT CA,Wed Aug 04 15:31:26 PDT 2004,0.00,39.00
AP820,VE6BMR Sherwood Park             ALT CA,Wed Aug 04 15:24:37 PDT 2004,3.13,121.00
AP823,AD4BL Fairbanks                   AK US,Wed Aug 04 15:27:19 PDT 2004,0.00,198.00
AP830,KA2FNK Merriam                    KS US,Wed Aug 04 15:34:45 PDT 2004,0.89,328.00
AP831,N9NJK Warsaw                      IN US,Wed Aug 04 15:33:46 PDT 2004,3.58,24.00
AP832,WB9TLH-11 Bloomington             IN US,Wed Aug 04 15:21:08 PDT 2004,0.00,0.00
AP833,KE4CON-3 Woodstock                IL US,Wed Aug 04 15:34:54 PDT 2004,5.81,30.00
AP838,W5MAI San Antonio                 TX US,Wed Aug 04 15:33:35 PDT 2004,0.89,99.00
AP840,KC0OGY-5 Bailey                   CO US,Wed Aug 04 15:24:37 PDT 2004,0.45,122.00
AP841,WE1A USAF Academy                 CO US,Wed Aug 04 15:30:05 PDT 2004,2.68,248.00
AP842,VE5VAP Dalmeny                    SK CA,Wed Aug 04 15:33:32 PDT 2004,4.92,124.00
AP845,K2TCO Binghamton                  NY US,Wed Aug 04 15:34:07 PDT 2004,0.00,27.00
AP850,KC2GLZ Lowville                   NY US,Wed Aug 04 15:34:45 PDT 2004,0.00,357.00
AP852,WG4R Meadows of Dan               VA US,Wed Aug 04 15:35:18 PDT 2004,0.89,246.00
AP854,N4HHP-1 Plantation                FL US,Wed Aug 04 15:35:04 PDT 2004,2.68,356.00
AP855,N4HHP-2 Ft. Lauderdale            FL US,Wed Aug 04 15:32:25 PDT 2004,4.92,11.00
AP856,N4HHP-3 Hallandale Beach          FL US,Wed Aug 04 15:33:32 PDT 2004,2.68,13.00
AP860,AA5ED-10 Brandon                  MS US,Wed Aug 04 15:33:32 PDT 2004,0.00,299.00
AP861,N1IV Plainville                   MA US,Wed Aug 04 15:32:41 PDT 2004,0.00,195.00
AP864,AB0XM-1 Great Bend                KS US,Wed Aug 04 15:33:37 PDT 2004,6.26,26.00
AP866,KA0HJZ Van Meter                  IA US,Wed Aug 04 15:31:18 PDT 2004,1.34,3.00
AP867,N0VPR Johnston                    IA US,Wed Aug 04 15:28:30 PDT 2004,1.34,38.00
AP870,KC0LBV Farmington                 MN US,Wed Aug 04 15:31:07 PDT 2004,3.58,17.00
AP871,N0PFY Northfield                  MN US,Wed Aug 04 15:33:41 PDT 2004,2.68,8.00
AP874,VK2AAK Forster                       AU,Wed Aug 04 15:33:39 PDT 2004,1.79,307.00
AP877,KA8OAD-1 Fairlawn                 OH US,Wed Aug 04 15:28:12 PDT 2004,0.00,320.00
AP878,AB9FX Chicago                     IL US,Wed Aug 04 15:31:14 PDT 2004,4.02,136.00
AP879,N9VPV Galesburg                   IL US,Wed Aug 04 15:34:01 PDT 2004,0.89,21.00
AP888,N7QXO-2 Vancouver                 WA US,Wed Aug 04 15:33:00 PDT 2004,1.79,8.00
AP890,KB7DZR Tigard                     OR US,Wed Aug 04 15:34:59 PDT 2004,2.68,354.00
AP892,KG6QHD Prineville                 OR US,Wed Aug 04 15:35:08 PDT 2004,3.13,272.00
AP893,KE6KYI Groveland                  CA US,Wed Aug 04 15:25:16 PDT 2004,1.79,284.00
AP896,WA6YLB Exeter                     CA US,Wed Aug 04 15:34:33 PDT 2004,1.34,217.00
AP897,WA6YLB-4 Govt.Peak                CA US,Wed Aug 04 15:34:41 PDT 2004,0.00,359.00
AP898,WA6YLB-6 Visalia                  CA US,Wed Aug 04 15:32:00 PDT 2004,0.00,0.00
AP900,KE6ZPS-1 Miranda Canyon           CA US,Wed Aug 04 15:34:45 PDT 2004,6.26,218.00
AP901,KB6OQJ Santa Ynez                 CA US,Wed Aug 04 15:32:22 PDT 2004,3.13,234.00
AP904,W6MAF Hesperia                    CA US,Wed Aug 04 15:33:49 PDT 2004,4.47,190.00
AP907,W9IF-4 Torry Pines                CA US,Wed Aug 04 15:32:09 PDT 2004,3.13,274.00
AP911,K4GIG-7 Brindley Mtn.             AL US,Wed Aug 04 15:33:38 PDT 2004,0.00,248.00
AP912,WB2JSH Eaton                      CO US,Wed Aug 04 15:35:14 PDT 2004,4.02,151.00
AP913,WB5SLA Ball Ground                GA US,Wed Aug 04 15:34:19 PDT 2004,0.00,298.00
AP917,W7NWS Billings                    MT US,Wed Aug 04 15:31:06 PDT 2004,2.68,65.00
AP918,KB0YUP Maryland Hts.              MO US,Wed Aug 04 15:29:46 PDT 2004,0.00,338.00
AP919,LB9ME Trondheim                      NO,Wed Aug 04 15:29:31 PDT 2004,0.45,194.00
AP921,OZ6GX-5 Roervig                      DK,Wed Aug 04 15:27:35 PDT 2004,0.00,128.00
AP922,OZ1IEP-5 Jaegerspris                 DK,Wed Aug 04 15:30:17 PDT 2004,2.24,150.00
AP924,OH6GGL-3 Lppalahti                   FI,Wed Aug 04 15:21:06 PDT 2004,0.00,0.00
AP937,MB7UEK Herne Bay                     UK,Wed Aug 04 15:34:37 PDT 2004,0.00,107.00
AP938,G3OJZ-6 Kent                         UK,Wed Aug 04 15:27:12 PDT 2004,0.45,81.00
AP943,MTHEBO Mt. Hebo                   OR US,Wed Aug 04 15:28:36 PDT 2004,0.00,0.00
AP946,F1HCI-12 Versailles                  FR,Wed Aug 04 15:32:21 PDT 2004,0.00,315.00
AP949,F4CEP-12 Rubelles                    FR,Wed Aug 04 15:35:01 PDT 2004,4.02,350.00
AP952,N1NSI Contoocook                  NH US,Wed Aug 04 15:30:37 PDT 2004,0.00,3.00
AP953,ZF1EJ Savannah                       KY,Wed Aug 04 15:33:48 PDT 2004,1.79,79.00
AP957,KA4EOC Tallahassee                FL US,Wed Aug 04 15:29:07 PDT 2004,0.00,213.00
AP962,EB2FGI-15 Irun                       ES,Wed Aug 04 15:27:29 PDT 2004,0.89,291.00
AP965,EB5ESX Sta Pola                      ES,Wed Aug 04 15:34:18 PDT 2004,1.79,90.00
AP967,EA3AYP-1 Girona                      ES,Wed Aug 04 15:21:09 PDT 2004,1.34,299.00
AP968,EA3FAJ-1 Girona                      ES,Wed Aug 04 15:34:57 PDT 2004,0.00,184.00
AP969,EA3RCK-1 Lleida                      ES,Wed Aug 04 15:34:31 PDT 2004,0.00,351.00
AP973,PE1NAT-1 Heerhugowaard               NL,Wed Aug 04 15:30:03 PDT 2004,0.00,39.00
AP976,DO7VLR-5 Zweibruecken                DE,Wed Aug 04 15:34:17 PDT 2004,2.68,140.00
AP979,KC9BWF-3 Sister Bay               MI US,Wed Aug 04 15:32:59 PDT 2004,8.05,316.00
AP981,KG4SEY Niceville                  FL US,Wed Aug 04 15:31:14 PDT 2004,1.34,193.00
AP984,N8QQ Cincinnati                   OH US,Wed Aug 04 15:35:04 PDT 2004,0.00,338.00
AP985,KB9QJM-11 Cloverdale              IN US,Wed Aug 04 15:33:07 PDT 2004,2.68,356.00
AP986,KB9QJM-12 Atlanta                 IN US,Wed Aug 04 15:27:01 PDT 2004,2.24,32.00
AP987,KC5CPO Keene                      TX US,Wed Aug 04 15:30:21 PDT 2004,1.34,194.00
AP989,KC9JWM Clam Lake                  WI US,Wed Aug 04 15:28:18 PDT 2004,0.00,103.00
AP990,KG6MOZ Sunnyvale                  CA US,Wed Aug 04 15:33:09 PDT 2004,0.89,337.00
AP991,W0BIS-3 Killdeer                  ND US,Wed Aug 04 15:34:29 PDT 2004,7.60,139.00
AP993,F6CNB Frelsburg                   TX US,Wed Aug 04 15:22:13 PDT 2004,0.00,99.00
AP994,DL2YED-6 Recklinghausen              DE,Wed Aug 04 15:27:16 PDT 2004,0.00,185.00
AP996,KC5YVU Lampasas                   TX US,Wed Aug 04 15:35:05 PDT 2004,2.68,115.00
AP998,DK1PR-6 Altenahr                     DE,Wed Aug 04 15:29:45 PDT 2004,0.00,338.00
AR003,DL9GJ-6 Burgrieden                   DE,Wed Aug 04 15:34:26 PDT 2004,0.00,90.00
AR005,HB9BA-8 Solothurn                    CH,Wed Aug 04 15:33:18 PDT 2004,0.00,0.00
AR009,SR3TK-1 Gontyniec                    PL,Wed Aug 04 15:30:52 PDT 2004,5.36,73.00
AR016,IW4APJ-3 Soliera                     IT,Wed Aug 04 15:34:04 PDT 2004,0.00,151.00
AR022,IW5BFZ Lucca                         IT,Wed Aug 04 15:35:09 PDT 2004,0.00,249.00
AR026,IK8ERL-2 Scilla                      IT,Wed Aug 04 15:31:41 PDT 2004,0.89,193.00
AR027,IZ8GMP-2 Reggio Calabria             IT,Wed Aug 04 15:30:50 PDT 2004,2.24,57.00
AR028,IW8PCP-2 Gambarie d'Aspromonte       IT,Wed Aug 04 15:33:18 PDT 2004,0.00,84.00
AR030,N4HHP-4 Pompano Beach             FL US,Wed Aug 04 15:33:50 PDT 2004,2.24,139.00
AR031,SV2BNL-2 Thessaloniki                GR,Wed Aug 04 15:33:35 PDT 2004,2.68,303.00
AR034,SV1CIF-2 Aitoloakarnania             GR,Wed Aug 04 15:23:47 PDT 2004,0.45,139.00
AR035,SV3AQN-2 Patra                       GR,Wed Aug 04 15:27:12 PDT 2004,1.79,171.00
AR038,VK4AGS-3 Calliope                    AU,Wed Aug 04 15:24:03 PDT 2004,0.00,294.00
AR039,VK4TMK Arana Hills                   AU,Wed Aug 04 15:32:03 PDT 2004,1.79,306.00
AR040,N3BSQ Bethel Park                 PA US,Wed Aug 04 15:31:44 PDT 2004,0.45,309.00
AR042,VK1AC Bywong                     NSW AU,Wed Aug 04 15:28:07 PDT 2004,1.34,261.00
AR043,K4ZZR Port St. Lucie              FL US,Wed Aug 04 15:33:47 PDT 2004,2.24,224.00
AR044,N0QXY Ft.Lupton                   CO US,Wed Aug 04 15:28:22 PDT 2004,0.00,92.00
AR045,IW9ETI-2 Taormina                    IT,Wed Aug 04 15:33:31 PDT 2004,3.13,309.00
AR051,KE7TR-8 Mesa                      AZ US,Wed Aug 04 15:34:41 PDT 2004,0.00,287.00
AR052,KG4QXL Fort Valley                VA US,Wed Aug 04 15:34:07 PDT 2004,2.24,80.00
AR053,VK3AWA Paradise Beach                AU,Wed Aug 04 15:31:00 PDT 2004,1.34,251.00
AR057,VK3XJB Shepparton                    AU,Wed Aug 04 15:31:34 PDT 2004,0.00,262.00
AR060,VK3JTM-3 Ararat                      AU,Wed Aug 04 15:32:24 PDT 2004,3.13,242.00
AR061,VK3YLV Horsham                       AU,Wed Aug 04 15:21:43 PDT 2004,1.79,254.00
AR062,VK5EX-1 Adelaide                     AU,Wed Aug 04 15:34:48 PDT 2004,1.34,343.00
AR068,WA2MAK Bolton                     MA US,Wed Aug 04 15:35:22 PDT 2004,0.00,78.00
AR069,KF7KN-7 Red Lodge                 MT US,Wed Aug 04 15:35:10 PDT 2004,3.58,184.00
AR070,KI0BJ-2 Fort Smith                MT US,Wed Aug 04 15:34:56 PDT 2004,0.00,277.00
AR071,KD4BJW Albertville                AL US,Wed Aug 04 15:30:02 PDT 2004,0.00,157.00
AR072,KB2KMM N. Babylon                 NY US,Wed Aug 04 15:35:08 PDT 2004,0.00,225.00
AR075,W3UGI Ambler                      PA US,Wed Aug 04 15:27:24 PDT 2004,0.00,187.00
AR078,N9NYF-6 Evansville                IN US,Wed Aug 04 15:29:21 PDT 2004,2.24,290.00
AR079,WX4BUY Elon                       NC US,Wed Aug 04 15:34:12 PDT 2004,2.68,169.00
AR084,W4ERC-10 Avon Park                FL US,Wed Aug 04 15:34:22 PDT 2004,2.68,304.00
AR091,DB0SAC-6 Bad Sackingen               DE,Wed Aug 04 15:23:59 PDT 2004,0.00,278.00
AR094,DL2MAX Bad Reichenhall               DE,Wed Aug 04 15:27:06 PDT 2004,0.00,325.00
AR095,DO2UMM Gorlitz                       DE,Wed Aug 04 15:25:49 PDT 2004,0.00,90.00
AR097,EA3AGQ Lleida                        ES,Wed Aug 04 15:33:47 PDT 2004,2.24,186.00
AR098,EA3AGQ-1 Montsec d'Ares              ES,Wed Aug 04 15:32:14 PDT 2004,6.26,28.00
AR100,N1FWV Peabody                     MA US,Wed Aug 04 15:34:19 PDT 2004,0.00,134.00
AR103,W4SBO-7 Section                   AL US,Wed Aug 04 15:33:49 PDT 2004,0.00,218.00
AR105,K5BV Aransas Pass                 TX US,Wed Aug 04 15:30:16 PDT 2004,5.36,133.00
AR107,EA3AKS-15 SantPere de Ribes          ES,Wed Aug 04 15:35:00 PDT 2004,0.00,5.00
AR108,EA3BB Santpedor                      ES,Wed Aug 04 15:26:08 PDT 2004,0.89,42.00
AR109,EA3BSJ-1 Pinos                       ES,Wed Aug 04 15:34:19 PDT 2004,0.00,246.00
AR110,EA3CNO-1 Barcelona                   ES,Wed Aug 04 15:28:58 PDT 2004,0.89,281.00
AR112,EB3DMC-1 Belvis                      ES,Wed Aug 04 15:34:05 PDT 2004,1.79,74.00
AR115,EUGENE Eugene                     OR US,Wed Aug 04 15:28:42 PDT 2004,5.36,259.00
AR127,ZL1RED Tauranga Bay                  NZ,Wed Aug 04 15:33:09 PDT 2004,0.00,231.00
AR133,K0MXU-4 Hoxie                     KS US,Wed Aug 04 15:22:37 PDT 2004,3.58,23.00
AR134,K4JRG Miami                       FL US,Wed Aug 04 15:29:35 PDT 2004,2.24,265.00
AR137,K6NE Ventura                      CA US,Wed Aug 04 15:29:31 PDT 2004,0.00,318.00
AR138,K7LHC-1 Lake Havasu               AZ US,Wed Aug 04 15:35:14 PDT 2004,7.60,154.00
AR141,KB5NMB-5 Fulton                   MS US,Wed Aug 04 15:28:44 PDT 2004,3.58,247.00
AR144,KB6CYS Cypress                    CA US,Wed Aug 04 15:32:06 PDT 2004,3.58,225.00
AR145,KB9KTD-1 Onalaska                 WI US,Wed Aug 04 15:34:08 PDT 2004,1.79,12.00
AR147,W0NWS-4 Colon                     NE US,Wed Aug 04 15:33:36 PDT 2004,2.68,17.00
AR148,K6DYC Meeker                      CO US,Wed Aug 04 15:35:19 PDT 2004,1.79,133.00
AR150,KC4WPS Hendersonville             TN US,Wed Aug 04 15:30:57 PDT 2004,1.34,262.00
AR152,KC5LIO West Point                 MS US,Wed Aug 04 15:30:21 PDT 2004,0.00,248.00
AR156,KD4DLT-6 Lithonia                 GA US,Wed Aug 04 15:29:02 PDT 2004,0.00,0.00
AR159,KD6VLN-14 Tucson                  AZ US,Wed Aug 04 15:33:08 PDT 2004,2.24,323.00
AR160,NEWPRT Cape Foulweather           OR US,Wed Aug 04 15:31:21 PDT 2004,3.13,326.00
AR161,KD7DR-3 Tempe                     AZ US,Wed Aug 04 15:33:51 PDT 2004,0.00,0.00
AR162,KF4VTT Mebane                     NC US,Wed Aug 04 15:34:41 PDT 2004,0.00,158.00
AR163,KF6JSV San Bernardino             CA US,Wed Aug 04 15:30:43 PDT 2004,1.34,198.00
AR166,KG4LXH-2 Miami                    FL US,Wed Aug 04 15:34:00 PDT 2004,1.79,182.00
AR167,KI0IO-2 Berthoud                  CO US,Wed Aug 04 15:32:28 PDT 2004,0.45,136.00
AR168,KK5CA-2 Spring                    TX US,Wed Aug 04 15:25:41 PDT 2004,0.45,308.00
AR169,KK6RW Gig Harbor                  WA US,Wed Aug 04 15:27:38 PDT 2004,0.00,116.00
AR170,KO5Z Denton                       TX US,Wed Aug 04 15:32:57 PDT 2004,0.00,112.00
AR172,W6TQP Soquel                      CA US,Wed Aug 04 15:30:57 PDT 2004,1.34,125.00
AR173,LA2YEA Hauglandshella                NO,Wed Aug 04 15:34:57 PDT 2004,0.00,158.00
AR177,K7UGT Cary                        NC US,Wed Aug 04 15:34:31 PDT 2004,0.00,229.00
AR178,KJ3L Erie                         PA US,Wed Aug 04 15:35:08 PDT 2004,2.68,4.00
AR179,KC9AAG Fond Du Lac                WI US,Wed Aug 04 15:30:31 PDT 2004,2.68,46.00
AR180,WB6YPF Altadena                   CA US,Wed Aug 04 15:30:47 PDT 2004,2.24,199.00
AR181,KE6ONT Duarte                     CA US,Wed Aug 04 15:28:12 PDT 2004,2.68,225.00
AR182,GW4TJC Caerphilly                    UK,Wed Aug 04 15:35:12 PDT 2004,1.34,246.00
AR183,N7LUF Hansville                   WA US,Wed Aug 04 15:33:26 PDT 2004,0.00,356.00
AR184,W7PG-10 Forsyth                   MT US,Wed Aug 04 15:27:07 PDT 2004,6.71,58.00
AR185,N1XH-15 Spencer                   MA US,Wed Aug 04 15:34:27 PDT 2004,0.00,13.00
AR187,N3ZLL-1 Elkton                    MD US,Wed Aug 04 15:30:43 PDT 2004,1.34,222.00
AR189,N5JEI-8 Spicewood                 TX US,Wed Aug 04 15:31:46 PDT 2004,2.24,110.00
AR190,N6GIW Joshua Tree                 CA US,Wed Aug 04 15:31:40 PDT 2004,7.15,225.00
AR191,WA4BPS Huntsville                 AL US,Wed Aug 04 15:33:23 PDT 2004,1.79,263.00
AR195,N7BIV Glendale                    AZ US,Wed Aug 04 15:31:14 PDT 2004,1.79,45.00
AR196,N7CK San Manuel                   AZ US,Wed Aug 04 15:23:11 PDT 2004,2.68,295.00
AR197,N7FZA-15 Boise                    ID US,Wed Aug 04 15:27:27 PDT 2004,2.24,356.00
AR198,N7GLR Grand Isle                  ME US,Wed Aug 04 15:30:32 PDT 2004,0.00,318.00
AR199,N7TCF Phoenix                     AZ US,Wed Aug 04 15:30:30 PDT 2004,1.34,244.00
AR200,N7TQZ Tacoma                      WA US,Wed Aug 04 15:31:26 PDT 2004,0.00,330.00
AR201,N8NQF-1 Middletown                OH US,Wed Aug 04 15:34:00 PDT 2004,0.00,291.00
AR202,N8VIM Pepperell                   MA US,Wed Aug 04 15:34:55 PDT 2004,0.00,0.00
AR203,N9UDO-2 Baraboo                   WI US,Wed Aug 04 15:33:44 PDT 2004,4.02,54.00
AR204,N9YWZ Kimberly                    WI US,Wed Aug 04 15:32:56 PDT 2004,2.68,32.00
AR205,OE9FWV Feldkirch                     AT,Wed Aug 04 15:26:01 PDT 2004,0.00,257.00
AR208,KD7WIS Miles City                 MT US,Wed Aug 04 15:33:09 PDT 2004,2.24,74.00
AR209,K0OQ Northfield                   MN US,Wed Aug 04 15:35:08 PDT 2004,1.34,32.00
AR213,W4HSV Huntsville                  AL US,Wed Aug 04 15:33:17 PDT 2004,2.24,305.00
AR214,KB0RPX Wood River                 NE US,Wed Aug 04 15:30:05 PDT 2004,3.13,13.00
AR216,W7PG-12 Home Creek                MT US,Wed Aug 04 15:34:39 PDT 2004,2.24,190.00
AR218,KD7YTJ Brownstown                 WA US,Wed Aug 04 15:35:08 PDT 2004,1.79,84.00
AR220,KB6KJX Ellensburg                 WA US,Wed Aug 04 15:31:13 PDT 2004,1.34,84.00
AR221,K6TVI-1 Onyx Peak                 CA US,Wed Aug 04 15:26:34 PDT 2004,1.79,215.00
AR223,W7IUC-5 Grassy Key                FL US,Wed Aug 04 15:21:33 PDT 2004,0.00,177.00
AR225,KG6QHS Shingletown                CA US,Wed Aug 04 15:33:31 PDT 2004,3.58,357.00
AR226,W4RL-1 Pensacola                  FL US,Wed Aug 04 15:34:15 PDT 2004,1.34,359.00
AR227,WA5SJW-10 E.Albuquerque           NM US,Wed Aug 04 15:32:05 PDT 2004,7.60,76.00
AR230,K4DIG-7 Sardis Springs            AL US,Wed Aug 04 15:33:53 PDT 2004,0.00,229.00
AR231,KB5GAS-1 Balloon Fiesta           NM US,Wed Aug 04 15:33:59 PDT 2004,9.39,76.00
AR232,KC7RJK Eugene                     OR US,Wed Aug 04 15:33:01 PDT 2004,0.89,246.00
AR233,N4BK-5 Hartselle                  AL US,Wed Aug 04 15:29:59 PDT 2004,0.45,292.00
AR234,NK7W Reno                         NV US,Wed Aug 04 15:33:34 PDT 2004,4.02,179.00
AR235,K6SUD Hesperia                    CA US,Wed Aug 04 15:23:50 PDT 2004,0.00,128.00
AR238,N5YXO Granbury                    TX US,Wed Aug 04 15:32:05 PDT 2004,2.24,205.00
AR239,OZ9WC-5 Lejre                        DK,Wed Aug 04 15:30:15 PDT 2004,0.00,135.00
AR240,K0CQW New London                  MN US,Wed Aug 04 15:29:57 PDT 2004,2.68,17.00
AR241,K2LCA-1 Chappaqua                 NY US,Wed Aug 04 15:30:51 PDT 2004,0.00,302.00
AR243,K4TPD-5 Tallahassee               FL US,Wed Aug 04 15:33:38 PDT 2004,2.24,227.00
AR245,K7HRT Greenacres                  WA US,Wed Aug 04 15:29:15 PDT 2004,0.00,247.00
AR248,K7VIP Tucson                      AZ US,Wed Aug 04 15:35:08 PDT 2004,0.89,248.00
AR249,KA5WRG Oklahoma City              OK US,Wed Aug 04 15:28:18 PDT 2004,2.24,0.00
AR250,KA8SCP Westford                   MA US,Wed Aug 04 15:33:34 PDT 2004,0.00,143.00
AR252,KB7IPU-2 Payson                   AZ US,Wed Aug 04 15:32:32 PDT 2004,0.45,51.00
AR253,KB8WFH Springfield                OH US,Wed Aug 04 15:33:45 PDT 2004,0.00,351.00
AR254,KB9TPG Viroqua                    WI US,Wed Aug 04 15:33:41 PDT 2004,0.45,355.00
AR255,KC4YLE Efland                     NC US,Wed Aug 04 15:31:13 PDT 2004,0.00,343.00
AR256,W5HKR Schertz                     TX US,Wed Aug 04 15:34:57 PDT 2004,0.45,58.00
AR257,N1ETY New Britain                 CT US,Wed Aug 04 15:30:34 PDT 2004,0.00,337.00
AR258,KC8HJN Ludington                  MI US,Wed Aug 04 15:27:06 PDT 2004,0.89,357.00
AR259,KD5CUW-1 Copperas Cove            TX US,Wed Aug 04 15:31:34 PDT 2004,0.00,143.00
AR260,KD5FDE Runaway Bay                TX US,Wed Aug 04 15:27:59 PDT 2004,0.45,51.00
AR261,KD6RXY Calimesa                   CA US,Wed Aug 04 15:33:16 PDT 2004,3.58,312.00
AR262,KD7GXO-7 Seattle                  WA US,Wed Aug 04 15:30:20 PDT 2004,0.89,325.00
AR264,K0JDN Phoenix                     AZ US,Wed Aug 04 15:34:09 PDT 2004,0.89,225.00
AR266,KJ7XE Port Angeles                WA US,Wed Aug 04 15:31:02 PDT 2004,2.68,315.00
AR267,N3WNZ Brandon                        UK,Wed Aug 04 15:31:22 PDT 2004,0.89,55.00
AR269,KC7PHC Orofino                    ID US,Wed Aug 04 15:30:13 PDT 2004,0.00,270.00
AR270,KF4UXI Southern Shores            NC US,Wed Aug 04 15:30:24 PDT 2004,0.00,220.00
AR271,AA0MM-2 Holton                    KS US,Wed Aug 04 15:35:27 PDT 2004,3.58,354.00
AR272,KG4JPL Hudson                     FL US,Wed Aug 04 15:33:47 PDT 2004,0.89,254.00
AR273,N1JJX Southington                 CT US,Wed Aug 04 15:31:34 PDT 2004,0.00,24.00
AR274,W4RP Palm Bay                     FL US,Wed Aug 04 15:32:04 PDT 2004,0.00,171.00
AR277,VE2GAT-2 St.Hyacinthe             QB CA,Wed Aug 04 15:35:21 PDT 2004,1.34,204.00
AR279,VE3COE Kincardine                ONT CA,Wed Aug 04 15:35:09 PDT 2004,2.68,338.00
AR280,VE3JON Kincardine                ONT CA,Wed Aug 04 15:26:52 PDT 2004,0.00,33.00
AR282,VE7IMD-2 Delta                    BC CA,Wed Aug 04 15:33:52 PDT 2004,0.00,56.00
AR286,K0NSA Omaha                       NE US,Wed Aug 04 15:32:07 PDT 2004,3.13,21.00
AR290,AB4KN Peachtree City              GA US,Wed Aug 04 15:34:41 PDT 2004,0.00,336.00
AR299,KB5NMB-15 Belmont                 MS US,Wed Aug 04 15:26:39 PDT 2004,0.00,165.00
AR300,KB8GQ Galloway                    OH US,Wed Aug 04 15:35:18 PDT 2004,0.89,338.00
AR301,N5KUK Norman                      OK US,Wed Aug 04 15:33:37 PDT 2004,0.89,353.00
AR302,N4NW Stafford                     VA US,Wed Aug 04 15:35:02 PDT 2004,0.00,244.00
AR303,DL1BLU Schortens                     DE,Wed Aug 04 15:30:33 PDT 2004,0.00,63.00
AR304,AA6HF-5 Cathedral City            CA US,Wed Aug 04 15:32:00 PDT 2004,2.24,132.00
AR305,KF6ZGH Fremont                    CA US,Wed Aug 04 15:31:50 PDT 2004,4.47,304.00
AR306,KQ6DI-15 Livermore                CA US,Wed Aug 04 15:32:19 PDT 2004,4.02,290.00
AR307,W6KL Burbank                      CA US,Wed Aug 04 15:24:43 PDT 2004,3.13,195.00
AR308,W8EHH Winter Garden               FL US,Wed Aug 04 15:33:22 PDT 2004,1.34,201.00
AR309,WB6ABE-4 Benicia                  CA US,Wed Aug 04 15:25:53 PDT 2004,8.05,319.00
AR310,K4ROK-10 Fountain                 NC US,Wed Aug 04 15:26:26 PDT 2004,0.00,155.00
AR311,KD4DLT-3 Lithonia                 GA US,Wed Aug 04 15:30:00 PDT 2004,0.00,287.00
AR312,WA6BAY-1 Soquel                   CA US,Wed Aug 04 15:25:59 PDT 2004,1.34,226.00
AR313,WB6AHC-1 San Jose                 CA US,Wed Aug 04 15:31:23 PDT 2004,4.02,304.00
AR314,N7NAT Yakima                      WA US,Wed Aug 04 15:31:41 PDT 2004,0.00,19.00
AR315,OH6GPB Pietarsaari                   FI,Wed Aug 04 15:21:01 PDT 2004,0.00,356.00
AR320,K6TZ Diablo Peak                  CA US,Wed Aug 04 15:35:08 PDT 2004,0.00,305.00
AR321,K6DJR W.Menlo Park                CA US,Wed Aug 04 15:30:13 PDT 2004,0.89,307.00
AR323,KF6YUA Sebastopol                 CA US,Wed Aug 04 15:32:11 PDT 2004,1.79,272.00
AR326,N2KTO Sparta                      NJ US,Wed Aug 04 15:31:28 PDT 2004,0.00,135.00
AR327,WB1FYE Weirs Beach                NH US,Wed Aug 04 15:35:20 PDT 2004,0.00,270.00
AR328,N1EO Center Harbor                NH US,Wed Aug 04 15:32:53 PDT 2004,0.45,337.00
AR329,KA1RVR Epping                     NH US,Wed Aug 04 15:30:20 PDT 2004,0.00,158.00
AR330,KC1EO Hollis                      NH US,Wed Aug 04 15:30:21 PDT 2004,0.00,11.00
AR333,WO4U-10 Crossville                TN US,Wed Aug 04 15:31:35 PDT 2004,0.00,223.00
AR334,W4OZK-8 Collinsville              AL US,Wed Aug 04 15:32:41 PDT 2004,0.00,359.00
AR335,KB0RF San Jose                    CA US,Wed Aug 04 15:33:28 PDT 2004,2.68,354.00
AR338,N3WKE Baltimore                   MD US,Wed Aug 04 15:33:29 PDT 2004,0.45,236.00
AR339,AB0YW Blair                       NE US,Wed Aug 04 15:33:31 PDT 2004,2.68,11.00
AR342,N2NZD Copake                      NY US,Wed Aug 04 15:30:30 PDT 2004,0.00,4.00
AR343,WA1OUI West Simsbury              CT US,Wed Aug 04 15:32:40 PDT 2004,0.00,41.00
AR345,KD5ZLP Rowlett                    TX US,Wed Aug 04 15:35:09 PDT 2004,0.45,151.00
AR346,TG9RB Guatemala City                 GT,Wed Aug 04 15:33:17 PDT 2004,0.00,264.00
AR347,KC5ZJO-1 Madison                  AL US,Wed Aug 04 15:35:17 PDT 2004,0.00,270.00
AR348,KG4VVU Helena                     AL US,Wed Aug 04 15:31:34 PDT 2004,0.45,268.00
AR350,W6MAR Galt                        CA US,Wed Aug 04 15:28:12 PDT 2004,1.79,234.00
AR351,ON7EQ-1 Brugge                       BE,Wed Aug 04 15:27:39 PDT 2004,1.34,28.00
AR354,W7PAQ Missoula                    MT US,Wed Aug 04 15:30:44 PDT 2004,0.00,290.00
AR355,KC4CSX-9 Holly Springs            GA US,Wed Aug 04 15:34:43 PDT 2004,0.00,134.00
AR357,WB1ETW Plainville                 MA US,Wed Aug 04 15:35:26 PDT 2004,0.00,236.00
AR358,N1MZX Peterborough                NH US,Wed Aug 04 15:31:24 PDT 2004,0.00,45.00
AR365,KM6GE Allenspark                  CO US,Wed Aug 04 15:34:04 PDT 2004,0.45,85.00
AR366,KB9VSQ Reedsburg                  WI US,Wed Aug 04 15:34:46 PDT 2004,1.79,40.00
AR368,WA0VSL Monument                   CO US,Wed Aug 04 15:30:56 PDT 2004,0.89,147.00
